17:28:14.854885 IP bom07s01-in-f133.1e100.net.https > 10.0.0.222.40812: Flags [P.], seq 1150857225:1150857576, ack 2009797568, win 365, options [nop,nop,TS val 1560703422 ecr 2466949], length 351
17:28:14.961772 IP 10.0.0.222 > 239.255.255.250: igmp v2 report 239.255.255.250
17:28:14.961862 IP 10.0.0.222.46738 > 10.0.0.1.4886: UDP, length 0
17:28:14.962293 IP 10.0.0.222.46738 > 10.0.0.1.4886: UDP, length 0
17:28:14.962510 IP 10.0.0.222 > 239.255.255.250: igmp v2 report 239.255.255.250
17:28:14.962535 IP 10.0.0.1 > 10.0.0.222: ICMP 10.0.0.1 udp port 4886 unreachable, length 36
17:28:14.962557 IP 10.0.0.222.46738 > 10.0.0.1.4886: UDP, length 0
17:28:14.962636 IP 10.0.0.222.46738 > 10.0.0.1.4886: UDP, length 0
17:28:14.962712 IP 10.0.0.222.46738 > 10.0.0.1.4886: UDP, length 0
17:28:14.963013 IP 10.0.0.222.46738 > 10.0.0.1.4886: UDP, length 0
17:28:14.964159 IP 10.0.0.222.46738 > 10.0.0.1.4886: UDP, length 0
17:28:14.964221 IP 10.0.0.222.46738 > 10.0.0.1.4886: UDP, length 0
17:28:14.964610 IP 10.0.0.222.40812 > bom07s01-in-f133.1e100.net.https: Flags [.], ack 351, win 395, options [nop,nop,TS val 2467076 ecr 1560702776], length 0
17:28:14.965362 IP 10.0.0.222.40812 > bom07s01-in-f133.1e100.net.https: Flags [.], ack 1076, win 406, options [nop,nop,TS val 2467076 ecr 1560702776], length 0
17:28:14.965664 IP 10.0.0.222.40812 > bom07s01-in-f133.1e100.net.https: Flags [.], ack 2424, win 416, options [nop,nop,TS val 2467077 ecr 1560702777], length 0
17:28:14.966735 IP 10.0.0.222.40812 > bom07s01-in-f133.1e100.net.https: Flags [.], ack 3392, win 427, options [nop,nop,TS val 2467077 ecr 1560702777], length 0
17:28:14.966960 IP 10.0.0.222.40812 > bom07s01-in-f133.1e100.net.https: Flags [.], ack 4740, win 437, options [nop,nop,TS val 2467077 ecr 1560702777], length 0
17:28:14.968142 IP 10.0.0.222.40812 > bom07s01-in-f133.1e100.net.https: Flags [.], ack 6088, win 448, options [nop,nop,TS val 2467077 ecr 1560702777], length 0
17:28:14.968279 IP bom07s01-in-f133.1e100.net.https > 10.0.0.222.40812: Flags [.], seq 40904:42252, ack 1, win 365, options [nop,nop,TS val 1560703534 ecr 2467076], length 1348
17:28:14.968417 IP 10.0.0.222.40812 > bom07s01-in-f133.1e100.net.https: Flags [.], ack 7436, win 459, options [nop,nop,TS val 2467077 ecr 1560702777], length 0
17:28:14.968563 IP bom07s01-in-f133.1e100.net.https > 10.0.0.222.40812: Flags [.], seq 42252:43600, ack 1, win 365, options [nop,nop,TS val 1560703534 ecr 2467076], length 1348
17:28:14.968623 IP bom07s01-in-f133.1e100.net.https > 10.0.0.222.40812: Flags [.], seq 43600:44948, ack 1, win 365, options [nop,nop,TS val 1560703534 ecr 2467076], length 1348
17:28:14.968663 IP bom07s01-in-f133.1e100.net.https > 10.0.0.222.40812: Flags [.], seq 44948:46296, ack 1, win 365, options [nop,nop,TS val 1560703534 ecr 2467077], length 1348
17:28:14.971582 IP 10.0.0.222.40812 > bom07s01-in-f133.1e100.net.https: Flags [.], ack 8784, win 469, options [nop,nop,TS val 2467077 ecr 1560702777], length 0
17:28:14.971893 IP 10.0.0.222.40812 > bom07s01-in-f133.1e100.net.https: Flags [.], ack 10132, win 480, options [nop,nop,TS val 2467077 ecr 1560702777], length 0
17:28:14.972388 IP bom07s01-in-f133.1e100.net.https > 10.0.0.222.40812: Flags [.], seq 46296:47644, ack 1, win 365, options [nop,nop,TS val 1560703534 ecr 2467077], length 1348
17:28:14.973063 IP 10.0.0.222.40812 > bom07s01-in-f133.1e100.net.https: Flags [.], ack 11480, win 490, options [nop,nop,TS val 2467077 ecr 1560702777], length 0
17:28:14.973741 IP 10.0.0.222.40812 > bom07s01-in-f133.1e100.net.https: Flags [.], ack 12828, win 501, options [nop,nop,TS val 2467077 ecr 1560702777], length 0
17:28:14.974022 IP 10.0.0.222.40812 > bom07s01-in-f133.1e100.net.https: Flags [.], ack 14176, win 511, options [nop,nop,TS val 2467077 ecr 1560702777], length 0
17:28:14.974990 IP 10.0.0.222.40812 > bom07s01-in-f133.1e100.net.https: Flags [.], ack 15173, win 522, options [nop,nop,TS val 2467077 ecr 1560702777], length 0
17:28:14.975332 IP 10.0.0.222.40812 > bom07s01-in-f133.1e100.net.https: Flags [.], ack 15750, win 532, options [nop,nop,TS val 2467078 ecr 1560702777], length 0
17:28:14.976472 IP 10.0.0.222.40812 > bom07s01-in-f133.1e100.net.https: Flags [.], ack 17098, win 543, options [nop,nop,TS val 2467078 ecr 1560702779], length 0
17:28:14.976725 IP 10.0.0.222.40812 > bom07s01-in-f133.1e100.net.https: Flags [.], ack 18028, win 553, options [nop,nop,TS val 2467078 ecr 1560702779], length 0
17:28:14.977297 IP bom07s01-in-f133.1e100.net.https > 10.0.0.222.40812: Flags [.], seq 47644:48992, ack 1, win 365, options [nop,nop,TS val 1560703537 ecr 2467077], length 1348
17:28:14.977979 IP 10.0.0.222.40812 > bom07s01-in-f133.1e100.net.https: Flags [.], ack 19376, win 564, options [nop,nop,TS val 2467078 ecr 1560702779], length 0
17:28:14.978303 IP 10.0.0.222.40812 > bom07s01-in-f133.1e100.net.https: Flags [.], ack 20724, win 574, options [nop,nop,TS val 2467078 ecr 1560702779], length 0
17:28:14.979409 IP 10.0.0.222.40812 > bom07s01-in-f133.1e100.net.https: Flags [.], ack 22072, win 585, options [nop,nop,TS val 2467078 ecr 1560702779], length 0
17:28:14.980044 IP 10.0.0.222.40812 > bom07s01-in-f133.1e100.net.https: Flags [.], ack 23420, win 595, options [nop,nop,TS val 2467078 ecr 1560702779], length 0
17:28:14.980665 IP 10.0.0.222.40812 > bom07s01-in-f133.1e100.net.https: Flags [.], ack 24768, win 606, options [nop,nop,TS val 2467078 ecr 1560702779], length 0
17:28:14.981341 IP 10.0.0.222.40812 > bom07s01-in-f133.1e100.net.https: Flags [.], ack 26116, win 616, options [nop,nop,TS val 2467078 ecr 1560702779], length 0
17:28:14.981727 IP 10.0.0.222.40812 > bom07s01-in-f133.1e100.net.https: Flags [.], ack 27464, win 627, options [nop,nop,TS val 2467078 ecr 1560702779], length 0
17:28:14.982270 IP bom07s01-in-f133.1e100.net.https > 10.0.0.222.40812: Flags [.], seq 48992:50340, ack 1, win 365, options [nop,nop,TS val 1560703537 ecr 2467077], length 1348
17:28:14.982776 IP 10.0.0.222.40812 > bom07s01-in-f133.1e100.net.https: Flags [.], ack 28812, win 638, options [nop,nop,TS val 2467078 ecr 1560702779], length 0
17:28:14.982992 IP 10.0.0.222.40812 > bom07s01-in-f133.1e100.net.https: Flags [.], ack 30120, win 648, options [nop,nop,TS val 2467078 ecr 1560702779], length 0
17:28:14.984116 IP 10.0.0.222.40812 > bom07s01-in-f133.1e100.net.https: Flags [.], ack 31468, win 659, options [nop,nop,TS val 2467078 ecr 1560702780], length 0
17:28:14.984382 IP 10.0.0.222.40812 > bom07s01-in-f133.1e100.net.https: Flags [.], ack 32816, win 669, options [nop,nop,TS val 2467078 ecr 1560702780], length 0
17:28:14.986798 IP 10.0.0.222.40812 > bom07s01-in-f133.1e100.net.https: Flags [.], ack 34164, win 680, options [nop,nop,TS val 2467079 ecr 1560702781], length 0
17:28:14.987021 IP 10.0.0.222.40812 > bom07s01-in-f133.1e100.net.https: Flags [.], ack 35512, win 690, options [nop,nop,TS val 2467079 ecr 1560702781], length 0
17:28:14.987282 IP bom07s01-in-f133.1e100.net.https > 10.0.0.222.40812: Flags [.], seq 50340:51688, ack 1, win 365, options [nop,nop,TS val 1560703537 ecr 2467077], length 1348
17:28:14.988211 IP 10.0.0.222.40812 > bom07s01-in-f133.1e100.net.https: Flags [.], ack 36860, win 701, options [nop,nop,TS val 2467079 ecr 1560702781], length 0
17:28:14.988496 IP 10.0.0.222.40812 > bom07s01-in-f133.1e100.net.https: Flags [.], ack 38208, win 711, options [nop,nop,TS val 2467079 ecr 1560702781], length 0
17:28:14.989548 IP 10.0.0.222.40812 > bom07s01-in-f133.1e100.net.https: Flags [.], ack 39556, win 722, options [nop,nop,TS val 2467079 ecr 1560702781], length 0
17:28:14.989751 IP 10.0.0.222.40812 > bom07s01-in-f133.1e100.net.https: Flags [.], ack 40904, win 732, options [nop,nop,TS val 2467079 ecr 1560702797], length 0
17:28:14.990725 IP 10.0.0.222.40812 > bom07s01-in-f133.1e100.net.https: Flags [.], ack 40904, win 732, options [nop,nop,TS val 2467079 ecr 1560702797,nop,nop,sack 1 {0:351}], length 0
17:28:14.992190 IP bom07s01-in-f133.1e100.net.https > 10.0.0.222.40812: Flags [.], seq 51688:53036, ack 1, win 365, options [nop,nop,TS val 1560703537 ecr 2467077], length 1348
17:28:14.992278 IP 10.0.0.222.40812 > bom07s01-in-f133.1e100.net.https: Flags [.], ack 40904, win 732, options [nop,nop,TS val 2467079 ecr 1560702797,nop,nop,sack 1 {0:351}], length 0
17:28:14.993120 IP 10.0.0.222.40812 > bom07s01-in-f133.1e100.net.https: Flags [.], ack 42252, win 743, options [nop,nop,TS val 2467079 ecr 1560703534], length 0
17:28:14.995272 IP 10.0.0.222.40812 > bom07s01-in-f133.1e100.net.https: Flags [.], ack 43600, win 753, options [nop,nop,TS val 2467079 ecr 1560703534], length 0
17:28:14.996562 IP 10.0.0.222.40812 > bom07s01-in-f133.1e100.net.https: Flags [.], ack 44948, win 764, options [nop,nop,TS val 2467080 ecr 1560703534], length 0
17:28:14.996871 IP 10.0.0.222.40812 > bom07s01-in-f133.1e100.net.https: Flags [.], ack 46296, win 774, options [nop,nop,TS val 2467080 ecr 1560703534], length 0
17:28:14.997265 IP bom07s01-in-f133.1e100.net.https > 10.0.0.222.40812: Flags [.], seq 53036:54384, ack 1, win 365, options [nop,nop,TS val 1560703537 ecr 2467077], length 1348
17:28:14.998743 IP 10.0.0.222.40812 > bom07s01-in-f133.1e100.net.https: Flags [.], ack 47644, win 785, options [nop,nop,TS val 2467080 ecr 1560703534], length 0
17:28:14.998964 IP 10.0.0.222.40812 > bom07s01-in-f133.1e100.net.https: Flags [.], ack 48992, win 796, options [nop,nop,TS val 2467080 ecr 1560703537], length 0
17:28:14.999150 IP 10.0.0.222.40812 > bom07s01-in-f133.1e100.net.https: Flags [.], ack 50340, win 806, options [nop,nop,TS val 2467080 ecr 1560703537], length 0
17:28:15.002282 IP bom07s01-in-f133.1e100.net.https > 10.0.0.222.40812: Flags [.], seq 54384:55732, ack 1, win 365, options [nop,nop,TS val 1560703537 ecr 2467077], length 1348
17:28:15.002501 IP 10.0.0.222.40812 > bom07s01-in-f133.1e100.net.https: Flags [.], ack 51688, win 817, options [nop,nop,TS val 2467080 ecr 1560703537], length 0
17:28:15.003499 IP 10.0.0.222.40812 > bom07s01-in-f133.1e100.net.https: Flags [.], ack 53036, win 827, options [nop,nop,TS val 2467080 ecr 1560703537], length 0
17:28:15.004721 IP 10.0.0.222.40812 > bom07s01-in-f133.1e100.net.https: Flags [.], ack 54384, win 838, options [nop,nop,TS val 2467080 ecr 1560703537], length 0
17:28:15.004976 IP 10.0.0.222.40812 > bom07s01-in-f133.1e100.net.https: Flags [.], ack 55732, win 848, options [nop,nop,TS val 2467080 ecr 1560703537], length 0
17:28:15.007142 IP bom07s01-in-f133.1e100.net.https > 10.0.0.222.40812: Flags [.], seq 55732:57080, ack 1, win 365, options [nop,nop,TS val 1560703539 ecr 2467077], length 1348
17:28:15.008243 IP 10.0.0.222.40812 > bom07s01-in-f133.1e100.net.https: Flags [.], ack 57080, win 859, options [nop,nop,TS val 2467081 ecr 1560703539], length 0
17:28:15.012182 IP bom07s01-in-f133.1e100.net.https > 10.0.0.222.40812: Flags [.], seq 57080:58428, ack 1, win 365, options [nop,nop,TS val 1560703539 ecr 2467077], length 1348
17:28:15.013292 IP 10.0.0.222.40812 > bom07s01-in-f133.1e100.net.https: Flags [.], ack 58428, win 869, options [nop,nop,TS val 2467081 ecr 1560703539], length 0
17:28:15.017103 IP bom07s01-in-f133.1e100.net.https > 10.0.0.222.40812: Flags [.], seq 58428:59776, ack 1, win 365, options [nop,nop,TS val 1560703540 ecr 2467077], length 1348
17:28:15.018245 IP 10.0.0.222.40812 > bom07s01-in-f133.1e100.net.https: Flags [.], ack 59776, win 880, options [nop,nop,TS val 2467082 ecr 1560703540], length 0
17:28:15.022066 IP bom07s01-in-f133.1e100.net.https > 10.0.0.222.40812: Flags [.], seq 59776:61124, ack 1, win 365, options [nop,nop,TS val 1560703540 ecr 2467077], length 1348
17:28:15.023144 IP 10.0.0.222.40812 > bom07s01-in-f133.1e100.net.https: Flags [.], ack 61124, win 890, options [nop,nop,TS val 2467082 ecr 1560703540], length 0
17:28:15.027054 IP bom07s01-in-f133.1e100.net.https > 10.0.0.222.40812: Flags [.], seq 61124:62472, ack 1, win 365, options [nop,nop,TS val 1560703550 ecr 2467078], length 1348
17:28:15.028227 IP 10.0.0.222.40812 > bom07s01-in-f133.1e100.net.https: Flags [.], ack 62472, win 901, options [nop,nop,TS val 2467083 ecr 1560703550], length 0
17:28:15.032480 IP bom07s01-in-f133.1e100.net.https > 10.0.0.222.40812: Flags [.], seq 62472:63820, ack 1, win 365, options [nop,nop,TS val 1560703550 ecr 2467078], length 1348
17:28:15.033636 IP 10.0.0.222.40812 > bom07s01-in-f133.1e100.net.https: Flags [.], ack 63820, win 911, options [nop,nop,TS val 2467083 ecr 1560703550], length 0
17:28:15.036985 IP bom07s01-in-f133.1e100.net.https > 10.0.0.222.40812: Flags [.], seq 63820:65168, ack 1, win 365, options [nop,nop,TS val 1560703566 ecr 2467079], length 1348
17:28:15.038480 IP 10.0.0.222.40812 > bom07s01-in-f133.1e100.net.https: Flags [.], ack 65168, win 922, options [nop,nop,TS val 2467084 ecr 1560703566], length 0
17:28:15.041934 IP bom07s01-in-f133.1e100.net.https > 10.0.0.222.40812: Flags [.], seq 65168:66516, ack 1, win 365, options [nop,nop,TS val 1560703566 ecr 2467079], length 1348
17:28:15.043295 IP 10.0.0.222.40812 > bom07s01-in-f133.1e100.net.https: Flags [.], ack 66516, win 932, options [nop,nop,TS val 2467084 ecr 1560703566], length 0
17:28:15.046935 IP bom07s01-in-f133.1e100.net.https > 10.0.0.222.40812: Flags [.], seq 66516:67864, ack 1, win 365, options [nop,nop,TS val 1560703582 ecr 2467081], length 1348
17:28:15.048127 IP 10.0.0.222.40812 > bom07s01-in-f133.1e100.net.https: Flags [.], ack 67864, win 943, options [nop,nop,TS val 2467085 ecr 1560703582], length 0
17:28:15.052001 IP bom07s01-in-f133.1e100.net.https > 10.0.0.222.40812: Flags [.], seq 67864:69212, ack 1, win 365, options [nop,nop,TS val 1560703582 ecr 2467081], length 1348
17:28:15.053148 IP 10.0.0.222.40812 > bom07s01-in-f133.1e100.net.https: Flags [.], ack 69212, win 953, options [nop,nop,TS val 2467085 ecr 1560703582], length 0
17:28:15.056918 IP bom07s01-in-f133.1e100.net.https > 10.0.0.222.40812: Flags [.], seq 69212:70560, ack 1, win 365, options [nop,nop,TS val 1560703582 ecr 2467081], length 1348
17:28:15.058132 IP 10.0.0.222.40812 > bom07s01-in-f133.1e100.net.https: Flags [.], ack 70560, win 964, options [nop,nop,TS val 2467086 ecr 1560703582], length 0
17:28:15.061855 IP bom07s01-in-f133.1e100.net.https > 10.0.0.222.40812: Flags [.], seq 70560:71908, ack 1, win 365, options [nop,nop,TS val 1560703582 ecr 2467081], length 1348
17:28:15.063033 IP 10.0.0.222.40812 > bom07s01-in-f133.1e100.net.https: Flags [.], ack 71908, win 975, options [nop,nop,TS val 2467086 ecr 1560703582], length 0
17:28:15.066881 IP bom07s01-in-f133.1e100.net.https > 10.0.0.222.40812: Flags [.], seq 71908:73256, ack 1, win 365, options [nop,nop,TS val 1560703587 ecr 2467082], length 1348
17:28:15.068168 IP 10.0.0.222.40812 > bom07s01-in-f133.1e100.net.https: Flags [.], ack 73256, win 985, options [nop,nop,TS val 2467087 ecr 1560703587], length 0
17:28:15.071876 IP bom07s01-in-f133.1e100.net.https > 10.0.0.222.40812: Flags [.], seq 73256:74604, ack 1, win 365, options [nop,nop,TS val 1560703587 ecr 2467082], length 1348
17:28:15.076758 IP bom07s01-in-f133.1e100.net.https > 10.0.0.222.40812: Flags [.], seq 74604:75952, ack 1, win 365, options [nop,nop,TS val 1560703591 ecr 2467082], length 1348
17:28:15.078493 IP 10.0.0.222.40812 > bom07s01-in-f133.1e100.net.https: Flags [.], ack 74604, win 996, options [nop,nop,TS val 2467088 ecr 1560703587], length 0
17:28:15.081659 IP 10.0.0.222.40812 > bom07s01-in-f133.1e100.net.https: Flags [.], ack 75952, win 1006, options [nop,nop,TS val 2467088 ecr 1560703591], length 0
17:28:15.081799 IP bom07s01-in-f133.1e100.net.https > 10.0.0.222.40812: Flags [.], seq 75952:77300, ack 1, win 365, options [nop,nop,TS val 1560703591 ecr 2467082], length 1348
17:28:15.082790 IP 10.0.0.222.40812 > bom07s01-in-f133.1e100.net.https: Flags [.], ack 77300, win 1017, options [nop,nop,TS val 2467088 ecr 1560703591], length 0
17:28:15.086739 IP bom07s01-in-f133.1e100.net.https > 10.0.0.222.40812: Flags [.], seq 77300:78648, ack 1, win 365, options [nop,nop,TS val 1560703596 ecr 2467082], length 1348
17:28:15.089259 IP 10.0.0.222.40812 > bom07s01-in-f133.1e100.net.https: Flags [.], ack 78648, win 1027, options [nop,nop,TS val 2467089 ecr 1560703596], length 0
17:28:15.091696 IP bom07s01-in-f133.1e100.net.https > 10.0.0.222.40812: Flags [.], seq 78648:79996, ack 1, win 365, options [nop,nop,TS val 1560703596 ecr 2467082], length 1348
17:28:15.092868 IP 10.0.0.222.40812 > bom07s01-in-f133.1e100.net.https: Flags [.], ack 79996, win 1038, options [nop,nop,TS val 2467089 ecr 1560703596], length 0
17:28:15.096658 IP bom07s01-in-f133.1e100.net.https > 10.0.0.222.40812: Flags [.], seq 79996:81344, ack 1, win 365, options [nop,nop,TS val 1560703600 ecr 2467083], length 1348
17:28:15.097726 IP 10.0.0.222.40812 > bom07s01-in-f133.1e100.net.https: Flags [.], ack 81344, win 1048, options [nop,nop,TS val 2467090 ecr 1560703600], length 0
17:28:15.101679 IP bom07s01-in-f133.1e100.net.https > 10.0.0.222.40812: Flags [.], seq 81344:82692, ack 1, win 365, options [nop,nop,TS val 1560703600 ecr 2467083], length 1348
17:28:15.102755 IP 10.0.0.222.40812 > bom07s01-in-f133.1e100.net.https: Flags [.], ack 82692, win 1059, options [nop,nop,TS val 2467090 ecr 1560703600], length 0
17:28:15.106648 IP bom07s01-in-f133.1e100.net.https > 10.0.0.222.40812: Flags [.], seq 82692:84040, ack 1, win 365, options [nop,nop,TS val 1560703603 ecr 2467083], length 1348
17:28:15.107940 IP 10.0.0.222.40812 > bom07s01-in-f133.1e100.net.https: Flags [.], ack 84040, win 1069, options [nop,nop,TS val 2467091 ecr 1560703603], length 0
17:28:15.111675 IP bom07s01-in-f133.1e100.net.https > 10.0.0.222.40812: Flags [.], seq 84040:85388, ack 1, win 365, options [nop,nop,TS val 1560703603 ecr 2467083], length 1348
17:28:15.112957 IP 10.0.0.222.40812 > bom07s01-in-f133.1e100.net.https: Flags [.], ack 85388, win 1080, options [nop,nop,TS val 2467091 ecr 1560703603], length 0
17:28:15.116549 IP bom07s01-in-f133.1e100.net.https > 10.0.0.222.40812: Flags [.], seq 85388:86736, ack 1, win 365, options [nop,nop,TS val 1560703607 ecr 2467083], length 1348
17:28:15.117702 IP 10.0.0.222.40812 > bom07s01-in-f133.1e100.net.https: Flags [.], ack 86736, win 1090, options [nop,nop,TS val 2467092 ecr 1560703607], length 0
17:28:15.121520 IP bom07s01-in-f133.1e100.net.https > 10.0.0.222.40812: Flags [.], seq 86736:88084, ack 1, win 365, options [nop,nop,TS val 1560703607 ecr 2467083], length 1348
17:28:15.122739 IP 10.0.0.222.40812 > bom07s01-in-f133.1e100.net.https: Flags [.], ack 88084, win 1101, options [nop,nop,TS val 2467092 ecr 1560703607], length 0
17:28:15.126447 IP bom07s01-in-f133.1e100.net.https > 10.0.0.222.40812: Flags [.], seq 88084:89432, ack 1, win 365, options [nop,nop,TS val 1560703611 ecr 2467084], length 1348
17:28:15.127637 IP 10.0.0.222.40812 > bom07s01-in-f133.1e100.net.https: Flags [.], ack 89432, win 1111, options [nop,nop,TS val 2467093 ecr 1560703611], length 0
17:28:15.131522 IP bom07s01-in-f133.1e100.net.https > 10.0.0.222.40812: Flags [.], seq 89432:90780, ack 1, win 365, options [nop,nop,TS val 1560703611 ecr 2467084], length 1348
17:28:15.132663 IP 10.0.0.222.40812 > bom07s01-in-f133.1e100.net.https: Flags [.], ack 90780, win 1122, options [nop,nop,TS val 2467093 ecr 1560703611], length 0
17:28:15.136532 IP bom07s01-in-f133.1e100.net.https > 10.0.0.222.40812: Flags [.], seq 90780:92128, ack 1, win 365, options [nop,nop,TS val 1560703611 ecr 2467084], length 1348
17:28:15.137639 IP 10.0.0.222.40812 > bom07s01-in-f133.1e100.net.https: Flags [.], ack 92128, win 1133, options [nop,nop,TS val 2467094 ecr 1560703611], length 0
17:28:15.141405 IP bom07s01-in-f133.1e100.net.https > 10.0.0.222.40812: Flags [.], seq 92128:93476, ack 1, win 365, options [nop,nop,TS val 1560703614 ecr 2467084], length 1348
17:28:15.142501 IP 10.0.0.222.40812 > bom07s01-in-f133.1e100.net.https: Flags [.], ack 93476, win 1143, options [nop,nop,TS val 2467094 ecr 1560703614], length 0
17:28:15.146391 IP bom07s01-in-f133.1e100.net.https > 10.0.0.222.40812: Flags [.], seq 93476:94824, ack 1, win 365, options [nop,nop,TS val 1560703614 ecr 2467084], length 1348
17:28:15.149558 IP 10.0.0.222.40812 > bom07s01-in-f133.1e100.net.https: Flags [.], ack 94824, win 1154, options [nop,nop,TS val 2467095 ecr 1560703614], length 0
17:28:15.151335 IP bom07s01-in-f133.1e100.net.https > 10.0.0.222.40812: Flags [.], seq 94824:96172, ack 1, win 365, options [nop,nop,TS val 1560703617 ecr 2467084], length 1348
17:28:15.152388 IP 10.0.0.222.40812 > bom07s01-in-f133.1e100.net.https: Flags [.], ack 96172, win 1164, options [nop,nop,TS val 2467095 ecr 1560703617], length 0
17:28:15.156461 IP bom07s01-in-f133.1e100.net.https > 10.0.0.222.40812: Flags [.], seq 96172:97520, ack 1, win 365, options [nop,nop,TS val 1560703617 ecr 2467084], length 1348
17:28:15.157824 IP 10.0.0.222.40812 > bom07s01-in-f133.1e100.net.https: Flags [.], ack 97520, win 1175, options [nop,nop,TS val 2467096 ecr 1560703617], length 0
17:28:15.161306 IP bom07s01-in-f133.1e100.net.https > 10.0.0.222.40812: Flags [.], seq 97520:98868, ack 1, win 365, options [nop,nop,TS val 1560703620 ecr 2467085], length 1348
17:28:15.162694 IP 10.0.0.222.40812 > bom07s01-in-f133.1e100.net.https: Flags [.], ack 98868, win 1185, options [nop,nop,TS val 2467096 ecr 1560703620], length 0
17:28:15.166242 IP bom07s01-in-f133.1e100.net.https > 10.0.0.222.40812: Flags [.], seq 98868:100216, ack 1, win 365, options [nop,nop,TS val 1560703620 ecr 2467085], length 1348
17:28:15.167511 IP 10.0.0.222.40812 > bom07s01-in-f133.1e100.net.https: Flags [.], ack 100216, win 1196, options [nop,nop,TS val 2467097 ecr 1560703620], length 0
17:28:15.171266 IP bom07s01-in-f133.1e100.net.https > 10.0.0.222.40812: Flags [.], seq 100216:101564, ack 1, win 365, options [nop,nop,TS val 1560703622 ecr 2467085], length 1348
17:28:15.172532 IP 10.0.0.222.40812 > bom07s01-in-f133.1e100.net.https: Flags [.], ack 101564, win 1206, options [nop,nop,TS val 2467097 ecr 1560703622], length 0
17:28:15.175708 IP 10.0.0.222.1900 > 239.255.255.250.1900: UDP, length 94
17:28:15.175767 IP 10.0.0.222.1900 > 239.255.255.250.1900: UDP, length 94
17:28:15.176236 IP bom07s01-in-f133.1e100.net.https > 10.0.0.222.40812: Flags [.], seq 101564:102912, ack 1, win 365, options [nop,nop,TS val 1560703622 ecr 2467085], length 1348
17:28:15.178623 IP 10.0.0.222.40812 > bom07s01-in-f133.1e100.net.https: Flags [.], ack 102912, win 1217, options [nop,nop,TS val 2467098 ecr 1560703622], length 0
17:28:15.181152 IP bom07s01-in-f133.1e100.net.https > 10.0.0.222.40812: Flags [.], seq 102912:104260, ack 1, win 365, options [nop,nop,TS val 1560703625 ecr 2467085], length 1348
17:28:15.182396 IP 10.0.0.222.40812 > bom07s01-in-f133.1e100.net.https: Flags [.], ack 104260, win 1227, options [nop,nop,TS val 2467098 ecr 1560703625], length 0
17:28:15.186152 IP bom07s01-in-f133.1e100.net.https > 10.0.0.222.40812: Flags [.], seq 104260:105608, ack 1, win 365, options [nop,nop,TS val 1560703625 ecr 2467085], length 1348
17:28:15.187433 IP 10.0.0.222.40812 > bom07s01-in-f133.1e100.net.https: Flags [.], ack 105608, win 1238, options [nop,nop,TS val 2467099 ecr 1560703625], length 0
17:28:15.191147 IP bom07s01-in-f133.1e100.net.https > 10.0.0.222.40812: Flags [.], seq 105608:106956, ack 1, win 365, options [nop,nop,TS val 1560703627 ecr 2467085], length 1348
17:28:15.192653 IP 10.0.0.222.40812 > bom07s01-in-f133.1e100.net.https: Flags [.], ack 106956, win 1248, options [nop,nop,TS val 2467099 ecr 1560703627], length 0
17:28:15.196162 IP bom07s01-in-f133.1e100.net.https > 10.0.0.222.40812: Flags [.], seq 106956:108304, ack 1, win 365, options [nop,nop,TS val 1560703627 ecr 2467085], length 1348
17:28:15.197784 IP 10.0.0.222.40812 > bom07s01-in-f133.1e100.net.https: Flags [.], ack 108304, win 1259, options [nop,nop,TS val 2467100 ecr 1560703627], length 0
17:28:15.201082 IP bom07s01-in-f133.1e100.net.https > 10.0.0.222.40812: Flags [.], seq 108304:109652, ack 1, win 365, options [nop,nop,TS val 1560703629 ecr 2467086], length 1348
17:28:15.202338 IP 10.0.0.222.40812 > bom07s01-in-f133.1e100.net.https: Flags [.], ack 109652, win 1269, options [nop,nop,TS val 2467100 ecr 1560703629], length 0
17:28:15.206026 IP bom07s01-in-f133.1e100.net.https > 10.0.0.222.40812: Flags [.], seq 109652:111000, ack 1, win 365, options [nop,nop,TS val 1560703629 ecr 2467086], length 1348
17:28:15.207400 IP 10.0.0.222.40812 > bom07s01-in-f133.1e100.net.https: Flags [.], ack 111000, win 1280, options [nop,nop,TS val 2467101 ecr 1560703629], length 0
17:28:15.211094 IP bom07s01-in-f133.1e100.net.https > 10.0.0.222.40812: Flags [.], seq 111000:112348, ack 1, win 365, options [nop,nop,TS val 1560703632 ecr 2467086], length 1348
17:28:15.212398 IP 10.0.0.222.40812 > bom07s01-in-f133.1e100.net.https: Flags [.], ack 112348, win 1290, options [nop,nop,TS val 2467101 ecr 1560703632], length 0
17:28:15.216059 IP bom07s01-in-f133.1e100.net.https > 10.0.0.222.40812: Flags [.], seq 112348:113696, ack 1, win 365, options [nop,nop,TS val 1560703632 ecr 2467086], length 1348
17:28:15.217297 IP 10.0.0.222.40812 > bom07s01-in-f133.1e100.net.https: Flags [.], ack 113696, win 1301, options [nop,nop,TS val 2467102 ecr 1560703632], length 0
17:28:15.220974 IP bom07s01-in-f133.1e100.net.https > 10.0.0.222.40812: Flags [.], seq 113696:115044, ack 1, win 365, options [nop,nop,TS val 1560703634 ecr 2467086], length 1348
17:28:15.224785 IP 10.0.0.222.40812 > bom07s01-in-f133.1e100.net.https: Flags [.], ack 115044, win 1312, options [nop,nop,TS val 2467102 ecr 1560703634], length 0
17:28:15.225928 IP bom07s01-in-f133.1e100.net.https > 10.0.0.222.40812: Flags [.], seq 115044:116392, ack 1, win 365, options [nop,nop,TS val 1560703634 ecr 2467086], length 1348
17:28:15.227250 IP 10.0.0.222.40812 > bom07s01-in-f133.1e100.net.https: Flags [.], ack 116392, win 1322, options [nop,nop,TS val 2467103 ecr 1560703634], length 0
17:28:15.230916 IP bom07s01-in-f133.1e100.net.https > 10.0.0.222.40812: Flags [.], seq 116392:117740, ack 1, win 365, options [nop,nop,TS val 1560703637 ecr 2467086], length 1348
17:28:15.231717 IP 10.0.0.222.9505 > 10.0.0.1.domain: 22722+ A? safebrowsing.google.com. (41)
17:28:15.232167 IP 10.0.0.222.40812 > bom07s01-in-f133.1e100.net.https: Flags [.], ack 117740, win 1333, options [nop,nop,TS val 2467103 ecr 1560703637], length 0
17:28:15.235960 IP bom07s01-in-f133.1e100.net.https > 10.0.0.222.40812: Flags [.], seq 117740:119088, ack 1, win 365, options [nop,nop,TS val 1560703637 ecr 2467086], length 1348
17:28:15.237416 IP 10.0.0.222.40812 > bom07s01-in-f133.1e100.net.https: Flags [.], ack 119088, win 1343, options [nop,nop,TS val 2467104 ecr 1560703637], length 0
17:28:15.241023 IP bom07s01-in-f133.1e100.net.https > 10.0.0.222.40812: Flags [.], seq 119088:120436, ack 1, win 365, options [nop,nop,TS val 1560703639 ecr 2467087], length 1348
17:28:15.242311 IP 10.0.0.222.40812 > bom07s01-in-f133.1e100.net.https: Flags [.], ack 120436, win 1354, options [nop,nop,TS val 2467104 ecr 1560703639], length 0
17:28:15.245840 IP bom07s01-in-f133.1e100.net.https > 10.0.0.222.40812: Flags [.], seq 120436:121784, ack 1, win 365, options [nop,nop,TS val 1560703639 ecr 2467087], length 1348
17:28:15.247080 IP 10.0.0.222.40812 > bom07s01-in-f133.1e100.net.https: Flags [.], ack 121784, win 1364, options [nop,nop,TS val 2467105 ecr 1560703639], length 0
17:28:15.251019 IP bom07s01-in-f133.1e100.net.https > 10.0.0.222.40812: Flags [.], seq 121784:123132, ack 1, win 365, options [nop,nop,TS val 1560703641 ecr 2467087], length 1348
17:28:15.252345 IP 10.0.0.222.40812 > bom07s01-in-f133.1e100.net.https: Flags [.], ack 123132, win 1375, options [nop,nop,TS val 2467105 ecr 1560703641], length 0
17:28:15.255833 IP bom07s01-in-f133.1e100.net.https > 10.0.0.222.40812: Flags [.], seq 123132:124480, ack 1, win 365, options [nop,nop,TS val 1560703641 ecr 2467087], length 1348
17:28:15.257159 IP 10.0.0.222.40812 > bom07s01-in-f133.1e100.net.https: Flags [.], ack 124480, win 1385, options [nop,nop,TS val 2467106 ecr 1560703641], length 0
17:28:15.260908 IP bom07s01-in-f133.1e100.net.https > 10.0.0.222.40812: Flags [.], seq 124480:125828, ack 1, win 365, options [nop,nop,TS val 1560703642 ecr 2467087], length 1348
17:28:15.262187 IP 10.0.0.222.40812 > bom07s01-in-f133.1e100.net.https: Flags [.], ack 125828, win 1396, options [nop,nop,TS val 2467106 ecr 1560703642], length 0
17:28:15.265725 IP bom07s01-in-f133.1e100.net.https > 10.0.0.222.40812: Flags [.], seq 125828:127176, ack 1, win 365, options [nop,nop,TS val 1560703642 ecr 2467087], length 1348
17:28:15.266928 IP 10.0.0.222.40812 > bom07s01-in-f133.1e100.net.https: Flags [.], ack 127176, win 1406, options [nop,nop,TS val 2467107 ecr 1560703642], length 0
17:28:15.284466 IP bom07s01-in-f133.1e100.net.https > 10.0.0.222.40812: Flags [.], seq 127176:128524, ack 1, win 365, options [nop,nop,TS val 1560703645 ecr 2467087], length 1348
17:28:15.284590 IP bom07s01-in-f133.1e100.net.https > 10.0.0.222.40812: Flags [.], seq 128524:129872, ack 1, win 365, options [nop,nop,TS val 1560703645 ecr 2467087], length 1348
17:28:15.284706 IP bom07s01-in-f133.1e100.net.https > 10.0.0.222.40812: Flags [.], seq 129872:131220, ack 1, win 365, options [nop,nop,TS val 1560703645 ecr 2467087], length 1348
17:28:15.285709 IP bom07s01-in-f133.1e100.net.https > 10.0.0.222.40812: Flags [.], seq 131220:132568, ack 1, win 365, options [nop,nop,TS val 1560703645 ecr 2467087], length 1348
17:28:15.285833 IP 10.0.0.222.40812 > bom07s01-in-f133.1e100.net.https: Flags [.], ack 128524, win 1417, options [nop,nop,TS val 2467109 ecr 1560703645], length 0
17:28:15.286102 IP 10.0.0.222.40812 > bom07s01-in-f133.1e100.net.https: Flags [.], ack 129872, win 1427, options [nop,nop,TS val 2467109 ecr 1560703645], length 0
17:28:15.287230 IP 10.0.0.222.40812 > bom07s01-in-f133.1e100.net.https: Flags [.], ack 131220, win 1438, options [nop,nop,TS val 2467109 ecr 1560703645], length 0
17:28:15.287853 IP 10.0.0.222.40812 > bom07s01-in-f133.1e100.net.https: Flags [.], ack 132568, win 1448, options [nop,nop,TS val 2467109 ecr 1560703645], length 0
17:28:15.290693 IP bom07s01-in-f133.1e100.net.https > 10.0.0.222.40812: Flags [.], seq 132568:133916, ack 1, win 365, options [nop,nop,TS val 1560703647 ecr 2467087], length 1348
17:28:15.292192 IP 10.0.0.222.40812 > bom07s01-in-f133.1e100.net.https: Flags [.], ack 133916, win 1459, options [nop,nop,TS val 2467109 ecr 1560703647], length 0
17:28:15.295651 IP bom07s01-in-f133.1e100.net.https > 10.0.0.222.40812: Flags [.], seq 133916:135264, ack 1, win 365, options [nop,nop,TS val 1560703647 ecr 2467087], length 1348
17:28:15.299188 IP 10.0.0.222.40812 > bom07s01-in-f133.1e100.net.https: Flags [.], ack 135264, win 1470, options [nop,nop,TS val 2467110 ecr 1560703647], length 0
17:28:15.300538 IP bom07s01-in-f133.1e100.net.https > 10.0.0.222.40812: Flags [.], seq 135264:136612, ack 1, win 365, options [nop,nop,TS val 1560703649 ecr 2467088], length 1348
17:28:15.303596 IP 10.0.0.222.40812 > bom07s01-in-f133.1e100.net.https: Flags [.], ack 136612, win 1480, options [nop,nop,TS val 2467110 ecr 1560703649], length 0
17:28:15.305720 IP bom07s01-in-f133.1e100.net.https > 10.0.0.222.40812: Flags [.], seq 136612:137960, ack 1, win 365, options [nop,nop,TS val 1560703649 ecr 2467088], length 1348
17:28:15.306890 IP 10.0.0.222.40812 > bom07s01-in-f133.1e100.net.https: Flags [.], ack 137960, win 1491, options [nop,nop,TS val 2467111 ecr 1560703649], length 0
17:28:15.310516 IP bom07s01-in-f133.1e100.net.https > 10.0.0.222.40812: Flags [.], seq 137960:139308, ack 1, win 365, options [nop,nop,TS val 1560703651 ecr 2467088], length 1348
17:28:15.311921 IP 10.0.0.222.40812 > bom07s01-in-f133.1e100.net.https: Flags [.], ack 139308, win 1501, options [nop,nop,TS val 2467111 ecr 1560703651], length 0
17:28:15.315463 IP bom07s01-in-f133.1e100.net.https > 10.0.0.222.40812: Flags [.], seq 139308:140656, ack 1, win 365, options [nop,nop,TS val 1560703651 ecr 2467088], length 1348
17:28:15.316846 IP 10.0.0.222.40812 > bom07s01-in-f133.1e100.net.https: Flags [.], ack 140656, win 1512, options [nop,nop,TS val 2467112 ecr 1560703651], length 0
17:28:15.320461 IP bom07s01-in-f133.1e100.net.https > 10.0.0.222.40812: Flags [.], seq 140656:142004, ack 1, win 365, options [nop,nop,TS val 1560703651 ecr 2467088], length 1348
17:28:15.321803 IP 10.0.0.222.40812 > bom07s01-in-f133.1e100.net.https: Flags [.], ack 142004, win 1522, options [nop,nop,TS val 2467112 ecr 1560703651], length 0
17:28:15.325428 IP bom07s01-in-f133.1e100.net.https > 10.0.0.222.40812: Flags [.], seq 142004:143352, ack 1, win 365, options [nop,nop,TS val 1560703651 ecr 2467088], length 1348
17:28:15.326971 IP 10.0.0.222.40812 > bom07s01-in-f133.1e100.net.https: Flags [.], ack 143352, win 1533, options [nop,nop,TS val 2467113 ecr 1560703651], length 0
17:28:15.330362 IP bom07s01-in-f133.1e100.net.https > 10.0.0.222.40812: Flags [.], seq 143352:144700, ack 1, win 365, options [nop,nop,TS val 1560703654 ecr 2467088], length 1348
17:28:15.331721 IP 10.0.0.222.40812 > bom07s01-in-f133.1e100.net.https: Flags [.], ack 144700, win 1543, options [nop,nop,TS val 2467113 ecr 1560703654], length 0
17:28:15.335354 IP bom07s01-in-f133.1e100.net.https > 10.0.0.222.40812: Flags [.], seq 144700:146048, ack 1, win 365, options [nop,nop,TS val 1560703654 ecr 2467088], length 1348
17:28:15.336670 IP 10.0.0.222.40812 > bom07s01-in-f133.1e100.net.https: Flags [.], ack 146048, win 1554, options [nop,nop,TS val 2467114 ecr 1560703654], length 0
17:28:15.340351 IP bom07s01-in-f133.1e100.net.https > 10.0.0.222.40812: Flags [.], seq 146048:147396, ack 1, win 365, options [nop,nop,TS val 1560703658 ecr 2467088], length 1348
17:28:15.341550 IP 10.0.0.222.40812 > bom07s01-in-f133.1e100.net.https: Flags [.], ack 147396, win 1564, options [nop,nop,TS val 2467114 ecr 1560703658], length 0
17:28:15.345312 IP bom07s01-in-f133.1e100.net.https > 10.0.0.222.40812: Flags [.], seq 148744:150092, ack 1, win 365, options [nop,nop,TS val 1560703660 ecr 2467089], length 1348
17:28:15.346477 IP 10.0.0.222.40812 > bom07s01-in-f133.1e100.net.https: Flags [.], ack 147396, win 1564, options [nop,nop,TS val 2467115 ecr 1560703658,nop,nop,sack 1 {148744:150092}], length 0
17:28:15.350241 IP bom07s01-in-f133.1e100.net.https > 10.0.0.222.40812: Flags [.], seq 156832:158180, ack 1, win 365, options [nop,nop,TS val 1560703665 ecr 2467089], length 1348
17:28:15.351470 IP 10.0.0.222.40812 > bom07s01-in-f133.1e100.net.https: Flags [.], ack 147396, win 1564, options [nop,nop,TS val 2467115 ecr 1560703658,nop,nop,sack 2 {156832:158180}{148744:150092}], length 0
17:28:15.355269 IP bom07s01-in-f133.1e100.net.https > 10.0.0.222.40812: Flags [.], seq 162224:163572, ack 1, win 365, options [nop,nop,TS val 1560703669 ecr 2467090], length 1348
17:28:15.356522 IP 10.0.0.222.40812 > bom07s01-in-f133.1e100.net.https: Flags [.], ack 147396, win 1564, options [nop,nop,TS val 2467116 ecr 1560703658,nop,nop,sack 3 {162224:163572}{156832:158180}{148744:150092}], length 0
17:28:15.366348 IP 10.0.0.222.16074 > 10.0.0.1.domain: 22410+ AAAA? 10.0.0.222. (28)
17:28:15.372530 IP bom07s01-in-f133.1e100.net.https > 10.0.0.222.40812: Flags [.], seq 171660:173008, ack 1, win 365, options [nop,nop,TS val 1560703682 ecr 2467091], length 1348
17:28:15.372679 IP bom07s01-in-f133.1e100.net.https > 10.0.0.222.40812: Flags [.], seq 173008:174356, ack 1, win 365, options [nop,nop,TS val 1560703687 ecr 2467092], length 1348
17:28:15.372728 IP bom07s01-in-f133.1e100.net.https > 10.0.0.222.40812: Flags [.], seq 174356:175704, ack 1, win 365, options [nop,nop,TS val 1560703692 ecr 2467092], length 1348
17:28:15.373930 IP 10.0.0.222.40812 > bom07s01-in-f133.1e100.net.https: Flags [.], ack 147396, win 1564, options [nop,nop,TS val 2467117 ecr 1560703658,nop,nop,sack 3 {171660:173008}{162224:163572}{156832:158180}], length 0
17:28:15.374196 IP 10.0.0.222.40812 > bom07s01-in-f133.1e100.net.https: Flags [.], ack 147396, win 1564, options [nop,nop,TS val 2467117 ecr 1560703658,nop,nop,sack 3 {171660:174356}{162224:163572}{156832:158180}], length 0
17:28:15.375269 IP 10.0.0.222.40812 > bom07s01-in-f133.1e100.net.https: Flags [.], ack 147396, win 1564, options [nop,nop,TS val 2467117 ecr 1560703658,nop,nop,sack 3 {171660:175704}{162224:163572}{156832:158180}], length 0
17:28:15.375525 IP bom07s01-in-f133.1e100.net.https > 10.0.0.222.40812: Flags [.], seq 177052:178400, ack 1, win 365, options [nop,nop,TS val 1560703697 ecr 2467093], length 1348
17:28:15.376583 IP 10.0.0.222.40812 > bom07s01-in-f133.1e100.net.https: Flags [.], ack 147396, win 1564, options [nop,nop,TS val 2467118 ecr 1560703658,nop,nop,sack 3 {177052:178400}{171660:175704}{162224:163572}], length 0
17:28:15.380106 IP bom07s01-in-f133.1e100.net.https > 10.0.0.222.40812: Flags [.], seq 178400:179748, ack 1, win 365, options [nop,nop,TS val 1560703702 ecr 2467093], length 1348
17:28:15.381117 IP 10.0.0.222.40812 > bom07s01-in-f133.1e100.net.https: Flags [.], ack 147396, win 1564, options [nop,nop,TS val 2467118 ecr 1560703658,nop,nop,sack 3 {177052:179748}{171660:175704}{162224:163572}], length 0
17:28:15.385151 IP bom07s01-in-f133.1e100.net.https > 10.0.0.222.40812: Flags [.], seq 179748:181096, ack 1, win 365, options [nop,nop,TS val 1560703706 ecr 2467094], length 1348
17:28:15.386338 IP 10.0.0.222.40812 > bom07s01-in-f133.1e100.net.https: Flags [.], ack 147396, win 1564, options [nop,nop,TS val 2467119 ecr 1560703658,nop,nop,sack 3 {177052:181096}{171660:175704}{162224:163572}], length 0
17:28:15.390073 IP bom07s01-in-f133.1e100.net.https > 10.0.0.222.40812: Flags [.], seq 181096:182444, ack 1, win 365, options [nop,nop,TS val 1560703712 ecr 2467094], length 1348
17:28:15.391284 IP 10.0.0.222.40812 > bom07s01-in-f133.1e100.net.https: Flags [.], ack 147396, win 1564, options [nop,nop,TS val 2467119 ecr 1560703658,nop,nop,sack 3 {177052:182444}{171660:175704}{162224:163572}], length 0
17:28:15.395044 IP bom07s01-in-f133.1e100.net.https > 10.0.0.222.40812: Flags [.], seq 182444:183792, ack 1, win 365, options [nop,nop,TS val 1560703719 ecr 2467095], length 1348
17:28:15.396238 IP 10.0.0.222.40812 > bom07s01-in-f133.1e100.net.https: Flags [.], ack 147396, win 1564, options [nop,nop,TS val 2467120 ecr 1560703658,nop,nop,sack 3 {177052:183792}{171660:175704}{162224:163572}], length 0
17:28:15.400036 IP bom07s01-in-f133.1e100.net.https > 10.0.0.222.40812: Flags [.], seq 183792:185140, ack 1, win 365, options [nop,nop,TS val 1560703722 ecr 2467095], length 1348
17:28:15.401225 IP 10.0.0.222.40812 > bom07s01-in-f133.1e100.net.https: Flags [.], ack 147396, win 1564, options [nop,nop,TS val 2467120 ecr 1560703658,nop,nop,sack 3 {177052:185140}{171660:175704}{162224:163572}], length 0
17:28:15.405030 IP bom07s01-in-f133.1e100.net.https > 10.0.0.222.40812: Flags [.], seq 185140:186488, ack 1, win 365, options [nop,nop,TS val 1560703727 ecr 2467096], length 1348
17:28:15.406454 IP 10.0.0.222.40812 > bom07s01-in-f133.1e100.net.https: Flags [.], ack 147396, win 1564, options [nop,nop,TS val 2467121 ecr 1560703658,nop,nop,sack 3 {177052:186488}{171660:175704}{162224:163572}], length 0
17:28:15.409927 IP bom07s01-in-f133.1e100.net.https > 10.0.0.222.40812: Flags [.], seq 186488:187836, ack 1, win 365, options [nop,nop,TS val 1560703732 ecr 2467096], length 1348
17:28:15.411223 IP 10.0.0.222.40812 > bom07s01-in-f133.1e100.net.https: Flags [.], ack 147396, win 1564, options [nop,nop,TS val 2467121 ecr 1560703658,nop,nop,sack 3 {177052:187836}{171660:175704}{162224:163572}], length 0
17:28:15.414946 IP bom07s01-in-f133.1e100.net.https > 10.0.0.222.40812: Flags [.], seq 187836:189184, ack 1, win 365, options [nop,nop,TS val 1560703737 ecr 2467097], length 1348
17:28:15.416308 IP 10.0.0.222.40812 > bom07s01-in-f133.1e100.net.https: Flags [.], ack 147396, win 1564, options [nop,nop,TS val 2467122 ecr 1560703658,nop,nop,sack 3 {177052:189184}{171660:175704}{162224:163572}], length 0
