14:16:04.296299 IP 10.0.0.222.32031 > 10.0.0.1.domain: 233+ AAAA? 224.0.0.0. (27)
14:16:04.520131 IP 10.0.0.1.domain > 10.0.0.222.32031: 233 NXDomain 0/1/0 (102)
14:16:04.695415 IP 10.0.0.222.19270 > 10.0.0.1.domain: 7408+ AAAA? 169.254.0.0. (29)
14:16:04.933904 IP 10.0.0.1.domain > 10.0.0.222.19270: 7408 NXDomain 0/1/0 (104)
14:16:06.058918 IP 10.0.0.222.21052 > 10.0.0.1.domain: 32619+ AAAA? 172.16.0.0. (28)
14:16:06.282690 IP 10.0.0.1.domain > 10.0.0.222.21052: 32619 NXDomain 0/1/0 (103)
14:16:08.404674 IP 10.0.0.222.16498 > 10.0.0.1.domain: 21303+ AAAA? 10.0.0.222. (28)
14:16:08.649393 IP 10.0.0.1.domain > 10.0.0.222.16498: 21303 NXDomain 0/1/0 (103)
14:16:12.432319 IP 10.0.0.222.54806 > 43.3a.559e.ip4.static.sl-reverse.com.xmpp-client: Flags [P.], seq 3980155331:3980155334, ack 266709554, win 774, options [nop,nop,TS val 288508 ecr 1177025862], length 3
14:16:13.010212 IP 43.3a.559e.ip4.static.sl-reverse.com.xmpp-client > 10.0.0.222.54806: Flags [.], ack 3, win 513, options [nop,nop,TS val 1177038258 ecr 288508], length 0
14:16:13.165204 IP 10.0.0.222.54806 > 43.3a.559e.ip4.static.sl-reverse.com.xmpp-client: Flags [P.], seq 3:71, ack 1, win 774, options [nop,nop,TS val 288583 ecr 1177038258], length 68
14:16:13.779739 IP 43.3a.559e.ip4.static.sl-reverse.com.xmpp-client > 10.0.0.222.54806: Flags [P.], seq 1:74, ack 71, win 513, options [nop,nop,TS val 1177038961 ecr 288583], length 73
14:16:13.883663 IP 10.0.0.222.54806 > 43.3a.559e.ip4.static.sl-reverse.com.xmpp-client: Flags [.], ack 74, win 774, options [nop,nop,TS val 288655 ecr 1177038961], length 0
14:16:13.889716 ARP, Reply 192.168.0.100 is-at 00:1e:a6:6a:69:23 (oui Unknown), length 28
14:16:13.916421 IP 10.0.0.222.54806 > 43.3a.559e.ip4.static.sl-reverse.com.xmpp-client: Flags [P.], seq 71:74, ack 74, win 774, options [nop,nop,TS val 288658 ecr 1177038961], length 3
14:16:14.487473 IP 43.3a.559e.ip4.static.sl-reverse.com.xmpp-client > 10.0.0.222.54806: Flags [P.], seq 1:74, ack 71, win 513, options [nop,nop,TS val 1177039601 ecr 288583], length 73
14:16:14.599194 IP 10.0.0.222.54806 > 43.3a.559e.ip4.static.sl-reverse.com.xmpp-client: Flags [.], ack 74, win 774, options [nop,nop,TS val 288726 ecr 1177039601,nop,nop,sack 1 {1:74}], length 0
14:16:14.626331 IP 43.3a.559e.ip4.static.sl-reverse.com.xmpp-client > 10.0.0.222.54806: Flags [.], ack 74, win 513, options [nop,nop,TS val 1177039742 ecr 288658], length 0
14:16:14.627424 IP 10.0.0.222.54806 > 43.3a.559e.ip4.static.sl-reverse.com.xmpp-client: Flags [P.], seq 74:109, ack 74, win 774, options [nop,nop,TS val 288729 ecr 1177039742], length 35
14:16:15.340619 IP 43.3a.559e.ip4.static.sl-reverse.com.xmpp-client > 10.0.0.222.54806: Flags [P.], seq 74:113, ack 109, win 513, options [nop,nop,TS val 1177040424 ecr 288729], length 39
14:16:15.419110 IP 10.0.0.222.54806 > 43.3a.559e.ip4.static.sl-reverse.com.xmpp-client: Flags [P.], seq 109:208, ack 113, win 774, options [nop,nop,TS val 288808 ecr 1177040424], length 99
14:16:16.113073 IP 43.3a.559e.ip4.static.sl-reverse.com.xmpp-client > 10.0.0.222.54806: Flags [P.], seq 113:186, ack 208, win 513, options [nop,nop,TS val 1177041223 ecr 288808], length 73
14:16:16.374143 IP 10.0.0.222.54806 > 43.3a.559e.ip4.static.sl-reverse.com.xmpp-client: Flags [P.], seq 208:211, ack 186, win 774, options [nop,nop,TS val 288904 ecr 1177041223], length 3
14:16:16.937189 IP 43.3a.559e.ip4.static.sl-reverse.com.xmpp-client > 10.0.0.222.54806: Flags [.], ack 211, win 513, options [nop,nop,TS val 1177042199 ecr 288904], length 0
14:16:17.041861 ARP, Reply 192.168.0.100 is-at 00:1e:a6:6a:69:23 (oui Unknown), length 28
14:16:17.158709 IP 10.0.0.222.54806 > 43.3a.559e.ip4.static.sl-reverse.com.xmpp-client: Flags [P.], seq 211:307, ack 186, win 774, options [nop,nop,TS val 288982 ecr 1177042199], length 96
14:16:17.733493 IP 43.3a.559e.ip4.static.sl-reverse.com.xmpp-client > 10.0.0.222.54806: Flags [P.], seq 186:259, ack 307, win 513, options [nop,nop,TS val 1177042955 ecr 288982], length 73
14:16:18.011866 IP 10.0.0.222.54806 > 43.3a.559e.ip4.static.sl-reverse.com.xmpp-client: Flags [.], ack 259, win 774, options [nop,nop,TS val 289068 ecr 1177042955], length 0
14:16:18.853425 IP 10.0.0.222.22834 > 10.0.0.1.domain: 32551+ A? switchboard.services.mozilla.com. (50)
14:16:19.220639 IP 10.0.0.1.domain > 10.0.0.222.22834: 32551 2/0/0 CNAME switchboard.r53-2.services.mozilla.com., A 52.42.79.187 (98)
14:16:19.276734 IP 10.0.0.222.40104 > ec2-52-42-79-187.us-west-2.compute.amazonaws.com.https: Flags [S], seq 758895851, win 65535, options [mss 1460,sackOK,TS val 289194 ecr 0,nop,wscale 8], length 0
14:16:19.899011 IP ec2-52-42-79-187.us-west-2.compute.amazonaws.com.https > 10.0.0.222.40104: Flags [S.], seq 3878322642, ack 758895852, win 17898, options [mss 1440,sackOK,TS val 602418771 ecr 289194,nop,wscale 8], length 0
14:16:20.024787 IP 10.0.0.222.40104 > ec2-52-42-79-187.us-west-2.compute.amazonaws.com.https: Flags [.], ack 1, win 343, options [nop,nop,TS val 289269 ecr 602418771], length 0
14:16:20.026739 IP 10.0.0.222.40104 > ec2-52-42-79-187.us-west-2.compute.amazonaws.com.https: Flags [P.], seq 1:199, ack 1, win 343, options [nop,nop,TS val 289269 ecr 602418771], length 198
14:16:20.053895 ARP, Reply 192.168.0.100 is-at 00:1e:a6:6a:69:23 (oui Unknown), length 28
14:16:20.538170 IP 10.0.0.222.mdns > 224.0.0.251.mdns: 0 PTR (QU)? _mozilla_papi._tcp.local. (42)
14:16:20.538278 IP 10.0.0.222.mdns > 224.0.0.251.mdns: 0 PTR (QU)? _mozilla_papi._tcp.local. (42)
14:16:20.538410 IP 10.0.0.222 > igmp.mcast.net: igmp v3 report, 1 group record(s)
14:16:20.538473 IP 10.0.0.222 > igmp.mcast.net: igmp v3 report, 1 group record(s)
14:16:20.640562 IP ec2-52-42-79-187.us-west-2.compute.amazonaws.com.https > 10.0.0.222.40104: Flags [.], ack 199, win 75, options [nop,nop,TS val 602418958 ecr 289269], length 0
14:16:20.641422 IP ec2-52-42-79-187.us-west-2.compute.amazonaws.com.https > 10.0.0.222.40104: Flags [.], seq 1:1349, ack 199, win 75, options [nop,nop,TS val 602418959 ecr 289269], length 1348
14:16:20.641612 IP ec2-52-42-79-187.us-west-2.compute.amazonaws.com.https > 10.0.0.222.40104: Flags [.], seq 1349:2697, ack 199, win 75, options [nop,nop,TS val 602418959 ecr 289269], length 1348
14:16:20.641669 IP ec2-52-42-79-187.us-west-2.compute.amazonaws.com.https > 10.0.0.222.40104: Flags [P.], seq 2697:2942, ack 199, win 75, options [nop,nop,TS val 602418959 ecr 289269], length 245
14:16:20.642775 IP 10.0.0.222.40104 > ec2-52-42-79-187.us-west-2.compute.amazonaws.com.https: Flags [.], ack 1349, win 353, options [nop,nop,TS val 289331 ecr 602418959], length 0
14:16:20.643042 IP 10.0.0.222.40104 > ec2-52-42-79-187.us-west-2.compute.amazonaws.com.https: Flags [.], ack 2697, win 364, options [nop,nop,TS val 289331 ecr 602418959], length 0
14:16:20.643562 IP 10.0.0.222.40104 > ec2-52-42-79-187.us-west-2.compute.amazonaws.com.https: Flags [.], ack 2942, win 374, options [nop,nop,TS val 289331 ecr 602418959], length 0
14:16:20.746991 IP 10.0.0.222.40104 > ec2-52-42-79-187.us-west-2.compute.amazonaws.com.https: Flags [P.], seq 199:325, ack 2942, win 374, options [nop,nop,TS val 289341 ecr 602418959], length 126
14:16:21.358213 IP ec2-52-42-79-187.us-west-2.compute.amazonaws.com.https > 10.0.0.222.40104: Flags [P.], seq 2942:3200, ack 325, win 75, options [nop,nop,TS val 602419139 ecr 289341], length 258
14:16:21.454684 IP 10.0.0.222.40104 > ec2-52-42-79-187.us-west-2.compute.amazonaws.com.https: Flags [.], ack 3200, win 385, options [nop,nop,TS val 289412 ecr 602419139], length 0
14:16:21.457204 IP 10.0.0.222.40104 > ec2-52-42-79-187.us-west-2.compute.amazonaws.com.https: Flags [P.], seq 325:669, ack 3200, win 385, options [nop,nop,TS val 289412 ecr 602419139], length 344
14:16:21.914503 IP ec2-52-42-79-187.us-west-2.compute.amazonaws.com.https > 10.0.0.222.40104: Flags [P.], seq 3200:4174, ack 669, win 79, options [nop,nop,TS val 602419317 ecr 289412], length 974
14:16:22.001717 IP 10.0.0.222.40104 > ec2-52-42-79-187.us-west-2.compute.amazonaws.com.https: Flags [.], ack 4174, win 395, options [nop,nop,TS val 289467 ecr 602419317], length 0
14:16:23.067135 ARP, Reply 192.168.0.100 is-at 00:1e:a6:6a:69:23 (oui Unknown), length 28
14:16:25.383342 IP 10.0.0.222.12082 > 10.0.0.1.domain: 7127+ A? mail.google.com. (33)
14:16:25.389168 IP 10.0.0.222.7519 > 10.0.0.1.domain: 3908+ A? https. (23)
14:16:25.391047 IP 10.0.0.222.25641 > 10.0.0.1.domain: 32044+ A? accounts.google.co.in. (39)
14:16:25.526512 IP 10.0.0.1.domain > 10.0.0.222.7519: 3908 NXDomain 0/1/0 (98)
14:16:25.539585 IP 10.0.0.1.domain > 10.0.0.222.12082: 7127 2/0/0 CNAME googlemail.l.google.com., A 216.58.199.133 (76)
14:16:25.540112 IP 10.0.0.1.domain > 10.0.0.222.25641: 32044 2/0/0 CNAME accounts-cctld.l.google.com., A 216.58.199.131 (96)
14:16:25.545435 IP 10.0.0.222.41307 > bom07s01-in-f5.1e100.net.https: Flags [S], seq 1997989161, win 65535, options [mss 1460,sackOK,TS val 289821 ecr 0,nop,wscale 8], length 0
14:16:25.545986 IP 10.0.0.222.58371 > bom07s01-in-f3.1e100.net.https: Flags [S], seq 3424960877, win 65535, options [mss 1460,sackOK,TS val 289821 ecr 0,nop,wscale 8], length 0
14:16:25.615865 IP bom07s01-in-f5.1e100.net.https > 10.0.0.222.41307: Flags [S.], seq 220788871, ack 1997989162, win 42540, options [mss 1430,sackOK,TS val 2439431254 ecr 289821,nop,wscale 7], length 0
14:16:25.616235 IP bom07s01-in-f3.1e100.net.https > 10.0.0.222.58371: Flags [S.], seq 568122859, ack 3424960878, win 42540, options [mss 1430,sackOK,TS val 2435474883 ecr 289821,nop,wscale 7], length 0
14:16:25.616848 IP 10.0.0.222.41307 > bom07s01-in-f5.1e100.net.https: Flags [.], ack 1, win 343, options [nop,nop,TS val 289828 ecr 2439431254], length 0
14:16:25.617781 IP 10.0.0.222.58371 > bom07s01-in-f3.1e100.net.https: Flags [.], ack 1, win 343, options [nop,nop,TS val 289828 ecr 2435474883], length 0
14:16:25.618826 IP 10.0.0.222.41307 > bom07s01-in-f5.1e100.net.https: Flags [P.], seq 1:198, ack 1, win 343, options [nop,nop,TS val 289828 ecr 2439431254], length 197
14:16:25.619062 IP 10.0.0.222.58371 > bom07s01-in-f3.1e100.net.https: Flags [P.], seq 1:204, ack 1, win 343, options [nop,nop,TS val 289828 ecr 2435474883], length 203
14:16:25.705000 IP bom07s01-in-f5.1e100.net.https > 10.0.0.222.41307: Flags [.], ack 198, win 341, options [nop,nop,TS val 2439431328 ecr 289828], length 0
14:16:25.705246 IP bom07s01-in-f3.1e100.net.https > 10.0.0.222.58371: Flags [.], ack 204, win 341, options [nop,nop,TS val 2435474956 ecr 289828], length 0
14:16:25.705994 IP bom07s01-in-f5.1e100.net.https > 10.0.0.222.41307: Flags [.], seq 1:1349, ack 198, win 341, options [nop,nop,TS val 2439431328 ecr 289828], length 1348
14:16:25.707394 IP 10.0.0.222.41307 > bom07s01-in-f5.1e100.net.https: Flags [.], ack 1349, win 353, options [nop,nop,TS val 289837 ecr 2439431328], length 0
14:16:25.712492 IP bom07s01-in-f5.1e100.net.https > 10.0.0.222.41307: Flags [.], seq 1349:2697, ack 198, win 341, options [nop,nop,TS val 2439431328 ecr 289828], length 1348
14:16:25.713753 IP 10.0.0.222.41307 > bom07s01-in-f5.1e100.net.https: Flags [.], ack 2697, win 364, options [nop,nop,TS val 289838 ecr 2439431328], length 0
14:16:25.718481 IP bom07s01-in-f5.1e100.net.https > 10.0.0.222.41307: Flags [P.], seq 2697:3160, ack 198, win 341, options [nop,nop,TS val 2439431328 ecr 289828], length 463
14:16:25.720222 IP 10.0.0.222.41307 > bom07s01-in-f5.1e100.net.https: Flags [.], ack 3160, win 374, options [nop,nop,TS val 289838 ecr 2439431328], length 0
14:16:25.721104 IP bom07s01-in-f3.1e100.net.https > 10.0.0.222.58371: Flags [.], seq 1:1349, ack 204, win 341, options [nop,nop,TS val 2435474957 ecr 289828], length 1348
14:16:25.722254 IP 10.0.0.222.58371 > bom07s01-in-f3.1e100.net.https: Flags [.], ack 1349, win 353, options [nop,nop,TS val 289839 ecr 2435474957], length 0
14:16:25.727612 IP bom07s01-in-f3.1e100.net.https > 10.0.0.222.58371: Flags [.], seq 1349:2697, ack 204, win 341, options [nop,nop,TS val 2435474957 ecr 289828], length 1348
14:16:25.729028 IP 10.0.0.222.58371 > bom07s01-in-f3.1e100.net.https: Flags [.], ack 2697, win 364, options [nop,nop,TS val 289839 ecr 2435474957], length 0
14:16:25.734084 IP bom07s01-in-f3.1e100.net.https > 10.0.0.222.58371: Flags [P.], seq 2697:3989, ack 204, win 341, options [nop,nop,TS val 2435474957 ecr 289828], length 1292
14:16:25.738763 IP 10.0.0.222.58371 > bom07s01-in-f3.1e100.net.https: Flags [.], ack 3989, win 374, options [nop,nop,TS val 289840 ecr 2435474957], length 0
14:16:25.757205 IP 10.0.0.222.41307 > bom07s01-in-f5.1e100.net.https: Flags [P.], seq 198:324, ack 3160, win 374, options [nop,nop,TS val 289842 ecr 2439431328], length 126
14:16:25.757498 IP 10.0.0.222.41307 > bom07s01-in-f5.1e100.net.https: Flags [P.], seq 324:481, ack 3160, win 374, options [nop,nop,TS val 289842 ecr 2439431328], length 157
14:16:25.779301 IP 10.0.0.222.58371 > bom07s01-in-f3.1e100.net.https: Flags [P.], seq 204:330, ack 3989, win 374, options [nop,nop,TS val 289844 ecr 2435474957], length 126
14:16:25.783606 IP 10.0.0.222.58371 > bom07s01-in-f3.1e100.net.https: Flags [P.], seq 330:487, ack 3989, win 374, options [nop,nop,TS val 289845 ecr 2435474957], length 157
14:16:25.892185 IP bom07s01-in-f5.1e100.net.https > 10.0.0.222.41307: Flags [P.], seq 3160:3422, ack 324, win 341, options [nop,nop,TS val 2439431466 ecr 289842], length 262
14:16:25.893488 IP bom07s01-in-f5.1e100.net.https > 10.0.0.222.41307: Flags [P.], seq 3422:3484, ack 324, win 341, options [nop,nop,TS val 2439431466 ecr 289842], length 62
14:16:25.893648 IP 10.0.0.222.41307 > bom07s01-in-f5.1e100.net.https: Flags [.], ack 3422, win 385, options [nop,nop,TS val 289856 ecr 2439431466], length 0
14:16:25.894125 IP bom07s01-in-f5.1e100.net.https > 10.0.0.222.41307: Flags [P.], seq 3484:3526, ack 324, win 341, options [nop,nop,TS val 2439431466 ecr 289842], length 42
14:16:25.894277 IP bom07s01-in-f5.1e100.net.https > 10.0.0.222.41307: Flags [P.], seq 3526:3564, ack 481, win 350, options [nop,nop,TS val 2439431467 ecr 289842], length 38
14:16:25.894536 IP 10.0.0.222.41307 > bom07s01-in-f5.1e100.net.https: Flags [.], ack 3484, win 385, options [nop,nop,TS val 289856 ecr 2439431466], length 0
14:16:25.894768 IP 10.0.0.222.41307 > bom07s01-in-f5.1e100.net.https: Flags [P.], seq 481:519, ack 3484, win 385, options [nop,nop,TS val 289856 ecr 2439431466], length 38
14:16:25.896483 IP 10.0.0.222.41307 > bom07s01-in-f5.1e100.net.https: Flags [.], ack 3564, win 385, options [nop,nop,TS val 289856 ecr 2439431466], length 0
14:16:25.907442 IP bom07s01-in-f3.1e100.net.https > 10.0.0.222.58371: Flags [P.], seq 4251:4313, ack 330, win 341, options [nop,nop,TS val 2435475117 ecr 289844], length 62
14:16:25.907819 IP bom07s01-in-f3.1e100.net.https > 10.0.0.222.58371: Flags [P.], seq 4313:4355, ack 330, win 341, options [nop,nop,TS val 2435475117 ecr 289844], length 42
14:16:25.908188 IP bom07s01-in-f3.1e100.net.https > 10.0.0.222.58371: Flags [P.], seq 4355:4393, ack 487, win 350, options [nop,nop,TS val 2435475121 ecr 289845], length 38
14:16:25.908797 IP 10.0.0.222.58371 > bom07s01-in-f3.1e100.net.https: Flags [.], ack 3989, win 374, options [nop,nop,TS val 289857 ecr 2435474957,nop,nop,sack 1 {4251:4313}], length 0
14:16:25.909152 IP 10.0.0.222.58371 > bom07s01-in-f3.1e100.net.https: Flags [.], ack 3989, win 374, options [nop,nop,TS val 289857 ecr 2435474957,nop,nop,sack 1 {4251:4355}], length 0
14:16:25.909387 IP 10.0.0.222.58371 > bom07s01-in-f3.1e100.net.https: Flags [.], ack 3989, win 374, options [nop,nop,TS val 289857 ecr 2435474957,nop,nop,sack 1 {4251:4393}], length 0
14:16:26.048717 IP bom07s01-in-f3.1e100.net.https > 10.0.0.222.58371: Flags [P.], seq 3989:4251, ack 487, win 350, options [nop,nop,TS val 2435475247 ecr 289857], length 262
14:16:26.050377 IP 10.0.0.222.58371 > bom07s01-in-f3.1e100.net.https: Flags [.], ack 4393, win 385, options [nop,nop,TS val 289871 ecr 2435475247], length 0
14:16:26.051402 IP 10.0.0.222.58371 > bom07s01-in-f3.1e100.net.https: Flags [P.], seq 487:525, ack 4393, win 385, options [nop,nop,TS val 289871 ecr 2435475247], length 38
14:16:26.075163 IP bom07s01-in-f5.1e100.net.https > 10.0.0.222.41307: Flags [.], ack 519, win 350, options [nop,nop,TS val 2439431645 ecr 289856], length 0
14:16:26.078666 ARP, Reply 192.168.0.100 is-at 00:1e:a6:6a:69:23 (oui Unknown), length 28
14:16:26.189092 IP bom07s01-in-f3.1e100.net.https > 10.0.0.222.58371: Flags [.], ack 525, win 350, options [nop,nop,TS val 2435475429 ecr 289871], length 0
14:16:26.211572 IP 10.0.0.222 > igmp.mcast.net: igmp v3 report, 1 group record(s)
14:16:26.211688 IP 10.0.0.222 > igmp.mcast.net: igmp v3 report, 1 group record(s)
14:16:26.768918 IP 10.0.0.222.25757 > 10.0.0.1.domain: 16215+ A? www.google.com. (32)
14:16:26.788862 IP 10.0.0.222.48605 > 10.0.0.1.4886: UDP, length 0
14:16:26.789039 IP 10.0.0.1 > 10.0.0.222: ICMP 10.0.0.1 udp port 4886 unreachable, length 36
14:16:26.805338 IP 10.0.0.222.48605 > 10.0.0.1.4886: UDP, length 0
14:16:26.805426 IP 10.0.0.1 > 10.0.0.222: ICMP 10.0.0.1 udp port 4886 unreachable, length 36
14:16:26.821352 IP 10.0.0.222.48605 > 10.0.0.1.4886: UDP, length 0
14:16:26.821418 IP 10.0.0.1 > 10.0.0.222: ICMP 10.0.0.1 udp port 4886 unreachable, length 36
14:16:26.838409 IP 10.0.0.222.48605 > 10.0.0.1.4886: UDP, length 0
14:16:26.838513 IP 10.0.0.1 > 10.0.0.222: ICMP 10.0.0.1 udp port 4886 unreachable, length 36
14:16:26.855408 IP 10.0.0.222.48605 > 10.0.0.1.4886: UDP, length 0
14:16:26.855496 IP 10.0.0.1 > 10.0.0.222: ICMP 10.0.0.1 udp port 4886 unreachable, length 36
14:16:26.871544 IP 10.0.0.222.48605 > 10.0.0.1.4886: UDP, length 0
14:16:26.871629 IP 10.0.0.1 > 10.0.0.222: ICMP 10.0.0.1 udp port 4886 unreachable, length 36
14:16:26.890090 IP 10.0.0.222.48605 > 10.0.0.1.4886: UDP, length 0
14:16:26.905052 IP 10.0.0.222.48605 > 10.0.0.1.4886: UDP, length 0
14:16:26.911676 IP 10.0.0.222 > igmp.mcast.net: igmp v3 report, 1 group record(s)
14:16:26.911747 IP 10.0.0.222 > igmp.mcast.net: igmp v3 report, 1 group record(s)
14:16:26.921653 IP 10.0.0.222.48605 > 10.0.0.1.4886: UDP, length 0
14:16:26.938020 IP 10.0.0.222.48605 > 10.0.0.1.4886: UDP, length 0
14:16:26.954970 IP 10.0.0.222.48605 > 10.0.0.1.4886: UDP, length 0
14:16:26.962698 IP 10.0.0.1.domain > 10.0.0.222.25757: 16215 1/0/0 A 216.58.199.132 (48)
14:16:26.964704 IP 10.0.0.222.46942 > bom07s01-in-f4.1e100.net.https: Flags [S], seq 3252759612, win 65535, options [mss 1460,sackOK,TS val 289963 ecr 0,nop,wscale 8], length 0
14:16:26.972046 IP 10.0.0.222.48605 > 10.0.0.1.4886: UDP, length 0
14:16:26.985156 IP 10.0.0.222.57046 > bom07s01-in-f4.1e100.net.https: Flags [S], seq 3395209235, win 65535, options [mss 1460,sackOK,TS val 289965 ecr 0,nop,wscale 8], length 0
14:16:26.989164 IP 10.0.0.222.48605 > 10.0.0.1.4886: UDP, length 0
14:16:27.005416 IP 10.0.0.222.48605 > 10.0.0.1.4886: UDP, length 0
14:16:27.021774 IP 10.0.0.222.48605 > 10.0.0.1.4886: UDP, length 0
14:16:27.038645 IP 10.0.0.222.48605 > 10.0.0.1.4886: UDP, length 0
14:16:27.055250 IP 10.0.0.222.48605 > 10.0.0.1.4886: UDP, length 0
14:16:27.071363 IP 10.0.0.222.48605 > 10.0.0.1.4886: UDP, length 0
14:16:27.087554 IP 10.0.0.222.48605 > 10.0.0.1.4886: UDP, length 0
14:16:27.103930 IP 10.0.0.222.48605 > 10.0.0.1.4886: UDP, length 0
14:16:27.120202 IP 10.0.0.222.48605 > 10.0.0.1.4886: UDP, length 0
14:16:27.136254 IP 10.0.0.222.48605 > 10.0.0.1.4886: UDP, length 0
14:16:27.152265 IP bom07s01-in-f4.1e100.net.https > 10.0.0.222.46942: Flags [S.], seq 3111345806, ack 3252759613, win 42540, options [mss 1430,sackOK,TS val 2435352925 ecr 289963,nop,wscale 7], length 0
14:16:27.152445 IP 10.0.0.222.48605 > 10.0.0.1.4886: UDP, length 0
14:16:27.153378 IP 10.0.0.222.46942 > bom07s01-in-f4.1e100.net.https: Flags [.], ack 1, win 343, options [nop,nop,TS val 289982 ecr 2435352925], length 0
14:16:27.154013 IP 10.0.0.222.46942 > bom07s01-in-f4.1e100.net.https: Flags [P.], seq 1:197, ack 1, win 343, options [nop,nop,TS val 289982 ecr 2435352925], length 196
14:16:27.165317 IP bom07s01-in-f4.1e100.net.https > 10.0.0.222.57046: Flags [S.], seq 2249737109, ack 3395209236, win 42540, options [mss 1430,sackOK,TS val 1376395761 ecr 289965,nop,wscale 7], length 0
14:16:27.166434 IP 10.0.0.222.57046 > bom07s01-in-f4.1e100.net.https: Flags [.], ack 1, win 343, options [nop,nop,TS val 289983 ecr 1376395761], length 0
14:16:27.167400 IP 10.0.0.222.57046 > bom07s01-in-f4.1e100.net.https: Flags [P.], seq 1:181, ack 1, win 343, options [nop,nop,TS val 289983 ecr 1376395761], length 180
14:16:27.168375 IP 10.0.0.222.48605 > 10.0.0.1.4886: UDP, length 0
14:16:27.184571 IP 10.0.0.222.48605 > 10.0.0.1.4886: UDP, length 0
14:16:27.336372 IP bom07s01-in-f4.1e100.net.https > 10.0.0.222.46942: Flags [.], ack 197, win 341, options [nop,nop,TS val 2435353115 ecr 289982], length 0
14:16:27.337044 IP bom07s01-in-f4.1e100.net.https > 10.0.0.222.46942: Flags [.], seq 1:1349, ack 197, win 341, options [nop,nop,TS val 2435353116 ecr 289982], length 1348
14:16:27.338842 IP 10.0.0.222.46942 > bom07s01-in-f4.1e100.net.https: Flags [.], ack 1349, win 353, options [nop,nop,TS val 290000 ecr 2435353116], length 0
14:16:27.343549 IP bom07s01-in-f4.1e100.net.https > 10.0.0.222.46942: Flags [.], seq 1349:2697, ack 197, win 341, options [nop,nop,TS val 2435353116 ecr 289982], length 1348
14:16:27.344930 IP 10.0.0.222.46942 > bom07s01-in-f4.1e100.net.https: Flags [.], ack 2697, win 364, options [nop,nop,TS val 290001 ecr 2435353116], length 0
14:16:27.350475 IP bom07s01-in-f4.1e100.net.https > 10.0.0.222.46942: Flags [P.], seq 2697:3515, ack 197, win 341, options [nop,nop,TS val 2435353116 ecr 289982], length 818
14:16:27.351709 IP 10.0.0.222.46942 > bom07s01-in-f4.1e100.net.https: Flags [.], ack 3515, win 374, options [nop,nop,TS val 290002 ecr 2435353116], length 0
14:16:27.365944 IP bom07s01-in-f4.1e100.net.https > 10.0.0.222.57046: Flags [.], ack 181, win 341, options [nop,nop,TS val 1376395942 ecr 289983], length 0
14:16:27.371580 IP 10.0.0.222.46942 > bom07s01-in-f4.1e100.net.https: Flags [P.], seq 197:323, ack 3515, win 374, options [nop,nop,TS val 290003 ecr 2435353116], length 126
14:16:27.377711 IP 10.0.0.222.46942 > bom07s01-in-f4.1e100.net.https: Flags [P.], seq 323:480, ack 3515, win 374, options [nop,nop,TS val 290004 ecr 2435353116], length 157
14:16:27.379229 IP bom07s01-in-f4.1e100.net.https > 10.0.0.222.57046: Flags [.], seq 1:1349, ack 181, win 341, options [nop,nop,TS val 1376395943 ecr 289983], length 1348
14:16:27.380093 IP 10.0.0.222.46942 > bom07s01-in-f4.1e100.net.https: Flags [P.], seq 480:1116, ack 3515, win 374, options [nop,nop,TS val 290004 ecr 2435353116], length 636
14:16:27.381345 IP 10.0.0.222.57046 > bom07s01-in-f4.1e100.net.https: Flags [.], ack 1349, win 353, options [nop,nop,TS val 290004 ecr 1376395943], length 0
14:16:27.385923 IP bom07s01-in-f4.1e100.net.https > 10.0.0.222.57046: Flags [.], seq 1349:2697, ack 181, win 341, options [nop,nop,TS val 1376395943 ecr 289983], length 1348
14:16:27.388333 IP 10.0.0.222.57046 > bom07s01-in-f4.1e100.net.https: Flags [.], ack 2697, win 364, options [nop,nop,TS val 290005 ecr 1376395943], length 0
14:16:27.391999 IP bom07s01-in-f4.1e100.net.https > 10.0.0.222.57046: Flags [P.], seq 2697:3521, ack 181, win 341, options [nop,nop,TS val 1376395943 ecr 289983], length 824
14:16:27.393968 IP 10.0.0.222.57046 > bom07s01-in-f4.1e100.net.https: Flags [.], ack 3521, win 374, options [nop,nop,TS val 290006 ecr 1376395943], length 0
14:16:27.402915 IP 10.0.0.222.1900 > 239.255.255.250.1900: UDP, length 94
14:16:27.402990 IP 10.0.0.222.1900 > 239.255.255.250.1900: UDP, length 94
14:16:27.422626 IP 10.0.0.222.57046 > bom07s01-in-f4.1e100.net.https: Flags [P.], seq 181:307, ack 3521, win 374, options [nop,nop,TS val 290009 ecr 1376395943], length 126
14:16:27.446066 IP 10.0.0.222.6595 > 10.0.0.1.domain: 19750+ A? safebrowsing.google.com. (41)
14:16:27.584642 IP bom07s01-in-f4.1e100.net.https > 10.0.0.222.46942: Flags [P.], seq 3515:3777, ack 323, win 341, options [nop,nop,TS val 2435353333 ecr 290003], length 262
14:16:27.586485 IP bom07s01-in-f4.1e100.net.https > 10.0.0.222.46942: Flags [P.], seq 3777:3839, ack 323, win 341, options [nop,nop,TS val 2435353333 ecr 290003], length 62
14:16:27.586607 IP bom07s01-in-f4.1e100.net.https > 10.0.0.222.46942: Flags [P.], seq 3839:3881, ack 323, win 341, options [nop,nop,TS val 2435353333 ecr 290003], length 42
14:16:27.586830 IP bom07s01-in-f4.1e100.net.https > 10.0.0.222.46942: Flags [P.], seq 3881:3919, ack 480, win 350, options [nop,nop,TS val 2435353338 ecr 290004], length 38
14:16:27.589604 IP 10.0.0.222.46942 > bom07s01-in-f4.1e100.net.https: Flags [P.], seq 1116:1154, ack 3919, win 385, options [nop,nop,TS val 290025 ecr 2435353333], length 38
14:16:27.638247 IP bom07s01-in-f4.1e100.net.https > 10.0.0.222.46942: Flags [.], ack 1116, win 360, options [nop,nop,TS val 2435353381 ecr 290004], length 0
14:16:27.638461 IP bom07s01-in-f4.1e100.net.https > 10.0.0.222.57046: Flags [P.], seq 3521:3783, ack 307, win 341, options [nop,nop,TS val 1376396199 ecr 290009], length 262
14:16:27.645283 IP 10.0.0.222.57046 > bom07s01-in-f4.1e100.net.https: Flags [P.], seq 307:553, ack 3783, win 385, options [nop,nop,TS val 290031 ecr 1376396199], length 246
14:16:27.652690 IP bom07s01-in-f4.1e100.net.https > 10.0.0.222.46942: Flags [P.], seq 3919:4572, ack 1116, win 360, options [nop,nop,TS val 2435353404 ecr 290004], length 653
14:16:27.655724 IP bom07s01-in-f4.1e100.net.https > 10.0.0.222.46942: Flags [P.], seq 4572:4926, ack 1116, win 360, options [nop,nop,TS val 2435353404 ecr 290004], length 354
14:16:27.657446 IP bom07s01-in-f4.1e100.net.https > 10.0.0.222.46942: Flags [P.], seq 4926:4972, ack 1116, win 360, options [nop,nop,TS val 2435353405 ecr 290004], length 46
14:16:27.658057 IP 10.0.0.222.46942 > bom07s01-in-f4.1e100.net.https: Flags [.], ack 4926, win 406, options [nop,nop,TS val 290032 ecr 2435353404], length 0
14:16:27.662607 IP 10.0.0.222.46942 > bom07s01-in-f4.1e100.net.https: Flags [P.], seq 1154:1200, ack 4972, win 406, options [nop,nop,TS val 290032 ecr 2435353405], length 46
14:16:27.674540 IP 10.0.0.1.domain > 10.0.0.222.6595: 19750 2/0/0 CNAME sb.l.google.com., A 216.58.220.174 (76)
14:16:27.682665 IP 10.0.0.222.33109 > bom07s10-in-f174.1e100.net.https: Flags [S], seq 353436905, win 65535, options [mss 1460,sackOK,TS val 290035 ecr 0,nop,wscale 8], length 0
14:16:27.694874 IP 10.0.0.222.17181 > 10.0.0.1.domain: 8149+ A? www.google.co.in. (34)
14:16:27.708273 IP 10.0.0.222.48605 > 10.0.0.1.4886: UDP, length 0
14:16:27.724722 IP 10.0.0.222.48605 > 10.0.0.1.4886: UDP, length 0
14:16:27.741637 IP 10.0.0.222.48605 > 10.0.0.1.4886: UDP, length 0
14:16:27.758599 IP 10.0.0.222.48605 > 10.0.0.1.4886: UDP, length 0
14:16:27.775227 IP 10.0.0.222.48605 > 10.0.0.1.4886: UDP, length 0
14:16:27.779871 IP bom07s01-in-f4.1e100.net.https > 10.0.0.222.46942: Flags [.], ack 1154, win 360, options [nop,nop,TS val 2435353551 ecr 290025], length 0
14:16:27.791622 IP 10.0.0.222.48605 > 10.0.0.1.4886: UDP, length 0
14:16:27.791801 IP 10.0.0.1 > 10.0.0.222: ICMP 10.0.0.1 udp port 4886 unreachable, length 36
14:16:27.808137 IP 10.0.0.222.48605 > 10.0.0.1.4886: UDP, length 0
14:16:27.817474 IP bom07s10-in-f174.1e100.net.https > 10.0.0.222.33109: Flags [S.], seq 4195224940, ack 353436906, win 42540, options [mss 1430,sackOK,TS val 3579465522 ecr 290035,nop,wscale 7], length 0
14:16:27.818644 IP 10.0.0.222.33109 > bom07s10-in-f174.1e100.net.https: Flags [.], ack 1, win 343, options [nop,nop,TS val 290048 ecr 3579465522], length 0
14:16:27.819555 IP 10.0.0.222.33109 > bom07s10-in-f174.1e100.net.https: Flags [P.], seq 1:206, ack 1, win 343, options [nop,nop,TS val 290048 ecr 3579465522], length 205
14:16:27.824414 IP 10.0.0.222.48605 > 10.0.0.1.4886: UDP, length 0
14:16:27.840920 IP 10.0.0.222.48605 > 10.0.0.1.4886: UDP, length 0
14:16:27.856121 IP bom07s01-in-f4.1e100.net.https > 10.0.0.222.46942: Flags [.], ack 1200, win 360, options [nop,nop,TS val 2435353623 ecr 290032], length 0
14:16:27.857595 IP 10.0.0.222.48605 > 10.0.0.1.4886: UDP, length 0
14:16:27.874408 IP 10.0.0.222.48605 > 10.0.0.1.4886: UDP, length 0
14:16:27.881058 IP bom07s01-in-f4.1e100.net.https > 10.0.0.222.57046: Flags [.], ack 553, win 350, options [nop,nop,TS val 1376396460 ecr 290031], length 0
14:16:27.891365 IP 10.0.0.222.48605 > 10.0.0.1.4886: UDP, length 0
14:16:27.908195 IP 10.0.0.222.48605 > 10.0.0.1.4886: UDP, length 0
14:16:27.920167 IP 10.0.0.1.domain > 10.0.0.222.17181: 8149 1/0/0 A 216.58.199.131 (50)
14:16:27.920501 IP bom07s01-in-f4.1e100.net.https > 10.0.0.222.57046: Flags [P.], seq 3783:4584, ack 553, win 350, options [nop,nop,TS val 1376396505 ecr 290031], length 801
14:16:27.924601 IP 10.0.0.222.48605 > 10.0.0.1.4886: UDP, length 0
14:16:27.936412 IP 10.0.0.222.58371 > bom07s01-in-f3.1e100.net.https: Flags [P.], seq 525:1188, ack 4393, win 385, options [nop,nop,TS val 290060 ecr 2435475429], length 663
14:16:27.937255 IP 10.0.0.222.58374 > bom07s01-in-f3.1e100.net.https: Flags [S], seq 265193286, win 65535, options [mss 1460,sackOK,TS val 290060 ecr 0,nop,wscale 8], length 0
14:16:27.941377 IP 10.0.0.222.48605 > 10.0.0.1.4886: UDP, length 0
14:16:27.957855 IP 10.0.0.222.48605 > 10.0.0.1.4886: UDP, length 0
14:16:27.961687 IP 10.0.0.222.57046 > bom07s01-in-f4.1e100.net.https: Flags [.], ack 4584, win 395, options [nop,nop,TS val 290063 ecr 1376396505], length 0
14:16:27.962101 IP bom07s10-in-f174.1e100.net.https > 10.0.0.222.33109: Flags [.], ack 206, win 341, options [nop,nop,TS val 3579465658 ecr 290048], length 0
14:16:27.962818 IP bom07s10-in-f174.1e100.net.https > 10.0.0.222.33109: Flags [.], seq 1:1349, ack 206, win 341, options [nop,nop,TS val 3579465658 ecr 290048], length 1348
14:16:27.964070 IP 10.0.0.222.33109 > bom07s10-in-f174.1e100.net.https: Flags [.], ack 1349, win 353, options [nop,nop,TS val 290063 ecr 3579465658], length 0
14:16:27.969356 IP bom07s10-in-f174.1e100.net.https > 10.0.0.222.33109: Flags [.], seq 1349:2697, ack 206, win 341, options [nop,nop,TS val 3579465658 ecr 290048], length 1348
14:16:27.970908 IP 10.0.0.222.33109 > bom07s10-in-f174.1e100.net.https: Flags [.], ack 2697, win 364, options [nop,nop,TS val 290063 ecr 3579465658], length 0
14:16:27.974404 IP 10.0.0.222.48605 > 10.0.0.1.4886: UDP, length 0
14:16:27.975747 IP bom07s10-in-f174.1e100.net.https > 10.0.0.222.33109: Flags [P.], seq 2697:3988, ack 206, win 341, options [nop,nop,TS val 3579465658 ecr 290048], length 1291
14:16:27.977282 IP 10.0.0.222.33109 > bom07s10-in-f174.1e100.net.https: Flags [.], ack 3988, win 374, options [nop,nop,TS val 290064 ecr 3579465658], length 0
14:16:27.990653 IP 10.0.0.222.48605 > 10.0.0.1.4886: UDP, length 0
14:16:27.994260 IP 10.0.0.222.33109 > bom07s10-in-f174.1e100.net.https: Flags [P.], seq 206:332, ack 3988, win 374, options [nop,nop,TS val 290066 ecr 3579465658], length 126
14:16:27.998767 IP 10.0.0.222.33109 > bom07s10-in-f174.1e100.net.https: Flags [P.], seq 332:489, ack 3988, win 374, options [nop,nop,TS val 290066 ecr 3579465658], length 157
14:16:27.999021 IP 10.0.0.222.33109 > bom07s10-in-f174.1e100.net.https: Flags [P.], seq 489:912, ack 3988, win 374, options [nop,nop,TS val 290066 ecr 3579465658], length 423
14:16:28.000016 IP 10.0.0.222.33109 > bom07s10-in-f174.1e100.net.https: Flags [.], seq 912:2330, ack 3988, win 374, options [nop,nop,TS val 290066 ecr 3579465658], length 1418
14:16:28.000506 IP 10.0.0.222.33109 > bom07s10-in-f174.1e100.net.https: Flags [.], seq 2330:3748, ack 3988, win 374, options [nop,nop,TS val 290066 ecr 3579465658], length 1418
14:16:28.002359 IP 10.0.0.222.33109 > bom07s10-in-f174.1e100.net.https: Flags [.], seq 3748:5166, ack 3988, win 374, options [nop,nop,TS val 290066 ecr 3579465658], length 1418
14:16:28.002853 IP 10.0.0.222.33109 > bom07s10-in-f174.1e100.net.https: Flags [P.], seq 5166:6329, ack 3988, win 374, options [nop,nop,TS val 290066 ecr 3579465658], length 1163
14:16:28.007637 IP 10.0.0.222.48605 > 10.0.0.1.4886: UDP, length 0
14:16:28.024064 IP 10.0.0.222.48605 > 10.0.0.1.4886: UDP, length 0
14:16:28.041043 IP 10.0.0.222.48605 > 10.0.0.1.4886: UDP, length 0
14:16:28.057888 IP 10.0.0.222.48605 > 10.0.0.1.4886: UDP, length 0
14:16:28.075413 IP 10.0.0.222.48605 > 10.0.0.1.4886: UDP, length 0
14:16:28.095239 IP bom07s01-in-f3.1e100.net.https > 10.0.0.222.58371: Flags [.], ack 1188, win 360, options [nop,nop,TS val 2435477274 ecr 290060], length 0
14:16:28.095417 IP bom07s01-in-f3.1e100.net.https > 10.0.0.222.58374: Flags [S.], seq 3120375382, ack 265193287, win 42540, options [mss 1430,sackOK,TS val 2442362551 ecr 290060,nop,wscale 7], length 0
14:16:28.098058 IP 10.0.0.222.58374 > bom07s01-in-f3.1e100.net.https: Flags [.], ack 1, win 343, options [nop,nop,TS val 290076 ecr 2442362551], length 0
14:16:28.101685 IP 10.0.0.222.58374 > bom07s01-in-f3.1e100.net.https: Flags [P.], seq 1:199, ack 1, win 343, options [nop,nop,TS val 290076 ecr 2442362551], length 198
14:16:28.146594 IP bom07s10-in-f174.1e100.net.https > 10.0.0.222.33109: Flags [P.], seq 3988:4250, ack 332, win 341, options [nop,nop,TS val 3579465834 ecr 290066], length 262
14:16:28.147815 IP bom07s10-in-f174.1e100.net.https > 10.0.0.222.33109: Flags [P.], seq 4250:4312, ack 332, win 341, options [nop,nop,TS val 3579465834 ecr 290066], length 62
14:16:28.148298 IP bom07s10-in-f174.1e100.net.https > 10.0.0.222.33109: Flags [P.], seq 4312:4354, ack 332, win 341, options [nop,nop,TS val 3579465834 ecr 290066], length 42
14:16:28.148725 IP bom07s10-in-f174.1e100.net.https > 10.0.0.222.33109: Flags [.], ack 912, win 358, options [nop,nop,TS val 3579465837 ecr 290066], length 0
14:16:28.148900 IP bom07s10-in-f174.1e100.net.https > 10.0.0.222.33109: Flags [P.], seq 4354:4392, ack 912, win 358, options [nop,nop,TS val 3579465837 ecr 290066], length 38
14:16:28.149370 IP bom07s10-in-f174.1e100.net.https > 10.0.0.222.33109: Flags [.], ack 3748, win 402, options [nop,nop,TS val 3579465840 ecr 290066], length 0
14:16:28.149531 IP bom07s10-in-f174.1e100.net.https > 10.0.0.222.33109: Flags [.], ack 6329, win 447, options [nop,nop,TS val 3579465843 ecr 290066], length 0
14:16:28.174895 IP 10.0.0.222.33109 > bom07s10-in-f174.1e100.net.https: Flags [P.], seq 6329:6367, ack 4392, win 385, options [nop,nop,TS val 290084 ecr 3579465834], length 38
14:16:28.188139 IP bom07s01-in-f3.1e100.net.https > 10.0.0.222.58371: Flags [P.], seq 4393:4956, ack 1188, win 360, options [nop,nop,TS val 2435477380 ecr 290060], length 563
14:16:28.191178 IP bom07s01-in-f3.1e100.net.https > 10.0.0.222.58371: Flags [P.], seq 4956:6304, ack 1188, win 360, options [nop,nop,TS val 2435477380 ecr 290060], length 1348
14:16:28.197670 IP bom07s01-in-f3.1e100.net.https > 10.0.0.222.58371: Flags [P.], seq 6304:7652, ack 1188, win 360, options [nop,nop,TS val 2435477380 ecr 290060], length 1348
14:16:28.204089 IP bom07s01-in-f3.1e100.net.https > 10.0.0.222.58371: Flags [P.], seq 7652:9000, ack 1188, win 360, options [nop,nop,TS val 2435477380 ecr 290060], length 1348
14:16:28.210548 IP bom07s01-in-f3.1e100.net.https > 10.0.0.222.58371: Flags [P.], seq 9000:10348, ack 1188, win 360, options [nop,nop,TS val 2435477380 ecr 290060], length 1348
14:16:28.212320 IP 10.0.0.222.58371 > bom07s01-in-f3.1e100.net.https: Flags [.], ack 10348, win 437, options [nop,nop,TS val 290088 ecr 2435477380], length 0
14:16:28.217046 IP bom07s01-in-f3.1e100.net.https > 10.0.0.222.58371: Flags [P.], seq 10348:11696, ack 1188, win 360, options [nop,nop,TS val 2435477380 ecr 290060], length 1348
14:16:28.223794 IP bom07s01-in-f3.1e100.net.https > 10.0.0.222.58371: Flags [P.], seq 11696:13044, ack 1188, win 360, options [nop,nop,TS val 2435477380 ecr 290060], length 1348
14:16:28.231101 IP bom07s01-in-f3.1e100.net.https > 10.0.0.222.58371: Flags [P.], seq 13044:14392, ack 1188, win 360, options [nop,nop,TS val 2435477380 ecr 290060], length 1348
14:16:28.249346 IP bom07s01-in-f3.1e100.net.https > 10.0.0.222.58371: Flags [.], seq 14392:15740, ack 1188, win 360, options [nop,nop,TS val 2435477381 ecr 290060], length 1348
14:16:28.255776 IP bom07s01-in-f3.1e100.net.https > 10.0.0.222.58371: Flags [P.], seq 15740:17088, ack 1188, win 360, options [nop,nop,TS val 2435477381 ecr 290060], length 1348
14:16:28.257321 IP 10.0.0.222.58371 > bom07s01-in-f3.1e100.net.https: Flags [.], ack 17088, win 490, options [nop,nop,TS val 290092 ecr 2435477380], length 0
14:16:28.275094 IP bom07s01-in-f3.1e100.net.https > 10.0.0.222.58371: Flags [P.], seq 17088:18255, ack 1188, win 360, options [nop,nop,TS val 2435477381 ecr 290060], length 1167
14:16:28.280153 IP bom07s01-in-f3.1e100.net.https > 10.0.0.222.58371: Flags [P.], seq 18255:18442, ack 1188, win 360, options [nop,nop,TS val 2435477389 ecr 290060], length 187
14:16:28.280925 IP bom07s10-in-f174.1e100.net.https > 10.0.0.222.33109: Flags [P.], seq 4392:4626, ack 6329, win 447, options [nop,nop,TS val 3579465900 ecr 290066], length 234
14:16:28.281813 IP 10.0.0.222.58371 > bom07s01-in-f3.1e100.net.https: Flags [.], ack 18442, win 501, options [nop,nop,TS val 290095 ecr 2435477381], length 0
14:16:28.282411 IP bom07s10-in-f174.1e100.net.https > 10.0.0.222.33109: Flags [P.], seq 4626:5275, ack 6329, win 447, options [nop,nop,TS val 3579465900 ecr 290066], length 649
14:16:28.283577 IP 10.0.0.222.33109 > bom07s10-in-f174.1e100.net.https: Flags [.], ack 5275, win 406, options [nop,nop,TS val 290095 ecr 3579465900], length 0
14:16:28.285396 IP bom07s10-in-f174.1e100.net.https > 10.0.0.222.33109: Flags [P.], seq 5275:5321, ack 6329, win 447, options [nop,nop,TS val 3579465900 ecr 290066], length 46
14:16:28.286947 IP 10.0.0.222.33109 > bom07s10-in-f174.1e100.net.https: Flags [P.], seq 6367:6413, ack 5321, win 406, options [nop,nop,TS val 290095 ecr 3579465900], length 46
14:16:28.324190 IP bom07s01-in-f3.1e100.net.https > 10.0.0.222.58374: Flags [.], ack 199, win 341, options [nop,nop,TS val 2442362716 ecr 290076], length 0
14:16:28.324903 IP bom07s01-in-f3.1e100.net.https > 10.0.0.222.58374: Flags [.], seq 1:1349, ack 199, win 341, options [nop,nop,TS val 2442362716 ecr 290076], length 1348
14:16:28.326419 IP 10.0.0.222.58374 > bom07s01-in-f3.1e100.net.https: Flags [.], ack 1349, win 353, options [nop,nop,TS val 290099 ecr 2442362716], length 0
14:16:28.331086 IP bom07s01-in-f3.1e100.net.https > 10.0.0.222.58374: Flags [.], seq 1349:2697, ack 199, win 341, options [nop,nop,TS val 2442362716 ecr 290076], length 1348
14:16:28.332335 IP 10.0.0.222.58374 > bom07s01-in-f3.1e100.net.https: Flags [.], ack 2697, win 364, options [nop,nop,TS val 290100 ecr 2442362716], length 0
14:16:28.337535 IP bom07s01-in-f3.1e100.net.https > 10.0.0.222.58374: Flags [P.], seq 2697:3988, ack 199, win 341, options [nop,nop,TS val 2442362716 ecr 290076], length 1291
14:16:28.338820 IP 10.0.0.222.58374 > bom07s01-in-f3.1e100.net.https: Flags [.], ack 3988, win 374, options [nop,nop,TS val 290100 ecr 2442362716], length 0
14:16:28.362621 IP 10.0.0.222.58374 > bom07s01-in-f3.1e100.net.https: Flags [P.], seq 199:325, ack 3988, win 374, options [nop,nop,TS val 290103 ecr 2442362716], length 126
14:16:28.386819 IP 10.0.0.222.58374 > bom07s01-in-f3.1e100.net.https: Flags [P.], seq 325:482, ack 3988, win 374, options [nop,nop,TS val 290105 ecr 2442362716], length 157
14:16:28.387112 IP 10.0.0.222.58374 > bom07s01-in-f3.1e100.net.https: Flags [P.], seq 482:528, ack 3988, win 374, options [nop,nop,TS val 290105 ecr 2442362716], length 46
14:16:28.388747 IP 10.0.0.222.30909 > 10.0.0.1.domain: 12044+ A? safebrowsing-cache.google.com. (47)
14:16:28.438084 IP 10.0.0.222.58374 > bom07s01-in-f3.1e100.net.https: Flags [F.], seq 528, ack 3988, win 374, options [nop,nop,TS val 290110 ecr 2442362716], length 0
14:16:28.438618 IP 10.0.0.222.1900 > 239.255.255.250.1900: UDP, length 98
14:16:28.438702 IP 10.0.0.222.1900 > 239.255.255.250.1900: UDP, length 98
14:16:28.443800 IP bom07s10-in-f174.1e100.net.https > 10.0.0.222.33109: Flags [.], ack 6367, win 447, options [nop,nop,TS val 3579466054 ecr 290084], length 0
