06:41:41.949895 ARP, Request who-has 10.0.0.222 tell 10.0.0.1, length 28
06:41:42.940392 ARP, Request who-has 10.0.0.222 tell 10.0.0.1, length 28
06:41:43.940393 ARP, Request who-has 10.0.0.222 tell 10.0.0.1, length 28
06:42:03.363620 ARP, Reply 192.168.0.100 is-at 98:de:d0:09:37:b4 (oui Unknown), length 28
06:42:06.386040 ARP, Reply 192.168.0.100 is-at 98:de:d0:09:37:b4 (oui Unknown), length 28
06:42:09.400047 ARP, Reply 192.168.0.100 is-at 98:de:d0:09:37:b4 (oui Unknown), length 28
06:42:12.414456 ARP, Reply 192.168.0.100 is-at 98:de:d0:09:37:b4 (oui Unknown), length 28
06:42:15.426717 ARP, Reply 192.168.0.100 is-at 98:de:d0:09:37:b4 (oui Unknown), length 28
06:42:18.441789 ARP, Reply 192.168.0.100 is-at 98:de:d0:09:37:b4 (oui Unknown), length 28
06:42:21.455593 ARP, Reply 192.168.0.100 is-at 98:de:d0:09:37:b4 (oui Unknown), length 28
06:42:24.470932 ARP, Reply 192.168.0.100 is-at 98:de:d0:09:37:b4 (oui Unknown), length 28
06:42:27.495076 ARP, Reply 192.168.0.100 is-at 98:de:d0:09:37:b4 (oui Unknown), length 28
06:42:30.507882 ARP, Reply 192.168.0.100 is-at 98:de:d0:09:37:b4 (oui Unknown), length 28
06:42:31.688331 c0:ee:fb:3b:35:93 (oui Unknown) > Broadcast Null Unnumbered, xid, Flags [Response], length 6: 01 00
06:42:31.853428 IP6 :: > ff02::1:ff3b:3593: ICMP6, neighbor solicitation, who has fe80::c2ee:fbff:fe3b:3593, length 24
06:42:31.853503 IP6 :: > ff02::1:ff3b:3593: ICMP6, neighbor solicitation, who has fe80::c2ee:fbff:fe3b:3593, length 24
06:42:31.885866 IP 0.0.0.0.bootpc > 255.255.255.255.bootps: BOOTP/DHCP, Request from c0:ee:fb:3b:35:93 (oui Unknown), length 298
06:42:31.886010 IP 0.0.0.0.bootpc > 255.255.255.255.bootps: BOOTP/DHCP, Request from c0:ee:fb:3b:35:93 (oui Unknown), length 298
06:42:31.886857 IP 10.0.0.1.bootps > 10.0.0.222.bootpc: BOOTP/DHCP, Reply, length 300
06:42:31.895263 IP 0.0.0.0.bootpc > 255.255.255.255.bootps: BOOTP/DHCP, Request from c0:ee:fb:3b:35:93 (oui Unknown), length 310
06:42:31.895379 IP 0.0.0.0.bootpc > 255.255.255.255.bootps: BOOTP/DHCP, Request from c0:ee:fb:3b:35:93 (oui Unknown), length 310
06:42:31.904149 IP 10.0.0.1.bootps > 10.0.0.222.bootpc: BOOTP/DHCP, Reply, length 300
06:42:32.020634 ARP, Request who-has 10.0.0.1 tell 10.0.0.222, length 28
06:42:32.020747 ARP, Reply 10.0.0.1 is-at 98:de:d0:09:37:b4 (oui Unknown), length 28
06:42:32.020835 ARP, Request who-has 10.0.0.1 tell 10.0.0.222, length 28
06:42:32.022504 IP 10.0.0.222.19187 > 10.0.0.1.domain: 12947+ AAAA? connectivitycheck.gstatic.com. (47)
06:42:32.092832 IP 10.0.0.1.domain > 10.0.0.222.19187: 12947 1/0/0 AAAA 2404:6800:4009:806::200e (75)
06:42:32.095160 IP 10.0.0.222.5899 > 10.0.0.1.domain: 15748+ A? connectivitycheck.gstatic.com. (47)
06:42:32.101794 IP 10.0.0.1.domain > 10.0.0.222.5899: 15748 1/0/0 A 216.58.199.142 (63)
06:42:32.110000 IP 10.0.0.222.59446 > bom07s01-in-f142.1e100.net.http: Flags [S], seq 3968075514, win 65535, options [mss 1460,sackOK,TS val 1152407 ecr 0,nop,wscale 8], length 0
06:42:32.110238 IP bom07s01-in-f142.1e100.net.http > 10.0.0.222.59446: Flags [S.], seq 3507757954, ack 3968075515, win 28960, options [mss 1460,sackOK,TS val 320749 ecr 1152407,nop,wscale 7], length 0
06:42:32.112117 IP 10.0.0.222.59446 > bom07s01-in-f142.1e100.net.http: Flags [.], ack 1, win 343, options [nop,nop,TS val 1152407 ecr 320749], length 0
06:42:32.114902 IP 10.0.0.222.59446 > bom07s01-in-f142.1e100.net.http: Flags [P.], seq 1:187, ack 1, win 343, options [nop,nop,TS val 1152407 ecr 320749], length 186
06:42:32.115090 IP bom07s01-in-f142.1e100.net.http > 10.0.0.222.59446: Flags [.], ack 187, win 235, options [nop,nop,TS val 320750 ecr 1152407], length 0
06:42:32.480806 IP bom07s01-in-f142.1e100.net.http > 10.0.0.222.59446: Flags [P.], seq 1:163, ack 187, win 235, options [nop,nop,TS val 320787 ecr 1152407], length 162
06:42:32.600648 IP 10.0.0.222.59446 > bom07s01-in-f142.1e100.net.http: Flags [.], ack 163, win 347, options [nop,nop,TS val 1152456 ecr 320787], length 0
06:42:32.853994 IP6 fe80::c2ee:fbff:fe3b:3593 > ip6-allrouters: ICMP6, router solicitation, length 16
06:42:32.854091 IP6 fe80::c2ee:fbff:fe3b:3593 > ip6-allrouters: ICMP6, router solicitation, length 16
06:42:33.521424 ARP, Reply 192.168.0.100 is-at 98:de:d0:09:37:b4 (oui Unknown), length 28
06:42:34.425302 IP 10.0.0.222.1900 > 239.255.255.250.1900: UDP, length 98
06:42:34.425435 IP 10.0.0.222.1900 > 239.255.255.250.1900: UDP, length 98
06:42:34.469577 IP 10.0.0.222.30921 > 10.0.0.1.domain: 24052+ AAAA? 127.0.0.1. (27)
06:42:34.533615 IP 10.0.0.1.domain > 10.0.0.222.30921: 24052 NXDomain 0/1/0 (102)
06:42:35.071268 IP 10.0.0.222.20558 > 10.0.0.1.domain: 9616+ AAAA? 127.0.0.0. (27)
06:42:35.133945 IP 10.0.0.1.domain > 10.0.0.222.20558: 9616 NXDomain 0/1/0 (102)
06:42:35.520659 IP 10.0.0.222.1900 > 239.255.255.250.1900: UDP, length 130
06:42:35.520783 IP 10.0.0.222.1900 > 239.255.255.250.1900: UDP, length 130
06:42:36.533603 ARP, Reply 192.168.0.100 is-at 98:de:d0:09:37:b4 (oui Unknown), length 28
06:42:36.702296 IP 10.0.0.222.28404 > 10.0.0.1.domain: 30551+ AAAA? 224.0.0.0. (27)
06:42:36.766055 IP 10.0.0.1.domain > 10.0.0.222.28404: 30551 NXDomain 0/1/0 (102)
06:42:36.934408 IP 10.0.0.222.29212 > 10.0.0.1.domain: 18487+ AAAA? 169.254.0.0. (29)
06:42:36.940507 IP 10.0.0.1.domain > 10.0.0.222.29212: 18487 NXDomain 0/1/0 (104)
06:42:37.202845 IP 10.0.0.222 > 239.255.255.250: igmp v2 report 239.255.255.250
06:42:37.202965 IP 10.0.0.222 > 239.255.255.250: igmp v2 report 239.255.255.250
06:42:37.683548 IP 10.0.0.222.30123 > 10.0.0.1.domain: 32266+ AAAA? 172.16.0.0. (28)
06:42:37.695628 IP 10.0.0.222.1900 > 239.255.255.250.1900: UDP, length 94
06:42:37.695703 IP 10.0.0.222.1900 > 239.255.255.250.1900: UDP, length 94
06:42:37.748728 IP 10.0.0.1.domain > 10.0.0.222.30123: 32266 NXDomain 0/1/0 (103)
06:42:37.800222 IP 10.0.0.222.27307 > 10.0.0.1.domain: 20170+ AAAA? 10.0.0.0. (26)
06:42:37.862220 IP 10.0.0.1.domain > 10.0.0.222.27307: 20170 NXDomain 0/1/0 (101)
06:42:38.647426 IP 10.0.0.222.3624 > 10.0.0.1.domain: 21372+ AAAA? 192.168.0.0. (29)
06:42:38.653515 IP 10.0.0.1.domain > 10.0.0.222.3624: 21372 NXDomain 0/1/0 (104)
06:42:38.695804 IP 10.0.0.222.1900 > 239.255.255.250.1900: UDP, length 98
06:42:38.695916 IP 10.0.0.222.1900 > 239.255.255.250.1900: UDP, length 98
06:42:39.545505 ARP, Reply 192.168.0.100 is-at 98:de:d0:09:37:b4 (oui Unknown), length 28
06:42:39.709455 IP 10.0.0.222.1900 > 239.255.255.250.1900: UDP, length 130
06:42:39.709587 IP 10.0.0.222.1900 > 239.255.255.250.1900: UDP, length 130
06:42:40.885377 IP6 fe80::c2ee:fbff:fe3b:3593 > ip6-allrouters: ICMP6, router solicitation, length 16
06:42:40.885477 IP6 fe80::c2ee:fbff:fe3b:3593 > ip6-allrouters: ICMP6, router solicitation, length 16
06:42:42.481588 IP bom07s01-in-f142.1e100.net.http > 10.0.0.222.59446: Flags [F.], seq 163, ack 187, win 235, options [nop,nop,TS val 321787 ecr 1152456], length 0
06:42:42.556798 ARP, Reply 192.168.0.100 is-at 98:de:d0:09:37:b4 (oui Unknown), length 28
06:42:42.700472 IP bom07s01-in-f142.1e100.net.http > 10.0.0.222.59446: Flags [F.], seq 163, ack 187, win 235, options [nop,nop,TS val 321809 ecr 1152456], length 0
06:42:42.920431 IP bom07s01-in-f142.1e100.net.http > 10.0.0.222.59446: Flags [F.], seq 163, ack 187, win 235, options [nop,nop,TS val 321831 ecr 1152456], length 0
06:42:43.740626 IP 10.0.0.222.59446 > bom07s01-in-f142.1e100.net.http: Flags [.], ack 164, win 347, options [nop,nop,TS val 1153464 ecr 321787], length 0
06:42:43.742056 IP 10.0.0.222.59446 > bom07s01-in-f142.1e100.net.http: Flags [.], ack 164, win 347, options [nop,nop,TS val 1153570 ecr 321809,nop,nop,sack 1 {163:164}], length 0
06:42:43.742394 IP 10.0.0.222.59446 > bom07s01-in-f142.1e100.net.http: Flags [.], ack 164, win 347, options [nop,nop,TS val 1153570 ecr 321831,nop,nop,sack 1 {163:164}], length 0
06:42:44.482973 IP 10.0.0.222.22104 > 10.0.0.1.domain: 9480+ A? www.google.co.in. (34)
06:42:44.483271 IP 10.0.0.222.25505 > 10.0.0.1.domain: 17659+ A? clients1.google.co.in. (39)
06:42:44.548750 IP 10.0.0.1.domain > 10.0.0.222.22104: 9480 1/0/0 A 216.58.196.99 (50)
06:42:44.550903 IP 10.0.0.222.60347 > maa03s19-in-f99.1e100.net.http: Flags [S], seq 2682912694, win 65535, options [mss 1460,sackOK,TS val 1153651 ecr 0,nop,wscale 8], length 0
06:42:44.551162 IP maa03s19-in-f99.1e100.net.http > 10.0.0.222.60347: Flags [S.], seq 1982972413, ack 2682912695, win 28960, options [mss 1460,sackOK,TS val 321994 ecr 1153651,nop,wscale 7], length 0
06:42:44.552134 IP 10.0.0.222.60347 > maa03s19-in-f99.1e100.net.http: Flags [.], ack 1, win 343, options [nop,nop,TS val 1153651 ecr 321994], length 0
06:42:44.553358 IP 10.0.0.222.60347 > maa03s19-in-f99.1e100.net.http: Flags [P.], seq 1:876, ack 1, win 343, options [nop,nop,TS val 1153652 ecr 321994], length 875
06:42:44.553512 IP maa03s19-in-f99.1e100.net.http > 10.0.0.222.60347: Flags [.], ack 876, win 249, options [nop,nop,TS val 321994 ecr 1153652], length 0
06:42:44.618494 IP 10.0.0.1.domain > 10.0.0.222.25505: 17659 2/0/0 CNAME clients-cctld.l.google.com., A 216.58.199.131 (95)
06:42:45.583691 ARP, Reply 192.168.0.100 is-at 98:de:d0:09:37:b4 (oui Unknown), length 28
06:42:46.678897 IP maa03s19-in-f99.1e100.net.http > 10.0.0.222.60347: Flags [.], seq 1:1449, ack 876, win 249, options [nop,nop,TS val 322206 ecr 1153652], length 1448
06:42:46.679040 IP maa03s19-in-f99.1e100.net.http > 10.0.0.222.60347: Flags [.], seq 1449:2897, ack 876, win 249, options [nop,nop,TS val 322206 ecr 1153652], length 1448
06:42:46.679101 IP maa03s19-in-f99.1e100.net.http > 10.0.0.222.60347: Flags [.], seq 2897:4345, ack 876, win 249, options [nop,nop,TS val 322206 ecr 1153652], length 1448
06:42:46.679194 IP maa03s19-in-f99.1e100.net.http > 10.0.0.222.60347: Flags [.], seq 4345:5793, ack 876, win 249, options [nop,nop,TS val 322206 ecr 1153652], length 1448
06:42:46.679274 IP maa03s19-in-f99.1e100.net.http > 10.0.0.222.60347: Flags [.], seq 5793:7241, ack 876, win 249, options [nop,nop,TS val 322206 ecr 1153652], length 1448
06:42:46.679328 IP maa03s19-in-f99.1e100.net.http > 10.0.0.222.60347: Flags [.], seq 7241:8689, ack 876, win 249, options [nop,nop,TS val 322206 ecr 1153652], length 1448
06:42:46.679411 IP maa03s19-in-f99.1e100.net.http > 10.0.0.222.60347: Flags [.], seq 8689:10137, ack 876, win 249, options [nop,nop,TS val 322206 ecr 1153652], length 1448
06:42:47.036438 IP maa03s19-in-f99.1e100.net.http > 10.0.0.222.60347: Flags [.], seq 10137:11585, ack 876, win 249, options [nop,nop,TS val 322242 ecr 1153652], length 1448
06:42:47.036758 IP maa03s19-in-f99.1e100.net.http > 10.0.0.222.60347: Flags [.], seq 11585:13033, ack 876, win 249, options [nop,nop,TS val 322242 ecr 1153652], length 1448
06:42:47.037385 IP maa03s19-in-f99.1e100.net.http > 10.0.0.222.60347: Flags [.], seq 13033:14481, ack 876, win 249, options [nop,nop,TS val 322242 ecr 1153652], length 1448
06:42:47.049738 IP 10.0.0.222.60347 > maa03s19-in-f99.1e100.net.http: Flags [.], ack 1449, win 354, options [nop,nop,TS val 1153901 ecr 322206], length 0
06:42:47.049993 IP maa03s19-in-f99.1e100.net.http > 10.0.0.222.60347: Flags [.], seq 14481:15929, ack 876, win 249, options [nop,nop,TS val 322243 ecr 1153901], length 1448
06:42:47.050115 IP maa03s19-in-f99.1e100.net.http > 10.0.0.222.60347: Flags [.], seq 15929:17377, ack 876, win 249, options [nop,nop,TS val 322243 ecr 1153901], length 1448
06:42:47.050328 IP 10.0.0.222.60347 > maa03s19-in-f99.1e100.net.http: Flags [.], ack 2897, win 365, options [nop,nop,TS val 1153901 ecr 322206], length 0
06:42:47.050469 IP 10.0.0.222.60347 > maa03s19-in-f99.1e100.net.http: Flags [.], ack 4345, win 377, options [nop,nop,TS val 1153901 ecr 322206], length 0
06:42:47.050701 IP 10.0.0.222.60347 > maa03s19-in-f99.1e100.net.http: Flags [.], ack 5793, win 388, options [nop,nop,TS val 1153901 ecr 322206], length 0
06:42:47.050853 IP 10.0.0.222.60347 > maa03s19-in-f99.1e100.net.http: Flags [.], ack 7241, win 399, options [nop,nop,TS val 1153901 ecr 322206], length 0
06:42:47.051014 IP 10.0.0.222.60347 > maa03s19-in-f99.1e100.net.http: Flags [.], ack 8689, win 411, options [nop,nop,TS val 1153901 ecr 322206], length 0
06:42:47.051384 IP 10.0.0.222.60347 > maa03s19-in-f99.1e100.net.http: Flags [.], ack 10137, win 422, options [nop,nop,TS val 1153901 ecr 322206], length 0
06:42:47.051702 IP 10.0.0.222.60347 > maa03s19-in-f99.1e100.net.http: Flags [.], ack 11585, win 433, options [nop,nop,TS val 1153901 ecr 322242], length 0
06:42:47.052012 IP 10.0.0.222.60347 > maa03s19-in-f99.1e100.net.http: Flags [.], ack 13033, win 444, options [nop,nop,TS val 1153901 ecr 322242], length 0
06:42:47.053395 IP 10.0.0.222.60347 > maa03s19-in-f99.1e100.net.http: Flags [.], ack 14481, win 456, options [nop,nop,TS val 1153901 ecr 322242], length 0
06:42:47.053571 IP maa03s19-in-f99.1e100.net.http > 10.0.0.222.60347: Flags [.], seq 17377:18825, ack 876, win 249, options [nop,nop,TS val 322244 ecr 1153901], length 1448
06:42:47.054408 IP maa03s19-in-f99.1e100.net.http > 10.0.0.222.60347: Flags [.], seq 18825:20273, ack 876, win 249, options [nop,nop,TS val 322244 ecr 1153901], length 1448
06:42:47.054517 IP maa03s19-in-f99.1e100.net.http > 10.0.0.222.60347: Flags [.], seq 20273:21721, ack 876, win 249, options [nop,nop,TS val 322244 ecr 1153901], length 1448
06:42:47.055125 IP maa03s19-in-f99.1e100.net.http > 10.0.0.222.60347: Flags [.], seq 21721:23169, ack 876, win 249, options [nop,nop,TS val 322244 ecr 1153901], length 1448
06:42:47.055370 IP 10.0.0.222.60347 > maa03s19-in-f99.1e100.net.http: Flags [.], ack 15929, win 467, options [nop,nop,TS val 1153902 ecr 322243], length 0
06:42:47.055623 IP 10.0.0.222.60347 > maa03s19-in-f99.1e100.net.http: Flags [.], ack 17377, win 478, options [nop,nop,TS val 1153902 ecr 322243], length 0
06:42:47.055775 IP 10.0.0.222.60347 > maa03s19-in-f99.1e100.net.http: Flags [.], ack 18825, win 490, options [nop,nop,TS val 1153902 ecr 322244], length 0
06:42:47.056815 IP maa03s19-in-f99.1e100.net.http > 10.0.0.222.60347: Flags [.], seq 23169:24617, ack 876, win 249, options [nop,nop,TS val 322244 ecr 1153902], length 1448
06:42:47.056900 IP maa03s19-in-f99.1e100.net.http > 10.0.0.222.60347: Flags [.], seq 24617:26065, ack 876, win 249, options [nop,nop,TS val 322244 ecr 1153902], length 1448
06:42:47.059787 IP maa03s19-in-f99.1e100.net.http > 10.0.0.222.60347: Flags [.], seq 26065:27513, ack 876, win 249, options [nop,nop,TS val 322244 ecr 1153902], length 1448
06:42:47.060275 IP maa03s19-in-f99.1e100.net.http > 10.0.0.222.60347: Flags [P.], seq 27513:28961, ack 876, win 249, options [nop,nop,TS val 322244 ecr 1153902], length 1448
06:42:47.060836 IP maa03s19-in-f99.1e100.net.http > 10.0.0.222.60347: Flags [.], seq 28961:30409, ack 876, win 249, options [nop,nop,TS val 322245 ecr 1153902], length 1448
06:42:47.061316 IP maa03s19-in-f99.1e100.net.http > 10.0.0.222.60347: Flags [.], seq 30409:31857, ack 876, win 249, options [nop,nop,TS val 322245 ecr 1153902], length 1448
06:42:47.062511 IP maa03s19-in-f99.1e100.net.http > 10.0.0.222.60347: Flags [.], seq 31857:33305, ack 876, win 249, options [nop,nop,TS val 322245 ecr 1153902], length 1448
06:42:47.062631 IP maa03s19-in-f99.1e100.net.http > 10.0.0.222.60347: Flags [.], seq 33305:34753, ack 876, win 249, options [nop,nop,TS val 322245 ecr 1153902], length 1448
06:42:47.063280 IP maa03s19-in-f99.1e100.net.http > 10.0.0.222.60347: Flags [.], seq 34753:36201, ack 876, win 249, options [nop,nop,TS val 322245 ecr 1153902], length 1448
06:42:47.063477 IP 10.0.0.222.60347 > maa03s19-in-f99.1e100.net.http: Flags [.], ack 20273, win 501, options [nop,nop,TS val 1153902 ecr 322244], length 0
06:42:47.063701 IP 10.0.0.222.60347 > maa03s19-in-f99.1e100.net.http: Flags [.], ack 21721, win 512, options [nop,nop,TS val 1153902 ecr 322244], length 0
06:42:47.063939 IP 10.0.0.222.60347 > maa03s19-in-f99.1e100.net.http: Flags [.], ack 23169, win 524, options [nop,nop,TS val 1153902 ecr 322244], length 0
06:42:47.064203 IP 10.0.0.222.60347 > maa03s19-in-f99.1e100.net.http: Flags [.], ack 24617, win 535, options [nop,nop,TS val 1153902 ecr 322244], length 0
06:42:47.064470 IP 10.0.0.222.60347 > maa03s19-in-f99.1e100.net.http: Flags [.], ack 26065, win 546, options [nop,nop,TS val 1153902 ecr 322244], length 0
06:42:47.064703 IP 10.0.0.222.60347 > maa03s19-in-f99.1e100.net.http: Flags [.], ack 27513, win 558, options [nop,nop,TS val 1153902 ecr 322244], length 0
06:42:47.067728 IP 10.0.0.222.60347 > maa03s19-in-f99.1e100.net.http: Flags [.], ack 28961, win 569, options [nop,nop,TS val 1153902 ecr 322244], length 0
06:42:47.068013 IP 10.0.0.222.60347 > maa03s19-in-f99.1e100.net.http: Flags [.], ack 30409, win 580, options [nop,nop,TS val 1153903 ecr 322245], length 0
06:42:47.073508 IP 10.0.0.222.60347 > maa03s19-in-f99.1e100.net.http: Flags [.], ack 31857, win 592, options [nop,nop,TS val 1153903 ecr 322245], length 0
06:42:47.076879 IP 10.0.0.222.60347 > maa03s19-in-f99.1e100.net.http: Flags [.], ack 33305, win 603, options [nop,nop,TS val 1153903 ecr 322245], length 0
06:42:47.093607 IP maa03s19-in-f99.1e100.net.http > 10.0.0.222.60347: Flags [.], seq 36201:37649, ack 876, win 249, options [nop,nop,TS val 322248 ecr 1153903], length 1448
06:42:47.095404 IP 10.0.0.222.60347 > maa03s19-in-f99.1e100.net.http: Flags [.], ack 34753, win 614, options [nop,nop,TS val 1153906 ecr 322245], length 0
06:42:47.095760 IP maa03s19-in-f99.1e100.net.http > 10.0.0.222.60347: Flags [.], seq 37649:39097, ack 876, win 249, options [nop,nop,TS val 322248 ecr 1153906], length 1448
06:42:47.096359 IP 10.0.0.222.60347 > maa03s19-in-f99.1e100.net.http: Flags [.], ack 36201, win 625, options [nop,nop,TS val 1153906 ecr 322245], length 0
06:42:47.096875 IP maa03s19-in-f99.1e100.net.http > 10.0.0.222.60347: Flags [.], seq 39097:40545, ack 876, win 249, options [nop,nop,TS val 322248 ecr 1153906], length 1448
06:42:47.097286 IP 10.0.0.222.60347 > maa03s19-in-f99.1e100.net.http: Flags [.], ack 37649, win 637, options [nop,nop,TS val 1153906 ecr 322248], length 0
06:42:47.097741 IP maa03s19-in-f99.1e100.net.http > 10.0.0.222.60347: Flags [.], seq 40545:41993, ack 876, win 249, options [nop,nop,TS val 322248 ecr 1153906], length 1448
06:42:47.098236 IP maa03s19-in-f99.1e100.net.http > 10.0.0.222.60347: Flags [.], seq 41993:43441, ack 876, win 249, options [nop,nop,TS val 322248 ecr 1153906], length 1448
06:42:47.098415 IP 10.0.0.222.60347 > maa03s19-in-f99.1e100.net.http: Flags [.], ack 39097, win 648, options [nop,nop,TS val 1153906 ecr 322248], length 0
06:42:47.098730 IP 10.0.0.222.60347 > maa03s19-in-f99.1e100.net.http: Flags [.], ack 40545, win 659, options [nop,nop,TS val 1153906 ecr 322248], length 0
06:42:47.099242 IP maa03s19-in-f99.1e100.net.http > 10.0.0.222.60347: Flags [.], seq 43441:44889, ack 876, win 249, options [nop,nop,TS val 322248 ecr 1153906], length 1448
06:42:47.099729 IP 10.0.0.222.60347 > maa03s19-in-f99.1e100.net.http: Flags [.], ack 41993, win 671, options [nop,nop,TS val 1153906 ecr 322248], length 0
06:42:47.100119 IP maa03s19-in-f99.1e100.net.http > 10.0.0.222.60347: Flags [.], seq 44889:46337, ack 876, win 249, options [nop,nop,TS val 322248 ecr 1153906], length 1448
06:42:47.100628 IP maa03s19-in-f99.1e100.net.http > 10.0.0.222.60347: Flags [.], seq 46337:47785, ack 876, win 249, options [nop,nop,TS val 322249 ecr 1153906], length 1448
06:42:47.100863 IP 10.0.0.222.60347 > maa03s19-in-f99.1e100.net.http: Flags [.], ack 43441, win 682, options [nop,nop,TS val 1153906 ecr 322248], length 0
06:42:47.101198 IP 10.0.0.222.60347 > maa03s19-in-f99.1e100.net.http: Flags [.], ack 44889, win 693, options [nop,nop,TS val 1153906 ecr 322248], length 0
06:42:47.101742 IP maa03s19-in-f99.1e100.net.http > 10.0.0.222.60347: Flags [.], seq 47785:49233, ack 876, win 249, options [nop,nop,TS val 322249 ecr 1153906], length 1448
06:42:47.102159 IP 10.0.0.222.60347 > maa03s19-in-f99.1e100.net.http: Flags [.], ack 46337, win 705, options [nop,nop,TS val 1153906 ecr 322248], length 0
06:42:47.102649 IP maa03s19-in-f99.1e100.net.http > 10.0.0.222.60347: Flags [.], seq 49233:50681, ack 876, win 249, options [nop,nop,TS val 322249 ecr 1153906], length 1448
06:42:47.103269 IP maa03s19-in-f99.1e100.net.http > 10.0.0.222.60347: Flags [P.], seq 50681:50870, ack 876, win 249, options [nop,nop,TS val 322249 ecr 1153906], length 189
06:42:47.107461 IP 10.0.0.222.60347 > maa03s19-in-f99.1e100.net.http: Flags [.], ack 47785, win 716, options [nop,nop,TS val 1153907 ecr 322249], length 0
06:42:47.108849 IP 10.0.0.222.60347 > maa03s19-in-f99.1e100.net.http: Flags [.], ack 49233, win 727, options [nop,nop,TS val 1153907 ecr 322249], length 0
06:42:47.109119 IP 10.0.0.222.60347 > maa03s19-in-f99.1e100.net.http: Flags [.], ack 50681, win 739, options [nop,nop,TS val 1153907 ecr 322249], length 0
06:42:47.111506 IP 10.0.0.222.60347 > maa03s19-in-f99.1e100.net.http: Flags [.], ack 50870, win 739, options [nop,nop,TS val 1153907 ecr 322249], length 0
06:42:47.134409 IP 10.0.0.222.46076 > 10.0.0.1.domain: 36835+ AAAA? 10.0.0.222. (28)
06:42:47.216988 IP 10.0.0.1.domain > 10.0.0.222.46076: 36835 NXDomain 0/1/0 (103)
06:42:47.297188 IP 10.0.0.222.60347 > maa03s19-in-f99.1e100.net.http: Flags [P.], seq 876:1812, ack 50870, win 739, options [nop,nop,TS val 1153926 ecr 322249], length 936
06:42:47.297425 IP maa03s19-in-f99.1e100.net.http > 10.0.0.222.60347: Flags [.], ack 1812, win 272, options [nop,nop,TS val 322268 ecr 1153926], length 0
06:42:47.298271 IP 10.0.0.222.60347 > maa03s19-in-f99.1e100.net.http: Flags [P.], seq 1812:2695, ack 50870, win 739, options [nop,nop,TS val 1153926 ecr 322249], length 883
06:42:47.298425 IP maa03s19-in-f99.1e100.net.http > 10.0.0.222.60347: Flags [.], ack 2695, win 295, options [nop,nop,TS val 322268 ecr 1153926], length 0
06:42:47.314617 IP 10.0.0.222.60347 > maa03s19-in-f99.1e100.net.http: Flags [P.], seq 2695:3668, ack 50870, win 739, options [nop,nop,TS val 1153928 ecr 322268], length 973
06:42:47.314801 IP maa03s19-in-f99.1e100.net.http > 10.0.0.222.60347: Flags [.], ack 3668, win 317, options [nop,nop,TS val 322270 ecr 1153928], length 0
06:42:48.211284 IP maa03s19-in-f99.1e100.net.http > 10.0.0.222.60347: Flags [.], seq 50870:52318, ack 3668, win 317, options [nop,nop,TS val 322360 ecr 1153928], length 1448
06:42:48.267933 IP maa03s19-in-f99.1e100.net.http > 10.0.0.222.60347: Flags [P.], seq 52318:52941, ack 3668, win 317, options [nop,nop,TS val 322365 ecr 1153928], length 623
06:42:48.271688 IP 10.0.0.222.60347 > maa03s19-in-f99.1e100.net.http: Flags [.], ack 52318, win 750, options [nop,nop,TS val 1154023 ecr 322360], length 0
06:42:48.271994 IP 10.0.0.222.60347 > maa03s19-in-f99.1e100.net.http: Flags [.], ack 52941, win 761, options [nop,nop,TS val 1154023 ecr 322365], length 0
06:42:48.355155 IP maa03s19-in-f99.1e100.net.http > 10.0.0.222.60347: Flags [.], seq 52941:54389, ack 3668, win 317, options [nop,nop,TS val 322374 ecr 1154023], length 1448
06:42:48.355333 IP maa03s19-in-f99.1e100.net.http > 10.0.0.222.60347: Flags [.], seq 54389:55837, ack 3668, win 317, options [nop,nop,TS val 322374 ecr 1154023], length 1448
06:42:48.358775 IP maa03s19-in-f99.1e100.net.http > 10.0.0.222.60347: Flags [.], seq 55837:57285, ack 3668, win 317, options [nop,nop,TS val 322374 ecr 1154023], length 1448
06:42:48.358892 IP maa03s19-in-f99.1e100.net.http > 10.0.0.222.60347: Flags [.], seq 57285:58733, ack 3668, win 317, options [nop,nop,TS val 322374 ecr 1154023], length 1448
06:42:48.359451 IP maa03s19-in-f99.1e100.net.http > 10.0.0.222.60347: Flags [P.], seq 58733:59310, ack 3668, win 317, options [nop,nop,TS val 322374 ecr 1154023], length 577
06:42:48.360197 IP 10.0.0.222.60347 > maa03s19-in-f99.1e100.net.http: Flags [.], ack 54389, win 773, options [nop,nop,TS val 1154032 ecr 322374], length 0
06:42:48.363515 IP 10.0.0.222.60347 > maa03s19-in-f99.1e100.net.http: Flags [.], ack 55837, win 784, options [nop,nop,TS val 1154032 ecr 322374], length 0
06:42:48.363820 IP 10.0.0.222.60347 > maa03s19-in-f99.1e100.net.http: Flags [.], ack 57285, win 795, options [nop,nop,TS val 1154032 ecr 322374], length 0
06:42:48.364081 IP 10.0.0.222.60347 > maa03s19-in-f99.1e100.net.http: Flags [.], ack 58733, win 806, options [nop,nop,TS val 1154032 ecr 322374], length 0
06:42:48.364321 IP 10.0.0.222.60347 > maa03s19-in-f99.1e100.net.http: Flags [.], ack 59310, win 818, options [nop,nop,TS val 1154033 ecr 322374], length 0
06:42:48.384683 IP maa03s19-in-f99.1e100.net.http > 10.0.0.222.60347: Flags [.], seq 59310:60758, ack 3668, win 317, options [nop,nop,TS val 322377 ecr 1154033], length 1448
06:42:48.384839 IP maa03s19-in-f99.1e100.net.http > 10.0.0.222.60347: Flags [.], seq 60758:62206, ack 3668, win 317, options [nop,nop,TS val 322377 ecr 1154033], length 1448
06:42:48.385518 IP maa03s19-in-f99.1e100.net.http > 10.0.0.222.60347: Flags [P.], seq 62206:63144, ack 3668, win 317, options [nop,nop,TS val 322377 ecr 1154033], length 938
06:42:48.387183 IP 10.0.0.222.60347 > maa03s19-in-f99.1e100.net.http: Flags [.], ack 60758, win 829, options [nop,nop,TS val 1154035 ecr 322377], length 0
06:42:48.388464 IP 10.0.0.222.60347 > maa03s19-in-f99.1e100.net.http: Flags [.], ack 62206, win 840, options [nop,nop,TS val 1154035 ecr 322377], length 0
06:42:48.390683 IP 10.0.0.222.60347 > maa03s19-in-f99.1e100.net.http: Flags [.], ack 63144, win 852, options [nop,nop,TS val 1154035 ecr 322377], length 0
06:42:48.604701 ARP, Reply 192.168.0.100 is-at 98:de:d0:09:37:b4 (oui Unknown), length 28
06:42:48.666553 IP maa03s19-in-f99.1e100.net.http > 10.0.0.222.60347: Flags [.], seq 63144:64592, ack 3668, win 317, options [nop,nop,TS val 322405 ecr 1154035], length 1448
06:42:48.666719 IP maa03s19-in-f99.1e100.net.http > 10.0.0.222.60347: Flags [.], seq 64592:66040, ack 3668, win 317, options [nop,nop,TS val 322405 ecr 1154035], length 1448
06:42:48.668252 IP maa03s19-in-f99.1e100.net.http > 10.0.0.222.60347: Flags [.], seq 66040:67488, ack 3668, win 317, options [nop,nop,TS val 322405 ecr 1154035], length 1448
06:42:48.668345 IP maa03s19-in-f99.1e100.net.http > 10.0.0.222.60347: Flags [.], seq 67488:68936, ack 3668, win 317, options [nop,nop,TS val 322405 ecr 1154035], length 1448
06:42:48.672595 IP 10.0.0.222.60347 > maa03s19-in-f99.1e100.net.http: Flags [.], ack 64592, win 863, options [nop,nop,TS val 1154063 ecr 322405], length 0
06:42:48.672841 IP 10.0.0.222.60347 > maa03s19-in-f99.1e100.net.http: Flags [.], ack 66040, win 874, options [nop,nop,TS val 1154063 ecr 322405], length 0
06:42:48.673373 IP maa03s19-in-f99.1e100.net.http > 10.0.0.222.60347: Flags [.], seq 68936:70384, ack 3668, win 317, options [nop,nop,TS val 322406 ecr 1154063], length 1448
06:42:48.673977 IP maa03s19-in-f99.1e100.net.http > 10.0.0.222.60347: Flags [P.], seq 70384:70540, ack 3668, win 317, options [nop,nop,TS val 322406 ecr 1154063], length 156
06:42:48.674587 IP 10.0.0.222.60347 > maa03s19-in-f99.1e100.net.http: Flags [.], ack 67488, win 886, options [nop,nop,TS val 1154064 ecr 322405], length 0
06:42:48.674737 IP 10.0.0.222.60348 > maa03s19-in-f99.1e100.net.http: Flags [S], seq 3103018619, win 65535, options [mss 1460,sackOK,TS val 1154064 ecr 0,nop,wscale 8], length 0
06:42:48.674945 IP maa03s19-in-f99.1e100.net.http > 10.0.0.222.60348: Flags [S.], seq 1928316321, ack 3103018620, win 28960, options [mss 1460,sackOK,TS val 322406 ecr 1154064,nop,wscale 7], length 0
06:42:48.675059 IP 10.0.0.222.60347 > maa03s19-in-f99.1e100.net.http: Flags [.], ack 68936, win 897, options [nop,nop,TS val 1154064 ecr 322405], length 0
06:42:48.675181 IP 10.0.0.222.60347 > maa03s19-in-f99.1e100.net.http: Flags [.], ack 70384, win 908, options [nop,nop,TS val 1154064 ecr 322406], length 0
06:42:48.676305 IP 10.0.0.222.60347 > maa03s19-in-f99.1e100.net.http: Flags [.], ack 70540, win 908, options [nop,nop,TS val 1154064 ecr 322406], length 0
06:42:48.676591 IP 10.0.0.222.60348 > maa03s19-in-f99.1e100.net.http: Flags [.], ack 1, win 343, options [nop,nop,TS val 1154064 ecr 322406], length 0
06:42:48.769384 IP 10.0.0.222.60347 > maa03s19-in-f99.1e100.net.http: Flags [F.], seq 3668, ack 70540, win 908, options [nop,nop,TS val 1154073 ecr 322406], length 0
06:42:48.783476 IP 10.0.0.222.60348 > maa03s19-in-f99.1e100.net.http: Flags [P.], seq 1:997, ack 1, win 343, options [nop,nop,TS val 1154075 ecr 322406], length 996
06:42:48.783649 IP maa03s19-in-f99.1e100.net.http > 10.0.0.222.60348: Flags [.], ack 997, win 249, options [nop,nop,TS val 322417 ecr 1154075], length 0
06:42:48.800490 IP maa03s19-in-f99.1e100.net.http > 10.0.0.222.60347: Flags [.], ack 3669, win 317, options [nop,nop,TS val 322419 ecr 1154073], length 0
06:42:49.333574 IP maa03s19-in-f99.1e100.net.http > 10.0.0.222.60348: Flags [.], seq 1:1449, ack 997, win 249, options [nop,nop,TS val 322472 ecr 1154075], length 1448
06:42:49.393730 IP maa03s19-in-f99.1e100.net.http > 10.0.0.222.60348: Flags [P.], seq 1449:1622, ack 997, win 249, options [nop,nop,TS val 322478 ecr 1154075], length 173
06:42:49.395864 IP 10.0.0.222.60348 > maa03s19-in-f99.1e100.net.http: Flags [.], ack 1449, win 354, options [nop,nop,TS val 1154136 ecr 322472], length 0
06:42:49.396941 IP 10.0.0.222.60348 > maa03s19-in-f99.1e100.net.http: Flags [.], ack 1622, win 365, options [nop,nop,TS val 1154136 ecr 322478], length 0
06:42:49.432802 IP maa03s19-in-f99.1e100.net.http > 10.0.0.222.60347: Flags [F.], seq 70540, ack 3669, win 317, options [nop,nop,TS val 322482 ecr 1154073], length 0
06:42:49.434973 IP 10.0.0.222.60347 > maa03s19-in-f99.1e100.net.http: Flags [.], ack 70541, win 908, options [nop,nop,TS val 1154140 ecr 322482], length 0
06:42:49.627431 IP 10.0.0.222.63758 > 10.0.0.1.domain: 38651+ A? www.onlinesbi.com. (35)
06:42:49.633648 IP 10.0.0.1.domain > 10.0.0.222.63758: 38651 1/0/0 A 223.31.160.61 (51)
06:42:51.615287 ARP, Reply 192.168.0.100 is-at 98:de:d0:09:37:b4 (oui Unknown), length 28
06:42:53.409837 IP 10.0.0.222.47013 > 223.31.160.61.http: Flags [S], seq 1480733619, win 65535, options [mss 1460,sackOK,TS val 1154536 ecr 0,nop,wscale 8], length 0
06:42:53.410060 IP 223.31.160.61.http > 10.0.0.222.47013: Flags [S.], seq 4155449657, ack 1480733620, win 28960, options [mss 1460,sackOK,TS val 322879 ecr 1154536,nop,wscale 7], length 0
06:42:53.411583 IP 10.0.0.222.47013 > 223.31.160.61.http: Flags [.], ack 1, win 343, options [nop,nop,TS val 1154537 ecr 322879], length 0
06:42:53.782924 IP 10.0.0.222.47013 > 223.31.160.61.http: Flags [P.], seq 1:538, ack 1, win 343, options [nop,nop,TS val 1154574 ecr 322879], length 537
06:42:53.783165 IP 223.31.160.61.http > 10.0.0.222.47013: Flags [.], ack 538, win 235, options [nop,nop,TS val 322917 ecr 1154574], length 0
06:42:54.400803 IP 223.31.160.61.http > 10.0.0.222.47013: Flags [P.], seq 1:168, ack 538, win 235, options [nop,nop,TS val 322979 ecr 1154574], length 167
06:42:54.513783 IP 10.0.0.222.47013 > 223.31.160.61.http: Flags [.], ack 168, win 347, options [nop,nop,TS val 1154648 ecr 322979], length 0
06:42:54.544284 IP 10.0.0.222.41143 > 10.0.0.1.domain: 48658+ A? wwww.onlinesbi.com. (36)
06:42:54.554491 IP 10.0.0.1.domain > 10.0.0.222.41143: 48658* 1/0/0 A 223.31.160.61 (52)
06:42:54.558074 IP 10.0.0.222.47014 > 223.31.160.61.http: Flags [S], seq 2605574361, win 65535, options [mss 1460,sackOK,TS val 1154652 ecr 0,nop,wscale 8], length 0
06:42:54.558312 IP 223.31.160.61.http > 10.0.0.222.47014: Flags [S.], seq 1775387143, ack 2605574362, win 28960, options [mss 1460,sackOK,TS val 322994 ecr 1154652,nop,wscale 7], length 0
06:42:54.559312 IP 10.0.0.222.47014 > 223.31.160.61.http: Flags [.], ack 1, win 343, options [nop,nop,TS val 1154652 ecr 322994], length 0
06:42:54.560157 IP 10.0.0.222.47014 > 223.31.160.61.http: Flags [P.], seq 1:539, ack 1, win 343, options [nop,nop,TS val 1154652 ecr 322994], length 538
06:42:54.560287 IP 223.31.160.61.http > 10.0.0.222.47014: Flags [.], ack 539, win 235, options [nop,nop,TS val 322994 ecr 1154652], length 0
06:42:54.629170 ARP, Reply 192.168.0.100 is-at 98:de:d0:09:37:b4 (oui Unknown), length 28
06:42:55.429047 IP 223.31.160.61.http > 10.0.0.222.47014: Flags [P.], seq 1:615, ack 539, win 235, options [nop,nop,TS val 323081 ecr 1154652], length 614
06:42:55.537419 IP 10.0.0.222.47014 > 223.31.160.61.http: Flags [.], ack 615, win 347, options [nop,nop,TS val 1154750 ecr 323081], length 0
06:42:55.539452 IP 10.0.0.222.47014 > 223.31.160.61.http: Flags [F.], seq 539, ack 615, win 347, options [nop,nop,TS val 1154750 ecr 323081], length 0
06:42:55.544019 IP 223.31.160.61.http > 10.0.0.222.47014: Flags [F.], seq 615, ack 540, win 235, options [nop,nop,TS val 323093 ecr 1154750], length 0
06:42:55.546221 IP 10.0.0.222.47014 > 223.31.160.61.http: Flags [.], ack 616, win 347, options [nop,nop,TS val 1154751 ecr 323093], length 0
06:42:55.746171 IP 10.0.0.222.42106 > 223.31.160.61.http: Flags [S], seq 1640960805, win 65535, options [mss 1460,sackOK,TS val 1154771 ecr 0,nop,wscale 8], length 0
06:42:55.746473 IP 223.31.160.61.http > 10.0.0.222.42106: Flags [S.], seq 2046852860, ack 1640960806, win 28960, options [mss 1460,sackOK,TS val 323113 ecr 1154771,nop,wscale 7], length 0
06:42:55.747470 IP 10.0.0.222.42106 > 223.31.160.61.http: Flags [.], ack 1, win 343, options [nop,nop,TS val 1154771 ecr 323113], length 0
06:42:55.747961 IP 10.0.0.222.42106 > 223.31.160.61.http: Flags [P.], seq 1:185, ack 1, win 343, options [nop,nop,TS val 1154771 ecr 323113], length 184
06:42:55.748095 IP 223.31.160.61.http > 10.0.0.222.42106: Flags [.], ack 185, win 235, options [nop,nop,TS val 323113 ecr 1154771], length 0
06:42:56.306710 IP 223.31.160.61.http > 10.0.0.222.42106: Flags [P.], seq 1:179, ack 185, win 235, options [nop,nop,TS val 323169 ecr 1154771], length 178
06:42:56.459174 IP 10.0.0.222.42106 > 223.31.160.61.http: Flags [.], ack 179, win 347, options [nop,nop,TS val 1154842 ecr 323169], length 0
06:42:56.459957 IP 10.0.0.222.42106 > 223.31.160.61.http: Flags [P.], seq 185:369, ack 179, win 347, options [nop,nop,TS val 1154842 ecr 323169], length 184
06:42:56.460104 IP 223.31.160.61.http > 10.0.0.222.42106: Flags [.], ack 369, win 243, options [nop,nop,TS val 323184 ecr 1154842], length 0
06:42:57.294465 IP 223.31.160.61.http > 10.0.0.222.42106: Flags [P.], seq 179:791, ack 369, win 243, options [nop,nop,TS val 323268 ecr 1154842], length 612
06:42:57.387462 IP 10.0.0.222.42106 > 223.31.160.61.http: Flags [F.], seq 369, ack 791, win 352, options [nop,nop,TS val 1154935 ecr 323268], length 0
06:42:57.393904 IP 223.31.160.61.http > 10.0.0.222.42106: Flags [F.], seq 791, ack 370, win 243, options [nop,nop,TS val 323278 ecr 1154935], length 0
06:42:57.395732 IP 10.0.0.222.42106 > 223.31.160.61.http: Flags [.], ack 792, win 352, options [nop,nop,TS val 1154936 ecr 323278], length 0
06:42:57.404072 IP 10.0.0.222.40918 > 223.31.160.61.http: Flags [S], seq 1239876578, win 65535, options [mss 1460,sackOK,TS val 1154937 ecr 0,nop,wscale 8], length 0
06:42:57.404351 IP 223.31.160.61.http > 10.0.0.222.40918: Flags [S.], seq 3802629223, ack 1239876579, win 28960, options [mss 1460,sackOK,TS val 323279 ecr 1154937,nop,wscale 7], length 0
06:42:57.405592 IP 10.0.0.222.40918 > 223.31.160.61.http: Flags [.], ack 1, win 343, options [nop,nop,TS val 1154937 ecr 323279], length 0
06:42:57.406497 IP 10.0.0.222.40918 > 223.31.160.61.http: Flags [P.], seq 1:185, ack 1, win 343, options [nop,nop,TS val 1154937 ecr 323279], length 184
06:42:57.406655 IP 223.31.160.61.http > 10.0.0.222.40918: Flags [.], ack 185, win 235, options [nop,nop,TS val 323279 ecr 1154937], length 0
06:42:57.640857 ARP, Reply 192.168.0.100 is-at 98:de:d0:09:37:b4 (oui Unknown), length 28
06:42:58.278557 IP 223.31.160.61.http > 10.0.0.222.40918: Flags [P.], seq 1:613, ack 185, win 235, options [nop,nop,TS val 323366 ecr 1154937], length 612
06:42:58.403590 IP 10.0.0.222.40918 > 223.31.160.61.http: Flags [.], ack 613, win 347, options [nop,nop,TS val 1155037 ecr 323366], length 0
06:42:58.404170 IP 10.0.0.222.40918 > 223.31.160.61.http: Flags [F.], seq 185, ack 613, win 347, options [nop,nop,TS val 1155037 ecr 323366], length 0
06:42:58.415080 IP 223.31.160.61.http > 10.0.0.222.40918: Flags [F.], seq 613, ack 186, win 235, options [nop,nop,TS val 323380 ecr 1155037], length 0
06:42:58.416557 IP 10.0.0.222.40918 > 223.31.160.61.http: Flags [.], ack 614, win 347, options [nop,nop,TS val 1155038 ecr 323380], length 0
06:42:59.077473 IP 10.0.0.222.60351 > maa03s19-in-f99.1e100.net.http: Flags [S], seq 3983632986, win 65535, options [mss 1460,sackOK,TS val 1155103 ecr 0,nop,wscale 8], length 0
06:42:59.077830 IP maa03s19-in-f99.1e100.net.http > 10.0.0.222.60351: Flags [S.], seq 3695774742, ack 3983632987, win 28960, options [mss 1460,sackOK,TS val 323446 ecr 1155103,nop,wscale 7], length 0
06:42:59.078059 IP 10.0.0.222.60352 > maa03s19-in-f99.1e100.net.http: Flags [S], seq 152584638, win 65535, options [mss 1460,sackOK,TS val 1155103 ecr 0,nop,wscale 8], length 0
06:42:59.078218 IP maa03s19-in-f99.1e100.net.http > 10.0.0.222.60352: Flags [S.], seq 1242333644, ack 152584639, win 28960, options [mss 1460,sackOK,TS val 323446 ecr 1155103,nop,wscale 7], length 0
06:42:59.078337 IP 10.0.0.222.60353 > maa03s19-in-f99.1e100.net.http: Flags [S], seq 4280420116, win 65535, options [mss 1460,sackOK,TS val 1155103 ecr 0,nop,wscale 8], length 0
06:42:59.078467 IP maa03s19-in-f99.1e100.net.http > 10.0.0.222.60353: Flags [S.], seq 2751477297, ack 4280420117, win 28960, options [mss 1460,sackOK,TS val 323446 ecr 1155103,nop,wscale 7], length 0
06:42:59.080974 IP 10.0.0.222.60351 > maa03s19-in-f99.1e100.net.http: Flags [.], ack 1, win 343, options [nop,nop,TS val 1155104 ecr 323446], length 0
06:42:59.081307 IP 10.0.0.222.60352 > maa03s19-in-f99.1e100.net.http: Flags [.], ack 1, win 343, options [nop,nop,TS val 1155104 ecr 323446], length 0
06:42:59.081529 IP 10.0.0.222.60353 > maa03s19-in-f99.1e100.net.http: Flags [.], ack 1, win 343, options [nop,nop,TS val 1155104 ecr 323446], length 0
06:42:59.334356 IP maa03s19-in-f99.1e100.net.http > 10.0.0.222.60348: Flags [F.], seq 1622, ack 997, win 249, options [nop,nop,TS val 323472 ecr 1154136], length 0
06:42:59.335689 IP 10.0.0.222.60348 > maa03s19-in-f99.1e100.net.http: Flags [F.], seq 997, ack 1623, win 365, options [nop,nop,TS val 1155130 ecr 323472], length 0
06:42:59.335864 IP maa03s19-in-f99.1e100.net.http > 10.0.0.222.60348: Flags [.], ack 998, win 249, options [nop,nop,TS val 323472 ecr 1155130], length 0
06:42:59.560242 IP 10.0.0.222.37102 > bom07s01-in-f131.1e100.net.http: Flags [S], seq 3478070945, win 65535, options [mss 1460,sackOK,TS val 1155152 ecr 0,nop,wscale 8], length 0
06:42:59.560536 IP bom07s01-in-f131.1e100.net.http > 10.0.0.222.37102: Flags [S.], seq 2162508009, ack 3478070946, win 28960, options [mss 1460,sackOK,TS val 323495 ecr 1155152,nop,wscale 7], length 0
06:42:59.562522 IP 10.0.0.222.37102 > bom07s01-in-f131.1e100.net.http: Flags [.], ack 1, win 343, options [nop,nop,TS val 1155152 ecr 323495], length 0
06:42:59.728725 IP 10.0.0.222.60351 > maa03s19-in-f99.1e100.net.http: Flags [P.], seq 1:1048, ack 1, win 343, options [nop,nop,TS val 1155169 ecr 323446], length 1047
06:42:59.728984 IP maa03s19-in-f99.1e100.net.http > 10.0.0.222.60351: Flags [.], ack 1048, win 249, options [nop,nop,TS val 323511 ecr 1155169], length 0
06:42:59.983052 IP maa03s19-in-f99.1e100.net.http > 10.0.0.222.60351: Flags [P.], seq 1:265, ack 1048, win 249, options [nop,nop,TS val 323537 ecr 1155169], length 264
06:42:59.984474 IP 10.0.0.222.60351 > maa03s19-in-f99.1e100.net.http: Flags [.], ack 265, win 347, options [nop,nop,TS val 1155195 ecr 323537], length 0
06:43:00.650211 ARP, Reply 192.168.0.100 is-at 98:de:d0:09:37:b4 (oui Unknown), length 28
06:43:01.944175 IP 10.0.0.222.60353 > maa03s19-in-f99.1e100.net.http: Flags [P.], seq 1:1007, ack 1, win 343, options [nop,nop,TS val 1155390 ecr 323446], length 1006
06:43:01.944436 IP maa03s19-in-f99.1e100.net.http > 10.0.0.222.60353: Flags [.], ack 1007, win 249, options [nop,nop,TS val 323733 ecr 1155390], length 0
