06:10:30.274204 IP 10.0.0.222.16109 > 10.0.0.1.domain: 10221+ AAAA? 10.0.0.0. (26)
06:10:30.335503 IP 10.0.0.1.domain > 10.0.0.222.16109: 10221 NXDomain 0/1/0 (101)
06:10:30.464838 IP 10.0.0.222.28237 > 10.0.0.1.domain: 3434+ AAAA? 192.168.0.0. (29)
06:10:30.525473 IP 10.0.0.1.domain > 10.0.0.222.28237: 3434 NXDomain 0/1/0 (104)
06:10:31.596915 IP 10.0.0.222.20312 > 10.0.0.1.domain: 498+ AAAA? 192.168.0.102. (31)
06:10:31.657900 IP 10.0.0.1.domain > 10.0.0.222.20312: 498 NXDomain 0/1/0 (106)
06:10:32.377009 ARP, Request who-has 10.0.0.222 tell 10.0.0.1, length 28
06:10:32.514833 ARP, Reply 10.0.0.222 is-at c0:ee:fb:3b:35:93 (oui Unknown), length 28
06:10:33.216483 IP6 fe80::c2ee:fbff:fe3b:3593 > ff02::16: HBH ICMP6, multicast listener report v2, 1 group record(s), length 28
06:10:33.216554 IP6 fe80::c2ee:fbff:fe3b:3593 > ff02::16: HBH ICMP6, multicast listener report v2, 1 group record(s), length 28
06:10:33.444896 IP6 fe80::c2ee:fbff:fe3b:3593 > ip6-allrouters: ICMP6, router solicitation, length 16
06:10:33.444978 IP6 fe80::c2ee:fbff:fe3b:3593 > ip6-allrouters: ICMP6, router solicitation, length 16
06:10:36.493759 IP 10.0.0.222.22648 > 10.0.0.1.domain: 29833+ AAAA? 127.0.0.1. (27)
06:10:36.554855 IP 10.0.0.1.domain > 10.0.0.222.22648: 29833 NXDomain 0/1/0 (102)
06:10:37.459012 IP 10.0.0.222.2280 > 10.0.0.1.domain: 15346+ AAAA? 127.0.0.0. (27)
06:10:37.522403 IP 10.0.0.1.domain > 10.0.0.222.2280: 15346 NXDomain 0/1/0 (102)
06:10:40.239975 IP 10.0.0.222.11629 > 10.0.0.1.domain: 22095+ AAAA? 224.0.0.0. (27)
06:10:45.249029 IP 10.0.0.222.11629 > 10.0.0.1.domain: 22095+ AAAA? 224.0.0.0. (27)
06:10:45.258748 IP 10.0.0.1.domain > 10.0.0.222.11629: 22095 NXDomain 0/1/0 (102)
06:10:46.358396 IP 10.0.0.222.8042 > 10.0.0.1.domain: 16095+ AAAA? 172.16.0.0. (28)
06:10:46.396953 IP 10.0.0.222.2998 > 10.0.0.1.domain: 27998+ A? switchboard.services.mozilla.com. (50)
06:10:46.415038 IP 10.0.0.1.domain > 10.0.0.222.8042: 16095 NXDomain 0/1/0 (103)
06:10:46.457356 IP 10.0.0.1.domain > 10.0.0.222.2998: 27998 2/0/0 CNAME switchboard.r53-2.services.mozilla.com., A 35.161.194.122 (98)
06:10:46.482656 IP 10.0.0.222.56280 > ec2-35-161-194-122.us-west-2.compute.amazonaws.com.https: Flags [S], seq 338277154, win 64240, options [mss 1460,sackOK,TS val 2742003 ecr 0,nop,wscale 8], length 0
06:10:46.585024 IP 10.0.0.222.5444 > 10.0.0.1.domain: 2792+ A? kali. (22)
06:10:46.648571 IP 10.0.0.1.domain > 10.0.0.222.5444: 2792 NXDomain 0/1/0 (97)
06:10:46.738256 IP ec2-35-161-194-122.us-west-2.compute.amazonaws.com.https > 10.0.0.222.56280: Flags [S.], seq 3113485439, ack 338277155, win 17898, options [mss 1440,sackOK,TS val 355818196 ecr 2742003,nop,wscale 8], length 0
06:10:46.739428 IP 10.0.0.222.56280 > ec2-35-161-194-122.us-west-2.compute.amazonaws.com.https: Flags [.], ack 1, win 251, options [nop,nop,TS val 2742029 ecr 355818196], length 0
06:10:46.747471 IP 10.0.0.222.56280 > ec2-35-161-194-122.us-west-2.compute.amazonaws.com.https: Flags [P.], seq 1:199, ack 1, win 251, options [nop,nop,TS val 2742030 ecr 355818196], length 198
06:10:47.002950 IP ec2-35-161-194-122.us-west-2.compute.amazonaws.com.https > 10.0.0.222.56280: Flags [.], ack 199, win 75, options [nop,nop,TS val 355818262 ecr 2742030], length 0
06:10:47.004834 IP ec2-35-161-194-122.us-west-2.compute.amazonaws.com.https > 10.0.0.222.56280: Flags [.], seq 1:1349, ack 199, win 75, options [nop,nop,TS val 355818263 ecr 2742030], length 1348
06:10:47.004951 IP ec2-35-161-194-122.us-west-2.compute.amazonaws.com.https > 10.0.0.222.56280: Flags [.], seq 1349:2697, ack 199, win 75, options [nop,nop,TS val 355818263 ecr 2742030], length 1348
06:10:47.005001 IP ec2-35-161-194-122.us-west-2.compute.amazonaws.com.https > 10.0.0.222.56280: Flags [P.], seq 2697:2961, ack 199, win 75, options [nop,nop,TS val 355818263 ecr 2742030], length 264
06:10:47.157167 IP 10.0.0.222.56280 > ec2-35-161-194-122.us-west-2.compute.amazonaws.com.https: Flags [.], ack 1349, win 262, options [nop,nop,TS val 2742071 ecr 355818263], length 0
06:10:47.157421 IP 10.0.0.222.56280 > ec2-35-161-194-122.us-west-2.compute.amazonaws.com.https: Flags [.], ack 2697, win 272, options [nop,nop,TS val 2742071 ecr 355818263], length 0
06:10:47.158049 IP 10.0.0.222.56280 > ec2-35-161-194-122.us-west-2.compute.amazonaws.com.https: Flags [.], ack 2961, win 283, options [nop,nop,TS val 2742071 ecr 355818263], length 0
06:10:47.249877 IP 10.0.0.222.56280 > ec2-35-161-194-122.us-west-2.compute.amazonaws.com.https: Flags [P.], seq 199:325, ack 2961, win 283, options [nop,nop,TS val 2742074 ecr 355818263], length 126
06:10:47.505693 IP ec2-35-161-194-122.us-west-2.compute.amazonaws.com.https > 10.0.0.222.56280: Flags [P.], seq 2961:3219, ack 325, win 75, options [nop,nop,TS val 355818388 ecr 2742074], length 258
06:10:47.691009 IP 10.0.0.222.56280 > ec2-35-161-194-122.us-west-2.compute.amazonaws.com.https: Flags [P.], seq 325:669, ack 3219, win 294, options [nop,nop,TS val 2742111 ecr 355818388], length 344
06:10:47.948091 IP ec2-35-161-194-122.us-west-2.compute.amazonaws.com.https > 10.0.0.222.56280: Flags [P.], seq 3219:4194, ack 669, win 79, options [nop,nop,TS val 355818498 ecr 2742111], length 975
06:10:47.950296 IP 10.0.0.222.6466 > 10.0.0.1.domain: 15392+ AAAA? 10.0.0.222. (28)
06:10:47.985331 IP 10.0.0.222.56280 > ec2-35-161-194-122.us-west-2.compute.amazonaws.com.https: Flags [.], ack 4194, win 304, options [nop,nop,TS val 2742154 ecr 355818498], length 0
06:10:48.010681 IP 10.0.0.1.domain > 10.0.0.222.6466: 15392 NXDomain 0/1/0 (103)
06:10:48.878156 IP 10.0.0.222 > igmp.mcast.net: igmp v3 report, 1 group record(s)
06:10:48.878271 IP 10.0.0.222 > igmp.mcast.net: igmp v3 report, 1 group record(s)
06:10:48.878397 IP 10.0.0.222.mdns > 224.0.0.251.mdns: 0 PTR (QU)? _mozilla_papi._tcp.local. (42)
06:10:48.878456 IP 10.0.0.222.mdns > 224.0.0.251.mdns: 0 PTR (QU)? _mozilla_papi._tcp.local. (42)
06:10:54.512668 IP 10.0.0.222.13928 > 10.0.0.1.domain: 1562+ A? files.brucon.org. (34)
06:10:54.512931 IP 10.0.0.222.15898 > 10.0.0.1.domain: 2623+ A? github.com. (28)
06:10:54.513191 IP 10.0.0.222.12199 > 10.0.0.1.domain: 24915+ A? mail.google.com. (33)
06:10:54.513452 IP 10.0.0.222.22343 > 10.0.0.1.domain: 21102+ A? google.co.in. (30)
06:10:54.515976 IP 10.0.0.1.domain > 10.0.0.222.15898: 2623 2/0/0 A 192.30.253.113, A 192.30.253.112 (60)
06:10:54.522108 IP 10.0.0.222.40326 > 192.30.253.113.https: Flags [S], seq 2737803973, win 64240, options [mss 1460,sackOK,TS val 2742807 ecr 0,nop,wscale 8], length 0
06:10:54.573840 IP 10.0.0.1.domain > 10.0.0.222.12199: 24915 2/0/0 CNAME googlemail.l.google.com., A 216.58.199.165 (76)
06:10:54.575997 IP 10.0.0.1.domain > 10.0.0.222.22343: 21102 1/0/0 A 216.58.199.131 (46)
06:10:54.577320 IP 10.0.0.222.35827 > bom05s08-in-f5.1e100.net.https: Flags [S], seq 1807499186, win 64240, options [mss 1460,sackOK,TS val 2742813 ecr 0,nop,wscale 8], length 0
06:10:54.577930 IP 10.0.0.222.44867 > bom07s01-in-f3.1e100.net.http: Flags [S], seq 1110452856, win 64240, options [mss 1460,sackOK,TS val 2742813 ecr 0,nop,wscale 8], length 0
06:10:54.578302 IP 10.0.0.222.44868 > bom07s01-in-f3.1e100.net.http: Flags [S], seq 3125049112, win 64240, options [mss 1460,sackOK,TS val 2742813 ecr 0,nop,wscale 8], length 0
06:10:54.580072 IP bom05s08-in-f5.1e100.net.https > 10.0.0.222.35827: Flags [S.], seq 1028130945, ack 1807499187, win 42540, options [mss 1430,sackOK,TS val 1054041055 ecr 2742813,nop,wscale 7], length 0
06:10:54.580114 IP 10.0.0.1.domain > 10.0.0.222.13928: 1562 1/0/0 A 195.154.243.219 (50)
06:10:54.580673 IP bom07s01-in-f3.1e100.net.http > 10.0.0.222.44867: Flags [S.], seq 2403843932, ack 1110452857, win 42540, options [mss 1430,sackOK,TS val 1962005037 ecr 2742813,nop,wscale 7], length 0
06:10:54.580784 IP bom07s01-in-f3.1e100.net.http > 10.0.0.222.44868: Flags [S.], seq 281348057, ack 3125049113, win 42540, options [mss 1430,sackOK,TS val 1962199343 ecr 2742813,nop,wscale 7], length 0
06:10:54.581063 IP 10.0.0.222.35827 > bom05s08-in-f5.1e100.net.https: Flags [.], ack 1, win 251, options [nop,nop,TS val 2742813 ecr 1054041055], length 0
06:10:54.581960 IP 10.0.0.222.44867 > bom07s01-in-f3.1e100.net.http: Flags [.], ack 1, win 251, options [nop,nop,TS val 2742813 ecr 1962005037], length 0
06:10:54.582228 IP 10.0.0.222.44868 > bom07s01-in-f3.1e100.net.http: Flags [.], ack 1, win 251, options [nop,nop,TS val 2742813 ecr 1962199343], length 0
06:10:54.583410 IP 10.0.0.222.35827 > bom05s08-in-f5.1e100.net.https: Flags [P.], seq 1:204, ack 1, win 251, options [nop,nop,TS val 2742813 ecr 1054041055], length 203
06:10:54.583700 IP 10.0.0.222.50742 > lisa.rootshell.be.http: Flags [S], seq 479423370, win 64240, options [mss 1460,sackOK,TS val 2742813 ecr 0,nop,wscale 8], length 0
06:10:54.584213 IP 10.0.0.222.44868 > bom07s01-in-f3.1e100.net.http: Flags [P.], seq 1:478, ack 1, win 251, options [nop,nop,TS val 2742813 ecr 1962199343], length 477
06:10:54.585693 IP bom05s08-in-f5.1e100.net.https > 10.0.0.222.35827: Flags [.], ack 204, win 341, options [nop,nop,TS val 1054041061 ecr 2742813], length 0
06:10:54.586055 IP 10.0.0.222.39235 > 10.0.0.1.4886: UDP, length 0
06:10:54.586154 IP 10.0.0.1 > 10.0.0.222: ICMP 10.0.0.1 udp port 4886 unreachable, length 36
06:10:54.586489 IP bom05s08-in-f5.1e100.net.https > 10.0.0.222.35827: Flags [.], seq 1:1349, ack 204, win 341, options [nop,nop,TS val 1054041061 ecr 2742813], length 1348
06:10:54.586704 IP bom05s08-in-f5.1e100.net.https > 10.0.0.222.35827: Flags [.], seq 1349:2697, ack 204, win 341, options [nop,nop,TS val 1054041061 ecr 2742813], length 1348
06:10:54.586775 IP bom05s08-in-f5.1e100.net.https > 10.0.0.222.35827: Flags [P.], seq 2697:3160, ack 204, win 341, options [nop,nop,TS val 1054041061 ecr 2742813], length 463
06:10:54.586873 IP bom07s01-in-f3.1e100.net.http > 10.0.0.222.44868: Flags [.], ack 478, win 341, options [nop,nop,TS val 1962199350 ecr 2742813], length 0
06:10:54.587839 IP 10.0.0.222.35827 > bom05s08-in-f5.1e100.net.https: Flags [.], ack 1349, win 262, options [nop,nop,TS val 2742814 ecr 1054041061], length 0
06:10:54.588146 IP 10.0.0.222.35827 > bom05s08-in-f5.1e100.net.https: Flags [.], ack 2697, win 272, options [nop,nop,TS val 2742814 ecr 1054041061], length 0
06:10:54.589454 IP 10.0.0.222.35827 > bom05s08-in-f5.1e100.net.https: Flags [.], ack 3160, win 283, options [nop,nop,TS val 2742814 ecr 1054041061], length 0
06:10:54.602318 IP 10.0.0.222.39235 > 10.0.0.1.4886: UDP, length 0
06:10:54.602404 IP 10.0.0.1 > 10.0.0.222: ICMP 10.0.0.1 udp port 4886 unreachable, length 36
06:10:54.618620 IP 10.0.0.222.39235 > 10.0.0.1.4886: UDP, length 0
06:10:54.618700 IP 10.0.0.1 > 10.0.0.222: ICMP 10.0.0.1 udp port 4886 unreachable, length 36
06:10:54.629347 IP 10.0.0.222.35827 > bom05s08-in-f5.1e100.net.https: Flags [P.], seq 204:330, ack 3160, win 283, options [nop,nop,TS val 2742818 ecr 1054041061], length 126
06:10:54.632278 IP bom05s08-in-f5.1e100.net.https > 10.0.0.222.35827: Flags [P.], seq 3160:3422, ack 330, win 341, options [nop,nop,TS val 1054041107 ecr 2742818], length 262
06:10:54.632405 IP bom05s08-in-f5.1e100.net.https > 10.0.0.222.35827: Flags [P.], seq 3422:3478, ack 330, win 341, options [nop,nop,TS val 1054041107 ecr 2742818], length 56
06:10:54.632466 IP bom05s08-in-f5.1e100.net.https > 10.0.0.222.35827: Flags [P.], seq 3478:3520, ack 330, win 341, options [nop,nop,TS val 1054041107 ecr 2742818], length 42
06:10:54.633443 IP 10.0.0.222.35827 > bom05s08-in-f5.1e100.net.https: Flags [.], ack 3422, win 294, options [nop,nop,TS val 2742818 ecr 1054041107], length 0
06:10:54.633669 IP 10.0.0.222.35827 > bom05s08-in-f5.1e100.net.https: Flags [.], ack 3478, win 294, options [nop,nop,TS val 2742818 ecr 1054041107], length 0
06:10:54.633957 IP 10.0.0.222.35827 > bom05s08-in-f5.1e100.net.https: Flags [.], ack 3520, win 294, options [nop,nop,TS val 2742818 ecr 1054041107], length 0
06:10:54.635087 IP 10.0.0.222.39235 > 10.0.0.1.4886: UDP, length 0
06:10:54.635165 IP 10.0.0.1 > 10.0.0.222: ICMP 10.0.0.1 udp port 4886 unreachable, length 36
06:10:54.639446 IP 10.0.0.222.35827 > bom05s08-in-f5.1e100.net.https: Flags [P.], seq 330:487, ack 3520, win 294, options [nop,nop,TS val 2742819 ecr 1054041107], length 157
06:10:54.639676 IP 10.0.0.222.35827 > bom05s08-in-f5.1e100.net.https: Flags [P.], seq 487:525, ack 3520, win 294, options [nop,nop,TS val 2742819 ecr 1054041107], length 38
06:10:54.642288 IP bom05s08-in-f5.1e100.net.https > 10.0.0.222.35827: Flags [.], ack 525, win 350, options [nop,nop,TS val 1054041117 ecr 2742819], length 0
06:10:54.642382 IP bom05s08-in-f5.1e100.net.https > 10.0.0.222.35827: Flags [P.], seq 3520:3558, ack 525, win 350, options [nop,nop,TS val 1054041117 ecr 2742819], length 38
06:10:54.651570 IP 10.0.0.222.39235 > 10.0.0.1.4886: UDP, length 0
06:10:54.651622 IP 10.0.0.1 > 10.0.0.222: ICMP 10.0.0.1 udp port 4886 unreachable, length 36
06:10:54.654343 IP bom07s01-in-f3.1e100.net.http > 10.0.0.222.44868: Flags [P.], seq 1:545, ack 478, win 341, options [nop,nop,TS val 1962199417 ecr 2742813], length 544
06:10:54.655429 IP 10.0.0.222.44868 > bom07s01-in-f3.1e100.net.http: Flags [.], ack 545, win 256, options [nop,nop,TS val 2742820 ecr 1962199417], length 0
06:10:54.667915 IP 10.0.0.222.39235 > 10.0.0.1.4886: UDP, length 0
06:10:54.667980 IP 10.0.0.1 > 10.0.0.222: ICMP 10.0.0.1 udp port 4886 unreachable, length 36
06:10:54.675844 IP 10.0.0.222.35827 > bom05s08-in-f5.1e100.net.https: Flags [.], ack 3558, win 294, options [nop,nop,TS val 2742823 ecr 1054041117], length 0
06:10:54.684220 IP 10.0.0.222.39235 > 10.0.0.1.4886: UDP, length 0
06:10:54.700383 IP 10.0.0.222.39235 > 10.0.0.1.4886: UDP, length 0
06:10:54.706858 IP lisa.rootshell.be.http > 10.0.0.222.50742: Flags [S.], seq 1420961127, ack 479423371, win 14480, options [mss 1440,sackOK,TS val 3400840857 ecr 2742813,nop,wscale 7], length 0
06:10:54.707744 IP 10.0.0.222.50742 > lisa.rootshell.be.http: Flags [.], ack 1, win 251, options [nop,nop,TS val 2742826 ecr 3400840857], length 0
06:10:54.716706 IP 10.0.0.222.39235 > 10.0.0.1.4886: UDP, length 0
06:10:54.733087 IP 10.0.0.222.39235 > 10.0.0.1.4886: UDP, length 0
06:10:54.749372 IP 10.0.0.222.39235 > 10.0.0.1.4886: UDP, length 0
06:10:54.765852 IP 10.0.0.222.39235 > 10.0.0.1.4886: UDP, length 0
06:10:54.766582 IP 192.30.253.113.https > 10.0.0.222.40326: Flags [S.], seq 3554405346, ack 2737803974, win 28480, options [mss 1436,sackOK,TS val 3703484975 ecr 2742807,nop,wscale 10], length 0
06:10:54.767702 IP 10.0.0.222.40326 > 192.30.253.113.https: Flags [.], ack 1, win 251, options [nop,nop,TS val 2742832 ecr 3703484975], length 0
06:10:54.768221 IP 10.0.0.222.40326 > 192.30.253.113.https: Flags [P.], seq 1:199, ack 1, win 251, options [nop,nop,TS val 2742832 ecr 3703484975], length 198
06:10:54.782231 IP 10.0.0.222.39235 > 10.0.0.1.4886: UDP, length 0
06:10:54.798692 IP 10.0.0.222.39235 > 10.0.0.1.4886: UDP, length 0
06:10:54.815262 IP 10.0.0.222.39235 > 10.0.0.1.4886: UDP, length 0
06:10:54.831822 IP 10.0.0.222.39235 > 10.0.0.1.4886: UDP, length 0
06:10:54.848232 IP 10.0.0.222.39235 > 10.0.0.1.4886: UDP, length 0
06:10:54.864717 IP 10.0.0.222.39235 > 10.0.0.1.4886: UDP, length 0
06:10:54.881118 IP 10.0.0.222.39235 > 10.0.0.1.4886: UDP, length 0
06:10:54.897511 IP 10.0.0.222.39235 > 10.0.0.1.4886: UDP, length 0
06:10:54.913841 IP 10.0.0.222.39235 > 10.0.0.1.4886: UDP, length 0
06:10:54.930311 IP 10.0.0.222.39235 > 10.0.0.1.4886: UDP, length 0
06:10:54.946653 IP 10.0.0.222.39235 > 10.0.0.1.4886: UDP, length 0
06:10:54.963146 IP 10.0.0.222.39235 > 10.0.0.1.4886: UDP, length 0
06:10:55.014580 IP 192.30.253.113.https > 10.0.0.222.40326: Flags [.], seq 1:1349, ack 199, win 29, options [nop,nop,TS val 3703485037 ecr 2742832], length 1348
06:10:55.014757 IP 192.30.253.113.https > 10.0.0.222.40326: Flags [.], seq 1349:2697, ack 199, win 29, options [nop,nop,TS val 3703485037 ecr 2742832], length 1348
06:10:55.014806 IP 192.30.253.113.https > 10.0.0.222.40326: Flags [P.], seq 2697:3606, ack 199, win 29, options [nop,nop,TS val 3703485037 ecr 2742832], length 909
06:10:55.016277 IP 10.0.0.222.40326 > 192.30.253.113.https: Flags [.], ack 1349, win 262, options [nop,nop,TS val 2742857 ecr 3703485037], length 0
06:10:55.016488 IP 10.0.0.222.40326 > 192.30.253.113.https: Flags [.], ack 2697, win 272, options [nop,nop,TS val 2742857 ecr 3703485037], length 0
06:10:55.017769 IP 10.0.0.222.40326 > 192.30.253.113.https: Flags [.], ack 3606, win 283, options [nop,nop,TS val 2742857 ecr 3703485037], length 0
06:10:55.034161 IP 10.0.0.222.40326 > 192.30.253.113.https: Flags [P.], seq 199:325, ack 3606, win 283, options [nop,nop,TS val 2742858 ecr 3703485037], length 126
06:10:55.278983 IP 192.30.253.113.https > 10.0.0.222.40326: Flags [P.], seq 3606:3657, ack 325, win 29, options [nop,nop,TS val 3703485103 ecr 2742858], length 51
06:10:55.316083 IP 10.0.0.222.40326 > 192.30.253.113.https: Flags [.], ack 3657, win 283, options [nop,nop,TS val 2742887 ecr 3703485103], length 0
06:10:55.807476 IP 10.0.0.222.24705 > 10.0.0.1.domain: 29276+ A? ocsp.digicert.com. (35)
06:10:55.828053 IP 10.0.0.222.25183 > 10.0.0.1.domain: 21313+ A? www.google.co.in. (34)
06:10:55.843619 IP 10.0.0.222.39235 > 10.0.0.1.4886: UDP, length 0
06:10:55.843727 IP 10.0.0.1 > 10.0.0.222: ICMP 10.0.0.1 udp port 4886 unreachable, length 36
06:10:55.860384 IP 10.0.0.222.39235 > 10.0.0.1.4886: UDP, length 0
06:10:55.872472 IP 10.0.0.1.domain > 10.0.0.222.24705: 29276 2/0/0 CNAME cs9.wac.phicdn.net., A 117.18.237.29 (83)
06:10:55.874846 IP 10.0.0.222.34762 > 117.18.237.29.http: Flags [S], seq 3158674392, win 64240, options [mss 1460,sackOK,TS val 2742942 ecr 0,nop,wscale 8], length 0
06:10:55.877314 IP 10.0.0.222.39235 > 10.0.0.1.4886: UDP, length 0
06:10:55.878363 IP 117.18.237.29.http > 10.0.0.222.34762: Flags [S.], seq 633673428, ack 3158674393, win 65535, options [mss 1440,sackOK,TS val 3017487681 ecr 2742942,nop,wscale 9], length 0
06:10:55.879834 IP 10.0.0.222.34762 > 117.18.237.29.http: Flags [.], ack 1, win 251, options [nop,nop,TS val 2742943 ecr 3017487681], length 0
06:10:55.880198 IP 10.0.0.222.34762 > 117.18.237.29.http: Flags [P.], seq 1:452, ack 1, win 251, options [nop,nop,TS val 2742943 ecr 3017487681], length 451
06:10:55.883562 IP 117.18.237.29.http > 10.0.0.222.34762: Flags [.], ack 452, win 285, options [nop,nop,TS val 3017487683 ecr 2742943], length 0
06:10:55.884368 IP 117.18.237.29.http > 10.0.0.222.34762: Flags [P.], seq 1:789, ack 452, win 285, options [nop,nop,TS val 3017487683 ecr 2742943], length 788
06:10:55.886044 IP 10.0.0.222.34762 > 117.18.237.29.http: Flags [.], ack 789, win 258, options [nop,nop,TS val 2742944 ecr 3017487683], length 0
06:10:55.886130 IP 10.0.0.1.domain > 10.0.0.222.25183: 21313 1/0/0 A 216.58.199.131 (50)
06:10:55.888466 IP 10.0.0.222.44871 > bom07s01-in-f3.1e100.net.http: Flags [S], seq 1887264693, win 64240, options [mss 1460,sackOK,TS val 2742944 ecr 0,nop,wscale 8], length 0
06:10:55.888850 IP 10.0.0.222.44872 > bom07s01-in-f3.1e100.net.http: Flags [S], seq 6105354, win 64240, options [mss 1460,sackOK,TS val 2742944 ecr 0,nop,wscale 8], length 0
06:10:55.891230 IP bom07s01-in-f3.1e100.net.http > 10.0.0.222.44871: Flags [S.], seq 1011347734, ack 1887264694, win 42540, options [mss 1430,sackOK,TS val 1962048037 ecr 2742944,nop,wscale 7], length 0
06:10:55.891348 IP bom07s01-in-f3.1e100.net.http > 10.0.0.222.44872: Flags [S.], seq 388262666, ack 6105355, win 42540, options [mss 1430,sackOK,TS val 1961936580 ecr 2742944,nop,wscale 7], length 0
06:10:55.892559 IP 10.0.0.222.44871 > bom07s01-in-f3.1e100.net.http: Flags [.], ack 1, win 251, options [nop,nop,TS val 2742944 ecr 1962048037], length 0
06:10:55.892607 IP 10.0.0.222.44872 > bom07s01-in-f3.1e100.net.http: Flags [.], ack 1, win 251, options [nop,nop,TS val 2742944 ecr 1961936580], length 0
06:10:55.892952 IP 10.0.0.222.44871 > bom07s01-in-f3.1e100.net.http: Flags [P.], seq 1:482, ack 1, win 251, options [nop,nop,TS val 2742944 ecr 1962048037], length 481
06:10:55.894145 IP 10.0.0.222.39235 > 10.0.0.1.4886: UDP, length 0
06:10:55.895594 IP bom07s01-in-f3.1e100.net.http > 10.0.0.222.44871: Flags [.], ack 482, win 341, options [nop,nop,TS val 1962048042 ecr 2742944], length 0
06:10:55.904967 IP lisa.rootshell.be.http > 10.0.0.222.50742: Flags [S.], seq 1420961127, ack 479423371, win 14480, options [mss 1440,sackOK,TS val 3400841157 ecr 2742826,nop,wscale 7], length 0
06:10:55.906211 IP 10.0.0.222.50742 > lisa.rootshell.be.http: Flags [.], ack 1, win 251, options [nop,nop,TS val 2742946 ecr 3400840857], length 0
06:10:55.910715 IP 10.0.0.222.39235 > 10.0.0.1.4886: UDP, length 0
06:10:55.927305 IP 10.0.0.222.39235 > 10.0.0.1.4886: UDP, length 0
06:10:55.944133 IP 10.0.0.222.39235 > 10.0.0.1.4886: UDP, length 0
06:10:55.960334 IP 10.0.0.222.39235 > 10.0.0.1.4886: UDP, length 0
06:10:55.969938 IP bom07s01-in-f3.1e100.net.http > 10.0.0.222.44871: Flags [.], seq 1:1349, ack 482, win 341, options [nop,nop,TS val 1962048115 ecr 2742944], length 1348
06:10:55.970130 IP bom07s01-in-f3.1e100.net.http > 10.0.0.222.44871: Flags [.], seq 1349:2697, ack 482, win 341, options [nop,nop,TS val 1962048115 ecr 2742944], length 1348
06:10:55.970199 IP bom07s01-in-f3.1e100.net.http > 10.0.0.222.44871: Flags [.], seq 2697:4045, ack 482, win 341, options [nop,nop,TS val 1962048115 ecr 2742944], length 1348
06:10:55.970278 IP bom07s01-in-f3.1e100.net.http > 10.0.0.222.44871: Flags [P.], seq 4045:5045, ack 482, win 341, options [nop,nop,TS val 1962048115 ecr 2742944], length 1000
06:10:55.970446 IP bom07s01-in-f3.1e100.net.http > 10.0.0.222.44871: Flags [P.], seq 5045:5065, ack 482, win 341, options [nop,nop,TS val 1962048117 ecr 2742944], length 20
06:10:55.971820 IP 10.0.0.222.44871 > bom07s01-in-f3.1e100.net.http: Flags [.], ack 1349, win 262, options [nop,nop,TS val 2742952 ecr 1962048115], length 0
06:10:55.972014 IP 10.0.0.222.44871 > bom07s01-in-f3.1e100.net.http: Flags [.], ack 2697, win 272, options [nop,nop,TS val 2742952 ecr 1962048115], length 0
06:10:55.972261 IP 10.0.0.222.44871 > bom07s01-in-f3.1e100.net.http: Flags [.], ack 4045, win 283, options [nop,nop,TS val 2742952 ecr 1962048115], length 0
06:10:55.973193 IP 10.0.0.222.44871 > bom07s01-in-f3.1e100.net.http: Flags [.], ack 5045, win 294, options [nop,nop,TS val 2742952 ecr 1962048115], length 0
06:10:55.973466 IP 10.0.0.222.44871 > bom07s01-in-f3.1e100.net.http: Flags [.], ack 5065, win 294, options [nop,nop,TS val 2742952 ecr 1962048117], length 0
06:10:55.976842 IP 10.0.0.222.39235 > 10.0.0.1.4886: UDP, length 0
06:10:55.993101 IP 10.0.0.222.39235 > 10.0.0.1.4886: UDP, length 0
06:10:56.009392 IP 10.0.0.222.39235 > 10.0.0.1.4886: UDP, length 0
06:10:56.025411 IP 10.0.0.222.39235 > 10.0.0.1.4886: UDP, length 0
06:10:56.041983 IP 10.0.0.222.39235 > 10.0.0.1.4886: UDP, length 0
06:10:56.058410 IP 10.0.0.222.39235 > 10.0.0.1.4886: UDP, length 0
06:10:56.074727 IP 10.0.0.222.39235 > 10.0.0.1.4886: UDP, length 0
06:10:56.091148 IP 10.0.0.222.39235 > 10.0.0.1.4886: UDP, length 0
06:10:56.106131 IP 10.0.0.222.35827 > bom05s08-in-f5.1e100.net.https: Flags [P.], seq 525:571, ack 3558, win 294, options [nop,nop,TS val 2742966 ecr 1054041117], length 46
06:10:56.107101 IP 10.0.0.222.39235 > 10.0.0.1.4886: UDP, length 0
06:10:56.109003 IP bom05s08-in-f5.1e100.net.https > 10.0.0.222.35827: Flags [P.], seq 3558:3604, ack 571, win 350, options [nop,nop,TS val 1054042584 ecr 2742966], length 46
06:10:56.110003 IP 10.0.0.222.35827 > bom05s08-in-f5.1e100.net.https: Flags [.], ack 3604, win 294, options [nop,nop,TS val 2742966 ecr 1054042584], length 0
06:10:56.123886 IP 10.0.0.222.39235 > 10.0.0.1.4886: UDP, length 0
06:10:56.140031 IP 10.0.0.222.39235 > 10.0.0.1.4886: UDP, length 0
06:10:56.156197 IP 10.0.0.222.39235 > 10.0.0.1.4886: UDP, length 0
06:10:56.172562 IP 10.0.0.222.39235 > 10.0.0.1.4886: UDP, length 0
06:10:56.189135 IP 10.0.0.222.39235 > 10.0.0.1.4886: UDP, length 0
06:10:56.205293 IP 10.0.0.222.39235 > 10.0.0.1.4886: UDP, length 0
06:10:56.221635 IP 10.0.0.222.39235 > 10.0.0.1.4886: UDP, length 0
06:10:56.237906 IP 10.0.0.222.39235 > 10.0.0.1.4886: UDP, length 0
06:10:56.254527 IP 10.0.0.222.39235 > 10.0.0.1.4886: UDP, length 0
06:10:56.266585 IP 10.0.0.222.4130 > 10.0.0.1.domain: 32433+ A? www.google.com. (32)
06:10:56.268098 IP 10.0.0.222.44871 > bom07s01-in-f3.1e100.net.http: Flags [P.], seq 482:983, ack 5065, win 294, options [nop,nop,TS val 2742982 ecr 1962048117], length 501
06:10:56.270157 IP 10.0.0.1.domain > 10.0.0.222.4130: 32433 1/0/0 A 216.58.199.132 (48)
06:10:56.270795 IP bom07s01-in-f3.1e100.net.http > 10.0.0.222.44871: Flags [.], ack 983, win 350, options [nop,nop,TS val 1962048417 ecr 2742982], length 0
06:10:56.271333 IP 10.0.0.222.39235 > 10.0.0.1.4886: UDP, length 0
06:10:56.273011 IP 10.0.0.222.55530 > bom07s01-in-f132.1e100.net.https: Flags [S], seq 2061080689, win 64240, options [mss 1460,sackOK,TS val 2742982 ecr 0,nop,wscale 8], length 0
06:10:56.289079 IP 10.0.0.222.39235 > 10.0.0.1.4886: UDP, length 0
06:10:56.297010 IP 10.0.0.222.49093 > bom07s01-in-f132.1e100.net.https: Flags [S], seq 2672274083, win 64240, options [mss 1460,sackOK,TS val 2742985 ecr 0,nop,wscale 8], length 0
06:10:56.304771 IP 10.0.0.222.39235 > 10.0.0.1.4886: UDP, length 0
06:10:56.317510 IP 10.0.0.222.31530 > 10.0.0.1.domain: 32133+ A? ssl.gstatic.com. (33)
06:10:56.321924 IP 10.0.0.222.39235 > 10.0.0.1.4886: UDP, length 0
06:10:56.329344 IP bom07s01-in-f132.1e100.net.https > 10.0.0.222.55530: Flags [S.], seq 3443213703, ack 2061080690, win 42540, options [mss 1430,sackOK,TS val 1962237672 ecr 2742982,nop,wscale 7], length 0
06:10:56.330417 IP 10.0.0.222.55530 > bom07s01-in-f132.1e100.net.https: Flags [.], ack 1, win 251, options [nop,nop,TS val 2742988 ecr 1962237672], length 0
06:10:56.330961 IP 10.0.0.222.55530 > bom07s01-in-f132.1e100.net.https: Flags [P.], seq 1:203, ack 1, win 251, options [nop,nop,TS val 2742988 ecr 1962237672], length 202
06:10:56.332349 IP bom07s01-in-f3.1e100.net.http > 10.0.0.222.44871: Flags [.], seq 5065:6413, ack 983, win 350, options [nop,nop,TS val 1962048477 ecr 2742982], length 1348
06:10:56.332485 IP bom07s01-in-f3.1e100.net.http > 10.0.0.222.44871: Flags [.], seq 6413:7761, ack 983, win 350, options [nop,nop,TS val 1962048477 ecr 2742982], length 1348
06:10:56.332674 IP bom07s01-in-f3.1e100.net.http > 10.0.0.222.44871: Flags [.], seq 7761:9109, ack 983, win 350, options [nop,nop,TS val 1962048477 ecr 2742982], length 1348
06:10:56.332719 IP bom07s01-in-f3.1e100.net.http > 10.0.0.222.44871: Flags [P.], seq 9109:9580, ack 983, win 350, options [nop,nop,TS val 1962048477 ecr 2742982], length 471
06:10:56.333714 IP 10.0.0.222.44871 > bom07s01-in-f3.1e100.net.http: Flags [.], ack 6413, win 304, options [nop,nop,TS val 2742988 ecr 1962048477], length 0
06:10:56.334417 IP 10.0.0.222.44871 > bom07s01-in-f3.1e100.net.http: Flags [.], ack 7761, win 315, options [nop,nop,TS val 2742988 ecr 1962048477], length 0
06:10:56.335286 IP 10.0.0.222.44871 > bom07s01-in-f3.1e100.net.http: Flags [.], ack 9109, win 325, options [nop,nop,TS val 2742988 ecr 1962048477], length 0
06:10:56.335330 IP 10.0.0.222.44871 > bom07s01-in-f3.1e100.net.http: Flags [.], ack 9580, win 336, options [nop,nop,TS val 2742988 ecr 1962048477], length 0
06:10:56.338297 IP 10.0.0.222.39235 > 10.0.0.1.4886: UDP, length 0
06:10:56.354557 IP 10.0.0.222.39235 > 10.0.0.1.4886: UDP, length 0
06:10:56.357613 IP bom07s01-in-f132.1e100.net.https > 10.0.0.222.49093: Flags [S.], seq 720616675, ack 2672274084, win 42540, options [mss 1430,sackOK,TS val 1962201120 ecr 2742985,nop,wscale 7], length 0
06:10:56.358679 IP 10.0.0.222.49093 > bom07s01-in-f132.1e100.net.https: Flags [.], ack 1, win 251, options [nop,nop,TS val 2742991 ecr 1962201120], length 0
06:10:56.359801 IP 10.0.0.222.49093 > bom07s01-in-f132.1e100.net.https: Flags [P.], seq 1:181, ack 1, win 251, options [nop,nop,TS val 2742991 ecr 1962201120], length 180
06:10:56.370985 IP 10.0.0.222.39235 > 10.0.0.1.4886: UDP, length 0
06:10:56.374844 IP 10.0.0.1.domain > 10.0.0.222.31530: 32133 1/0/0 A 216.58.220.163 (49)
06:10:56.377083 IP 10.0.0.222.60615 > bom07s10-in-f163.1e100.net.http: Flags [S], seq 3956626374, win 64240, options [mss 1460,sackOK,TS val 2742993 ecr 0,nop,wscale 8], length 0
06:10:56.386915 IP bom07s01-in-f132.1e100.net.https > 10.0.0.222.55530: Flags [.], ack 203, win 341, options [nop,nop,TS val 1962237730 ecr 2742988], length 0
06:10:56.387462 IP 10.0.0.222.39235 > 10.0.0.1.4886: UDP, length 0
06:10:56.389165 IP bom07s01-in-f132.1e100.net.https > 10.0.0.222.55530: Flags [.], seq 1:1349, ack 203, win 341, options [nop,nop,TS val 1962237732 ecr 2742988], length 1348
06:10:56.389328 IP bom07s01-in-f132.1e100.net.https > 10.0.0.222.55530: Flags [.], seq 1349:2697, ack 203, win 341, options [nop,nop,TS val 1962237732 ecr 2742988], length 1348
06:10:56.389419 IP bom07s01-in-f132.1e100.net.https > 10.0.0.222.55530: Flags [P.], seq 2697:3515, ack 203, win 341, options [nop,nop,TS val 1962237732 ecr 2742988], length 818
06:10:56.390576 IP 10.0.0.222.55530 > bom07s01-in-f132.1e100.net.https: Flags [.], ack 1349, win 262, options [nop,nop,TS val 2742994 ecr 1962237732], length 0
06:10:56.391063 IP 10.0.0.222.55530 > bom07s01-in-f132.1e100.net.https: Flags [.], ack 2697, win 272, options [nop,nop,TS val 2742994 ecr 1962237732], length 0
06:10:56.391574 IP 10.0.0.222.55530 > bom07s01-in-f132.1e100.net.https: Flags [.], ack 3515, win 283, options [nop,nop,TS val 2742994 ecr 1962237732], length 0
06:10:56.401279 IP bom07s10-in-f163.1e100.net.http > 10.0.0.222.60615: Flags [S.], seq 4020375023, ack 3956626375, win 42540, options [mss 1430,sackOK,TS val 1073559414 ecr 2742993,nop,wscale 7], length 0
06:10:56.402559 IP 10.0.0.222.60615 > bom07s10-in-f163.1e100.net.http: Flags [.], ack 1, win 251, options [nop,nop,TS val 2742995 ecr 1073559414], length 0
06:10:56.403727 IP 10.0.0.222.39235 > 10.0.0.1.4886: UDP, length 0
06:10:56.409652 IP 10.0.0.222.55530 > bom07s01-in-f132.1e100.net.https: Flags [P.], seq 203:329, ack 3515, win 283, options [nop,nop,TS val 2742996 ecr 1962237732], length 126
06:10:56.410069 IP 10.0.0.222.55530 > bom07s01-in-f132.1e100.net.https: Flags [P.], seq 329:486, ack 3515, win 283, options [nop,nop,TS val 2742996 ecr 1962237732], length 157
06:10:56.420357 IP bom07s01-in-f132.1e100.net.https > 10.0.0.222.49093: Flags [.], ack 181, win 341, options [nop,nop,TS val 1962201183 ecr 2742991], length 0
06:10:56.420448 IP 10.0.0.222.39235 > 10.0.0.1.4886: UDP, length 0
06:10:56.423913 IP bom07s01-in-f132.1e100.net.https > 10.0.0.222.49093: Flags [.], seq 1:1349, ack 181, win 341, options [nop,nop,TS val 1962201186 ecr 2742991], length 1348
06:10:56.424075 IP bom07s01-in-f132.1e100.net.https > 10.0.0.222.49093: Flags [.], seq 1349:2697, ack 181, win 341, options [nop,nop,TS val 1962201186 ecr 2742991], length 1348
06:10:56.424177 IP bom07s01-in-f132.1e100.net.https > 10.0.0.222.49093: Flags [P.], seq 2697:3521, ack 181, win 341, options [nop,nop,TS val 1962201186 ecr 2742991], length 824
06:10:56.425464 IP 10.0.0.222.49093 > bom07s01-in-f132.1e100.net.https: Flags [.], ack 1349, win 262, options [nop,nop,TS val 2742997 ecr 1962201186], length 0
06:10:56.425546 IP 10.0.0.222.49093 > bom07s01-in-f132.1e100.net.https: Flags [.], ack 2697, win 272, options [nop,nop,TS val 2742997 ecr 1962201186], length 0
06:10:56.426330 IP 10.0.0.222.49093 > bom07s01-in-f132.1e100.net.https: Flags [.], ack 3521, win 283, options [nop,nop,TS val 2742998 ecr 1962201186], length 0
06:10:56.436626 IP 10.0.0.222.39235 > 10.0.0.1.4886: UDP, length 0
06:10:56.450427 IP 10.0.0.222.49093 > bom07s01-in-f132.1e100.net.https: Flags [P.], seq 181:307, ack 3521, win 283, options [nop,nop,TS val 2743000 ecr 1962201186], length 126
06:10:56.453232 IP 10.0.0.222.39235 > 10.0.0.1.4886: UDP, length 0
06:10:56.466671 IP bom07s01-in-f132.1e100.net.https > 10.0.0.222.55530: Flags [P.], seq 3515:3777, ack 486, win 350, options [nop,nop,TS val 1962237809 ecr 2742996], length 262
06:10:56.466788 IP bom07s01-in-f132.1e100.net.https > 10.0.0.222.55530: Flags [P.], seq 3777:3833, ack 486, win 350, options [nop,nop,TS val 1962237809 ecr 2742996], length 56
06:10:56.466864 IP bom07s01-in-f132.1e100.net.https > 10.0.0.222.55530: Flags [P.], seq 3833:3875, ack 486, win 350, options [nop,nop,TS val 1962237809 ecr 2742996], length 42
06:10:56.466956 IP bom07s01-in-f132.1e100.net.https > 10.0.0.222.55530: Flags [P.], seq 3875:3913, ack 486, win 350, options [nop,nop,TS val 1962237810 ecr 2742996], length 38
06:10:56.468515 IP 10.0.0.222.55530 > bom07s01-in-f132.1e100.net.https: Flags [P.], seq 486:524, ack 3913, win 294, options [nop,nop,TS val 2743002 ecr 1962237809], length 38
06:10:56.469697 IP 10.0.0.222.39235 > 10.0.0.1.4886: UDP, length 0
06:10:56.486202 IP 10.0.0.222.39235 > 10.0.0.1.4886: UDP, length 0
06:10:56.502579 IP 10.0.0.222.39235 > 10.0.0.1.4886: UDP, length 0
06:10:56.510982 IP bom07s01-in-f132.1e100.net.https > 10.0.0.222.49093: Flags [P.], seq 3521:3783, ack 307, win 341, options [nop,nop,TS val 1962201274 ecr 2743000], length 262
06:10:56.514461 IP 10.0.0.222.49093 > bom07s01-in-f132.1e100.net.https: Flags [P.], seq 307:541, ack 3783, win 294, options [nop,nop,TS val 2743006 ecr 1962201274], length 234
06:10:56.523927 IP 10.0.0.222.39235 > 10.0.0.1.4886: UDP, length 0
06:10:56.540511 IP 10.0.0.222.39235 > 10.0.0.1.4886: UDP, length 0
06:10:56.556835 IP 10.0.0.222.39235 > 10.0.0.1.4886: UDP, length 0
06:10:56.564283 IP bom07s01-in-f132.1e100.net.https > 10.0.0.222.55530: Flags [.], ack 524, win 350, options [nop,nop,TS val 1962237907 ecr 2743002], length 0
06:10:56.573111 IP 10.0.0.222.39235 > 10.0.0.1.4886: UDP, length 0
06:10:56.589452 IP 10.0.0.222.39235 > 10.0.0.1.4886: UDP, length 0
06:10:56.589525 IP 10.0.0.1 > 10.0.0.222: ICMP 10.0.0.1 udp port 4886 unreachable, length 36
06:10:56.605953 IP 10.0.0.222.39235 > 10.0.0.1.4886: UDP, length 0
06:10:56.614519 IP bom07s01-in-f132.1e100.net.https > 10.0.0.222.49093: Flags [.], ack 541, win 350, options [nop,nop,TS val 1962201377 ecr 2743006], length 0
06:10:56.623072 IP 10.0.0.222.39235 > 10.0.0.1.4886: UDP, length 0
06:10:56.639587 IP 10.0.0.222.39235 > 10.0.0.1.4886: UDP, length 0
06:10:56.649799 IP 10.0.0.222.60615 > bom07s10-in-f163.1e100.net.http: Flags [P.], seq 1:306, ack 1, win 251, options [nop,nop,TS val 2743020 ecr 1073559414], length 305
06:10:56.651840 IP 10.0.0.222.44871 > bom07s01-in-f3.1e100.net.http: Flags [P.], seq 983:1431, ack 9580, win 336, options [nop,nop,TS val 2743020 ecr 1962048477], length 448
06:10:56.654551 IP bom07s01-in-f3.1e100.net.http > 10.0.0.222.44871: Flags [.], ack 1431, win 358, options [nop,nop,TS val 1962048800 ecr 2743020], length 0
06:10:56.656254 IP 10.0.0.222.39235 > 10.0.0.1.4886: UDP, length 0
06:10:56.657844 IP 10.0.0.222.44872 > bom07s01-in-f3.1e100.net.http: Flags [P.], seq 1:539, ack 1, win 251, options [nop,nop,TS val 2743021 ecr 1961936580], length 538
06:10:56.660656 IP bom07s01-in-f3.1e100.net.http > 10.0.0.222.44872: Flags [.], ack 539, win 341, options [nop,nop,TS val 1961937349 ecr 2743021], length 0
06:10:56.661643 IP bom07s01-in-f3.1e100.net.http > 10.0.0.222.44872: Flags [.], seq 1:1349, ack 539, win 341, options [nop,nop,TS val 1961937349 ecr 2743021], length 1348
06:10:56.661800 IP bom07s01-in-f3.1e100.net.http > 10.0.0.222.44872: Flags [.], seq 1349:2697, ack 539, win 341, options [nop,nop,TS val 1961937349 ecr 2743021], length 1348
06:10:56.662006 IP bom07s01-in-f3.1e100.net.http > 10.0.0.222.44872: Flags [.], seq 2697:4045, ack 539, win 341, options [nop,nop,TS val 1961937349 ecr 2743021], length 1348
06:10:56.662042 IP bom07s01-in-f3.1e100.net.http > 10.0.0.222.44872: Flags [.], seq 4045:5393, ack 539, win 341, options [nop,nop,TS val 1961937349 ecr 2743021], length 1348
06:10:56.662253 IP bom07s01-in-f3.1e100.net.http > 10.0.0.222.44872: Flags [.], seq 5393:6741, ack 539, win 341, options [nop,nop,TS val 1961937349 ecr 2743021], length 1348
06:10:56.662340 IP bom07s01-in-f3.1e100.net.http > 10.0.0.222.44872: Flags [.], seq 6741:8089, ack 539, win 341, options [nop,nop,TS val 1961937349 ecr 2743021], length 1348
06:10:56.662626 IP bom07s01-in-f3.1e100.net.http > 10.0.0.222.44872: Flags [.], seq 8089:9437, ack 539, win 341, options [nop,nop,TS val 1961937349 ecr 2743021], length 1348
06:10:56.662660 IP bom07s01-in-f3.1e100.net.http > 10.0.0.222.44872: Flags [.], seq 9437:10785, ack 539, win 341, options [nop,nop,TS val 1961937349 ecr 2743021], length 1348
06:10:56.662712 IP bom07s01-in-f3.1e100.net.http > 10.0.0.222.44872: Flags [.], seq 10785:12133, ack 539, win 341, options [nop,nop,TS val 1961937349 ecr 2743021], length 1348
06:10:56.662785 IP bom07s01-in-f3.1e100.net.http > 10.0.0.222.44872: Flags [.], seq 12133:13481, ack 539, win 341, options [nop,nop,TS val 1961937349 ecr 2743021], length 1348
06:10:56.663539 IP 10.0.0.222.44872 > bom07s01-in-f3.1e100.net.http: Flags [.], ack 1349, win 262, options [nop,nop,TS val 2743021 ecr 1961937349], length 0
06:10:56.664209 IP 10.0.0.222.44872 > bom07s01-in-f3.1e100.net.http: Flags [.], ack 2697, win 272, options [nop,nop,TS val 2743021 ecr 1961937349], length 0
06:10:56.664378 IP 10.0.0.222.44872 > bom07s01-in-f3.1e100.net.http: Flags [.], ack 4045, win 283, options [nop,nop,TS val 2743021 ecr 1961937349], length 0
06:10:56.664972 IP 10.0.0.222.44872 > bom07s01-in-f3.1e100.net.http: Flags [.], ack 5393, win 294, options [nop,nop,TS val 2743021 ecr 1961937349], length 0
06:10:56.665326 IP 10.0.0.222.44872 > bom07s01-in-f3.1e100.net.http: Flags [.], ack 6741, win 304, options [nop,nop,TS val 2743021 ecr 1961937349], length 0
06:10:56.665726 IP bom07s01-in-f132.1e100.net.https > 10.0.0.222.49093: Flags [P.], seq 3783:4487, ack 541, win 350, options [nop,nop,TS val 1962201428 ecr 2743006], length 704
06:10:56.666392 IP 10.0.0.222.44872 > bom07s01-in-f3.1e100.net.http: Flags [.], ack 8089, win 315, options [nop,nop,TS val 2743022 ecr 1961937349], length 0
06:10:56.666854 IP bom07s01-in-f3.1e100.net.http > 10.0.0.222.44872: Flags [.], seq 13481:14829, ack 539, win 341, options [nop,nop,TS val 1961937354 ecr 2743021], length 1348
06:10:56.667033 IP 10.0.0.222.44872 > bom07s01-in-f3.1e100.net.http: Flags [.], ack 9437, win 325, options [nop,nop,TS val 2743022 ecr 1961937349], length 0
06:10:56.667155 IP bom07s01-in-f3.1e100.net.http > 10.0.0.222.44872: Flags [.], seq 14829:16177, ack 539, win 341, options [nop,nop,TS val 1961937354 ecr 2743021], length 1348
06:10:56.667658 IP 10.0.0.222.44872 > bom07s01-in-f3.1e100.net.http: Flags [.], ack 10785, win 336, options [nop,nop,TS val 2743022 ecr 1961937349], length 0
06:10:56.668266 IP bom07s01-in-f3.1e100.net.http > 10.0.0.222.44872: Flags [.], seq 16177:17525, ack 539, win 341, options [nop,nop,TS val 1961937355 ecr 2743021], length 1348
06:10:56.668409 IP 10.0.0.222.44872 > bom07s01-in-f3.1e100.net.http: Flags [.], ack 12133, win 346, options [nop,nop,TS val 2743022 ecr 1961937349], length 0
06:10:56.668548 IP bom07s01-in-f3.1e100.net.http > 10.0.0.222.44872: Flags [.], seq 17525:18873, ack 539, win 341, options [nop,nop,TS val 1961937355 ecr 2743021], length 1348
06:10:56.668631 IP bom07s01-in-f3.1e100.net.http > 10.0.0.222.44872: Flags [.], seq 18873:20221, ack 539, win 341, options [nop,nop,TS val 1961937355 ecr 2743021], length 1348
06:10:56.668847 IP 10.0.0.222.44872 > bom07s01-in-f3.1e100.net.http: Flags [.], ack 13481, win 357, options [nop,nop,TS val 2743022 ecr 1961937349], length 0
06:10:56.668930 IP bom07s01-in-f3.1e100.net.http > 10.0.0.222.44872: Flags [.], seq 20221:21569, ack 539, win 341, options [nop,nop,TS val 1961937355 ecr 2743021], length 1348
06:10:56.669512 IP bom07s01-in-f3.1e100.net.http > 10.0.0.222.44872: Flags [.], seq 21569:22917, ack 539, win 341, options [nop,nop,TS val 1961937355 ecr 2743021], length 1348
06:10:56.669639 IP bom07s01-in-f3.1e100.net.http > 10.0.0.222.44872: Flags [.], seq 22917:24265, ack 539, win 341, options [nop,nop,TS val 1961937355 ecr 2743021], length 1348
