18:10:38.809510 c0:ee:fb:3b:35:93 (oui Unknown) > Broadcast Null Unnumbered, xid, Flags [Response], length 6: 01 00
18:10:39.950971 IP6 :: > ff02::1:ff3b:3593: ICMP6, neighbor solicitation, who has fe80::c2ee:fbff:fe3b:3593, length 24
18:10:39.951030 IP6 :: > ff02::1:ff3b:3593: ICMP6, neighbor solicitation, who has fe80::c2ee:fbff:fe3b:3593, length 24
18:10:39.952389 IP6 :: > ff02::16: HBH ICMP6, multicast listener report v2, 1 group record(s), length 28
18:10:39.952412 IP6 :: > ff02::16: HBH ICMP6, multicast listener report v2, 1 group record(s), length 28
18:10:39.978545 IP6 :: > ff02::16: HBH ICMP6, multicast listener report v2, 1 group record(s), length 28
18:10:39.978596 IP6 :: > ff02::16: HBH ICMP6, multicast listener report v2, 1 group record(s), length 28
18:10:40.077647 IP 0.0.0.0.bootpc > 255.255.255.255.bootps: BOOTP/DHCP, Request from c0:ee:fb:3b:35:93 (oui Unknown), length 298
18:10:40.077729 IP 0.0.0.0.bootpc > 255.255.255.255.bootps: BOOTP/DHCP, Request from c0:ee:fb:3b:35:93 (oui Unknown), length 298
18:10:40.078108 ARP, Request who-has 10.0.0.222 tell 10.0.0.1, length 28
18:10:40.938853 IP6 fe80::c2ee:fbff:fe3b:3593 > ip6-allrouters: ICMP6, router solicitation, length 16
18:10:40.938906 IP6 fe80::c2ee:fbff:fe3b:3593 > ip6-allrouters: ICMP6, router solicitation, length 16
18:10:41.068149 ARP, Request who-has 10.0.0.222 tell 10.0.0.1, length 28
18:10:42.068157 ARP, Request who-has 10.0.0.222 tell 10.0.0.1, length 28
18:10:43.068940 IP 10.0.0.1.bootps > 10.0.0.222.bootpc: BOOTP/DHCP, Reply, length 300
18:10:43.076205 IP 0.0.0.0.bootpc > 255.255.255.255.bootps: BOOTP/DHCP, Request from c0:ee:fb:3b:35:93 (oui Unknown), length 310
18:10:43.076262 IP 0.0.0.0.bootpc > 255.255.255.255.bootps: BOOTP/DHCP, Request from c0:ee:fb:3b:35:93 (oui Unknown), length 310
18:10:43.114649 IP 10.0.0.1.bootps > 10.0.0.222.bootpc: BOOTP/DHCP, Reply, length 300
18:10:44.344549 ARP, Request who-has 10.0.0.1 tell 10.0.0.222, length 28
18:10:44.344635 ARP, Reply 10.0.0.1 is-at 98:de:d0:09:37:b4 (oui Unknown), length 28
18:10:44.344683 ARP, Request who-has 10.0.0.1 tell 10.0.0.222, length 28
18:10:44.346907 IP 10.0.0.222.46427 > 10.0.0.1.domain: 53790+ AAAA? connectivitycheck.gstatic.com. (47)
18:10:44.401779 IP 10.0.0.1.domain > 10.0.0.222.46427: 53790 1/0/0 AAAA 2404:6800:4009:801::200e (75)
18:10:44.403538 IP 10.0.0.222.51948 > 10.0.0.1.domain: 39883+ A? connectivitycheck.gstatic.com. (47)
18:10:44.431065 IP 10.0.0.222.57445 > 10.0.0.1.domain: 43054+ A? clients3.google.com. (37)
18:10:44.461366 IP 10.0.0.1.domain > 10.0.0.222.51948: 39883 1/0/0 A 216.58.220.174 (63)
18:10:44.488810 IP 10.0.0.1.domain > 10.0.0.222.57445: 43054 2/0/0 CNAME clients.l.google.com., A 216.58.220.174 (77)
18:10:45.279553 IP 10.0.0.222.62154 > 10.0.0.1.domain: 58442+ AAAA? 169.254.0.0. (29)
18:10:45.336006 IP 10.0.0.1.domain > 10.0.0.222.62154: 58442 NXDomain 0/1/0 (104)
18:10:45.973254 IP 10.0.0.222.38450 > bom07s10-in-f174.1e100.net.http: Flags [S], seq 1384037057, win 64240, options [mss 1460,sackOK,TS val 689635 ecr 0,nop,wscale 8], length 0
18:10:45.974115 IP 10.0.0.222.36488 > bom07s10-in-f174.1e100.net.http: Flags [S], seq 485725246, win 64240, options [mss 1460,sackOK,TS val 689635 ecr 0,nop,wscale 8], length 0
18:10:45.975006 IP 10.0.0.222.40655 > 10.0.0.1.domain: 43623+ AAAA? 172.16.0.0. (28)
18:10:45.993321 IP bom07s10-in-f174.1e100.net.http > 10.0.0.222.38450: Flags [S.], seq 2908597918, ack 1384037058, win 42540, options [mss 1430,sackOK,TS val 1773803703 ecr 689635,nop,wscale 7], length 0
18:10:45.995196 IP 10.0.0.222.38450 > bom07s10-in-f174.1e100.net.http: Flags [.], ack 1, win 251, options [nop,nop,TS val 689672 ecr 1773803703], length 0
18:10:45.996869 IP 10.0.0.222.38450 > bom07s10-in-f174.1e100.net.http: Flags [P.], seq 1:187, ack 1, win 251, options [nop,nop,TS val 689672 ecr 1773803703], length 186
18:10:45.997508 IP bom07s10-in-f174.1e100.net.http > 10.0.0.222.36488: Flags [S.], seq 2916341277, ack 485725247, win 42540, options [mss 1430,sackOK,TS val 1636988353 ecr 689635,nop,wscale 7], length 0
18:10:45.999062 IP 10.0.0.222.36488 > bom07s10-in-f174.1e100.net.http: Flags [.], ack 1, win 251, options [nop,nop,TS val 689673 ecr 1636988353], length 0
18:10:46.000796 IP 10.0.0.222.36488 > bom07s10-in-f174.1e100.net.http: Flags [P.], seq 1:177, ack 1, win 251, options [nop,nop,TS val 689673 ecr 1636988353], length 176
18:10:46.016768 IP bom07s10-in-f174.1e100.net.http > 10.0.0.222.38450: Flags [.], ack 187, win 341, options [nop,nop,TS val 1773803726 ecr 689672], length 0
18:10:46.016948 IP bom07s10-in-f174.1e100.net.http > 10.0.0.222.38450: Flags [P.], seq 1:84, ack 187, win 341, options [nop,nop,TS val 1773803726 ecr 689672], length 83
18:10:46.018945 IP 10.0.0.222.38450 > bom07s10-in-f174.1e100.net.http: Flags [.], ack 84, win 251, options [nop,nop,TS val 689675 ecr 1773803726], length 0
18:10:46.023769 IP bom07s10-in-f174.1e100.net.http > 10.0.0.222.36488: Flags [.], ack 177, win 341, options [nop,nop,TS val 1636988378 ecr 689673], length 0
18:10:46.023873 IP bom07s10-in-f174.1e100.net.http > 10.0.0.222.36488: Flags [P.], seq 1:84, ack 177, win 341, options [nop,nop,TS val 1636988378 ecr 689673], length 83
18:10:46.028716 IP 10.0.0.222.36488 > bom07s10-in-f174.1e100.net.http: Flags [.], ack 84, win 251, options [nop,nop,TS val 689676 ecr 1636988378], length 0
18:10:46.036803 IP 10.0.0.222.52337 > 10.0.0.1.domain: 53580+ A? e1.whatsapp.net. (33)
18:10:46.040361 IP 10.0.0.1.domain > 10.0.0.222.52337: 53580 8/0/0 A 174.37.199.204, A 169.45.214.229, A 174.36.208.149, A 174.37.217.83, A 169.55.67.245, A 173.193.230.108, A 173.192.231.43, A 169.53.71.246 (161)
18:10:46.046305 IP 10.0.0.1.domain > 10.0.0.222.40655: 43623 NXDomain 0/1/0 (103)
18:10:46.049146 IP 10.0.0.222.58238 > cc.c7.25ae.ip4.static.sl-reverse.com.https: Flags [S], seq 4190246998, win 64240, options [mss 1460,sackOK,TS val 689678 ecr 0,nop,wscale 8], length 0
18:10:46.166896 IP 10.0.0.222.46136 > 10.0.0.1.domain: 47570+ AAAA? 10.0.0.0. (26)
18:10:46.220397 IP 10.0.0.1.domain > 10.0.0.222.46136: 47570 NXDomain 0/1/0 (101)
18:10:46.287965 IP cc.c7.25ae.ip4.static.sl-reverse.com.https > 10.0.0.222.58238: Flags [S.], seq 3255827644, ack 4190246999, win 65535, options [mss 1360,nop,wscale 9,sackOK,TS val 3527582255 ecr 689678], length 0
18:10:46.359251 IP 10.0.0.222.58238 > cc.c7.25ae.ip4.static.sl-reverse.com.https: Flags [.], ack 1, win 251, options [nop,nop,TS val 689709 ecr 3527582255], length 0
18:10:46.396403 IP 10.0.0.222.58238 > cc.c7.25ae.ip4.static.sl-reverse.com.https: Flags [P.], seq 1:5, ack 1, win 251, options [nop,nop,TS val 689712 ecr 3527582255], length 4
18:10:46.598319 IP cc.c7.25ae.ip4.static.sl-reverse.com.https > 10.0.0.222.58238: Flags [.], ack 1, win 513, options [nop,nop,TS val 3527582565 ecr 689709], length 0
18:10:46.672685 IP cc.c7.25ae.ip4.static.sl-reverse.com.https > 10.0.0.222.58238: Flags [.], ack 5, win 513, options [nop,nop,TS val 3527582632 ecr 689712], length 0
18:10:46.674712 IP 10.0.0.222.58238 > cc.c7.25ae.ip4.static.sl-reverse.com.https: Flags [P.], seq 5:283, ack 1, win 251, options [nop,nop,TS val 689740 ecr 3527582632], length 278
18:10:46.916053 IP cc.c7.25ae.ip4.static.sl-reverse.com.https > 10.0.0.222.58238: Flags [P.], seq 1:58, ack 283, win 513, options [nop,nop,TS val 3527582883 ecr 689740], length 57
18:10:46.916163 IP cc.c7.25ae.ip4.static.sl-reverse.com.https > 10.0.0.222.58238: Flags [P.], seq 58:101, ack 283, win 513, options [nop,nop,TS val 3527582883 ecr 689740], length 43
18:10:46.917549 IP 10.0.0.222.58238 > cc.c7.25ae.ip4.static.sl-reverse.com.https: Flags [.], ack 58, win 251, options [nop,nop,TS val 689764 ecr 3527582883], length 0
18:10:46.917872 IP 10.0.0.222.58238 > cc.c7.25ae.ip4.static.sl-reverse.com.https: Flags [.], ack 101, win 251, options [nop,nop,TS val 689765 ecr 3527582883], length 0
18:10:46.924361 IP 10.0.0.222.62919 > 10.0.0.1.domain: 49812+ AAAA? 192.168.0.0. (29)
18:10:46.940132 IP cc.c7.25ae.ip4.static.sl-reverse.com.https > 10.0.0.222.58238: Flags [.], seq 101:1449, ack 283, win 513, options [nop,nop,TS val 3527582906 ecr 689740], length 1348
18:10:46.940295 IP cc.c7.25ae.ip4.static.sl-reverse.com.https > 10.0.0.222.58238: Flags [P.], seq 1449:2442, ack 283, win 513, options [nop,nop,TS val 3527582906 ecr 689740], length 993
18:10:46.940580 IP 10.0.0.222.58238 > cc.c7.25ae.ip4.static.sl-reverse.com.https: Flags [P.], seq 283:286, ack 101, win 251, options [nop,nop,TS val 689767 ecr 3527582883], length 3
18:10:46.977667 IP 10.0.0.222.58238 > cc.c7.25ae.ip4.static.sl-reverse.com.https: Flags [.], ack 2442, win 272, options [nop,nop,TS val 689771 ecr 3527582906], length 0
18:10:46.980014 IP 10.0.0.1.domain > 10.0.0.222.62919: 49812 NXDomain 0/1/0 (104)
18:10:47.044366 IP cc.c7.25ae.ip4.static.sl-reverse.com.https > 10.0.0.222.58238: Flags [P.], seq 2442:2476, ack 283, win 513, options [nop,nop,TS val 3527583011 ecr 689740], length 34
18:10:47.045355 IP 10.0.0.222.58238 > cc.c7.25ae.ip4.static.sl-reverse.com.https: Flags [.], ack 2476, win 272, options [nop,nop,TS val 689777 ecr 3527583011], length 0
18:10:47.208407 IP cc.c7.25ae.ip4.static.sl-reverse.com.https > 10.0.0.222.58238: Flags [.], ack 286, win 513, options [nop,nop,TS val 3527583176 ecr 689767], length 0
18:10:47.209970 IP 10.0.0.222.58238 > cc.c7.25ae.ip4.static.sl-reverse.com.https: Flags [P.], seq 286:650, ack 2476, win 272, options [nop,nop,TS val 689794 ecr 3527583176], length 364
18:10:47.451023 IP cc.c7.25ae.ip4.static.sl-reverse.com.https > 10.0.0.222.58238: Flags [P.], seq 2476:2590, ack 650, win 513, options [nop,nop,TS val 3527583418 ecr 689794], length 114
18:10:47.451129 IP cc.c7.25ae.ip4.static.sl-reverse.com.https > 10.0.0.222.58238: Flags [P.], seq 2590:2631, ack 650, win 513, options [nop,nop,TS val 3527583418 ecr 689794], length 41
18:10:47.452321 IP 10.0.0.222.58238 > cc.c7.25ae.ip4.static.sl-reverse.com.https: Flags [P.], seq 650:719, ack 2590, win 272, options [nop,nop,TS val 689818 ecr 3527583418], length 69
18:10:47.487517 IP 10.0.0.222.58238 > cc.c7.25ae.ip4.static.sl-reverse.com.https: Flags [.], ack 2631, win 272, options [nop,nop,TS val 689822 ecr 3527583418], length 0
18:10:47.554630 IP 10.0.0.222.59264 > 10.0.0.1.domain: 52642+ A? switchboard.services.mozilla.com. (50)
18:10:47.557840 IP 10.0.0.1.domain > 10.0.0.222.59264: 52642 2/0/0 CNAME switchboard.r53-2.services.mozilla.com., A 54.68.19.239 (98)
18:10:47.581655 IP 10.0.0.222.60478 > ec2-54-68-19-239.us-west-2.compute.amazonaws.com.https: Flags [S], seq 1458652909, win 64240, options [mss 1460,sackOK,TS val 689831 ecr 0,nop,wscale 8], length 0
18:10:47.710251 IP 10.0.0.222.47211 > 10.0.0.1.domain: 62352+ AAAA? 192.168.0.102. (31)
18:10:47.720718 IP cc.c7.25ae.ip4.static.sl-reverse.com.https > 10.0.0.222.58238: Flags [.], ack 719, win 513, options [nop,nop,TS val 3527583688 ecr 689818], length 0
18:10:47.763413 IP 10.0.0.1.domain > 10.0.0.222.47211: 62352 NXDomain 0/1/0 (106)
18:10:47.797155 IP 10.0.0.222.55807 > 10.0.0.1.domain: 56477+ A? kali. (22)
18:10:47.837488 IP ec2-54-68-19-239.us-west-2.compute.amazonaws.com.https > 10.0.0.222.60478: Flags [S.], seq 1116010100, ack 1458652910, win 17898, options [mss 1440,sackOK,TS val 17377619 ecr 689831,nop,wscale 8], length 0
18:10:47.839346 IP 10.0.0.222.60478 > ec2-54-68-19-239.us-west-2.compute.amazonaws.com.https: Flags [.], ack 1, win 251, options [nop,nop,TS val 689857 ecr 17377619], length 0
18:10:47.852930 IP 10.0.0.1.domain > 10.0.0.222.55807: 56477 NXDomain 0/1/0 (97)
18:10:47.859418 IP 10.0.0.222.60478 > ec2-54-68-19-239.us-west-2.compute.amazonaws.com.https: Flags [P.], seq 1:199, ack 1, win 251, options [nop,nop,TS val 689859 ecr 17377619], length 198
18:10:48.115278 IP ec2-54-68-19-239.us-west-2.compute.amazonaws.com.https > 10.0.0.222.60478: Flags [.], ack 199, win 75, options [nop,nop,TS val 17377689 ecr 689859], length 0
18:10:48.116874 IP ec2-54-68-19-239.us-west-2.compute.amazonaws.com.https > 10.0.0.222.60478: Flags [.], seq 1:1349, ack 199, win 75, options [nop,nop,TS val 17377689 ecr 689859], length 1348
18:10:48.117098 IP ec2-54-68-19-239.us-west-2.compute.amazonaws.com.https > 10.0.0.222.60478: Flags [.], seq 1349:2697, ack 199, win 75, options [nop,nop,TS val 17377689 ecr 689859], length 1348
18:10:48.117204 IP ec2-54-68-19-239.us-west-2.compute.amazonaws.com.https > 10.0.0.222.60478: Flags [P.], seq 2697:2961, ack 199, win 75, options [nop,nop,TS val 17377689 ecr 689859], length 264
18:10:48.118599 IP 10.0.0.222.60478 > ec2-54-68-19-239.us-west-2.compute.amazonaws.com.https: Flags [.], ack 1349, win 262, options [nop,nop,TS val 689885 ecr 17377689], length 0
18:10:48.118840 IP 10.0.0.222.60478 > ec2-54-68-19-239.us-west-2.compute.amazonaws.com.https: Flags [.], ack 2697, win 272, options [nop,nop,TS val 689885 ecr 17377689], length 0
18:10:48.119126 IP 10.0.0.222.60478 > ec2-54-68-19-239.us-west-2.compute.amazonaws.com.https: Flags [.], ack 2961, win 283, options [nop,nop,TS val 689885 ecr 17377689], length 0
18:10:48.247729 IP 10.0.0.222.60478 > ec2-54-68-19-239.us-west-2.compute.amazonaws.com.https: Flags [P.], seq 199:325, ack 2961, win 283, options [nop,nop,TS val 689898 ecr 17377689], length 126
18:10:48.504531 IP ec2-54-68-19-239.us-west-2.compute.amazonaws.com.https > 10.0.0.222.60478: Flags [P.], seq 2961:3219, ack 325, win 75, options [nop,nop,TS val 17377786 ecr 689898], length 258
18:10:48.507486 IP 10.0.0.222.60478 > ec2-54-68-19-239.us-west-2.compute.amazonaws.com.https: Flags [.], ack 3219, win 294, options [nop,nop,TS val 689923 ecr 17377786], length 0
18:10:48.508980 IP 10.0.0.222.60478 > ec2-54-68-19-239.us-west-2.compute.amazonaws.com.https: Flags [P.], seq 325:669, ack 3219, win 294, options [nop,nop,TS val 689924 ecr 17377786], length 344
18:10:48.767464 IP ec2-54-68-19-239.us-west-2.compute.amazonaws.com.https > 10.0.0.222.60478: Flags [P.], seq 3219:4194, ack 669, win 79, options [nop,nop,TS val 17377852 ecr 689924], length 975
18:10:48.847431 IP 10.0.0.222.60478 > ec2-54-68-19-239.us-west-2.compute.amazonaws.com.https: Flags [.], ack 4194, win 304, options [nop,nop,TS val 689958 ecr 17377852], length 0
18:10:48.957460 IP6 fe80::c2ee:fbff:fe3b:3593 > ip6-allrouters: ICMP6, router solicitation, length 16
18:10:48.957530 IP6 fe80::c2ee:fbff:fe3b:3593 > ip6-allrouters: ICMP6, router solicitation, length 16
18:10:49.408155 ARP, Request who-has 10.0.0.222 tell 10.0.0.1, length 28
18:10:49.537760 ARP, Reply 10.0.0.222 is-at c0:ee:fb:3b:35:93 (oui Unknown), length 28
18:10:52.015122 IP 10.0.0.222.46368 > 10.0.0.1.domain: 58694+ AAAA? 127.0.0.1. (27)
18:10:52.080031 IP 10.0.0.1.domain > 10.0.0.222.46368: 58694 NXDomain 0/1/0 (102)
18:10:52.482136 IP 10.0.0.222.51348 > 10.0.0.1.domain: 58440+ AAAA? 127.0.0.0. (27)
18:10:52.539161 IP 10.0.0.1.domain > 10.0.0.222.51348: 58440 NXDomain 0/1/0 (102)
18:10:54.535845 IP 10.0.0.222.47886 > 10.0.0.1.domain: 41006+ AAAA? 224.0.0.0. (27)
18:10:54.606144 IP 10.0.0.1.domain > 10.0.0.222.47886: 41006 NXDomain 0/1/0 (102)
18:10:56.882912 IP 10.0.0.222.38805 > 10.0.0.1.domain: 51448+ A? github.com. (28)
18:10:56.883155 IP 10.0.0.222.39264 > 10.0.0.1.domain: 33355+ A? files.brucon.org. (34)
18:10:56.885386 IP 10.0.0.222.58648 > 10.0.0.1.domain: 53767+ A? mail.google.com. (33)
18:10:56.885675 IP 10.0.0.222.47813 > 10.0.0.1.domain: 62488+ A? google.co.in. (30)
18:10:56.938779 IP 10.0.0.1.domain > 10.0.0.222.38805: 51448 2/0/0 A 192.30.253.113, A 192.30.253.112 (60)
18:10:56.942987 IP 10.0.0.1.domain > 10.0.0.222.47813: 62488 1/0/0 A 216.58.199.131 (46)
18:10:56.943241 IP 10.0.0.222.51495 > 192.30.253.113.https: Flags [S], seq 1098646199, win 64240, options [mss 1460,sackOK,TS val 690767 ecr 0,nop,wscale 8], length 0
18:10:56.944770 IP 10.0.0.222.53303 > bom07s01-in-f3.1e100.net.http: Flags [S], seq 448154081, win 64240, options [mss 1460,sackOK,TS val 690767 ecr 0,nop,wscale 8], length 0
18:10:56.945949 IP 10.0.0.1.domain > 10.0.0.222.39264: 33355 1/0/0 A 195.154.243.219 (50)
18:10:56.947512 IP bom07s01-in-f3.1e100.net.http > 10.0.0.222.53303: Flags [S.], seq 2055851350, ack 448154082, win 42540, options [mss 1430,sackOK,TS val 2523511021 ecr 690767,nop,wscale 7], length 0
18:10:56.948652 IP 10.0.0.222.53303 > bom07s01-in-f3.1e100.net.http: Flags [.], ack 1, win 251, options [nop,nop,TS val 690768 ecr 2523511021], length 0
18:10:56.948804 IP 10.0.0.222.55554 > lisa.rootshell.be.http: Flags [S], seq 1194491603, win 64240, options [mss 1460,sackOK,TS val 690768 ecr 0,nop,wscale 8], length 0
18:10:56.953425 IP 10.0.0.1.domain > 10.0.0.222.58648: 53767 2/0/0 CNAME googlemail.l.google.com., A 216.58.220.5 (76)
18:10:56.956248 IP 10.0.0.222.54243 > bom05s05-in-f5.1e100.net.https: Flags [S], seq 2720268457, win 64240, options [mss 1460,sackOK,TS val 690768 ecr 0,nop,wscale 8], length 0
18:10:56.959049 IP bom05s05-in-f5.1e100.net.https > 10.0.0.222.54243: Flags [S.], seq 418029324, ack 2720268458, win 42540, options [mss 1430,sackOK,TS val 2525864583 ecr 690768,nop,wscale 7], length 0
18:10:56.959992 IP 10.0.0.222.54243 > bom05s05-in-f5.1e100.net.https: Flags [.], ack 1, win 251, options [nop,nop,TS val 690769 ecr 2525864583], length 0
18:10:56.960756 IP 10.0.0.222.53303 > bom07s01-in-f3.1e100.net.http: Flags [P.], seq 1:702, ack 1, win 251, options [nop,nop,TS val 690769 ecr 2523511021], length 701
18:10:56.961663 IP 10.0.0.222.54243 > bom05s05-in-f5.1e100.net.https: Flags [P.], seq 1:204, ack 1, win 251, options [nop,nop,TS val 690769 ecr 2525864583], length 203
18:10:56.963931 IP bom07s01-in-f3.1e100.net.http > 10.0.0.222.53303: Flags [.], ack 702, win 344, options [nop,nop,TS val 2523511038 ecr 690769], length 0
18:10:56.964030 IP bom05s05-in-f5.1e100.net.https > 10.0.0.222.54243: Flags [.], ack 204, win 341, options [nop,nop,TS val 2525864588 ecr 690769], length 0
18:10:56.964941 IP bom05s05-in-f5.1e100.net.https > 10.0.0.222.54243: Flags [.], seq 1:1349, ack 204, win 341, options [nop,nop,TS val 2525864588 ecr 690769], length 1348
18:10:56.965144 IP bom05s05-in-f5.1e100.net.https > 10.0.0.222.54243: Flags [.], seq 1349:2697, ack 204, win 341, options [nop,nop,TS val 2525864588 ecr 690769], length 1348
18:10:56.965208 IP bom05s05-in-f5.1e100.net.https > 10.0.0.222.54243: Flags [P.], seq 2697:3159, ack 204, win 341, options [nop,nop,TS val 2525864588 ecr 690769], length 462
18:10:56.966213 IP 10.0.0.222.54243 > bom05s05-in-f5.1e100.net.https: Flags [.], ack 1349, win 262, options [nop,nop,TS val 690769 ecr 2525864588], length 0
18:10:56.966712 IP 10.0.0.222.54243 > bom05s05-in-f5.1e100.net.https: Flags [.], ack 2697, win 272, options [nop,nop,TS val 690769 ecr 2525864588], length 0
18:10:56.967121 IP 10.0.0.222.54243 > bom05s05-in-f5.1e100.net.https: Flags [.], ack 3159, win 283, options [nop,nop,TS val 690769 ecr 2525864588], length 0
18:10:56.975532 IP 10.0.0.222.48526 > 10.0.0.1.4886: UDP, length 0
18:10:56.975666 IP 10.0.0.1 > 10.0.0.222: ICMP 10.0.0.1 udp port 4886 unreachable, length 36
18:10:56.992159 IP 10.0.0.222.48526 > 10.0.0.1.4886: UDP, length 0
18:10:56.992252 IP 10.0.0.1 > 10.0.0.222: ICMP 10.0.0.1 udp port 4886 unreachable, length 36
18:10:57.009708 IP 10.0.0.222.48526 > 10.0.0.1.4886: UDP, length 0
18:10:57.009803 IP 10.0.0.1 > 10.0.0.222: ICMP 10.0.0.1 udp port 4886 unreachable, length 36
18:10:57.022383 IP 10.0.0.222.54243 > bom05s05-in-f5.1e100.net.https: Flags [P.], seq 204:330, ack 3159, win 283, options [nop,nop,TS val 690775 ecr 2525864588], length 126
18:10:57.022682 IP 10.0.0.222.54243 > bom05s05-in-f5.1e100.net.https: Flags [P.], seq 330:487, ack 3159, win 283, options [nop,nop,TS val 690775 ecr 2525864588], length 157
18:10:57.025033 IP 10.0.0.222.48526 > 10.0.0.1.4886: UDP, length 0
18:10:57.025093 IP 10.0.0.1 > 10.0.0.222: ICMP 10.0.0.1 udp port 4886 unreachable, length 36
18:10:57.025625 IP bom05s05-in-f5.1e100.net.https > 10.0.0.222.54243: Flags [P.], seq 3159:3421, ack 487, win 350, options [nop,nop,TS val 2525864649 ecr 690775], length 262
18:10:57.025710 IP bom05s05-in-f5.1e100.net.https > 10.0.0.222.54243: Flags [P.], seq 3421:3477, ack 487, win 350, options [nop,nop,TS val 2525864649 ecr 690775], length 56
18:10:57.025782 IP bom05s05-in-f5.1e100.net.https > 10.0.0.222.54243: Flags [P.], seq 3477:3519, ack 487, win 350, options [nop,nop,TS val 2525864649 ecr 690775], length 42
18:10:57.026299 IP bom05s05-in-f5.1e100.net.https > 10.0.0.222.54243: Flags [P.], seq 3519:3557, ack 487, win 350, options [nop,nop,TS val 2525864650 ecr 690775], length 38
18:10:57.026884 IP 10.0.0.222.54243 > bom05s05-in-f5.1e100.net.https: Flags [.], ack 3421, win 294, options [nop,nop,TS val 690775 ecr 2525864649], length 0
18:10:57.027370 IP 10.0.0.222.54243 > bom05s05-in-f5.1e100.net.https: Flags [.], ack 3477, win 294, options [nop,nop,TS val 690775 ecr 2525864649], length 0
18:10:57.027416 IP 10.0.0.222.54243 > bom05s05-in-f5.1e100.net.https: Flags [.], ack 3519, win 294, options [nop,nop,TS val 690776 ecr 2525864649], length 0
18:10:57.027639 IP 10.0.0.222.54243 > bom05s05-in-f5.1e100.net.https: Flags [P.], seq 487:525, ack 3519, win 294, options [nop,nop,TS val 690776 ecr 2525864649], length 38
18:10:57.041892 IP 10.0.0.222.48526 > 10.0.0.1.4886: UDP, length 0
18:10:57.041952 IP 10.0.0.1 > 10.0.0.222: ICMP 10.0.0.1 udp port 4886 unreachable, length 36
18:10:57.044148 IP bom07s01-in-f3.1e100.net.http > 10.0.0.222.53303: Flags [P.], seq 1:545, ack 702, win 344, options [nop,nop,TS val 2523511117 ecr 690769], length 544
18:10:57.045585 IP 10.0.0.222.53303 > bom07s01-in-f3.1e100.net.http: Flags [.], ack 545, win 256, options [nop,nop,TS val 690777 ecr 2523511117], length 0
18:10:57.057584 IP 10.0.0.222.48526 > 10.0.0.1.4886: UDP, length 0
18:10:57.057657 IP 10.0.0.1 > 10.0.0.222: ICMP 10.0.0.1 udp port 4886 unreachable, length 36
18:10:57.067882 IP 10.0.0.222.54243 > bom05s05-in-f5.1e100.net.https: Flags [.], ack 3557, win 294, options [nop,nop,TS val 690780 ecr 2525864650], length 0
18:10:57.069545 IP bom05s05-in-f5.1e100.net.https > 10.0.0.222.54243: Flags [.], ack 525, win 350, options [nop,nop,TS val 2525864694 ecr 690776], length 0
18:10:57.070328 IP lisa.rootshell.be.http > 10.0.0.222.55554: Flags [S.], seq 869284833, ack 1194491604, win 14480, options [mss 1440,sackOK,TS val 3541241455 ecr 690768,nop,wscale 7], length 0
18:10:57.071463 IP 10.0.0.222.55554 > lisa.rootshell.be.http: Flags [.], ack 1, win 251, options [nop,nop,TS val 690780 ecr 3541241455], length 0
18:10:57.073833 IP 10.0.0.222.48526 > 10.0.0.1.4886: UDP, length 0
18:10:57.090175 IP 10.0.0.222.48526 > 10.0.0.1.4886: UDP, length 0
18:10:57.108350 IP 10.0.0.222.48526 > 10.0.0.1.4886: UDP, length 0
18:10:57.122919 IP 10.0.0.222.48526 > 10.0.0.1.4886: UDP, length 0
18:10:57.139171 IP 10.0.0.222.48526 > 10.0.0.1.4886: UDP, length 0
18:10:57.155431 IP 10.0.0.222.48526 > 10.0.0.1.4886: UDP, length 0
18:10:57.171698 IP 10.0.0.222.48526 > 10.0.0.1.4886: UDP, length 0
18:10:57.188091 IP 10.0.0.222.48526 > 10.0.0.1.4886: UDP, length 0
18:10:57.204342 IP 10.0.0.222.48526 > 10.0.0.1.4886: UDP, length 0
18:10:57.208349 IP 192.30.253.113.https > 10.0.0.222.51495: Flags [S.], seq 3940602871, ack 1098646200, win 28480, options [mss 1436,sackOK,TS val 3215592593 ecr 690767,nop,wscale 10], length 0
18:10:57.212153 IP 10.0.0.222.51495 > 192.30.253.113.https: Flags [.], ack 1, win 251, options [nop,nop,TS val 690794 ecr 3215592593], length 0
18:10:57.213344 IP 10.0.0.222.51495 > 192.30.253.113.https: Flags [P.], seq 1:199, ack 1, win 251, options [nop,nop,TS val 690794 ecr 3215592593], length 198
18:10:57.220694 IP 10.0.0.222.48526 > 10.0.0.1.4886: UDP, length 0
18:10:57.237230 IP 10.0.0.222.48526 > 10.0.0.1.4886: UDP, length 0
18:10:57.253248 IP 10.0.0.222.48526 > 10.0.0.1.4886: UDP, length 0
18:10:57.269527 IP 10.0.0.222.48526 > 10.0.0.1.4886: UDP, length 0
18:10:57.285979 IP 10.0.0.222.48526 > 10.0.0.1.4886: UDP, length 0
18:10:57.294851 IP 10.0.0.222.40981 > 10.0.0.1.domain: 56879+ AAAA? 10.0.0.222. (28)
18:10:57.302581 IP 10.0.0.222.48526 > 10.0.0.1.4886: UDP, length 0
18:10:57.318983 IP 10.0.0.222.48526 > 10.0.0.1.4886: UDP, length 0
18:10:57.335285 IP 10.0.0.222.48526 > 10.0.0.1.4886: UDP, length 0
18:10:57.351829 IP 10.0.0.222.48526 > 10.0.0.1.4886: UDP, length 0
18:10:57.355501 IP 10.0.0.1.domain > 10.0.0.222.40981: 56879 NXDomain 0/1/0 (103)
18:10:57.480333 IP 192.30.253.113.https > 10.0.0.222.51495: Flags [.], seq 1:1349, ack 199, win 29, options [nop,nop,TS val 3215592661 ecr 690794], length 1348
18:10:57.480518 IP 192.30.253.113.https > 10.0.0.222.51495: Flags [.], seq 1349:2697, ack 199, win 29, options [nop,nop,TS val 3215592661 ecr 690794], length 1348
18:10:57.480596 IP 192.30.253.113.https > 10.0.0.222.51495: Flags [P.], seq 2697:3606, ack 199, win 29, options [nop,nop,TS val 3215592661 ecr 690794], length 909
18:10:57.482099 IP 10.0.0.222.51495 > 192.30.253.113.https: Flags [.], ack 1349, win 262, options [nop,nop,TS val 690821 ecr 3215592661], length 0
18:10:57.482346 IP 10.0.0.222.51495 > 192.30.253.113.https: Flags [.], ack 2697, win 272, options [nop,nop,TS val 690821 ecr 3215592661], length 0
18:10:57.482525 IP 10.0.0.222.51495 > 192.30.253.113.https: Flags [.], ack 3606, win 283, options [nop,nop,TS val 690821 ecr 3215592661], length 0
18:10:57.500386 IP 10.0.0.222.51495 > 192.30.253.113.https: Flags [P.], seq 199:325, ack 3606, win 283, options [nop,nop,TS val 690823 ecr 3215592661], length 126
18:10:57.728103 IP 10.0.0.222 > igmp.mcast.net: igmp v3 report, 1 group record(s)
18:10:57.728162 IP 10.0.0.222 > igmp.mcast.net: igmp v3 report, 1 group record(s)
18:10:57.765482 IP 192.30.253.113.https > 10.0.0.222.51495: Flags [P.], seq 3606:3657, ack 325, win 29, options [nop,nop,TS val 3215592732 ecr 690823], length 51
18:10:57.797425 IP 10.0.0.222.51495 > 192.30.253.113.https: Flags [.], ack 3657, win 283, options [nop,nop,TS val 690853 ecr 3215592732], length 0
18:10:58.165310 IP 10.0.0.222.50081 > 10.0.0.1.domain: 63921+ A? ocsp.digicert.com. (35)
18:10:58.168803 IP 10.0.0.1.domain > 10.0.0.222.50081: 63921 2/0/0 CNAME cs9.wac.phicdn.net., A 117.18.237.29 (83)
18:10:58.170830 IP 10.0.0.222.58930 > 117.18.237.29.http: Flags [S], seq 3900032221, win 64240, options [mss 1460,sackOK,TS val 690890 ecr 0,nop,wscale 8], length 0
18:10:58.174260 IP 117.18.237.29.http > 10.0.0.222.58930: Flags [S.], seq 702860518, ack 3900032222, win 65535, options [mss 1440,sackOK,TS val 3157888260 ecr 690890,nop,wscale 9], length 0
18:10:58.175297 IP 10.0.0.222.58930 > 117.18.237.29.http: Flags [.], ack 1, win 251, options [nop,nop,TS val 690890 ecr 3157888260], length 0
18:10:58.175666 IP 10.0.0.222.58930 > 117.18.237.29.http: Flags [P.], seq 1:452, ack 1, win 251, options [nop,nop,TS val 690890 ecr 3157888260], length 451
18:10:58.177164 IP 10.0.0.222.37116 > 10.0.0.1.domain: 36011+ A? www.google.co.in. (34)
18:10:58.179454 IP 117.18.237.29.http > 10.0.0.222.58930: Flags [.], ack 452, win 285, options [nop,nop,TS val 3157888261 ecr 690890], length 0
18:10:58.180198 IP 117.18.237.29.http > 10.0.0.222.58930: Flags [P.], seq 1:789, ack 452, win 285, options [nop,nop,TS val 3157888261 ecr 690890], length 788
18:10:58.186540 IP 10.0.0.222.58930 > 117.18.237.29.http: Flags [.], ack 789, win 258, options [nop,nop,TS val 690891 ecr 3157888261], length 0
18:10:58.194171 IP 10.0.0.222.48526 > 10.0.0.1.4886: UDP, length 0
18:10:58.194274 IP 10.0.0.1 > 10.0.0.222: ICMP 10.0.0.1 udp port 4886 unreachable, length 36
18:10:58.211180 IP 10.0.0.222.48526 > 10.0.0.1.4886: UDP, length 0
18:10:58.228311 IP 10.0.0.222.48526 > 10.0.0.1.4886: UDP, length 0
18:10:58.232839 IP 10.0.0.1.domain > 10.0.0.222.37116: 36011 1/0/0 A 216.58.199.163 (50)
18:10:58.235732 IP 10.0.0.222.46133 > bom05s08-in-f3.1e100.net.http: Flags [S], seq 2645328852, win 64240, options [mss 1460,sackOK,TS val 690896 ecr 0,nop,wscale 8], length 0
18:10:58.236215 IP 10.0.0.222.46134 > bom05s08-in-f3.1e100.net.http: Flags [S], seq 2173022774, win 64240, options [mss 1460,sackOK,TS val 690896 ecr 0,nop,wscale 8], length 0
18:10:58.244799 IP 10.0.0.222.48526 > 10.0.0.1.4886: UDP, length 0
18:10:58.259235 IP bom05s08-in-f3.1e100.net.http > 10.0.0.222.46133: Flags [S.], seq 3550325427, ack 2645328853, win 42540, options [mss 1430,sackOK,TS val 692753832 ecr 690896,nop,wscale 7], length 0
18:10:58.260440 IP 10.0.0.222.46133 > bom05s08-in-f3.1e100.net.http: Flags [.], ack 1, win 251, options [nop,nop,TS val 690899 ecr 692753832], length 0
18:10:58.261034 IP 10.0.0.222.46133 > bom05s08-in-f3.1e100.net.http: Flags [P.], seq 1:706, ack 1, win 251, options [nop,nop,TS val 690899 ecr 692753832], length 705
18:10:58.261237 IP 10.0.0.222.48526 > 10.0.0.1.4886: UDP, length 0
18:10:58.267305 IP bom05s08-in-f3.1e100.net.http > 10.0.0.222.46134: Flags [S.], seq 1017722920, ack 2173022775, win 42540, options [mss 1430,sackOK,TS val 1862072865 ecr 690896,nop,wscale 7], length 0
18:10:58.268287 IP 10.0.0.222.46134 > bom05s08-in-f3.1e100.net.http: Flags [.], ack 1, win 251, options [nop,nop,TS val 690900 ecr 1862072865], length 0
18:10:58.269367 IP lisa.rootshell.be.http > 10.0.0.222.55554: Flags [S.], seq 869284833, ack 1194491604, win 14480, options [mss 1440,sackOK,TS val 3541241755 ecr 690780,nop,wscale 7], length 0
18:10:58.270172 IP 10.0.0.222.55554 > lisa.rootshell.be.http: Flags [.], ack 1, win 251, options [nop,nop,TS val 690900 ecr 3541241455], length 0
18:10:58.277599 IP 10.0.0.222.48526 > 10.0.0.1.4886: UDP, length 0
18:10:58.284731 IP bom05s08-in-f3.1e100.net.http > 10.0.0.222.46133: Flags [.], ack 706, win 344, options [nop,nop,TS val 692753857 ecr 690899], length 0
18:10:58.293903 IP 10.0.0.222.48526 > 10.0.0.1.4886: UDP, length 0
18:10:58.310234 IP 10.0.0.222.48526 > 10.0.0.1.4886: UDP, length 0
18:10:58.326659 IP 10.0.0.222.48526 > 10.0.0.1.4886: UDP, length 0
18:10:58.342811 IP 10.0.0.222.48526 > 10.0.0.1.4886: UDP, length 0
18:10:58.359233 IP 10.0.0.222.48526 > 10.0.0.1.4886: UDP, length 0
18:10:58.367409 IP 10.0.0.222 > igmp.mcast.net: igmp v3 report, 1 group record(s)
18:10:58.367448 IP 10.0.0.222 > igmp.mcast.net: igmp v3 report, 1 group record(s)
18:10:58.373488 IP bom05s08-in-f3.1e100.net.http > 10.0.0.222.46133: Flags [.], seq 1:1349, ack 706, win 344, options [nop,nop,TS val 692753946 ecr 690899], length 1348
18:10:58.373669 IP bom05s08-in-f3.1e100.net.http > 10.0.0.222.46133: Flags [.], seq 1349:2697, ack 706, win 344, options [nop,nop,TS val 692753946 ecr 690899], length 1348
18:10:58.373737 IP bom05s08-in-f3.1e100.net.http > 10.0.0.222.46133: Flags [.], seq 2697:4045, ack 706, win 344, options [nop,nop,TS val 692753946 ecr 690899], length 1348
18:10:58.373968 IP bom05s08-in-f3.1e100.net.http > 10.0.0.222.46133: Flags [.], seq 4045:5393, ack 706, win 344, options [nop,nop,TS val 692753946 ecr 690899], length 1348
18:10:58.374002 IP bom05s08-in-f3.1e100.net.http > 10.0.0.222.46133: Flags [P.], seq 5393:5437, ack 706, win 344, options [nop,nop,TS val 692753946 ecr 690899], length 44
18:10:58.374059 IP bom05s08-in-f3.1e100.net.http > 10.0.0.222.46133: Flags [P.], seq 5437:5457, ack 706, win 344, options [nop,nop,TS val 692753946 ecr 690899], length 20
18:10:58.375488 IP 10.0.0.222.46133 > bom05s08-in-f3.1e100.net.http: Flags [.], ack 1349, win 262, options [nop,nop,TS val 690910 ecr 692753946], length 0
18:10:58.375705 IP 10.0.0.222.48526 > 10.0.0.1.4886: UDP, length 0
18:10:58.375925 IP 10.0.0.222.46133 > bom05s08-in-f3.1e100.net.http: Flags [.], ack 2697, win 272, options [nop,nop,TS val 690910 ecr 692753946], length 0
18:10:58.376188 IP 10.0.0.222.46133 > bom05s08-in-f3.1e100.net.http: Flags [.], ack 4045, win 283, options [nop,nop,TS val 690910 ecr 692753946], length 0
18:10:58.377044 IP 10.0.0.222.46133 > bom05s08-in-f3.1e100.net.http: Flags [.], ack 5393, win 294, options [nop,nop,TS val 690910 ecr 692753946], length 0
18:10:58.377462 IP 10.0.0.222.46133 > bom05s08-in-f3.1e100.net.http: Flags [.], ack 5437, win 294, options [nop,nop,TS val 690911 ecr 692753946], length 0
18:10:58.377690 IP 10.0.0.222.46133 > bom05s08-in-f3.1e100.net.http: Flags [.], ack 5457, win 294, options [nop,nop,TS val 690911 ecr 692753946], length 0
18:10:58.391318 IP 10.0.0.222.48526 > 10.0.0.1.4886: UDP, length 0
18:10:58.407738 IP 10.0.0.222.48526 > 10.0.0.1.4886: UDP, length 0
18:10:58.424218 IP 10.0.0.222.48526 > 10.0.0.1.4886: UDP, length 0
18:10:58.440455 IP 10.0.0.222.48526 > 10.0.0.1.4886: UDP, length 0
18:10:58.456752 IP 10.0.0.222.48526 > 10.0.0.1.4886: UDP, length 0
18:10:58.473138 IP 10.0.0.222.48526 > 10.0.0.1.4886: UDP, length 0
18:10:58.489339 IP 10.0.0.222.48526 > 10.0.0.1.4886: UDP, length 0
18:10:58.505368 IP 10.0.0.222.48526 > 10.0.0.1.4886: UDP, length 0
18:10:58.505967 IP 10.0.0.222.54243 > bom05s05-in-f5.1e100.net.https: Flags [P.], seq 525:571, ack 3557, win 294, options [nop,nop,TS val 690923 ecr 2525864694], length 46
18:10:58.508672 IP bom05s05-in-f5.1e100.net.https > 10.0.0.222.54243: Flags [.], ack 571, win 350, options [nop,nop,TS val 2525866132 ecr 690923], length 0
18:10:58.508772 IP bom05s05-in-f5.1e100.net.https > 10.0.0.222.54243: Flags [P.], seq 3557:3603, ack 571, win 350, options [nop,nop,TS val 2525866132 ecr 690923], length 46
18:10:58.509149 IP 10.0.0.222.46133 > bom05s08-in-f3.1e100.net.http: Flags [P.], seq 706:1431, ack 5457, win 294, options [nop,nop,TS val 690924 ecr 692753946], length 725
18:10:58.510583 IP 10.0.0.222.54243 > bom05s05-in-f5.1e100.net.https: Flags [.], ack 3603, win 294, options [nop,nop,TS val 690924 ecr 2525866132], length 0
18:10:58.523622 IP 10.0.0.222.48526 > 10.0.0.1.4886: UDP, length 0
18:10:58.532376 IP bom05s08-in-f3.1e100.net.http > 10.0.0.222.46133: Flags [.], ack 1431, win 355, options [nop,nop,TS val 692754105 ecr 690924], length 0
18:10:58.538597 IP 10.0.0.222.48526 > 10.0.0.1.4886: UDP, length 0
18:10:58.555697 IP 10.0.0.222.48526 > 10.0.0.1.4886: UDP, length 0
18:10:58.555894 IP 10.0.0.222.42681 > 10.0.0.1.domain: 58183+ A? ssl.gstatic.com. (33)
18:10:58.571255 IP 10.0.0.222.48526 > 10.0.0.1.4886: UDP, length 0
18:10:58.587626 IP 10.0.0.222.48526 > 10.0.0.1.4886: UDP, length 0
18:10:58.602506 IP bom05s08-in-f3.1e100.net.http > 10.0.0.222.46133: Flags [.], seq 5457:6805, ack 1431, win 355, options [nop,nop,TS val 692754175 ecr 690924], length 1348
18:10:58.602703 IP bom05s08-in-f3.1e100.net.http > 10.0.0.222.46133: Flags [.], seq 6805:8153, ack 1431, win 355, options [nop,nop,TS val 692754175 ecr 690924], length 1348
18:10:58.602854 IP bom05s08-in-f3.1e100.net.http > 10.0.0.222.46133: Flags [.], seq 8153:9501, ack 1431, win 355, options [nop,nop,TS val 692754175 ecr 690924], length 1348
18:10:58.602890 IP bom05s08-in-f3.1e100.net.http > 10.0.0.222.46133: Flags [P.], seq 9501:9972, ack 1431, win 355, options [nop,nop,TS val 692754175 ecr 690924], length 471
18:10:58.604909 IP 10.0.0.222.46133 > bom05s08-in-f3.1e100.net.http: Flags [.], ack 6805, win 304, options [nop,nop,TS val 690933 ecr 692754175], length 0
18:10:58.604980 IP 10.0.0.222.48526 > 10.0.0.1.4886: UDP, length 0
18:10:58.605032 IP 10.0.0.222.46133 > bom05s08-in-f3.1e100.net.http: Flags [.], ack 8153, win 315, options [nop,nop,TS val 690933 ecr 692754175], length 0
18:10:58.606016 IP 10.0.0.222.46133 > bom05s08-in-f3.1e100.net.http: Flags [.], ack 9501, win 325, options [nop,nop,TS val 690933 ecr 692754175], length 0
18:10:58.606277 IP 10.0.0.222.46133 > bom05s08-in-f3.1e100.net.http: Flags [.], ack 9972, win 336, options [nop,nop,TS val 690933 ecr 692754175], length 0
18:10:58.611690 IP 10.0.0.1.domain > 10.0.0.222.42681: 58183 1/0/0 A 216.58.199.163 (49)
18:10:58.613467 IP 10.0.0.222.46135 > bom05s08-in-f3.1e100.net.http: Flags [S], seq 886385378, win 64240, options [mss 1460,sackOK,TS val 690934 ecr 0,nop,wscale 8], length 0
18:10:58.620844 IP 10.0.0.222.48526 > 10.0.0.1.4886: UDP, length 0
18:10:58.633375 IP bom05s08-in-f3.1e100.net.http > 10.0.0.222.46135: Flags [S.], seq 4204728970, ack 886385379, win 42540, options [mss 1430,sackOK,TS val 2034140627 ecr 690934,nop,wscale 7], length 0
18:10:58.634594 IP 10.0.0.222.46135 > bom05s08-in-f3.1e100.net.http: Flags [.], ack 1, win 251, options [nop,nop,TS val 690936 ecr 2034140627], length 0
18:10:58.637232 IP 10.0.0.222.48526 > 10.0.0.1.4886: UDP, length 0
18:10:58.853309 IP 10.0.0.222.46135 > bom05s08-in-f3.1e100.net.http: Flags [P.], seq 1:306, ack 1, win 251, options [nop,nop,TS val 690958 ecr 2034140627], length 305
18:10:58.854769 IP 10.0.0.222.46133 > bom05s08-in-f3.1e100.net.http: Flags [P.], seq 1431:2103, ack 9972, win 336, options [nop,nop,TS val 690958 ecr 692754175], length 672
18:10:58.860627 IP 10.0.0.222.46134 > bom05s08-in-f3.1e100.net.http: Flags [P.], seq 1:763, ack 1, win 251, options [nop,nop,TS val 690959 ecr 1862072865], length 762
18:10:58.873390 IP bom05s08-in-f3.1e100.net.http > 10.0.0.222.46135: Flags [.], ack 306, win 341, options [nop,nop,TS val 2034140868 ecr 690958], length 0
18:10:58.873915 IP bom05s08-in-f3.1e100.net.http > 10.0.0.222.46135: Flags [.], seq 1:1349, ack 306, win 341, options [nop,nop,TS val 2034140868 ecr 690958], length 1348
18:10:58.874041 IP bom05s08-in-f3.1e100.net.http > 10.0.0.222.46135: Flags [.], seq 1349:2697, ack 306, win 341, options [nop,nop,TS val 2034140868 ecr 690958], length 1348
18:10:58.874155 IP bom05s08-in-f3.1e100.net.http > 10.0.0.222.46135: Flags [.], seq 2697:4045, ack 306, win 341, options [nop,nop,TS val 2034140868 ecr 690958], length 1348
18:10:58.874295 IP bom05s08-in-f3.1e100.net.http > 10.0.0.222.46135: Flags [.], seq 4045:5393, ack 306, win 341, options [nop,nop,TS val 2034140868 ecr 690958], length 1348
18:10:58.874558 IP bom05s08-in-f3.1e100.net.http > 10.0.0.222.46135: Flags [.], seq 5393:6741, ack 306, win 341, options [nop,nop,TS val 2034140868 ecr 690958], length 1348
18:10:58.874629 IP bom05s08-in-f3.1e100.net.http > 10.0.0.222.46135: Flags [.], seq 6741:8089, ack 306, win 341, options [nop,nop,TS val 2034140868 ecr 690958], length 1348
18:10:58.874860 IP bom05s08-in-f3.1e100.net.http > 10.0.0.222.46135: Flags [.], seq 8089:9437, ack 306, win 341, options [nop,nop,TS val 2034140868 ecr 690958], length 1348
18:10:58.874940 IP bom05s08-in-f3.1e100.net.http > 10.0.0.222.46135: Flags [.], seq 9437:10785, ack 306, win 341, options [nop,nop,TS val 2034140868 ecr 690958], length 1348
18:10:58.875050 IP bom05s08-in-f3.1e100.net.http > 10.0.0.222.46135: Flags [.], seq 10785:12133, ack 306, win 341, options [nop,nop,TS val 2034140868 ecr 690958], length 1348
18:10:58.875126 IP bom05s08-in-f3.1e100.net.http > 10.0.0.222.46135: Flags [.], seq 12133:13481, ack 306, win 341, options [nop,nop,TS val 2034140868 ecr 690958], length 1348
18:10:58.875846 IP 10.0.0.222.46135 > bom05s08-in-f3.1e100.net.http: Flags [.], ack 1349, win 262, options [nop,nop,TS val 690960 ecr 2034140868], length 0
18:10:58.876031 IP 10.0.0.222.46135 > bom05s08-in-f3.1e100.net.http: Flags [.], ack 2697, win 272, options [nop,nop,TS val 690960 ecr 2034140868], length 0
18:10:58.876307 IP 10.0.0.222.46135 > bom05s08-in-f3.1e100.net.http: Flags [.], ack 4045, win 283, options [nop,nop,TS val 690960 ecr 2034140868], length 0
18:10:58.877561 IP 10.0.0.222.46135 > bom05s08-in-f3.1e100.net.http: Flags [.], ack 5393, win 294, options [nop,nop,TS val 690961 ecr 2034140868], length 0
18:10:58.877907 IP 10.0.0.222.46135 > bom05s08-in-f3.1e100.net.http: Flags [.], ack 6741, win 304, options [nop,nop,TS val 690961 ecr 2034140868], length 0
18:10:58.878089 IP bom05s08-in-f3.1e100.net.http > 10.0.0.222.46133: Flags [.], ack 2103, win 367, options [nop,nop,TS val 692754451 ecr 690958], length 0
18:10:58.879041 IP 10.0.0.222.46135 > bom05s08-in-f3.1e100.net.http: Flags [.], ack 8089, win 315, options [nop,nop,TS val 690961 ecr 2034140868], length 0
18:10:58.879674 IP 10.0.0.222.46135 > bom05s08-in-f3.1e100.net.http: Flags [.], ack 9437, win 325, options [nop,nop,TS val 690961 ecr 2034140868], length 0
18:10:58.880058 IP 10.0.0.222.46135 > bom05s08-in-f3.1e100.net.http: Flags [.], ack 10785, win 336, options [nop,nop,TS val 690961 ecr 2034140868], length 0
