15:56:52.377825 c0:ee:fb:3b:35:93 (oui Unknown) > Broadcast Null Unnumbered, xid, Flags [Response], length 6: 01 00
15:56:52.583599 IP6 :: > ff02::1:ff3b:3593: ICMP6, neighbor solicitation, who has fe80::c2ee:fbff:fe3b:3593, length 24
15:56:52.583670 IP6 :: > ff02::1:ff3b:3593: ICMP6, neighbor solicitation, who has fe80::c2ee:fbff:fe3b:3593, length 24
15:56:52.592502 IP6 :: > ff02::16: HBH ICMP6, multicast listener report v2, 1 group record(s), length 28
15:56:52.592543 IP6 :: > ff02::16: HBH ICMP6, multicast listener report v2, 1 group record(s), length 28
15:56:52.711827 IP 0.0.0.0.bootpc > 255.255.255.255.bootps: BOOTP/DHCP, Request from c0:ee:fb:3b:35:93 (oui Unknown), length 298
15:56:52.711941 IP 0.0.0.0.bootpc > 255.255.255.255.bootps: BOOTP/DHCP, Request from c0:ee:fb:3b:35:93 (oui Unknown), length 298
15:56:52.712866 IP 10.0.0.1.bootps > 10.0.0.222.bootpc: BOOTP/DHCP, Reply, length 300
15:56:52.724119 IP 0.0.0.0.bootpc > 255.255.255.255.bootps: BOOTP/DHCP, Request from c0:ee:fb:3b:35:93 (oui Unknown), length 310
15:56:52.724192 IP 0.0.0.0.bootpc > 255.255.255.255.bootps: BOOTP/DHCP, Request from c0:ee:fb:3b:35:93 (oui Unknown), length 310
15:56:52.747032 IP 10.0.0.1.bootps > 10.0.0.222.bootpc: BOOTP/DHCP, Reply, length 300
15:56:54.152271 IP6 fe80::c2ee:fbff:fe3b:3593 > ip6-allrouters: ICMP6, router solicitation, length 16
15:56:54.152325 IP6 fe80::c2ee:fbff:fe3b:3593 > ip6-allrouters: ICMP6, router solicitation, length 16
15:56:54.153425 ARP, Request who-has 10.0.0.1 tell 10.0.0.222, length 28
15:56:54.153475 ARP, Reply 10.0.0.1 is-at 00:1e:a6:6a:7f:72 (oui Unknown), length 28
15:56:54.153532 ARP, Request who-has 10.0.0.1 tell 10.0.0.222, length 28
15:56:54.157436 IP 10.0.0.222.60064 > e.3a.559e.ip4.static.sl-reverse.com.xmpp-client: Flags [S], seq 3085039382, win 64240, options [mss 1460,sackOK,TS val 4913459 ecr 0,nop,wscale 8], length 0
15:56:54.406250 IP e.3a.559e.ip4.static.sl-reverse.com.xmpp-client > 10.0.0.222.60064: Flags [S.], seq 1848280137, ack 3085039383, win 65535, options [mss 1360,nop,wscale 9,sackOK,TS val 3256581148 ecr 4913459], length 0
15:56:54.408566 IP 10.0.0.222.60064 > e.3a.559e.ip4.static.sl-reverse.com.xmpp-client: Flags [.], ack 1, win 251, options [nop,nop,TS val 4913493 ecr 3256581148], length 0
15:56:54.412980 IP 10.0.0.222.60064 > e.3a.559e.ip4.static.sl-reverse.com.xmpp-client: Flags [P.], seq 1:5, ack 1, win 251, options [nop,nop,TS val 4913494 ecr 3256581148], length 4
15:56:54.643213 IP e.3a.559e.ip4.static.sl-reverse.com.xmpp-client > 10.0.0.222.60064: Flags [.], ack 1, win 513, options [nop,nop,TS val 3256581385 ecr 4913493], length 0
15:56:54.677133 IP e.3a.559e.ip4.static.sl-reverse.com.xmpp-client > 10.0.0.222.60064: Flags [.], ack 5, win 513, options [nop,nop,TS val 3256581419 ecr 4913494], length 0
15:56:54.680802 IP 10.0.0.222.60064 > e.3a.559e.ip4.static.sl-reverse.com.xmpp-client: Flags [P.], seq 5:283, ack 1, win 251, options [nop,nop,TS val 4913520 ecr 3256581419], length 278
15:56:54.921885 IP e.3a.559e.ip4.static.sl-reverse.com.xmpp-client > 10.0.0.222.60064: Flags [P.], seq 1:58, ack 283, win 513, options [nop,nop,TS val 3256581664 ecr 4913520], length 57
15:56:54.922006 IP e.3a.559e.ip4.static.sl-reverse.com.xmpp-client > 10.0.0.222.60064: Flags [P.], seq 58:101, ack 283, win 513, options [nop,nop,TS val 3256581664 ecr 4913520], length 43
15:56:54.924168 IP 10.0.0.222.60064 > e.3a.559e.ip4.static.sl-reverse.com.xmpp-client: Flags [.], ack 58, win 251, options [nop,nop,TS val 4913545 ecr 3256581664], length 0
15:56:54.925076 IP 10.0.0.222.60064 > e.3a.559e.ip4.static.sl-reverse.com.xmpp-client: Flags [.], ack 101, win 251, options [nop,nop,TS val 4913545 ecr 3256581664], length 0
15:56:54.931134 IP 10.0.0.222.60064 > e.3a.559e.ip4.static.sl-reverse.com.xmpp-client: Flags [P.], seq 283:286, ack 101, win 251, options [nop,nop,TS val 4913545 ecr 3256581664], length 3
15:56:54.941918 IP e.3a.559e.ip4.static.sl-reverse.com.xmpp-client > 10.0.0.222.60064: Flags [P.], seq 101:135, ack 283, win 513, options [nop,nop,TS val 3256581684 ecr 4913520], length 34
15:56:54.982291 IP 10.0.0.222.60064 > e.3a.559e.ip4.static.sl-reverse.com.xmpp-client: Flags [.], ack 135, win 251, options [nop,nop,TS val 4913551 ecr 3256581684], length 0
15:56:55.194997 IP e.3a.559e.ip4.static.sl-reverse.com.xmpp-client > 10.0.0.222.60064: Flags [.], ack 286, win 513, options [nop,nop,TS val 3256581937 ecr 4913545], length 0
15:56:55.197499 IP 10.0.0.222.60064 > e.3a.559e.ip4.static.sl-reverse.com.xmpp-client: Flags [P.], seq 286:319, ack 135, win 251, options [nop,nop,TS val 4913572 ecr 3256581937], length 33
15:56:55.461839 IP e.3a.559e.ip4.static.sl-reverse.com.xmpp-client > 10.0.0.222.60064: Flags [.], ack 319, win 513, options [nop,nop,TS val 3256582204 ecr 4913572], length 0
15:56:55.622621 IP e.3a.559e.ip4.static.sl-reverse.com.xmpp-client > 10.0.0.222.60064: Flags [P.], seq 135:176, ack 319, win 513, options [nop,nop,TS val 3256582364 ecr 4913572], length 41
15:56:55.625476 IP 10.0.0.222.60064 > e.3a.559e.ip4.static.sl-reverse.com.xmpp-client: Flags [.], ack 176, win 251, options [nop,nop,TS val 4913615 ecr 3256582364], length 0
15:56:55.974645 IP 10.0.0.222.35264 > 10.0.0.1.domain: 41344+ A? connectivitycheck.gstatic.com. (47)
15:56:55.978157 IP 10.0.0.1.domain > 10.0.0.222.35264: 41344 1/0/0 A 74.125.68.138 (63)
15:56:56.001064 IP 10.0.0.222.38736 > sc-in-f138.1e100.net.http: Flags [S], seq 2814006463, win 64240, options [mss 1460,sackOK,TS val 4913652 ecr 0,nop,wscale 8], length 0
15:56:56.061067 IP sc-in-f138.1e100.net.http > 10.0.0.222.38736: Flags [S.], seq 111577621, ack 2814006464, win 42408, options [mss 1380,sackOK,TS val 2040439505 ecr 4913652,nop,wscale 7], length 0
15:56:56.064771 IP 10.0.0.222.38736 > sc-in-f138.1e100.net.http: Flags [.], ack 1, win 251, options [nop,nop,TS val 4913659 ecr 2040439505], length 0
15:56:56.066359 IP 10.0.0.222.38736 > sc-in-f138.1e100.net.http: Flags [P.], seq 1:187, ack 1, win 251, options [nop,nop,TS val 4913659 ecr 2040439505], length 186
15:56:56.126055 IP sc-in-f138.1e100.net.http > 10.0.0.222.38736: Flags [.], ack 187, win 340, options [nop,nop,TS val 2040439570 ecr 4913659], length 0
15:56:56.126158 IP sc-in-f138.1e100.net.http > 10.0.0.222.38736: Flags [P.], seq 1:84, ack 187, win 340, options [nop,nop,TS val 2040439570 ecr 4913659], length 83
15:56:56.131228 IP 10.0.0.222.38736 > sc-in-f138.1e100.net.http: Flags [.], ack 84, win 251, options [nop,nop,TS val 4913665 ecr 2040439570], length 0
15:56:57.606712 IP6 fe80::c2ee:fbff:fe3b:3593 > ip6-allrouters: ICMP6, router solicitation, length 16
15:56:57.606792 IP6 fe80::c2ee:fbff:fe3b:3593 > ip6-allrouters: ICMP6, router solicitation, length 16
15:56:58.103583 IP6 fe80::c2ee:fbff:fe3b:3593 > ff02::16: HBH ICMP6, multicast listener report v2, 1 group record(s), length 28
15:56:58.103644 IP6 fe80::c2ee:fbff:fe3b:3593 > ff02::16: HBH ICMP6, multicast listener report v2, 1 group record(s), length 28
15:56:59.410788 ARP, Request who-has 10.0.0.222 tell 10.0.0.1, length 28
15:56:59.559778 ARP, Reply 10.0.0.222 is-at c0:ee:fb:3b:35:93 (oui Unknown), length 28
15:57:01.617444 IP6 fe80::c2ee:fbff:fe3b:3593 > ip6-allrouters: ICMP6, router solicitation, length 16
15:57:01.617503 IP6 fe80::c2ee:fbff:fe3b:3593 > ip6-allrouters: ICMP6, router solicitation, length 16
15:57:05.502417 ARP, Reply pi is-at 00:1e:a6:6a:7f:72 (oui Unknown), length 28
15:57:08.517029 ARP, Reply pi is-at 00:1e:a6:6a:7f:72 (oui Unknown), length 28
15:57:09.986662 IP 10.0.0.222.60064 > e.3a.559e.ip4.static.sl-reverse.com.xmpp-client: Flags [P.], seq 319:322, ack 176, win 251, options [nop,nop,TS val 4915050 ecr 3256582364], length 3
15:57:10.835803 IP 10.0.0.222.60064 > e.3a.559e.ip4.static.sl-reverse.com.xmpp-client: Flags [P.], seq 319:322, ack 176, win 251, options [nop,nop,TS val 4915135 ecr 3256582364], length 3
15:57:11.070837 IP e.3a.559e.ip4.static.sl-reverse.com.xmpp-client > 10.0.0.222.60064: Flags [.], ack 322, win 513, options [nop,nop,TS val 3256597812 ecr 4915135], length 0
15:57:11.074805 IP 10.0.0.222.60064 > e.3a.559e.ip4.static.sl-reverse.com.xmpp-client: Flags [P.], seq 322:357, ack 176, win 251, options [nop,nop,TS val 4915160 ecr 3256597812], length 35
15:57:11.310057 IP e.3a.559e.ip4.static.sl-reverse.com.xmpp-client > 10.0.0.222.60064: Flags [P.], seq 176:215, ack 357, win 513, options [nop,nop,TS val 3256598052 ecr 4915160], length 39
15:57:11.311686 IP 10.0.0.222.60064 > e.3a.559e.ip4.static.sl-reverse.com.xmpp-client: Flags [.], ack 215, win 251, options [nop,nop,TS val 4915183 ecr 3256598052], length 0
15:57:11.531799 ARP, Reply pi is-at 00:1e:a6:6a:7f:72 (oui Unknown), length 28
15:57:14.543822 ARP, Reply pi is-at 00:1e:a6:6a:7f:72 (oui Unknown), length 28
15:57:17.557977 ARP, Reply pi is-at 00:1e:a6:6a:7f:72 (oui Unknown), length 28
15:57:19.896246 IP 10.0.0.222.60910 > 10.0.0.1.domain: 52291+ A? mail.google.com. (33)
15:57:19.965025 IP 10.0.0.1.domain > 10.0.0.222.60910: 52291 2/0/0 CNAME googlemail.l.google.com., A 216.58.220.165 (76)
15:57:19.967792 IP 10.0.0.222.34582 > bom07s10-in-f165.1e100.net.https: Flags [S], seq 2146427334, win 64240, options [mss 1460,sackOK,TS val 4916049 ecr 0,nop,wscale 8], length 0
15:57:19.968533 IP 10.0.0.222.48497 > 10.0.0.1.domain: 54504+ A? google.co.in. (30)
15:57:19.970310 IP bom07s10-in-f165.1e100.net.https > 10.0.0.222.34582: Flags [S.], seq 3405180809, ack 2146427335, win 42540, options [mss 1430,sackOK,TS val 1464988852 ecr 4916049,nop,wscale 7], length 0
15:57:19.971480 IP 10.0.0.222.34582 > bom07s10-in-f165.1e100.net.https: Flags [.], ack 1, win 251, options [nop,nop,TS val 4916049 ecr 1464988852], length 0
15:57:19.974832 IP 10.0.0.222.34582 > bom07s10-in-f165.1e100.net.https: Flags [P.], seq 1:204, ack 1, win 251, options [nop,nop,TS val 4916050 ecr 1464988852], length 203
15:57:19.977213 IP bom07s10-in-f165.1e100.net.https > 10.0.0.222.34582: Flags [.], ack 204, win 341, options [nop,nop,TS val 1464988858 ecr 4916050], length 0
15:57:19.978335 IP bom07s10-in-f165.1e100.net.https > 10.0.0.222.34582: Flags [.], seq 1:1349, ack 204, win 341, options [nop,nop,TS val 1464988859 ecr 4916050], length 1348
15:57:19.978454 IP bom07s10-in-f165.1e100.net.https > 10.0.0.222.34582: Flags [.], seq 1349:2697, ack 204, win 341, options [nop,nop,TS val 1464988859 ecr 4916050], length 1348
15:57:19.978591 IP bom07s10-in-f165.1e100.net.https > 10.0.0.222.34582: Flags [P.], seq 2697:3160, ack 204, win 341, options [nop,nop,TS val 1464988859 ecr 4916050], length 463
15:57:19.979846 IP 10.0.0.222.34582 > bom07s10-in-f165.1e100.net.https: Flags [.], ack 1349, win 262, options [nop,nop,TS val 4916050 ecr 1464988859], length 0
15:57:19.980217 IP 10.0.0.222.34582 > bom07s10-in-f165.1e100.net.https: Flags [.], ack 2697, win 272, options [nop,nop,TS val 4916050 ecr 1464988859], length 0
15:57:19.981388 IP 10.0.0.222.34582 > bom07s10-in-f165.1e100.net.https: Flags [.], ack 3160, win 283, options [nop,nop,TS val 4916050 ecr 1464988859], length 0
15:57:20.018852 IP 10.0.0.222.34582 > bom07s10-in-f165.1e100.net.https: Flags [P.], seq 204:330, ack 3160, win 283, options [nop,nop,TS val 4916054 ecr 1464988859], length 126
15:57:20.019390 IP 10.0.0.222.34582 > bom07s10-in-f165.1e100.net.https: Flags [P.], seq 330:487, ack 3160, win 283, options [nop,nop,TS val 4916054 ecr 1464988859], length 157
15:57:20.020628 IP 10.0.0.222.44977 > 10.0.0.1.domain: 65005+ A? www.google.com. (32)
15:57:20.022180 IP bom07s10-in-f165.1e100.net.https > 10.0.0.222.34582: Flags [P.], seq 3160:3422, ack 330, win 341, options [nop,nop,TS val 1464988903 ecr 4916054], length 262
15:57:20.022330 IP bom07s10-in-f165.1e100.net.https > 10.0.0.222.34582: Flags [P.], seq 3422:3484, ack 330, win 341, options [nop,nop,TS val 1464988903 ecr 4916054], length 62
15:57:20.022401 IP bom07s10-in-f165.1e100.net.https > 10.0.0.222.34582: Flags [P.], seq 3484:3526, ack 330, win 341, options [nop,nop,TS val 1464988903 ecr 4916054], length 42
15:57:20.022510 IP bom07s10-in-f165.1e100.net.https > 10.0.0.222.34582: Flags [P.], seq 3526:3564, ack 487, win 350, options [nop,nop,TS val 1464988903 ecr 4916054], length 38
15:57:20.023314 IP 10.0.0.222.34582 > bom07s10-in-f165.1e100.net.https: Flags [.], ack 3422, win 294, options [nop,nop,TS val 4916055 ecr 1464988903], length 0
15:57:20.023548 IP 10.0.0.222.34582 > bom07s10-in-f165.1e100.net.https: Flags [.], ack 3484, win 294, options [nop,nop,TS val 4916055 ecr 1464988903], length 0
15:57:20.024213 IP 10.0.0.222.34582 > bom07s10-in-f165.1e100.net.https: Flags [P.], seq 487:525, ack 3484, win 294, options [nop,nop,TS val 4916055 ecr 1464988903], length 38
15:57:20.027437 IP 10.0.0.222.54154 > 10.0.0.1.4886: UDP, length 0
15:57:20.027686 IP 10.0.0.1 > 10.0.0.222: ICMP 10.0.0.1 udp port 4886 unreachable, length 36
15:57:20.027849 IP 10.0.0.222.34582 > bom07s10-in-f165.1e100.net.https: Flags [.], ack 3564, win 294, options [nop,nop,TS val 4916055 ecr 1464988903], length 0
15:57:20.043949 IP 10.0.0.222.54154 > 10.0.0.1.4886: UDP, length 0
15:57:20.044161 IP 10.0.0.1 > 10.0.0.222: ICMP 10.0.0.1 udp port 4886 unreachable, length 36
15:57:20.054208 IP 10.0.0.1.domain > 10.0.0.222.44977: 65005 1/0/0 A 216.58.220.4 (48)
15:57:20.058169 IP 10.0.0.222.33770 > bom05s05-in-f4.1e100.net.https: Flags [S], seq 1385384261, win 64240, options [mss 1460,sackOK,TS val 4916058 ecr 0,nop,wscale 8], length 0
15:57:20.059598 IP 10.0.0.1.domain > 10.0.0.222.48497: 54504 1/0/0 A 74.125.68.94 (46)
15:57:20.059967 IP 10.0.0.222.54154 > 10.0.0.1.4886: UDP, length 0
15:57:20.060081 IP 10.0.0.1 > 10.0.0.222: ICMP 10.0.0.1 udp port 4886 unreachable, length 36
15:57:20.061736 IP 10.0.0.222.49177 > bom05s05-in-f4.1e100.net.https: Flags [S], seq 1800184670, win 64240, options [mss 1460,sackOK,TS val 4916059 ecr 0,nop,wscale 8], length 0
15:57:20.063331 IP 10.0.0.222.53060 > sc-in-f94.1e100.net.http: Flags [S], seq 3958187963, win 64240, options [mss 1460,sackOK,TS val 4916059 ecr 0,nop,wscale 8], length 0
15:57:20.063544 IP sc-in-f94.1e100.net.http > 10.0.0.222.53060: Flags [S.], seq 3273205396, ack 3958187964, win 28960, options [mss 1460,sackOK,TS val 4294950239 ecr 4916059,nop,wscale 7], length 0
15:57:20.064715 IP 10.0.0.222.53060 > sc-in-f94.1e100.net.http: Flags [.], ack 1, win 251, options [nop,nop,TS val 4916059 ecr 4294950239], length 0
15:57:20.065704 IP bom07s10-in-f165.1e100.net.https > 10.0.0.222.34582: Flags [.], ack 525, win 350, options [nop,nop,TS val 1464988947 ecr 4916055], length 0
15:57:20.076609 IP 10.0.0.222.54154 > 10.0.0.1.4886: UDP, length 0
15:57:20.076819 IP 10.0.0.1 > 10.0.0.222: ICMP 10.0.0.1 udp port 4886 unreachable, length 36
15:57:20.092851 IP 10.0.0.222.54154 > 10.0.0.1.4886: UDP, length 0
15:57:20.093066 IP 10.0.0.1 > 10.0.0.222: ICMP 10.0.0.1 udp port 4886 unreachable, length 36
15:57:20.109183 IP 10.0.0.222.54154 > 10.0.0.1.4886: UDP, length 0
15:57:20.109396 IP 10.0.0.1 > 10.0.0.222: ICMP 10.0.0.1 udp port 4886 unreachable, length 36
15:57:20.123340 IP bom05s05-in-f4.1e100.net.https > 10.0.0.222.33770: Flags [S.], seq 3851798834, ack 1385384262, win 42540, options [mss 1430,sackOK,TS val 768690688 ecr 4916058,nop,wscale 7], length 0
15:57:20.124590 IP 10.0.0.222.33770 > bom05s05-in-f4.1e100.net.https: Flags [.], ack 1, win 251, options [nop,nop,TS val 4916065 ecr 768690688], length 0
15:57:20.125039 IP bom05s05-in-f4.1e100.net.https > 10.0.0.222.49177: Flags [S.], seq 522312499, ack 1800184671, win 42540, options [mss 1430,sackOK,TS val 907347506 ecr 4916059,nop,wscale 7], length 0
15:57:20.125462 IP 10.0.0.222.54154 > 10.0.0.1.4886: UDP, length 0
15:57:20.126273 IP 10.0.0.222.33770 > bom05s05-in-f4.1e100.net.https: Flags [P.], seq 1:518, ack 1, win 251, options [nop,nop,TS val 4916065 ecr 768690688], length 517
15:57:20.129322 IP 10.0.0.222.49177 > bom05s05-in-f4.1e100.net.https: Flags [.], ack 1, win 251, options [nop,nop,TS val 4916065 ecr 907347506], length 0
15:57:20.130963 IP 10.0.0.222.49177 > bom05s05-in-f4.1e100.net.https: Flags [P.], seq 1:181, ack 1, win 251, options [nop,nop,TS val 4916065 ecr 907347506], length 180
15:57:20.142172 IP 10.0.0.222.54154 > 10.0.0.1.4886: UDP, length 0
15:57:20.158855 IP 10.0.0.222.54154 > 10.0.0.1.4886: UDP, length 0
15:57:20.175426 IP 10.0.0.222.54154 > 10.0.0.1.4886: UDP, length 0
15:57:20.190863 IP bom05s05-in-f4.1e100.net.https > 10.0.0.222.33770: Flags [.], ack 518, win 341, options [nop,nop,TS val 768690755 ecr 4916065], length 0
15:57:20.191128 IP bom05s05-in-f4.1e100.net.https > 10.0.0.222.33770: Flags [P.], seq 1:157, ack 518, win 341, options [nop,nop,TS val 768690756 ecr 4916065], length 156
15:57:20.192601 IP 10.0.0.222.54154 > 10.0.0.1.4886: UDP, length 0
15:57:20.196192 IP 10.0.0.222.33770 > bom05s05-in-f4.1e100.net.https: Flags [.], ack 157, win 256, options [nop,nop,TS val 4916072 ecr 768690756], length 0
15:57:20.196503 IP bom05s05-in-f4.1e100.net.https > 10.0.0.222.49177: Flags [.], ack 181, win 341, options [nop,nop,TS val 907347575 ecr 4916065], length 0
15:57:20.196734 IP bom05s05-in-f4.1e100.net.https > 10.0.0.222.49177: Flags [.], seq 1:1349, ack 181, win 341, options [nop,nop,TS val 907347576 ecr 4916065], length 1348
15:57:20.196848 IP bom05s05-in-f4.1e100.net.https > 10.0.0.222.49177: Flags [.], seq 1349:2697, ack 181, win 341, options [nop,nop,TS val 907347576 ecr 4916065], length 1348
15:57:20.196910 IP bom05s05-in-f4.1e100.net.https > 10.0.0.222.49177: Flags [P.], seq 2697:3521, ack 181, win 341, options [nop,nop,TS val 907347576 ecr 4916065], length 824
15:57:20.198974 IP 10.0.0.222.33770 > bom05s05-in-f4.1e100.net.https: Flags [P.], seq 518:569, ack 157, win 256, options [nop,nop,TS val 4916072 ecr 768690756], length 51
15:57:20.199307 IP 10.0.0.222.49177 > bom05s05-in-f4.1e100.net.https: Flags [.], ack 1349, win 262, options [nop,nop,TS val 4916072 ecr 907347576], length 0
15:57:20.199676 IP 10.0.0.222.33770 > bom05s05-in-f4.1e100.net.https: Flags [P.], seq 569:726, ack 157, win 256, options [nop,nop,TS val 4916072 ecr 768690756], length 157
15:57:20.199880 IP 10.0.0.222.49177 > bom05s05-in-f4.1e100.net.https: Flags [.], ack 2697, win 272, options [nop,nop,TS val 4916072 ecr 907347576], length 0
15:57:20.200089 IP 10.0.0.222.49177 > bom05s05-in-f4.1e100.net.https: Flags [.], ack 3521, win 283, options [nop,nop,TS val 4916072 ecr 907347576], length 0
15:57:20.208750 IP 10.0.0.222.54154 > 10.0.0.1.4886: UDP, length 0
15:57:20.225192 IP 10.0.0.222.54154 > 10.0.0.1.4886: UDP, length 0
15:57:20.231118 IP 10.0.0.222.49177 > bom05s05-in-f4.1e100.net.https: Flags [P.], seq 181:307, ack 3521, win 283, options [nop,nop,TS val 4916075 ecr 907347576], length 126
15:57:20.242243 IP 10.0.0.222.54154 > 10.0.0.1.4886: UDP, length 0
15:57:20.258731 IP 10.0.0.222.54154 > 10.0.0.1.4886: UDP, length 0
15:57:20.263812 IP bom05s05-in-f4.1e100.net.https > 10.0.0.222.33770: Flags [P.], seq 157:219, ack 569, win 341, options [nop,nop,TS val 768690828 ecr 4916072], length 62
15:57:20.263948 IP bom05s05-in-f4.1e100.net.https > 10.0.0.222.33770: Flags [P.], seq 219:261, ack 569, win 341, options [nop,nop,TS val 768690828 ecr 4916072], length 42
15:57:20.264090 IP bom05s05-in-f4.1e100.net.https > 10.0.0.222.33770: Flags [P.], seq 261:299, ack 726, win 350, options [nop,nop,TS val 768690829 ecr 4916072], length 38
15:57:20.265421 IP 10.0.0.222.33770 > bom05s05-in-f4.1e100.net.https: Flags [P.], seq 726:764, ack 261, win 256, options [nop,nop,TS val 4916079 ecr 768690828], length 38
15:57:20.275622 IP 10.0.0.222.54154 > 10.0.0.1.4886: UDP, length 0
15:57:20.292591 IP 10.0.0.222.54154 > 10.0.0.1.4886: UDP, length 0
15:57:20.296758 IP bom05s05-in-f4.1e100.net.https > 10.0.0.222.49177: Flags [P.], seq 3521:3783, ack 307, win 341, options [nop,nop,TS val 907347676 ecr 4916075], length 262
15:57:20.299953 IP 10.0.0.222.49177 > bom05s05-in-f4.1e100.net.https: Flags [P.], seq 307:539, ack 3783, win 294, options [nop,nop,TS val 4916082 ecr 907347676], length 232
15:57:20.301922 IP 10.0.0.222.33770 > bom05s05-in-f4.1e100.net.https: Flags [.], ack 299, win 256, options [nop,nop,TS val 4916083 ecr 768690829], length 0
15:57:20.309117 IP 10.0.0.222.54154 > 10.0.0.1.4886: UDP, length 0
15:57:20.325680 IP 10.0.0.222.54154 > 10.0.0.1.4886: UDP, length 0
15:57:20.342301 IP 10.0.0.222.54154 > 10.0.0.1.4886: UDP, length 0
15:57:20.358869 IP 10.0.0.222.54154 > 10.0.0.1.4886: UDP, length 0
15:57:20.375463 IP 10.0.0.222.54154 > 10.0.0.1.4886: UDP, length 0
15:57:20.375875 IP bom05s05-in-f4.1e100.net.https > 10.0.0.222.33770: Flags [.], ack 764, win 350, options [nop,nop,TS val 768690934 ecr 4916079], length 0
15:57:20.392121 IP 10.0.0.222.54154 > 10.0.0.1.4886: UDP, length 0
15:57:20.402724 IP bom05s05-in-f4.1e100.net.https > 10.0.0.222.49177: Flags [.], ack 539, win 350, options [nop,nop,TS val 907347784 ecr 4916082], length 0
15:57:20.409190 IP 10.0.0.222.54154 > 10.0.0.1.4886: UDP, length 0
15:57:20.471364 IP bom05s05-in-f4.1e100.net.https > 10.0.0.222.49177: Flags [P.], seq 3783:4472, ack 539, win 350, options [nop,nop,TS val 907347848 ecr 4916082], length 689
15:57:20.512349 IP 10.0.0.222.49177 > bom05s05-in-f4.1e100.net.https: Flags [.], ack 4472, win 304, options [nop,nop,TS val 4916104 ecr 907347848], length 0
15:57:20.572100 ARP, Reply pi is-at 00:1e:a6:6a:7f:72 (oui Unknown), length 28
15:57:20.848530 IP 10.0.0.222.53060 > sc-in-f94.1e100.net.http: Flags [P.], seq 1:761, ack 1, win 251, options [nop,nop,TS val 4916137 ecr 4294950239], length 760
15:57:20.848723 IP sc-in-f94.1e100.net.http > 10.0.0.222.53060: Flags [.], ack 761, win 249, options [nop,nop,TS val 4294950317 ecr 4916137], length 0
15:57:20.864703 IP 10.0.0.222.54154 > 10.0.0.1.4886: UDP, length 0
15:57:20.881329 IP 10.0.0.222.54154 > 10.0.0.1.4886: UDP, length 0
15:57:20.897968 IP 10.0.0.222.54154 > 10.0.0.1.4886: UDP, length 0
15:57:20.914278 IP 10.0.0.222.54154 > 10.0.0.1.4886: UDP, length 0
15:57:20.930790 IP 10.0.0.222.54154 > 10.0.0.1.4886: UDP, length 0
15:57:20.947796 IP 10.0.0.222.54154 > 10.0.0.1.4886: UDP, length 0
15:57:20.963857 IP 10.0.0.222.54154 > 10.0.0.1.4886: UDP, length 0
15:57:20.980231 IP 10.0.0.222.54154 > 10.0.0.1.4886: UDP, length 0
15:57:20.996732 IP 10.0.0.222.54154 > 10.0.0.1.4886: UDP, length 0
15:57:21.013235 IP 10.0.0.222.54154 > 10.0.0.1.4886: UDP, length 0
15:57:21.029989 IP 10.0.0.222.54154 > 10.0.0.1.4886: UDP, length 0
15:57:21.030170 IP 10.0.0.1 > 10.0.0.222: ICMP 10.0.0.1 udp port 4886 unreachable, length 36
15:57:21.046576 IP 10.0.0.222.54154 > 10.0.0.1.4886: UDP, length 0
15:57:21.063179 IP 10.0.0.222.54154 > 10.0.0.1.4886: UDP, length 0
15:57:21.079925 IP 10.0.0.222.54154 > 10.0.0.1.4886: UDP, length 0
15:57:21.096490 IP 10.0.0.222.54154 > 10.0.0.1.4886: UDP, length 0
15:57:21.113881 IP 10.0.0.222.54154 > 10.0.0.1.4886: UDP, length 0
15:57:21.129755 IP 10.0.0.222.54154 > 10.0.0.1.4886: UDP, length 0
15:57:21.146216 IP 10.0.0.222.54154 > 10.0.0.1.4886: UDP, length 0
15:57:21.162494 IP 10.0.0.222.54154 > 10.0.0.1.4886: UDP, length 0
15:57:21.179050 IP 10.0.0.222.54154 > 10.0.0.1.4886: UDP, length 0
15:57:21.195639 IP 10.0.0.222.54154 > 10.0.0.1.4886: UDP, length 0
15:57:21.212869 IP 10.0.0.222.54154 > 10.0.0.1.4886: UDP, length 0
15:57:21.229752 IP 10.0.0.222.54154 > 10.0.0.1.4886: UDP, length 0
15:57:21.246691 IP 10.0.0.222.54154 > 10.0.0.1.4886: UDP, length 0
15:57:21.309072 IP sc-in-f94.1e100.net.http > 10.0.0.222.53060: Flags [P.], seq 1:546, ack 761, win 249, options [nop,nop,TS val 4294950363 ecr 4916137], length 545
15:57:21.312136 IP 10.0.0.222.53060 > sc-in-f94.1e100.net.http: Flags [.], ack 546, win 256, options [nop,nop,TS val 4916183 ecr 4294950363], length 0
15:57:21.334269 IP 10.0.0.222.62189 > 10.0.0.1.domain: 56097+ A? www.google.co.in. (34)
15:57:21.350076 IP 10.0.0.222.54154 > 10.0.0.1.4886: UDP, length 0
15:57:21.366702 IP 10.0.0.222.54154 > 10.0.0.1.4886: UDP, length 0
15:57:21.383244 IP 10.0.0.222.54154 > 10.0.0.1.4886: UDP, length 0
15:57:21.396717 IP 10.0.0.1.domain > 10.0.0.222.62189: 56097 1/0/0 A 216.58.220.163 (50)
15:57:21.399425 IP 10.0.0.222.54154 > 10.0.0.1.4886: UDP, length 0
15:57:21.399678 IP 10.0.0.222.46120 > bom07s10-in-f163.1e100.net.http: Flags [S], seq 1552408119, win 64240, options [mss 1460,sackOK,TS val 4916192 ecr 0,nop,wscale 8], length 0
15:57:21.399882 IP bom07s10-in-f163.1e100.net.http > 10.0.0.222.46120: Flags [S.], seq 3206182384, ack 1552408120, win 28960, options [mss 1460,sackOK,TS val 4294950372 ecr 4916192,nop,wscale 7], length 0
15:57:21.400974 IP 10.0.0.222.46120 > bom07s10-in-f163.1e100.net.http: Flags [.], ack 1, win 251, options [nop,nop,TS val 4916192 ecr 4294950372], length 0
15:57:21.401636 IP 10.0.0.222.46120 > bom07s10-in-f163.1e100.net.http: Flags [P.], seq 1:765, ack 1, win 251, options [nop,nop,TS val 4916192 ecr 4294950372], length 764
15:57:21.401767 IP bom07s10-in-f163.1e100.net.http > 10.0.0.222.46120: Flags [.], ack 765, win 249, options [nop,nop,TS val 4294950373 ecr 4916192], length 0
15:57:21.416051 IP 10.0.0.222.54154 > 10.0.0.1.4886: UDP, length 0
15:57:21.432607 IP 10.0.0.222.54154 > 10.0.0.1.4886: UDP, length 0
15:57:21.449058 IP 10.0.0.222.54154 > 10.0.0.1.4886: UDP, length 0
15:57:21.466162 IP 10.0.0.222.54154 > 10.0.0.1.4886: UDP, length 0
15:57:21.482616 IP 10.0.0.222.54154 > 10.0.0.1.4886: UDP, length 0
15:57:21.499028 IP 10.0.0.222.54154 > 10.0.0.1.4886: UDP, length 0
15:57:21.515378 IP 10.0.0.222.54154 > 10.0.0.1.4886: UDP, length 0
15:57:21.531866 IP 10.0.0.222.54154 > 10.0.0.1.4886: UDP, length 0
15:57:21.548422 IP 10.0.0.222.54154 > 10.0.0.1.4886: UDP, length 0
15:57:21.564801 IP 10.0.0.222.54154 > 10.0.0.1.4886: UDP, length 0
15:57:21.581306 IP 10.0.0.222.54154 > 10.0.0.1.4886: UDP, length 0
15:57:21.597771 IP 10.0.0.222.54154 > 10.0.0.1.4886: UDP, length 0
15:57:21.614200 IP 10.0.0.222.54154 > 10.0.0.1.4886: UDP, length 0
15:57:21.630675 IP 10.0.0.222.54154 > 10.0.0.1.4886: UDP, length 0
15:57:21.647120 IP 10.0.0.222.54154 > 10.0.0.1.4886: UDP, length 0
15:57:21.664567 IP 10.0.0.222.54154 > 10.0.0.1.4886: UDP, length 0
15:57:21.680070 IP 10.0.0.222.54154 > 10.0.0.1.4886: UDP, length 0
15:57:21.696592 IP 10.0.0.222.54154 > 10.0.0.1.4886: UDP, length 0
15:57:21.712909 IP 10.0.0.222.54154 > 10.0.0.1.4886: UDP, length 0
15:57:21.729503 IP 10.0.0.222.54154 > 10.0.0.1.4886: UDP, length 0
15:57:21.844815 IP bom07s10-in-f163.1e100.net.http > 10.0.0.222.46120: Flags [.], seq 1:1449, ack 765, win 249, options [nop,nop,TS val 4294950417 ecr 4916192], length 1448
15:57:21.844994 IP bom07s10-in-f163.1e100.net.http > 10.0.0.222.46120: Flags [.], seq 1449:2897, ack 765, win 249, options [nop,nop,TS val 4294950417 ecr 4916192], length 1448
15:57:21.845091 IP bom07s10-in-f163.1e100.net.http > 10.0.0.222.46120: Flags [.], seq 2897:4345, ack 765, win 249, options [nop,nop,TS val 4294950417 ecr 4916192], length 1448
15:57:21.845162 IP bom07s10-in-f163.1e100.net.http > 10.0.0.222.46120: Flags [.], seq 4345:5793, ack 765, win 249, options [nop,nop,TS val 4294950417 ecr 4916192], length 1448
15:57:21.845224 IP bom07s10-in-f163.1e100.net.http > 10.0.0.222.46120: Flags [.], seq 5793:7241, ack 765, win 249, options [nop,nop,TS val 4294950417 ecr 4916192], length 1448
15:57:21.845284 IP bom07s10-in-f163.1e100.net.http > 10.0.0.222.46120: Flags [.], seq 7241:8689, ack 765, win 249, options [nop,nop,TS val 4294950417 ecr 4916192], length 1448
15:57:21.845337 IP bom07s10-in-f163.1e100.net.http > 10.0.0.222.46120: Flags [.], seq 8689:10137, ack 765, win 249, options [nop,nop,TS val 4294950417 ecr 4916192], length 1448
15:57:21.845410 IP bom07s10-in-f163.1e100.net.http > 10.0.0.222.46120: Flags [.], seq 10137:11585, ack 765, win 249, options [nop,nop,TS val 4294950417 ecr 4916192], length 1448
15:57:21.845469 IP bom07s10-in-f163.1e100.net.http > 10.0.0.222.46120: Flags [.], seq 11585:13033, ack 765, win 249, options [nop,nop,TS val 4294950417 ecr 4916192], length 1448
15:57:21.845671 IP bom07s10-in-f163.1e100.net.http > 10.0.0.222.46120: Flags [P.], seq 13033:13186, ack 765, win 249, options [nop,nop,TS val 4294950417 ecr 4916192], length 153
15:57:21.847319 IP 10.0.0.222.46120 > bom07s10-in-f163.1e100.net.http: Flags [.], ack 1449, win 263, options [nop,nop,TS val 4916237 ecr 4294950417], length 0
15:57:21.847568 IP 10.0.0.222.46120 > bom07s10-in-f163.1e100.net.http: Flags [.], ack 2897, win 274, options [nop,nop,TS val 4916237 ecr 4294950417], length 0
15:57:21.847717 IP 10.0.0.222.46120 > bom07s10-in-f163.1e100.net.http: Flags [.], ack 4345, win 285, options [nop,nop,TS val 4916237 ecr 4294950417], length 0
15:57:21.847960 IP 10.0.0.222.46120 > bom07s10-in-f163.1e100.net.http: Flags [.], ack 5793, win 297, options [nop,nop,TS val 4916237 ecr 4294950417], length 0
15:57:21.849272 IP 10.0.0.222.46120 > bom07s10-in-f163.1e100.net.http: Flags [.], ack 7241, win 308, options [nop,nop,TS val 4916237 ecr 4294950417], length 0
15:57:21.849563 IP 10.0.0.222.46120 > bom07s10-in-f163.1e100.net.http: Flags [.], ack 8689, win 319, options [nop,nop,TS val 4916237 ecr 4294950417], length 0
15:57:21.850690 IP 10.0.0.222.46120 > bom07s10-in-f163.1e100.net.http: Flags [.], ack 10137, win 331, options [nop,nop,TS val 4916237 ecr 4294950417], length 0
15:57:21.851313 IP 10.0.0.222.46120 > bom07s10-in-f163.1e100.net.http: Flags [.], ack 11585, win 342, options [nop,nop,TS val 4916237 ecr 4294950417], length 0
15:57:21.851900 IP 10.0.0.222.46120 > bom07s10-in-f163.1e100.net.http: Flags [.], ack 13033, win 353, options [nop,nop,TS val 4916238 ecr 4294950417], length 0
15:57:21.852315 IP 10.0.0.222.46120 > bom07s10-in-f163.1e100.net.http: Flags [.], ack 13186, win 365, options [nop,nop,TS val 4916238 ecr 4294950417], length 0
15:57:21.969826 IP 10.0.0.222.46120 > bom07s10-in-f163.1e100.net.http: Flags [P.], seq 765:1549, ack 13186, win 365, options [nop,nop,TS val 4916249 ecr 4294950417], length 784
15:57:21.970043 IP bom07s10-in-f163.1e100.net.http > 10.0.0.222.46120: Flags [.], ack 1549, win 272, options [nop,nop,TS val 4294950429 ecr 4916249], length 0
15:57:21.985210 IP 10.0.0.222.54154 > 10.0.0.1.4886: UDP, length 0
15:57:22.001503 IP 10.0.0.222.54154 > 10.0.0.1.4886: UDP, length 0
15:57:22.018389 IP 10.0.0.222.54154 > 10.0.0.1.4886: UDP, length 0
15:57:22.035940 IP 10.0.0.222.54154 > 10.0.0.1.4886: UDP, length 0
15:57:22.036132 IP 10.0.0.1 > 10.0.0.222: ICMP 10.0.0.1 udp port 4886 unreachable, length 36
15:57:22.051390 IP 10.0.0.222.54154 > 10.0.0.1.4886: UDP, length 0
15:57:22.068126 IP 10.0.0.222.54154 > 10.0.0.1.4886: UDP, length 0
15:57:22.084483 IP 10.0.0.222.54154 > 10.0.0.1.4886: UDP, length 0
15:57:22.101146 IP 10.0.0.222.54154 > 10.0.0.1.4886: UDP, length 0
15:57:22.118023 IP 10.0.0.222.54154 > 10.0.0.1.4886: UDP, length 0
15:57:22.135103 IP 10.0.0.222.54154 > 10.0.0.1.4886: UDP, length 0
15:57:22.135232 IP 10.0.0.222.46121 > bom07s10-in-f163.1e100.net.http: Flags [S], seq 3074963715, win 64240, options [mss 1460,sackOK,TS val 4916266 ecr 0,nop,wscale 8], length 0
15:57:22.135470 IP bom07s10-in-f163.1e100.net.http > 10.0.0.222.46121: Flags [S.], seq 3715197118, ack 3074963716, win 28960, options [mss 1460,sackOK,TS val 4294950446 ecr 4916266,nop,wscale 7], length 0
15:57:22.136474 IP 10.0.0.222.46121 > bom07s10-in-f163.1e100.net.http: Flags [.], ack 1, win 251, options [nop,nop,TS val 4916266 ecr 4294950446], length 0
15:57:22.137612 IP 10.0.0.222.46121 > bom07s10-in-f163.1e100.net.http: Flags [P.], seq 1:822, ack 1, win 251, options [nop,nop,TS val 4916266 ecr 4294950446], length 821
15:57:22.137729 IP bom07s10-in-f163.1e100.net.http > 10.0.0.222.46121: Flags [.], ack 822, win 249, options [nop,nop,TS val 4294950446 ecr 4916266], length 0
15:57:22.151701 IP 10.0.0.222.54154 > 10.0.0.1.4886: UDP, length 0
15:57:22.168240 IP 10.0.0.222.54154 > 10.0.0.1.4886: UDP, length 0
15:57:22.184093 IP 10.0.0.222.54154 > 10.0.0.1.4886: UDP, length 0
15:57:22.200772 IP 10.0.0.222.54154 > 10.0.0.1.4886: UDP, length 0
15:57:22.209985 IP 10.0.0.222.52225 > 10.0.0.1.domain: 57494+ A? ssl.gstatic.com. (33)
15:57:22.217485 IP 10.0.0.222.54154 > 10.0.0.1.4886: UDP, length 0
15:57:22.222915 IP 10.0.0.222.46122 > bom07s10-in-f163.1e100.net.http: Flags [S], seq 505851878, win 64240, options [mss 1460,sackOK,TS val 4916275 ecr 0,nop,wscale 8], length 0
15:57:22.223235 IP bom07s10-in-f163.1e100.net.http > 10.0.0.222.46122: Flags [S.], seq 1095661299, ack 505851879, win 28960, options [mss 1460,sackOK,TS val 4294950455 ecr 4916275,nop,wscale 7], length 0
15:57:22.224343 IP 10.0.0.222.46122 > bom07s10-in-f163.1e100.net.http: Flags [.], ack 1, win 251, options [nop,nop,TS val 4916275 ecr 4294950455], length 0
15:57:22.224764 IP 10.0.0.222.46122 > bom07s10-in-f163.1e100.net.http: Flags [P.], seq 1:732, ack 1, win 251, options [nop,nop,TS val 4916275 ecr 4294950455], length 731
15:57:22.224913 IP bom07s10-in-f163.1e100.net.http > 10.0.0.222.46122: Flags [.], ack 732, win 249, options [nop,nop,TS val 4294950455 ecr 4916275], length 0
15:57:22.234382 IP 10.0.0.222.54154 > 10.0.0.1.4886: UDP, length 0
15:57:22.251351 IP 10.0.0.222.54154 > 10.0.0.1.4886: UDP, length 0
15:57:22.268005 IP 10.0.0.222.54154 > 10.0.0.1.4886: UDP, length 0
15:57:22.284771 IP 10.0.0.222.54154 > 10.0.0.1.4886: UDP, length 0
15:57:22.287099 IP 10.0.0.1.domain > 10.0.0.222.52225: 57494 1/0/0 A 216.58.220.163 (49)
15:57:22.289836 IP 10.0.0.222.46123 > bom07s10-in-f163.1e100.net.http: Flags [S], seq 2769513788, win 64240, options [mss 1460,sackOK,TS val 4916281 ecr 0,nop,wscale 8], length 0
15:57:22.290133 IP bom07s10-in-f163.1e100.net.http > 10.0.0.222.46123: Flags [S.], seq 1200321749, ack 2769513789, win 28960, options [mss 1460,sackOK,TS val 4294950461 ecr 4916281,nop,wscale 7], length 0
15:57:22.290347 IP 10.0.0.222.46124 > bom07s10-in-f163.1e100.net.http: Flags [S], seq 3822049054, win 64240, options [mss 1460,sackOK,TS val 4916281 ecr 0,nop,wscale 8], length 0
15:57:22.290509 IP bom07s10-in-f163.1e100.net.http > 10.0.0.222.46124: Flags [S.], seq 585005394, ack 3822049055, win 28960, options [mss 1460,sackOK,TS val 4294950461 ecr 4916281,nop,wscale 7], length 0
15:57:22.291611 IP 10.0.0.222.46123 > bom07s10-in-f163.1e100.net.http: Flags [.], ack 1, win 251, options [nop,nop,TS val 4916281 ecr 4294950461], length 0
15:57:22.291779 IP 10.0.0.222.46124 > bom07s10-in-f163.1e100.net.http: Flags [.], ack 1, win 251, options [nop,nop,TS val 4916281 ecr 4294950461], length 0
15:57:22.291975 IP 10.0.0.222.46123 > bom07s10-in-f163.1e100.net.http: Flags [P.], seq 1:306, ack 1, win 251, options [nop,nop,TS val 4916282 ecr 4294950461], length 305
15:57:22.292085 IP bom07s10-in-f163.1e100.net.http > 10.0.0.222.46123: Flags [.], ack 306, win 235, options [nop,nop,TS val 4294950462 ecr 4916282], length 0
15:57:22.301903 IP 10.0.0.222.54154 > 10.0.0.1.4886: UDP, length 0
15:57:22.318527 IP 10.0.0.222.54154 > 10.0.0.1.4886: UDP, length 0
15:57:22.334804 IP 10.0.0.222.54154 > 10.0.0.1.4886: UDP, length 0
15:57:22.351166 IP 10.0.0.222.54154 > 10.0.0.1.4886: UDP, length 0
15:57:22.367838 IP 10.0.0.222.54154 > 10.0.0.1.4886: UDP, length 0
15:57:22.384882 IP 10.0.0.222.54154 > 10.0.0.1.4886: UDP, length 0
15:57:22.401636 IP 10.0.0.222.54154 > 10.0.0.1.4886: UDP, length 0
15:57:22.418601 IP 10.0.0.222.54154 > 10.0.0.1.4886: UDP, length 0
15:57:22.435662 IP 10.0.0.222.54154 > 10.0.0.1.4886: UDP, length 0
15:57:22.452496 IP 10.0.0.222.54154 > 10.0.0.1.4886: UDP, length 0
15:57:22.469199 IP 10.0.0.222.54154 > 10.0.0.1.4886: UDP, length 0
15:57:22.486135 IP 10.0.0.222.54154 > 10.0.0.1.4886: UDP, length 0
15:57:22.502608 IP 10.0.0.222.54154 > 10.0.0.1.4886: UDP, length 0
15:57:22.519170 IP 10.0.0.222.54154 > 10.0.0.1.4886: UDP, length 0
15:57:22.535820 IP 10.0.0.222.54154 > 10.0.0.1.4886: UDP, length 0
15:57:22.552575 IP 10.0.0.222.54154 > 10.0.0.1.4886: UDP, length 0
15:57:22.569381 IP 10.0.0.222.54154 > 10.0.0.1.4886: UDP, length 0
15:57:22.586198 IP 10.0.0.222.54154 > 10.0.0.1.4886: UDP, length 0
15:57:22.602755 IP 10.0.0.222.54154 > 10.0.0.1.4886: UDP, length 0
15:57:22.619518 IP 10.0.0.222.54154 > 10.0.0.1.4886: UDP, length 0
15:57:22.889778 IP bom07s10-in-f163.1e100.net.http > 10.0.0.222.46120: Flags [.], seq 13186:14634, ack 1549, win 272, options [nop,nop,TS val 4294950521 ecr 4916249], length 1448
15:57:22.889922 IP bom07s10-in-f163.1e100.net.http > 10.0.0.222.46120: Flags [.], seq 14634:16082, ack 1549, win 272, options [nop,nop,TS val 4294950521 ecr 4916249], length 1448
15:57:22.889992 IP bom07s10-in-f163.1e100.net.http > 10.0.0.222.46120: Flags [.], seq 16082:17530, ack 1549, win 272, options [nop,nop,TS val 4294950521 ecr 4916249], length 1448
15:57:22.890501 IP bom07s10-in-f163.1e100.net.http > 10.0.0.222.46120: Flags [P.], seq 17530:17704, ack 1549, win 272, options [nop,nop,TS val 4294950521 ecr 4916249], length 174
15:57:22.893386 IP 10.0.0.222.46120 > bom07s10-in-f163.1e100.net.http: Flags [.], ack 14634, win 376, options [nop,nop,TS val 4916342 ecr 4294950521], length 0
15:57:22.893952 IP 10.0.0.222.46120 > bom07s10-in-f163.1e100.net.http: Flags [.], ack 16082, win 387, options [nop,nop,TS val 4916342 ecr 4294950521], length 0
15:57:22.895081 IP 10.0.0.222.46120 > bom07s10-in-f163.1e100.net.http: Flags [.], ack 17530, win 398, options [nop,nop,TS val 4916342 ecr 4294950521], length 0
15:57:22.895609 IP 10.0.0.222.46120 > bom07s10-in-f163.1e100.net.http: Flags [.], ack 17704, win 398, options [nop,nop,TS val 4916342 ecr 4294950521], length 0
15:57:23.041839 IP bom07s10-in-f163.1e100.net.http > 10.0.0.222.46122: Flags [P.], seq 1:1328, ack 732, win 249, options [nop,nop,TS val 4294950537 ecr 4916275], length 1327
15:57:23.043978 IP 10.0.0.222.46122 > bom07s10-in-f163.1e100.net.http: Flags [.], ack 1328, win 262, options [nop,nop,TS val 4916357 ecr 4294950537], length 0
15:57:23.071004 IP bom07s10-in-f163.1e100.net.http > 10.0.0.222.46122: Flags [.], seq 1328:2776, ack 732, win 249, options [nop,nop,TS val 4294950540 ecr 4916357], length 1448
15:57:23.071154 IP bom07s10-in-f163.1e100.net.http > 10.0.0.222.46122: Flags [.], seq 2776:4224, ack 732, win 249, options [nop,nop,TS val 4294950540 ecr 4916357], length 1448
15:57:23.071233 IP bom07s10-in-f163.1e100.net.http > 10.0.0.222.46122: Flags [.], seq 4224:5672, ack 732, win 249, options [nop,nop,TS val 4294950540 ecr 4916357], length 1448
15:57:23.071295 IP bom07s10-in-f163.1e100.net.http > 10.0.0.222.46122: Flags [.], seq 5672:7120, ack 732, win 249, options [nop,nop,TS val 4294950540 ecr 4916357], length 1448
15:57:23.071353 IP bom07s10-in-f163.1e100.net.http > 10.0.0.222.46122: Flags [.], seq 7120:8568, ack 732, win 249, options [nop,nop,TS val 4294950540 ecr 4916357], length 1448
15:57:23.071778 IP bom07s10-in-f163.1e100.net.http > 10.0.0.222.46122: Flags [P.], seq 8568:9416, ack 732, win 249, options [nop,nop,TS val 4294950540 ecr 4916357], length 848
15:57:23.073121 IP 10.0.0.222.46122 > bom07s10-in-f163.1e100.net.http: Flags [.], ack 2776, win 273, options [nop,nop,TS val 4916360 ecr 4294950540], length 0
15:57:23.073252 IP 10.0.0.222.46122 > bom07s10-in-f163.1e100.net.http: Flags [.], ack 4224, win 284, options [nop,nop,TS val 4916360 ecr 4294950540], length 0
15:57:23.074238 IP 10.0.0.222.46122 > bom07s10-in-f163.1e100.net.http: Flags [.], ack 5672, win 296, options [nop,nop,TS val 4916360 ecr 4294950540], length 0
15:57:23.074485 IP 10.0.0.222.46122 > bom07s10-in-f163.1e100.net.http: Flags [.], ack 7120, win 307, options [nop,nop,TS val 4916360 ecr 4294950540], length 0
15:57:23.074766 IP 10.0.0.222.46122 > bom07s10-in-f163.1e100.net.http: Flags [.], ack 8568, win 318, options [nop,nop,TS val 4916360 ecr 4294950540], length 0
15:57:23.075394 IP 10.0.0.222.46122 > bom07s10-in-f163.1e100.net.http: Flags [.], ack 9416, win 330, options [nop,nop,TS val 4916360 ecr 4294950540], length 0
15:57:23.147692 IP bom07s10-in-f163.1e100.net.http > 10.0.0.222.46122: Flags [.], seq 9416:10864, ack 732, win 249, options [nop,nop,TS val 4294950547 ecr 4916360], length 1448
15:57:23.147845 IP bom07s10-in-f163.1e100.net.http > 10.0.0.222.46122: Flags [.], seq 10864:12312, ack 732, win 249, options [nop,nop,TS val 4294950547 ecr 4916360], length 1448
15:57:23.148393 IP bom07s10-in-f163.1e100.net.http > 10.0.0.222.46122: Flags [P.], seq 12312:13460, ack 732, win 249, options [nop,nop,TS val 4294950547 ecr 4916360], length 1148
15:57:23.150011 IP 10.0.0.222.46122 > bom07s10-in-f163.1e100.net.http: Flags [.], ack 10864, win 341, options [nop,nop,TS val 4916367 ecr 4294950547], length 0
15:57:23.150172 IP 10.0.0.222.46122 > bom07s10-in-f163.1e100.net.http: Flags [.], ack 12312, win 352, options [nop,nop,TS val 4916367 ecr 4294950547], length 0
15:57:23.150297 IP 10.0.0.222.46122 > bom07s10-in-f163.1e100.net.http: Flags [.], ack 13460, win 364, options [nop,nop,TS val 4916367 ecr 4294950547], length 0
15:57:23.216054 IP bom07s10-in-f163.1e100.net.http > 10.0.0.222.46122: Flags [P.], seq 13460:14808, ack 732, win 249, options [nop,nop,TS val 4294950554 ecr 4916367], length 1348
15:57:23.218409 IP 10.0.0.222.46122 > bom07s10-in-f163.1e100.net.http: Flags [.], ack 14808, win 375, options [nop,nop,TS val 4916374 ecr 4294950554], length 0
15:57:23.235387 IP bom07s10-in-f163.1e100.net.http > 10.0.0.222.46123: Flags [.], seq 1:1449, ack 306, win 235, options [nop,nop,TS val 4294950556 ecr 4916282], length 1448
15:57:23.235550 IP bom07s10-in-f163.1e100.net.http > 10.0.0.222.46123: Flags [.], seq 1449:2897, ack 306, win 235, options [nop,nop,TS val 4294950556 ecr 4916282], length 1448
15:57:23.235623 IP bom07s10-in-f163.1e100.net.http > 10.0.0.222.46123: Flags [.], seq 2897:4345, ack 306, win 235, options [nop,nop,TS val 4294950556 ecr 4916282], length 1448
15:57:23.235677 IP bom07s10-in-f163.1e100.net.http > 10.0.0.222.46123: Flags [.], seq 4345:5793, ack 306, win 235, options [nop,nop,TS val 4294950556 ecr 4916282], length 1448
15:57:23.235734 IP bom07s10-in-f163.1e100.net.http > 10.0.0.222.46123: Flags [.], seq 5793:7241, ack 306, win 235, options [nop,nop,TS val 4294950556 ecr 4916282], length 1448
15:57:23.235793 IP bom07s10-in-f163.1e100.net.http > 10.0.0.222.46123: Flags [.], seq 7241:8689, ack 306, win 235, options [nop,nop,TS val 4294950556 ecr 4916282], length 1448
15:57:23.235849 IP bom07s10-in-f163.1e100.net.http > 10.0.0.222.46123: Flags [.], seq 8689:10137, ack 306, win 235, options [nop,nop,TS val 4294950556 ecr 4916282], length 1448
15:57:23.236160 IP bom07s10-in-f163.1e100.net.http > 10.0.0.222.46123: Flags [P.], seq 10137:10764, ack 306, win 235, options [nop,nop,TS val 4294950556 ecr 4916282], length 627
15:57:23.241729 IP 10.0.0.222.46123 > bom07s10-in-f163.1e100.net.http: Flags [.], ack 1449, win 263, options [nop,nop,TS val 4916376 ecr 4294950556], length 0
15:57:23.245531 IP 10.0.0.222.46123 > bom07s10-in-f163.1e100.net.http: Flags [.], ack 2897, win 274, options [nop,nop,TS val 4916377 ecr 4294950556], length 0
15:57:23.246478 IP 10.0.0.222.46123 > bom07s10-in-f163.1e100.net.http: Flags [.], ack 4345, win 285, options [nop,nop,TS val 4916377 ecr 4294950556], length 0
15:57:23.246995 IP 10.0.0.222.46123 > bom07s10-in-f163.1e100.net.http: Flags [.], ack 5793, win 297, options [nop,nop,TS val 4916377 ecr 4294950556], length 0
15:57:23.247519 IP 10.0.0.222.46123 > bom07s10-in-f163.1e100.net.http: Flags [.], ack 7241, win 308, options [nop,nop,TS val 4916377 ecr 4294950556], length 0
15:57:23.248143 IP 10.0.0.222.46123 > bom07s10-in-f163.1e100.net.http: Flags [.], ack 8689, win 319, options [nop,nop,TS val 4916377 ecr 4294950556], length 0
15:57:23.248936 IP 10.0.0.222.46123 > bom07s10-in-f163.1e100.net.http: Flags [.], ack 10137, win 331, options [nop,nop,TS val 4916377 ecr 4294950556], length 0
15:57:23.253052 IP 10.0.0.222.46123 > bom07s10-in-f163.1e100.net.http: Flags [.], ack 10764, win 342, options [nop,nop,TS val 4916378 ecr 4294950556], length 0
15:57:23.270165 IP bom07s10-in-f163.1e100.net.http > 10.0.0.222.46123: Flags [.], seq 10764:12212, ack 306, win 235, options [nop,nop,TS val 4294950559 ecr 4916378], length 1448
15:57:23.270983 IP bom07s10-in-f163.1e100.net.http > 10.0.0.222.46123: Flags [P.], seq 12212:13460, ack 306, win 235, options [nop,nop,TS val 4294950560 ecr 4916378], length 1248
15:57:23.272149 IP 10.0.0.222.46123 > bom07s10-in-f163.1e100.net.http: Flags [.], ack 12212, win 353, options [nop,nop,TS val 4916380 ecr 4294950559], length 0
15:57:23.272736 IP 10.0.0.222.46123 > bom07s10-in-f163.1e100.net.http: Flags [.], ack 13460, win 365, options [nop,nop,TS val 4916380 ecr 4294950560], length 0
15:57:23.357279 IP bom07s10-in-f163.1e100.net.http > 10.0.0.222.46122: Flags [.], seq 14808:16256, ack 732, win 249, options [nop,nop,TS val 4294950568 ecr 4916374], length 1448
15:57:23.357945 IP bom07s10-in-f163.1e100.net.http > 10.0.0.222.46122: Flags [P.], seq 16256:17600, ack 732, win 249, options [nop,nop,TS val 4294950568 ecr 4916374], length 1344
15:57:23.358787 IP 10.0.0.222.46122 > bom07s10-in-f163.1e100.net.http: Flags [.], ack 16256, win 386, options [nop,nop,TS val 4916388 ecr 4294950568], length 0
15:57:23.359244 IP 10.0.0.222.46122 > bom07s10-in-f163.1e100.net.http: Flags [.], ack 17600, win 398, options [nop,nop,TS val 4916388 ecr 4294950568], length 0
15:57:23.363277 IP bom07s10-in-f163.1e100.net.http > 10.0.0.222.46123: Flags [P.], seq 13460:14808, ack 306, win 235, options [nop,nop,TS val 4294950569 ecr 4916380], length 1348
15:57:23.364651 IP 10.0.0.222.46123 > bom07s10-in-f163.1e100.net.http: Flags [.], ack 14808, win 376, options [nop,nop,TS val 4916389 ecr 4294950569], length 0
15:57:23.453520 IP bom07s10-in-f163.1e100.net.http > 10.0.0.222.46123: Flags [.], seq 14808:16256, ack 306, win 235, options [nop,nop,TS val 4294950578 ecr 4916389], length 1448
15:57:23.453659 IP bom07s10-in-f163.1e100.net.http > 10.0.0.222.46123: Flags [.], seq 16256:17704, ack 306, win 235, options [nop,nop,TS val 4294950578 ecr 4916389], length 1448
15:57:23.453749 IP bom07s10-in-f163.1e100.net.http > 10.0.0.222.46123: Flags [.], seq 17704:19152, ack 306, win 235, options [nop,nop,TS val 4294950578 ecr 4916389], length 1448
15:57:23.454529 IP bom07s10-in-f163.1e100.net.http > 10.0.0.222.46123: Flags [P.], seq 19152:19658, ack 306, win 235, options [nop,nop,TS val 4294950578 ecr 4916389], length 506
15:57:23.455690 IP 10.0.0.222.46123 > bom07s10-in-f163.1e100.net.http: Flags [.], ack 16256, win 387, options [nop,nop,TS val 4916398 ecr 4294950578], length 0
15:57:23.455940 IP 10.0.0.222.46123 > bom07s10-in-f163.1e100.net.http: Flags [.], ack 17704, win 398, options [nop,nop,TS val 4916398 ecr 4294950578], length 0
15:57:23.456295 IP 10.0.0.222.46123 > bom07s10-in-f163.1e100.net.http: Flags [.], ack 19152, win 410, options [nop,nop,TS val 4916398 ecr 4294950578], length 0
15:57:23.457582 IP 10.0.0.222.46123 > bom07s10-in-f163.1e100.net.http: Flags [.], ack 19658, win 421, options [nop,nop,TS val 4916398 ecr 4294950578], length 0
15:57:23.585614 ARP, Reply pi is-at 00:1e:a6:6a:7f:72 (oui Unknown), length 28
15:57:23.772061 IP bom07s10-in-f163.1e100.net.http > 10.0.0.222.46121: Flags [.], seq 1:1449, ack 822, win 249, options [nop,nop,TS val 4294950610 ecr 4916266], length 1448
15:57:23.772227 IP bom07s10-in-f163.1e100.net.http > 10.0.0.222.46121: Flags [.], seq 1449:2897, ack 822, win 249, options [nop,nop,TS val 4294950610 ecr 4916266], length 1448
15:57:23.772320 IP bom07s10-in-f163.1e100.net.http > 10.0.0.222.46121: Flags [.], seq 2897:4345, ack 822, win 249, options [nop,nop,TS val 4294950610 ecr 4916266], length 1448
15:57:23.772379 IP bom07s10-in-f163.1e100.net.http > 10.0.0.222.46121: Flags [.], seq 4345:5793, ack 822, win 249, options [nop,nop,TS val 4294950610 ecr 4916266], length 1448
15:57:23.772435 IP bom07s10-in-f163.1e100.net.http > 10.0.0.222.46121: Flags [.], seq 5793:7241, ack 822, win 249, options [nop,nop,TS val 4294950610 ecr 4916266], length 1448
15:57:23.772483 IP bom07s10-in-f163.1e100.net.http > 10.0.0.222.46121: Flags [.], seq 7241:8689, ack 822, win 249, options [nop,nop,TS val 4294950610 ecr 4916266], length 1448
15:57:23.772537 IP bom07s10-in-f163.1e100.net.http > 10.0.0.222.46121: Flags [.], seq 8689:10137, ack 822, win 249, options [nop,nop,TS val 4294950610 ecr 4916266], length 1448
15:57:23.772589 IP bom07s10-in-f163.1e100.net.http > 10.0.0.222.46121: Flags [.], seq 10137:11585, ack 822, win 249, options [nop,nop,TS val 4294950610 ecr 4916266], length 1448
15:57:23.772660 IP bom07s10-in-f163.1e100.net.http > 10.0.0.222.46121: Flags [.], seq 11585:13033, ack 822, win 249, options [nop,nop,TS val 4294950610 ecr 4916266], length 1448
15:57:23.772712 IP bom07s10-in-f163.1e100.net.http > 10.0.0.222.46121: Flags [.], seq 13033:14481, ack 822, win 249, options [nop,nop,TS val 4294950610 ecr 4916266], length 1448
15:57:23.776231 IP 10.0.0.222.46121 > bom07s10-in-f163.1e100.net.http: Flags [.], ack 1449, win 263, options [nop,nop,TS val 4916430 ecr 4294950610], length 0
15:57:23.776411 IP bom07s10-in-f163.1e100.net.http > 10.0.0.222.46121: Flags [.], seq 14481:15929, ack 822, win 249, options [nop,nop,TS val 4294950610 ecr 4916430], length 1448
15:57:23.776496 IP bom07s10-in-f163.1e100.net.http > 10.0.0.222.46121: Flags [.], seq 15929:17377, ack 822, win 249, options [nop,nop,TS val 4294950610 ecr 4916430], length 1448
15:57:23.778661 IP 10.0.0.222.46121 > bom07s10-in-f163.1e100.net.http: Flags [.], ack 2897, win 274, options [nop,nop,TS val 4916430 ecr 4294950610], length 0
15:57:23.778812 IP bom07s10-in-f163.1e100.net.http > 10.0.0.222.46121: Flags [.], seq 17377:18825, ack 822, win 249, options [nop,nop,TS val 4294950610 ecr 4916430], length 1448
15:57:23.778904 IP bom07s10-in-f163.1e100.net.http > 10.0.0.222.46121: Flags [.], seq 18825:20273, ack 822, win 249, options [nop,nop,TS val 4294950610 ecr 4916430], length 1448
15:57:23.787656 IP 10.0.0.222.46121 > bom07s10-in-f163.1e100.net.http: Flags [.], ack 4345, win 285, options [nop,nop,TS val 4916430 ecr 4294950610], length 0
15:57:23.787812 IP bom07s10-in-f163.1e100.net.http > 10.0.0.222.46121: Flags [.], seq 20273:21721, ack 822, win 249, options [nop,nop,TS val 4294950611 ecr 4916430], length 1448
15:57:23.787910 IP bom07s10-in-f163.1e100.net.http > 10.0.0.222.46121: Flags [.], seq 21721:23169, ack 822, win 249, options [nop,nop,TS val 4294950611 ecr 4916430], length 1448
15:57:23.787971 IP 10.0.0.222.46121 > bom07s10-in-f163.1e100.net.http: Flags [.], ack 5793, win 297, options [nop,nop,TS val 4916431 ecr 4294950610], length 0
15:57:23.788045 IP bom07s10-in-f163.1e100.net.http > 10.0.0.222.46121: Flags [.], seq 23169:24617, ack 822, win 249, options [nop,nop,TS val 4294950611 ecr 4916431], length 1448
15:57:23.788086 IP bom07s10-in-f163.1e100.net.http > 10.0.0.222.46121: Flags [.], seq 24617:26065, ack 822, win 249, options [nop,nop,TS val 4294950611 ecr 4916431], length 1448
15:57:23.789103 IP 10.0.0.222.46121 > bom07s10-in-f163.1e100.net.http: Flags [.], ack 7241, win 308, options [nop,nop,TS val 4916431 ecr 4294950610], length 0
15:57:23.789238 IP bom07s10-in-f163.1e100.net.http > 10.0.0.222.46121: Flags [.], seq 26065:27513, ack 822, win 249, options [nop,nop,TS val 4294950611 ecr 4916431], length 1448
15:57:23.789424 IP 10.0.0.222.46121 > bom07s10-in-f163.1e100.net.http: Flags [.], ack 8689, win 319, options [nop,nop,TS val 4916431 ecr 4294950610], length 0
15:57:23.789731 IP bom07s10-in-f163.1e100.net.http > 10.0.0.222.46121: Flags [P.], seq 27513:28961, ack 822, win 249, options [nop,nop,TS val 4294950611 ecr 4916431], length 1448
15:57:23.789905 IP 10.0.0.222.46121 > bom07s10-in-f163.1e100.net.http: Flags [.], ack 10137, win 331, options [nop,nop,TS val 4916431 ecr 4294950610], length 0
15:57:23.790076 IP 10.0.0.222.46121 > bom07s10-in-f163.1e100.net.http: Flags [.], ack 11585, win 342, options [nop,nop,TS val 4916431 ecr 4294950610], length 0
15:57:23.790727 IP bom07s10-in-f163.1e100.net.http > 10.0.0.222.46121: Flags [.], seq 28961:30409, ack 822, win 249, options [nop,nop,TS val 4294950611 ecr 4916431], length 1448
15:57:23.790859 IP 10.0.0.222.46121 > bom07s10-in-f163.1e100.net.http: Flags [.], ack 13033, win 353, options [nop,nop,TS val 4916431 ecr 4294950610], length 0
15:57:23.791234 IP bom07s10-in-f163.1e100.net.http > 10.0.0.222.46121: Flags [.], seq 30409:31857, ack 822, win 249, options [nop,nop,TS val 4294950612 ecr 4916431], length 1448
15:57:23.791730 IP bom07s10-in-f163.1e100.net.http > 10.0.0.222.46121: Flags [.], seq 31857:33305, ack 822, win 249, options [nop,nop,TS val 4294950612 ecr 4916431], length 1448
15:57:23.792227 IP bom07s10-in-f163.1e100.net.http > 10.0.0.222.46121: Flags [.], seq 33305:34753, ack 822, win 249, options [nop,nop,TS val 4294950612 ecr 4916431], length 1448
15:57:23.792725 IP bom07s10-in-f163.1e100.net.http > 10.0.0.222.46121: Flags [.], seq 34753:36201, ack 822, win 249, options [nop,nop,TS val 4294950612 ecr 4916431], length 1448
15:57:23.793350 IP bom07s10-in-f163.1e100.net.http > 10.0.0.222.46121: Flags [.], seq 36201:37649, ack 822, win 249, options [nop,nop,TS val 4294950612 ecr 4916431], length 1448
15:57:23.793716 IP bom07s10-in-f163.1e100.net.http > 10.0.0.222.46121: Flags [.], seq 37649:39097, ack 822, win 249, options [nop,nop,TS val 4294950612 ecr 4916431], length 1448
15:57:23.794226 IP bom07s10-in-f163.1e100.net.http > 10.0.0.222.46121: Flags [.], seq 39097:40545, ack 822, win 249, options [nop,nop,TS val 4294950612 ecr 4916431], length 1448
15:57:23.798984 IP 10.0.0.222.46121 > bom07s10-in-f163.1e100.net.http: Flags [.], ack 14481, win 365, options [nop,nop,TS val 4916432 ecr 4294950610], length 0
15:57:23.799139 IP bom07s10-in-f163.1e100.net.http > 10.0.0.222.46121: Flags [.], seq 40545:41993, ack 822, win 249, options [nop,nop,TS val 4294950612 ecr 4916432], length 1448
15:57:23.799242 IP bom07s10-in-f163.1e100.net.http > 10.0.0.222.46121: Flags [.], seq 41993:43441, ack 822, win 249, options [nop,nop,TS val 4294950612 ecr 4916432], length 1448
15:57:23.799305 IP 10.0.0.222.46121 > bom07s10-in-f163.1e100.net.http: Flags [.], ack 15929, win 376, options [nop,nop,TS val 4916432 ecr 4294950610], length 0
15:57:23.799380 IP 10.0.0.222.46121 > bom07s10-in-f163.1e100.net.http: Flags [.], ack 17377, win 387, options [nop,nop,TS val 4916432 ecr 4294950610], length 0
15:57:23.799512 IP 10.0.0.222.46121 > bom07s10-in-f163.1e100.net.http: Flags [.], ack 18825, win 398, options [nop,nop,TS val 4916432 ecr 4294950610], length 0
15:57:23.799602 IP 10.0.0.222.46121 > bom07s10-in-f163.1e100.net.http: Flags [.], ack 20273, win 410, options [nop,nop,TS val 4916432 ecr 4294950610], length 0
15:57:23.799686 IP 10.0.0.222.46121 > bom07s10-in-f163.1e100.net.http: Flags [.], ack 21721, win 421, options [nop,nop,TS val 4916432 ecr 4294950611], length 0
15:57:23.799790 IP 10.0.0.222.46121 > bom07s10-in-f163.1e100.net.http: Flags [.], ack 23169, win 432, options [nop,nop,TS val 4916432 ecr 4294950611], length 0
15:57:23.799843 IP bom07s10-in-f163.1e100.net.http > 10.0.0.222.46121: Flags [.], seq 43441:44889, ack 822, win 249, options [nop,nop,TS val 4294950612 ecr 4916432], length 1448
15:57:23.799996 IP 10.0.0.222.46121 > bom07s10-in-f163.1e100.net.http: Flags [.], ack 24617, win 444, options [nop,nop,TS val 4916432 ecr 4294950611], length 0
15:57:23.800185 IP 10.0.0.222.46121 > bom07s10-in-f163.1e100.net.http: Flags [.], ack 26065, win 455, options [nop,nop,TS val 4916432 ecr 4294950611], length 0
15:57:23.800389 IP 10.0.0.222.46121 > bom07s10-in-f163.1e100.net.http: Flags [.], ack 27513, win 466, options [nop,nop,TS val 4916432 ecr 4294950611], length 0
15:57:23.800880 IP 10.0.0.222.46121 > bom07s10-in-f163.1e100.net.http: Flags [.], ack 28961, win 478, options [nop,nop,TS val 4916432 ecr 4294950611], length 0
15:57:23.800992 IP 10.0.0.222.46121 > bom07s10-in-f163.1e100.net.http: Flags [.], ack 30409, win 489, options [nop,nop,TS val 4916432 ecr 4294950611], length 0
15:57:23.801258 IP 10.0.0.222.46121 > bom07s10-in-f163.1e100.net.http: Flags [.], ack 31857, win 500, options [nop,nop,TS val 4916432 ecr 4294950612], length 0
15:57:23.801367 IP 10.0.0.222.46121 > bom07s10-in-f163.1e100.net.http: Flags [.], ack 33305, win 512, options [nop,nop,TS val 4916432 ecr 4294950612], length 0
15:57:23.801482 IP 10.0.0.222.46121 > bom07s10-in-f163.1e100.net.http: Flags [.], ack 34753, win 523, options [nop,nop,TS val 4916432 ecr 4294950612], length 0
15:57:23.802385 IP 10.0.0.222.46121 > bom07s10-in-f163.1e100.net.http: Flags [.], ack 36201, win 534, options [nop,nop,TS val 4916432 ecr 4294950612], length 0
15:57:23.802499 IP 10.0.0.222.46121 > bom07s10-in-f163.1e100.net.http: Flags [.], ack 37649, win 546, options [nop,nop,TS val 4916432 ecr 4294950612], length 0
15:57:23.802567 IP 10.0.0.222.46121 > bom07s10-in-f163.1e100.net.http: Flags [.], ack 39097, win 557, options [nop,nop,TS val 4916432 ecr 4294950612], length 0
15:57:23.802607 IP 10.0.0.222.46121 > bom07s10-in-f163.1e100.net.http: Flags [.], ack 40545, win 568, options [nop,nop,TS val 4916432 ecr 4294950612], length 0
15:57:23.802694 IP bom07s10-in-f163.1e100.net.http > 10.0.0.222.46121: Flags [.], seq 44889:46337, ack 822, win 249, options [nop,nop,TS val 4294950613 ecr 4916432], length 1448
15:57:23.802869 IP bom07s10-in-f163.1e100.net.http > 10.0.0.222.46121: Flags [.], seq 46337:47785, ack 822, win 249, options [nop,nop,TS val 4294950613 ecr 4916432], length 1448
15:57:23.803358 IP bom07s10-in-f163.1e100.net.http > 10.0.0.222.46121: Flags [.], seq 47785:49233, ack 822, win 249, options [nop,nop,TS val 4294950613 ecr 4916432], length 1448
15:57:23.803852 IP bom07s10-in-f163.1e100.net.http > 10.0.0.222.46121: Flags [.], seq 49233:50681, ack 822, win 249, options [nop,nop,TS val 4294950613 ecr 4916432], length 1448
15:57:23.804345 IP bom07s10-in-f163.1e100.net.http > 10.0.0.222.46121: Flags [.], seq 50681:52129, ack 822, win 249, options [nop,nop,TS val 4294950613 ecr 4916432], length 1448
15:57:23.804846 IP bom07s10-in-f163.1e100.net.http > 10.0.0.222.46121: Flags [.], seq 52129:53577, ack 822, win 249, options [nop,nop,TS val 4294950613 ecr 4916432], length 1448
15:57:23.805342 IP bom07s10-in-f163.1e100.net.http > 10.0.0.222.46121: Flags [P.], seq 53577:55025, ack 822, win 249, options [nop,nop,TS val 4294950613 ecr 4916432], length 1448
15:57:23.805844 IP bom07s10-in-f163.1e100.net.http > 10.0.0.222.46121: Flags [.], seq 55025:56473, ack 822, win 249, options [nop,nop,TS val 4294950613 ecr 4916432], length 1448
15:57:23.806477 IP bom07s10-in-f163.1e100.net.http > 10.0.0.222.46121: Flags [.], seq 56473:57921, ack 822, win 249, options [nop,nop,TS val 4294950613 ecr 4916432], length 1448
15:57:23.806634 IP 10.0.0.222.46121 > bom07s10-in-f163.1e100.net.http: Flags [.], ack 41993, win 579, options [nop,nop,TS val 4916433 ecr 4294950612], length 0
15:57:23.806988 IP bom07s10-in-f163.1e100.net.http > 10.0.0.222.46121: Flags [.], seq 57921:59369, ack 822, win 249, options [nop,nop,TS val 4294950613 ecr 4916433], length 1448
15:57:23.807247 IP 10.0.0.222.46121 > bom07s10-in-f163.1e100.net.http: Flags [.], ack 43441, win 591, options [nop,nop,TS val 4916433 ecr 4294950612], length 0
15:57:23.807630 IP bom07s10-in-f163.1e100.net.http > 10.0.0.222.46121: Flags [.], seq 59369:60817, ack 822, win 249, options [nop,nop,TS val 4294950613 ecr 4916433], length 1448
15:57:23.807801 IP 10.0.0.222.46121 > bom07s10-in-f163.1e100.net.http: Flags [.], ack 44889, win 602, options [nop,nop,TS val 4916433 ecr 4294950612], length 0
15:57:23.808085 IP 10.0.0.222.46121 > bom07s10-in-f163.1e100.net.http: Flags [.], ack 46337, win 613, options [nop,nop,TS val 4916433 ecr 4294950613], length 0
15:57:23.808484 IP bom07s10-in-f163.1e100.net.http > 10.0.0.222.46121: Flags [.], seq 60817:62265, ack 822, win 249, options [nop,nop,TS val 4294950613 ecr 4916433], length 1448
15:57:23.808704 IP 10.0.0.222.46121 > bom07s10-in-f163.1e100.net.http: Flags [.], ack 47785, win 625, options [nop,nop,TS val 4916433 ecr 4294950613], length 0
15:57:23.808928 IP 10.0.0.222.46121 > bom07s10-in-f163.1e100.net.http: Flags [.], ack 49233, win 636, options [nop,nop,TS val 4916433 ecr 4294950613], length 0
15:57:23.809353 IP bom07s10-in-f163.1e100.net.http > 10.0.0.222.46121: Flags [.], seq 62265:63713, ack 822, win 249, options [nop,nop,TS val 4294950613 ecr 4916433], length 1448
15:57:23.809576 IP 10.0.0.222.46121 > bom07s10-in-f163.1e100.net.http: Flags [.], ack 50681, win 647, options [nop,nop,TS val 4916433 ecr 4294950613], length 0
15:57:23.809826 IP 10.0.0.222.46121 > bom07s10-in-f163.1e100.net.http: Flags [.], ack 52129, win 659, options [nop,nop,TS val 4916433 ecr 4294950613], length 0
15:57:23.810230 IP bom07s10-in-f163.1e100.net.http > 10.0.0.222.46121: Flags [.], seq 63713:65161, ack 822, win 249, options [nop,nop,TS val 4294950613 ecr 4916433], length 1448
15:57:23.810453 IP 10.0.0.222.46121 > bom07s10-in-f163.1e100.net.http: Flags [.], ack 53577, win 670, options [nop,nop,TS val 4916433 ecr 4294950613], length 0
15:57:23.810785 IP 10.0.0.222.46121 > bom07s10-in-f163.1e100.net.http: Flags [.], ack 55025, win 681, options [nop,nop,TS val 4916433 ecr 4294950613], length 0
15:57:23.811108 IP bom07s10-in-f163.1e100.net.http > 10.0.0.222.46121: Flags [.], seq 65161:66609, ack 822, win 249, options [nop,nop,TS val 4294950614 ecr 4916433], length 1448
15:57:23.811328 IP 10.0.0.222.46121 > bom07s10-in-f163.1e100.net.http: Flags [.], ack 56473, win 693, options [nop,nop,TS val 4916433 ecr 4294950613], length 0
15:57:23.811415 IP bom07s10-in-f163.1e100.net.http > 10.0.0.222.46121: Flags [.], seq 66609:68057, ack 822, win 249, options [nop,nop,TS val 4294950614 ecr 4916433], length 1448
15:57:23.811873 IP bom07s10-in-f163.1e100.net.http > 10.0.0.222.46121: Flags [.], seq 68057:69505, ack 822, win 249, options [nop,nop,TS val 4294950614 ecr 4916433], length 1448
15:57:23.812060 IP 10.0.0.222.46121 > bom07s10-in-f163.1e100.net.http: Flags [.], ack 57921, win 704, options [nop,nop,TS val 4916434 ecr 4294950613], length 0
15:57:23.812310 IP 10.0.0.222.46121 > bom07s10-in-f163.1e100.net.http: Flags [.], ack 59369, win 715, options [nop,nop,TS val 4916434 ecr 4294950613], length 0
15:57:23.812728 IP bom07s10-in-f163.1e100.net.http > 10.0.0.222.46121: Flags [.], seq 69505:70953, ack 822, win 249, options [nop,nop,TS val 4294950614 ecr 4916434], length 1448
15:57:23.812879 IP 10.0.0.222.46121 > bom07s10-in-f163.1e100.net.http: Flags [.], ack 60817, win 727, options [nop,nop,TS val 4916434 ecr 4294950613], length 0
15:57:23.813318 IP 10.0.0.222.46121 > bom07s10-in-f163.1e100.net.http: Flags [.], ack 62265, win 738, options [nop,nop,TS val 4916434 ecr 4294950613], length 0
15:57:23.813379 IP 10.0.0.222.46121 > bom07s10-in-f163.1e100.net.http: Flags [.], ack 63713, win 749, options [nop,nop,TS val 4916434 ecr 4294950613], length 0
15:57:23.815419 IP 10.0.0.222.46121 > bom07s10-in-f163.1e100.net.http: Flags [.], ack 65161, win 760, options [nop,nop,TS val 4916434 ecr 4294950613], length 0
15:57:23.816005 IP bom07s10-in-f163.1e100.net.http > 10.0.0.222.46121: Flags [.], seq 70953:72401, ack 822, win 249, options [nop,nop,TS val 4294950614 ecr 4916434], length 1448
15:57:23.816600 IP bom07s10-in-f163.1e100.net.http > 10.0.0.222.46121: Flags [.], seq 72401:73849, ack 822, win 249, options [nop,nop,TS val 4294950614 ecr 4916434], length 1448
15:57:23.816756 IP 10.0.0.222.46121 > bom07s10-in-f163.1e100.net.http: Flags [.], ack 66609, win 772, options [nop,nop,TS val 4916434 ecr 4294950614], length 0
15:57:23.817229 IP bom07s10-in-f163.1e100.net.http > 10.0.0.222.46121: Flags [.], seq 73849:75297, ack 822, win 249, options [nop,nop,TS val 4294950614 ecr 4916434], length 1448
15:57:23.817718 IP bom07s10-in-f163.1e100.net.http > 10.0.0.222.46121: Flags [.], seq 75297:76745, ack 822, win 249, options [nop,nop,TS val 4294950614 ecr 4916434], length 1448
15:57:23.817881 IP 10.0.0.222.46121 > bom07s10-in-f163.1e100.net.http: Flags [.], ack 68057, win 783, options [nop,nop,TS val 4916434 ecr 4294950614], length 0
15:57:23.818130 IP 10.0.0.222.46121 > bom07s10-in-f163.1e100.net.http: Flags [.], ack 69505, win 794, options [nop,nop,TS val 4916434 ecr 4294950614], length 0
15:57:23.818599 IP bom07s10-in-f163.1e100.net.http > 10.0.0.222.46121: Flags [.], seq 76745:78193, ack 822, win 249, options [nop,nop,TS val 4294950614 ecr 4916434], length 1448
15:57:23.819230 IP bom07s10-in-f163.1e100.net.http > 10.0.0.222.46121: Flags [.], seq 78193:79641, ack 822, win 249, options [nop,nop,TS val 4294950614 ecr 4916434], length 1448
15:57:23.819718 IP bom07s10-in-f163.1e100.net.http > 10.0.0.222.46121: Flags [.], seq 79641:81089, ack 822, win 249, options [nop,nop,TS val 4294950614 ecr 4916434], length 1448
15:57:23.820222 IP bom07s10-in-f163.1e100.net.http > 10.0.0.222.46121: Flags [.], seq 81089:82537, ack 822, win 249, options [nop,nop,TS val 4294950614 ecr 4916434], length 1448
15:57:23.820721 IP bom07s10-in-f163.1e100.net.http > 10.0.0.222.46121: Flags [.], seq 82537:83985, ack 822, win 249, options [nop,nop,TS val 4294950614 ecr 4916434], length 1448
15:57:23.821366 IP bom07s10-in-f163.1e100.net.http > 10.0.0.222.46121: Flags [.], seq 83985:85433, ack 822, win 249, options [nop,nop,TS val 4294950615 ecr 4916434], length 1448
15:57:23.821842 IP bom07s10-in-f163.1e100.net.http > 10.0.0.222.46121: Flags [.], seq 85433:86881, ack 822, win 249, options [nop,nop,TS val 4294950615 ecr 4916434], length 1448
15:57:23.822351 IP bom07s10-in-f163.1e100.net.http > 10.0.0.222.46121: Flags [.], seq 86881:88329, ack 822, win 249, options [nop,nop,TS val 4294950615 ecr 4916434], length 1448
15:57:23.822852 IP bom07s10-in-f163.1e100.net.http > 10.0.0.222.46121: Flags [.], seq 88329:89777, ack 822, win 249, options [nop,nop,TS val 4294950615 ecr 4916434], length 1448
15:57:23.823351 IP bom07s10-in-f163.1e100.net.http > 10.0.0.222.46121: Flags [P.], seq 89777:91225, ack 822, win 249, options [nop,nop,TS val 4294950615 ecr 4916434], length 1448
15:57:23.823984 IP bom07s10-in-f163.1e100.net.http > 10.0.0.222.46121: Flags [.], seq 91225:92673, ack 822, win 249, options [nop,nop,TS val 4294950615 ecr 4916434], length 1448
15:57:23.824342 IP bom07s10-in-f163.1e100.net.http > 10.0.0.222.46121: Flags [.], seq 92673:94121, ack 822, win 249, options [nop,nop,TS val 4294950615 ecr 4916434], length 1448
15:57:23.824968 IP bom07s10-in-f163.1e100.net.http > 10.0.0.222.46121: Flags [.], seq 94121:95569, ack 822, win 249, options [nop,nop,TS val 4294950615 ecr 4916434], length 1448
15:57:23.825348 IP bom07s10-in-f163.1e100.net.http > 10.0.0.222.46121: Flags [.], seq 95569:97017, ack 822, win 249, options [nop,nop,TS val 4294950615 ecr 4916434], length 1448
15:57:23.825846 IP bom07s10-in-f163.1e100.net.http > 10.0.0.222.46121: Flags [.], seq 97017:98465, ack 822, win 249, options [nop,nop,TS val 4294950615 ecr 4916434], length 1448
15:57:23.826469 IP bom07s10-in-f163.1e100.net.http > 10.0.0.222.46121: Flags [.], seq 98465:99913, ack 822, win 249, options [nop,nop,TS val 4294950615 ecr 4916434], length 1448
15:57:23.826970 IP bom07s10-in-f163.1e100.net.http > 10.0.0.222.46121: Flags [.], seq 99913:101361, ack 822, win 249, options [nop,nop,TS val 4294950615 ecr 4916434], length 1448
15:57:23.827483 IP bom07s10-in-f163.1e100.net.http > 10.0.0.222.46121: Flags [.], seq 101361:102809, ack 822, win 249, options [nop,nop,TS val 4294950615 ecr 4916434], length 1448
15:57:23.827976 IP bom07s10-in-f163.1e100.net.http > 10.0.0.222.46121: Flags [.], seq 102809:104257, ack 822, win 249, options [nop,nop,TS val 4294950615 ecr 4916434], length 1448
15:57:23.828474 IP bom07s10-in-f163.1e100.net.http > 10.0.0.222.46121: Flags [.], seq 104257:105705, ack 822, win 249, options [nop,nop,TS val 4294950615 ecr 4916434], length 1448
15:57:23.829100 IP bom07s10-in-f163.1e100.net.http > 10.0.0.222.46121: Flags [.], seq 105705:107153, ack 822, win 249, options [nop,nop,TS val 4294950615 ecr 4916434], length 1448
15:57:23.829594 IP bom07s10-in-f163.1e100.net.http > 10.0.0.222.46121: Flags [.], seq 107153:108601, ack 822, win 249, options [nop,nop,TS val 4294950615 ecr 4916434], length 1448
15:57:23.830098 IP bom07s10-in-f163.1e100.net.http > 10.0.0.222.46121: Flags [.], seq 108601:110049, ack 822, win 249, options [nop,nop,TS val 4294950615 ecr 4916434], length 1448
15:57:23.830541 IP 10.0.0.222.46121 > bom07s10-in-f163.1e100.net.http: Flags [.], ack 70953, win 806, options [nop,nop,TS val 4916435 ecr 4294950614], length 0
15:57:23.831128 IP 10.0.0.222.46121 > bom07s10-in-f163.1e100.net.http: Flags [.], ack 72401, win 817, options [nop,nop,TS val 4916435 ecr 4294950614], length 0
15:57:23.831516 IP bom07s10-in-f163.1e100.net.http > 10.0.0.222.46121: Flags [.], seq 110049:111497, ack 822, win 249, options [nop,nop,TS val 4294950616 ecr 4916435], length 1448
15:57:23.832120 IP bom07s10-in-f163.1e100.net.http > 10.0.0.222.46121: Flags [.], seq 111497:112945, ack 822, win 249, options [nop,nop,TS val 4294950616 ecr 4916435], length 1448
15:57:23.832609 IP bom07s10-in-f163.1e100.net.http > 10.0.0.222.46121: Flags [.], seq 112945:114393, ack 822, win 249, options [nop,nop,TS val 4294950616 ecr 4916435], length 1448
15:57:23.834822 IP 10.0.0.222.46121 > bom07s10-in-f163.1e100.net.http: Flags [.], ack 73849, win 828, options [nop,nop,TS val 4916436 ecr 4294950614], length 0
15:57:23.834949 IP bom07s10-in-f163.1e100.net.http > 10.0.0.222.46121: Flags [.], seq 114393:115841, ack 822, win 249, options [nop,nop,TS val 4294950616 ecr 4916436], length 1448
15:57:23.836610 IP 10.0.0.222.46121 > bom07s10-in-f163.1e100.net.http: Flags [.], ack 75297, win 840, options [nop,nop,TS val 4916436 ecr 4294950614], length 0
15:57:23.836739 IP bom07s10-in-f163.1e100.net.http > 10.0.0.222.46121: Flags [.], seq 115841:117289, ack 822, win 249, options [nop,nop,TS val 4294950616 ecr 4916436], length 1448
15:57:23.842059 IP 10.0.0.222.46121 > bom07s10-in-f163.1e100.net.http: Flags [.], ack 76745, win 851, options [nop,nop,TS val 4916437 ecr 4294950614], length 0
15:57:23.842202 IP bom07s10-in-f163.1e100.net.http > 10.0.0.222.46121: Flags [.], seq 117289:118737, ack 822, win 249, options [nop,nop,TS val 4294950617 ecr 4916437], length 1448
15:57:23.849100 IP 10.0.0.222.46121 > bom07s10-in-f163.1e100.net.http: Flags [.], ack 78193, win 862, options [nop,nop,TS val 4916437 ecr 4294950614], length 0
15:57:23.849254 IP bom07s10-in-f163.1e100.net.http > 10.0.0.222.46121: Flags [.], seq 118737:120185, ack 822, win 249, options [nop,nop,TS val 4294950617 ecr 4916437], length 1448
15:57:23.849456 IP 10.0.0.222.46121 > bom07s10-in-f163.1e100.net.http: Flags [.], ack 79641, win 874, options [nop,nop,TS val 4916437 ecr 4294950614], length 0
15:57:23.849549 IP bom07s10-in-f163.1e100.net.http > 10.0.0.222.46121: Flags [.], seq 120185:121633, ack 822, win 249, options [nop,nop,TS val 4294950617 ecr 4916437], length 1448
15:57:23.849720 IP 10.0.0.222.46121 > bom07s10-in-f163.1e100.net.http: Flags [.], ack 81089, win 885, options [nop,nop,TS val 4916437 ecr 4294950614], length 0
15:57:23.850341 IP 10.0.0.222.46121 > bom07s10-in-f163.1e100.net.http: Flags [.], ack 82537, win 896, options [nop,nop,TS val 4916437 ecr 4294950614], length 0
15:57:23.850588 IP 10.0.0.222.46121 > bom07s10-in-f163.1e100.net.http: Flags [.], ack 83985, win 908, options [nop,nop,TS val 4916437 ecr 4294950614], length 0
15:57:23.851134 IP 10.0.0.222.46121 > bom07s10-in-f163.1e100.net.http: Flags [.], ack 85433, win 919, options [nop,nop,TS val 4916437 ecr 4294950615], length 0
15:57:23.851361 IP 10.0.0.222.46121 > bom07s10-in-f163.1e100.net.http: Flags [.], ack 86881, win 930, options [nop,nop,TS val 4916437 ecr 4294950615], length 0
15:57:23.851873 IP bom07s10-in-f163.1e100.net.http > 10.0.0.222.46121: Flags [.], seq 121633:123081, ack 822, win 249, options [nop,nop,TS val 4294950618 ecr 4916437], length 1448
15:57:23.852479 IP bom07s10-in-f163.1e100.net.http > 10.0.0.222.46121: Flags [.], seq 123081:124529, ack 822, win 249, options [nop,nop,TS val 4294950618 ecr 4916437], length 1448
15:57:23.852847 IP bom07s10-in-f163.1e100.net.http > 10.0.0.222.46121: Flags [P.], seq 124529:125977, ack 822, win 249, options [nop,nop,TS val 4294950618 ecr 4916437], length 1448
15:57:23.853358 IP bom07s10-in-f163.1e100.net.http > 10.0.0.222.46121: Flags [.], seq 125977:127425, ack 822, win 249, options [nop,nop,TS val 4294950618 ecr 4916437], length 1448
15:57:23.853852 IP bom07s10-in-f163.1e100.net.http > 10.0.0.222.46121: Flags [.], seq 127425:128873, ack 822, win 249, options [nop,nop,TS val 4294950618 ecr 4916437], length 1448
15:57:23.854056 IP 10.0.0.222.46121 > bom07s10-in-f163.1e100.net.http: Flags [.], ack 88329, win 941, options [nop,nop,TS val 4916438 ecr 4294950615], length 0
15:57:23.854493 IP bom07s10-in-f163.1e100.net.http > 10.0.0.222.46121: Flags [.], seq 128873:130321, ack 822, win 249, options [nop,nop,TS val 4294950618 ecr 4916438], length 1448
15:57:23.854676 IP 10.0.0.222.46121 > bom07s10-in-f163.1e100.net.http: Flags [.], ack 89777, win 953, options [nop,nop,TS val 4916438 ecr 4294950615], length 0
15:57:23.854914 IP 10.0.0.222.46121 > bom07s10-in-f163.1e100.net.http: Flags [.], ack 91225, win 964, options [nop,nop,TS val 4916438 ecr 4294950615], length 0
15:57:23.855179 IP 10.0.0.222.46121 > bom07s10-in-f163.1e100.net.http: Flags [.], ack 92673, win 975, options [nop,nop,TS val 4916438 ecr 4294950615], length 0
15:57:23.855336 IP 10.0.0.222.46121 > bom07s10-in-f163.1e100.net.http: Flags [.], ack 94121, win 987, options [nop,nop,TS val 4916438 ecr 4294950615], length 0
15:57:23.855726 IP bom07s10-in-f163.1e100.net.http > 10.0.0.222.46121: Flags [.], seq 130321:131769, ack 822, win 249, options [nop,nop,TS val 4294950618 ecr 4916438], length 1448
15:57:23.856207 IP 10.0.0.222.46121 > bom07s10-in-f163.1e100.net.http: Flags [.], ack 95569, win 998, options [nop,nop,TS val 4916438 ecr 4294950615], length 0
15:57:23.856354 IP 10.0.0.222.46121 > bom07s10-in-f163.1e100.net.http: Flags [.], ack 97017, win 1009, options [nop,nop,TS val 4916438 ecr 4294950615], length 0
15:57:23.856987 IP 10.0.0.222.46121 > bom07s10-in-f163.1e100.net.http: Flags [.], ack 98465, win 1021, options [nop,nop,TS val 4916438 ecr 4294950615], length 0
15:57:23.857082 IP 10.0.0.222.46121 > bom07s10-in-f163.1e100.net.http: Flags [.], ack 99913, win 1032, options [nop,nop,TS val 4916438 ecr 4294950615], length 0
15:57:23.857137 IP 10.0.0.222.46121 > bom07s10-in-f163.1e100.net.http: Flags [.], ack 101361, win 1043, options [nop,nop,TS val 4916438 ecr 4294950615], length 0
15:57:23.857268 IP 10.0.0.222.46121 > bom07s10-in-f163.1e100.net.http: Flags [.], ack 102809, win 1055, options [nop,nop,TS val 4916438 ecr 4294950615], length 0
15:57:23.857848 IP 10.0.0.222.46121 > bom07s10-in-f163.1e100.net.http: Flags [.], ack 104257, win 1066, options [nop,nop,TS val 4916438 ecr 4294950615], length 0
15:57:23.857994 IP bom07s10-in-f163.1e100.net.http > 10.0.0.222.46121: Flags [.], seq 131769:133217, ack 822, win 249, options [nop,nop,TS val 4294950618 ecr 4916438], length 1448
15:57:23.858122 IP 10.0.0.222.46121 > bom07s10-in-f163.1e100.net.http: Flags [.], ack 105705, win 1077, options [nop,nop,TS val 4916438 ecr 4294950615], length 0
15:57:23.858332 IP 10.0.0.222.46121 > bom07s10-in-f163.1e100.net.http: Flags [.], ack 107153, win 1089, options [nop,nop,TS val 4916438 ecr 4294950615], length 0
15:57:23.858741 IP bom07s10-in-f163.1e100.net.http > 10.0.0.222.46121: Flags [.], seq 133217:134665, ack 822, win 249, options [nop,nop,TS val 4294950618 ecr 4916438], length 1448
15:57:23.858969 IP 10.0.0.222.46121 > bom07s10-in-f163.1e100.net.http: Flags [.], ack 108601, win 1100, options [nop,nop,TS val 4916438 ecr 4294950615], length 0
15:57:23.859214 IP 10.0.0.222.46121 > bom07s10-in-f163.1e100.net.http: Flags [.], ack 110049, win 1111, options [nop,nop,TS val 4916438 ecr 4294950615], length 0
15:57:23.859467 IP 10.0.0.222.46121 > bom07s10-in-f163.1e100.net.http: Flags [.], ack 111497, win 1122, options [nop,nop,TS val 4916438 ecr 4294950616], length 0
15:57:23.859691 IP 10.0.0.222.46121 > bom07s10-in-f163.1e100.net.http: Flags [.], ack 112945, win 1134, options [nop,nop,TS val 4916438 ecr 4294950616], length 0
15:57:23.859888 IP 10.0.0.222.46121 > bom07s10-in-f163.1e100.net.http: Flags [.], ack 114393, win 1145, options [nop,nop,TS val 4916438 ecr 4294950616], length 0
15:57:23.860363 IP bom07s10-in-f163.1e100.net.http > 10.0.0.222.46121: Flags [.], seq 134665:136113, ack 822, win 249, options [nop,nop,TS val 4294950618 ecr 4916438], length 1448
15:57:23.860513 IP 10.0.0.222.46121 > bom07s10-in-f163.1e100.net.http: Flags [.], ack 115841, win 1156, options [nop,nop,TS val 4916438 ecr 4294950616], length 0
15:57:23.860712 IP 10.0.0.222.46121 > bom07s10-in-f163.1e100.net.http: Flags [.], ack 117289, win 1168, options [nop,nop,TS val 4916438 ecr 4294950616], length 0
15:57:23.860979 IP 10.0.0.222.46121 > bom07s10-in-f163.1e100.net.http: Flags [.], ack 118737, win 1179, options [nop,nop,TS val 4916438 ecr 4294950617], length 0
15:57:23.862008 IP bom07s10-in-f163.1e100.net.http > 10.0.0.222.46121: Flags [.], seq 136113:137561, ack 822, win 249, options [nop,nop,TS val 4294950619 ecr 4916438], length 1448
15:57:23.862203 IP 10.0.0.222.46121 > bom07s10-in-f163.1e100.net.http: Flags [.], ack 120185, win 1190, options [nop,nop,TS val 4916438 ecr 4294950617], length 0
15:57:23.862331 IP 10.0.0.222.46121 > bom07s10-in-f163.1e100.net.http: Flags [.], ack 121633, win 1202, options [nop,nop,TS val 4916439 ecr 4294950617], length 0
15:57:23.862521 IP 10.0.0.222.46121 > bom07s10-in-f163.1e100.net.http: Flags [.], ack 123081, win 1213, options [nop,nop,TS val 4916439 ecr 4294950618], length 0
15:57:23.863123 IP bom07s10-in-f163.1e100.net.http > 10.0.0.222.46121: Flags [.], seq 137561:139009, ack 822, win 249, options [nop,nop,TS val 4294950619 ecr 4916439], length 1448
15:57:23.863610 IP bom07s10-in-f163.1e100.net.http > 10.0.0.222.46121: Flags [.], seq 139009:140457, ack 822, win 249, options [nop,nop,TS val 4294950619 ecr 4916439], length 1448
15:57:23.863810 IP 10.0.0.222.46121 > bom07s10-in-f163.1e100.net.http: Flags [.], ack 124529, win 1224, options [nop,nop,TS val 4916439 ecr 4294950618], length 0
15:57:23.864363 IP bom07s10-in-f163.1e100.net.http > 10.0.0.222.46121: Flags [.], seq 140457:141905, ack 822, win 249, options [nop,nop,TS val 4294950619 ecr 4916439], length 1448
15:57:23.864512 IP 10.0.0.222.46121 > bom07s10-in-f163.1e100.net.http: Flags [.], ack 125977, win 1236, options [nop,nop,TS val 4916439 ecr 4294950618], length 0
15:57:23.864704 IP 10.0.0.222.46121 > bom07s10-in-f163.1e100.net.http: Flags [.], ack 127425, win 1247, options [nop,nop,TS val 4916439 ecr 4294950618], length 0
15:57:23.864957 IP 10.0.0.222.46121 > bom07s10-in-f163.1e100.net.http: Flags [.], ack 128873, win 1258, options [nop,nop,TS val 4916439 ecr 4294950618], length 0
15:57:23.865356 IP bom07s10-in-f163.1e100.net.http > 10.0.0.222.46121: Flags [.], seq 141905:143353, ack 822, win 249, options [nop,nop,TS val 4294950619 ecr 4916439], length 1448
15:57:23.865554 IP 10.0.0.222.46121 > bom07s10-in-f163.1e100.net.http: Flags [.], ack 130321, win 1270, options [nop,nop,TS val 4916439 ecr 4294950618], length 0
15:57:23.866472 IP 10.0.0.222.46121 > bom07s10-in-f163.1e100.net.http: Flags [.], ack 131769, win 1281, options [nop,nop,TS val 4916439 ecr 4294950618], length 0
15:57:23.866629 IP 10.0.0.222.46121 > bom07s10-in-f163.1e100.net.http: Flags [.], ack 133217, win 1292, options [nop,nop,TS val 4916439 ecr 4294950618], length 0
15:57:23.866847 IP 10.0.0.222.46121 > bom07s10-in-f163.1e100.net.http: Flags [.], ack 134665, win 1303, options [nop,nop,TS val 4916439 ecr 4294950618], length 0
15:57:23.867241 IP bom07s10-in-f163.1e100.net.http > 10.0.0.222.46121: Flags [.], seq 143353:144801, ack 822, win 249, options [nop,nop,TS val 4294950619 ecr 4916439], length 1448
15:57:23.867565 IP 10.0.0.222.46121 > bom07s10-in-f163.1e100.net.http: Flags [.], ack 136113, win 1315, options [nop,nop,TS val 4916439 ecr 4294950618], length 0
15:57:23.867986 IP bom07s10-in-f163.1e100.net.http > 10.0.0.222.46121: Flags [.], seq 144801:146249, ack 822, win 249, options [nop,nop,TS val 4294950619 ecr 4916439], length 1448
15:57:23.868477 IP bom07s10-in-f163.1e100.net.http > 10.0.0.222.46121: Flags [.], seq 146249:147697, ack 822, win 249, options [nop,nop,TS val 4294950619 ecr 4916439], length 1448
15:57:23.868980 IP bom07s10-in-f163.1e100.net.http > 10.0.0.222.46121: Flags [.], seq 147697:149145, ack 822, win 249, options [nop,nop,TS val 4294950619 ecr 4916439], length 1448
15:57:23.869473 IP bom07s10-in-f163.1e100.net.http > 10.0.0.222.46121: Flags [.], seq 149145:150593, ack 822, win 249, options [nop,nop,TS val 4294950619 ecr 4916439], length 1448
15:57:23.870107 IP bom07s10-in-f163.1e100.net.http > 10.0.0.222.46121: Flags [.], seq 150593:152041, ack 822, win 249, options [nop,nop,TS val 4294950619 ecr 4916439], length 1448
15:57:23.870606 IP bom07s10-in-f163.1e100.net.http > 10.0.0.222.46121: Flags [.], seq 152041:153489, ack 822, win 249, options [nop,nop,TS val 4294950619 ecr 4916439], length 1448
15:57:23.871118 IP bom07s10-in-f163.1e100.net.http > 10.0.0.222.46121: Flags [P.], seq 153489:154937, ack 822, win 249, options [nop,nop,TS val 4294950620 ecr 4916439], length 1448
15:57:23.871738 IP bom07s10-in-f163.1e100.net.http > 10.0.0.222.46121: Flags [.], seq 154937:156385, ack 822, win 249, options [nop,nop,TS val 4294950620 ecr 4916439], length 1448
15:57:23.872228 IP bom07s10-in-f163.1e100.net.http > 10.0.0.222.46121: Flags [.], seq 156385:157833, ack 822, win 249, options [nop,nop,TS val 4294950620 ecr 4916439], length 1448
15:57:23.872730 IP bom07s10-in-f163.1e100.net.http > 10.0.0.222.46121: Flags [.], seq 157833:159281, ack 822, win 249, options [nop,nop,TS val 4294950620 ecr 4916439], length 1448
15:57:23.873234 IP bom07s10-in-f163.1e100.net.http > 10.0.0.222.46121: Flags [.], seq 159281:160729, ack 822, win 249, options [nop,nop,TS val 4294950620 ecr 4916439], length 1448
15:57:23.873851 IP bom07s10-in-f163.1e100.net.http > 10.0.0.222.46121: Flags [.], seq 160729:162177, ack 822, win 249, options [nop,nop,TS val 4294950620 ecr 4916439], length 1448
15:57:23.874349 IP bom07s10-in-f163.1e100.net.http > 10.0.0.222.46121: Flags [.], seq 162177:163625, ack 822, win 249, options [nop,nop,TS val 4294950620 ecr 4916439], length 1448
15:57:23.874849 IP bom07s10-in-f163.1e100.net.http > 10.0.0.222.46121: Flags [.], seq 163625:165073, ack 822, win 249, options [nop,nop,TS val 4294950620 ecr 4916439], length 1448
15:57:23.875492 IP bom07s10-in-f163.1e100.net.http > 10.0.0.222.46121: Flags [.], seq 165073:166521, ack 822, win 249, options [nop,nop,TS val 4294950620 ecr 4916439], length 1448
15:57:23.875984 IP bom07s10-in-f163.1e100.net.http > 10.0.0.222.46121: Flags [.], seq 166521:167969, ack 822, win 249, options [nop,nop,TS val 4294950620 ecr 4916439], length 1448
15:57:23.876479 IP bom07s10-in-f163.1e100.net.http > 10.0.0.222.46121: Flags [.], seq 167969:169417, ack 822, win 249, options [nop,nop,TS val 4294950620 ecr 4916439], length 1448
15:57:23.876979 IP bom07s10-in-f163.1e100.net.http > 10.0.0.222.46121: Flags [.], seq 169417:170865, ack 822, win 249, options [nop,nop,TS val 4294950620 ecr 4916439], length 1448
15:57:23.879383 IP bom07s10-in-f163.1e100.net.http > 10.0.0.222.46121: Flags [.], seq 170865:172313, ack 822, win 249, options [nop,nop,TS val 4294950620 ecr 4916439], length 1448
15:57:23.879858 IP bom07s10-in-f163.1e100.net.http > 10.0.0.222.46121: Flags [.], seq 172313:173761, ack 822, win 249, options [nop,nop,TS val 4294950620 ecr 4916439], length 1448
15:57:23.880352 IP bom07s10-in-f163.1e100.net.http > 10.0.0.222.46121: Flags [.], seq 173761:175209, ack 822, win 249, options [nop,nop,TS val 4294950620 ecr 4916439], length 1448
15:57:23.880988 IP bom07s10-in-f163.1e100.net.http > 10.0.0.222.46121: Flags [.], seq 175209:176657, ack 822, win 249, options [nop,nop,TS val 4294950621 ecr 4916439], length 1448
15:57:23.881481 IP bom07s10-in-f163.1e100.net.http > 10.0.0.222.46121: Flags [.], seq 176657:178105, ack 822, win 249, options [nop,nop,TS val 4294950621 ecr 4916439], length 1448
15:57:23.881979 IP bom07s10-in-f163.1e100.net.http > 10.0.0.222.46121: Flags [.], seq 178105:179553, ack 822, win 249, options [nop,nop,TS val 4294950621 ecr 4916439], length 1448
15:57:23.882472 IP bom07s10-in-f163.1e100.net.http > 10.0.0.222.46121: Flags [.], seq 179553:181001, ack 822, win 249, options [nop,nop,TS val 4294950621 ecr 4916439], length 1448
15:57:23.882647 IP 10.0.0.222.46121 > bom07s10-in-f163.1e100.net.http: Flags [.], ack 137561, win 1326, options [nop,nop,TS val 4916441 ecr 4294950619], length 0
15:57:23.882988 IP bom07s10-in-f163.1e100.net.http > 10.0.0.222.46121: Flags [.], seq 181001:182449, ack 822, win 249, options [nop,nop,TS val 4294950621 ecr 4916441], length 1448
15:57:23.886356 IP 10.0.0.222.46121 > bom07s10-in-f163.1e100.net.http: Flags [.], ack 139009, win 1337, options [nop,nop,TS val 4916441 ecr 4294950619], length 0
15:57:23.886505 IP bom07s10-in-f163.1e100.net.http > 10.0.0.222.46121: Flags [.], seq 182449:183897, ack 822, win 249, options [nop,nop,TS val 4294950621 ecr 4916441], length 1448
15:57:23.887350 IP 10.0.0.222.46121 > bom07s10-in-f163.1e100.net.http: Flags [.], ack 140457, win 1349, options [nop,nop,TS val 4916441 ecr 4294950619], length 0
15:57:23.887459 IP bom07s10-in-f163.1e100.net.http > 10.0.0.222.46121: Flags [.], seq 183897:185345, ack 822, win 249, options [nop,nop,TS val 4294950621 ecr 4916441], length 1448
15:57:23.892055 IP 10.0.0.222.46121 > bom07s10-in-f163.1e100.net.http: Flags [.], ack 141905, win 1360, options [nop,nop,TS val 4916442 ecr 4294950619], length 0
15:57:23.892184 IP bom07s10-in-f163.1e100.net.http > 10.0.0.222.46121: Flags [P.], seq 185345:185753, ack 822, win 249, options [nop,nop,TS val 4294950622 ecr 4916442], length 408
15:57:23.892468 IP 10.0.0.222.46121 > bom07s10-in-f163.1e100.net.http: Flags [.], ack 143353, win 1371, options [nop,nop,TS val 4916442 ecr 4294950619], length 0
15:57:23.898271 IP 10.0.0.222.46121 > bom07s10-in-f163.1e100.net.http: Flags [.], ack 144801, win 1383, options [nop,nop,TS val 4916442 ecr 4294950619], length 0
15:57:23.898736 IP 10.0.0.222.46121 > bom07s10-in-f163.1e100.net.http: Flags [.], ack 146249, win 1394, options [nop,nop,TS val 4916442 ecr 4294950619], length 0
15:57:23.899092 IP 10.0.0.222.46121 > bom07s10-in-f163.1e100.net.http: Flags [.], ack 147697, win 1405, options [nop,nop,TS val 4916442 ecr 4294950619], length 0
15:57:23.899387 IP 10.0.0.222.46121 > bom07s10-in-f163.1e100.net.http: Flags [.], ack 149145, win 1417, options [nop,nop,TS val 4916442 ecr 4294950619], length 0
15:57:23.899714 IP 10.0.0.222.46121 > bom07s10-in-f163.1e100.net.http: Flags [.], ack 150593, win 1428, options [nop,nop,TS val 4916442 ecr 4294950619], length 0
15:57:23.900043 IP 10.0.0.222.46121 > bom07s10-in-f163.1e100.net.http: Flags [.], ack 152041, win 1439, options [nop,nop,TS val 4916442 ecr 4294950619], length 0
15:57:23.909511 IP 10.0.0.222.46121 > bom07s10-in-f163.1e100.net.http: Flags [.], ack 153489, win 1451, options [nop,nop,TS val 4916443 ecr 4294950619], length 0
15:57:23.909862 IP 10.0.0.222.46121 > bom07s10-in-f163.1e100.net.http: Flags [.], ack 154937, win 1462, options [nop,nop,TS val 4916443 ecr 4294950620], length 0
15:57:23.910217 IP 10.0.0.222.46121 > bom07s10-in-f163.1e100.net.http: Flags [.], ack 156385, win 1473, options [nop,nop,TS val 4916443 ecr 4294950620], length 0
15:57:23.910523 IP 10.0.0.222.46121 > bom07s10-in-f163.1e100.net.http: Flags [.], ack 157833, win 1484, options [nop,nop,TS val 4916443 ecr 4294950620], length 0
15:57:23.910864 IP 10.0.0.222.46121 > bom07s10-in-f163.1e100.net.http: Flags [.], ack 159281, win 1496, options [nop,nop,TS val 4916443 ecr 4294950620], length 0
15:57:23.911185 IP 10.0.0.222.46121 > bom07s10-in-f163.1e100.net.http: Flags [.], ack 160729, win 1507, options [nop,nop,TS val 4916443 ecr 4294950620], length 0
15:57:23.911613 IP 10.0.0.222.46121 > bom07s10-in-f163.1e100.net.http: Flags [.], ack 162177, win 1518, options [nop,nop,TS val 4916444 ecr 4294950620], length 0
15:57:23.912470 IP 10.0.0.222.46121 > bom07s10-in-f163.1e100.net.http: Flags [.], ack 163625, win 1530, options [nop,nop,TS val 4916444 ecr 4294950620], length 0
15:57:23.912837 IP 10.0.0.222.46121 > bom07s10-in-f163.1e100.net.http: Flags [.], ack 165073, win 1541, options [nop,nop,TS val 4916444 ecr 4294950620], length 0
15:57:23.913186 IP 10.0.0.222.46121 > bom07s10-in-f163.1e100.net.http: Flags [.], ack 166521, win 1552, options [nop,nop,TS val 4916444 ecr 4294950620], length 0
15:57:23.913549 IP 10.0.0.222.46121 > bom07s10-in-f163.1e100.net.http: Flags [.], ack 167969, win 1564, options [nop,nop,TS val 4916444 ecr 4294950620], length 0
15:57:23.913938 IP 10.0.0.222.46121 > bom07s10-in-f163.1e100.net.http: Flags [.], ack 169417, win 1575, options [nop,nop,TS val 4916444 ecr 4294950620], length 0
15:57:23.914276 IP 10.0.0.222.46121 > bom07s10-in-f163.1e100.net.http: Flags [.], ack 170865, win 1586, options [nop,nop,TS val 4916444 ecr 4294950620], length 0
15:57:23.914625 IP 10.0.0.222.46121 > bom07s10-in-f163.1e100.net.http: Flags [.], ack 172313, win 1598, options [nop,nop,TS val 4916444 ecr 4294950620], length 0
15:57:23.914977 IP 10.0.0.222.46121 > bom07s10-in-f163.1e100.net.http: Flags [.], ack 173761, win 1609, options [nop,nop,TS val 4916444 ecr 4294950620], length 0
15:57:23.920001 IP 10.0.0.222.46121 > bom07s10-in-f163.1e100.net.http: Flags [.], ack 175209, win 1620, options [nop,nop,TS val 4916444 ecr 4294950620], length 0
15:57:23.920084 IP 10.0.0.222.46121 > bom07s10-in-f163.1e100.net.http: Flags [.], ack 176657, win 1632, options [nop,nop,TS val 4916444 ecr 4294950621], length 0
15:57:23.920941 IP 10.0.0.222.46121 > bom07s10-in-f163.1e100.net.http: Flags [.], ack 178105, win 1643, options [nop,nop,TS val 4916444 ecr 4294950621], length 0
15:57:23.921011 IP 10.0.0.222.46121 > bom07s10-in-f163.1e100.net.http: Flags [.], ack 179553, win 1654, options [nop,nop,TS val 4916444 ecr 4294950621], length 0
15:57:23.921089 IP 10.0.0.222.46121 > bom07s10-in-f163.1e100.net.http: Flags [.], ack 181001, win 1665, options [nop,nop,TS val 4916444 ecr 4294950621], length 0
15:57:23.921178 IP 10.0.0.222.46121 > bom07s10-in-f163.1e100.net.http: Flags [.], ack 182449, win 1677, options [nop,nop,TS val 4916444 ecr 4294950621], length 0
15:57:23.921339 IP 10.0.0.222.46121 > bom07s10-in-f163.1e100.net.http: Flags [.], ack 183897, win 1688, options [nop,nop,TS val 4916444 ecr 4294950621], length 0
15:57:23.921523 IP 10.0.0.222.46121 > bom07s10-in-f163.1e100.net.http: Flags [.], ack 185345, win 1699, options [nop,nop,TS val 4916444 ecr 4294950621], length 0
15:57:23.921714 IP 10.0.0.222.46121 > bom07s10-in-f163.1e100.net.http: Flags [.], ack 185753, win 1699, options [nop,nop,TS val 4916444 ecr 4294950622], length 0
15:57:24.216808 IP 10.0.0.222.47772 > 10.0.0.1.domain: 61597+ A? clients1.google.co.in. (39)
15:57:24.218942 IP 10.0.0.222.54154 > 10.0.0.1.4886: UDP, length 0
15:57:24.219106 IP 10.0.0.1 > 10.0.0.222: ICMP 10.0.0.1 udp port 4886 unreachable, length 36
15:57:24.235608 IP 10.0.0.222.54154 > 10.0.0.1.4886: UDP, length 0
15:57:24.235752 IP 10.0.0.1 > 10.0.0.222: ICMP 10.0.0.1 udp port 4886 unreachable, length 36
15:57:24.253781 IP 10.0.0.222.54154 > 10.0.0.1.4886: UDP, length 0
15:57:24.261625 IP 10.0.0.222.46121 > bom07s10-in-f163.1e100.net.http: Flags [P.], seq 822:1655, ack 185753, win 1699, options [nop,nop,TS val 4916478 ecr 4294950622], length 833
15:57:24.261821 IP bom07s10-in-f163.1e100.net.http > 10.0.0.222.46121: Flags [.], ack 1655, win 272, options [nop,nop,TS val 4294950659 ecr 4916478], length 0
15:57:24.271287 IP 10.0.0.222.54154 > 10.0.0.1.4886: UDP, length 0
15:57:24.287441 IP 10.0.0.222.54154 > 10.0.0.1.4886: UDP, length 0
15:57:24.293284 IP 10.0.0.1.domain > 10.0.0.222.47772: 61597 2/0/0 CNAME clients-cctld.l.google.com., A 74.125.68.94 (95)
15:57:24.295748 IP 10.0.0.222.53066 > sc-in-f94.1e100.net.http: Flags [S], seq 1209581050, win 64240, options [mss 1460,sackOK,TS val 4916482 ecr 0,nop,wscale 8], length 0
15:57:24.295957 IP sc-in-f94.1e100.net.http > 10.0.0.222.53066: Flags [S.], seq 3476430002, ack 1209581051, win 28960, options [mss 1460,sackOK,TS val 4294950662 ecr 4916482,nop,wscale 7], length 0
15:57:24.297035 IP 10.0.0.222.53066 > sc-in-f94.1e100.net.http: Flags [.], ack 1, win 251, options [nop,nop,TS val 4916482 ecr 4294950662], length 0
15:57:24.297870 IP 10.0.0.222.53066 > sc-in-f94.1e100.net.http: Flags [P.], seq 1:727, ack 1, win 251, options [nop,nop,TS val 4916482 ecr 4294950662], length 726
15:57:24.297989 IP sc-in-f94.1e100.net.http > 10.0.0.222.53066: Flags [.], ack 727, win 249, options [nop,nop,TS val 4294950662 ecr 4916482], length 0
15:57:24.304043 IP 10.0.0.222.54154 > 10.0.0.1.4886: UDP, length 0
15:57:24.320527 IP 10.0.0.222.54154 > 10.0.0.1.4886: UDP, length 0
15:57:24.336832 IP 10.0.0.222.54154 > 10.0.0.1.4886: UDP, length 0
15:57:24.353274 IP 10.0.0.222.54154 > 10.0.0.1.4886: UDP, length 0
15:57:24.370316 IP 10.0.0.222.54154 > 10.0.0.1.4886: UDP, length 0
15:57:24.386635 IP 10.0.0.222.54154 > 10.0.0.1.4886: UDP, length 0
15:57:24.403167 IP 10.0.0.222.54154 > 10.0.0.1.4886: UDP, length 0
15:57:24.419828 IP 10.0.0.222.54154 > 10.0.0.1.4886: UDP, length 0
15:57:24.437760 IP 10.0.0.222.54154 > 10.0.0.1.4886: UDP, length 0
15:57:24.454825 IP 10.0.0.222.54154 > 10.0.0.1.4886: UDP, length 0
15:57:24.471281 IP 10.0.0.222.54154 > 10.0.0.1.4886: UDP, length 0
15:57:24.487604 IP 10.0.0.222.54154 > 10.0.0.1.4886: UDP, length 0
15:57:24.504033 IP 10.0.0.222.54154 > 10.0.0.1.4886: UDP, length 0
15:57:24.520849 IP 10.0.0.222.54154 > 10.0.0.1.4886: UDP, length 0
15:57:24.537350 IP 10.0.0.222.54154 > 10.0.0.1.4886: UDP, length 0
15:57:24.553988 IP 10.0.0.222.54154 > 10.0.0.1.4886: UDP, length 0
15:57:24.570908 IP 10.0.0.222.54154 > 10.0.0.1.4886: UDP, length 0
15:57:24.587748 IP 10.0.0.222.54154 > 10.0.0.1.4886: UDP, length 0
15:57:24.604351 IP 10.0.0.222.54154 > 10.0.0.1.4886: UDP, length 0
15:57:24.621034 IP 10.0.0.222.54154 > 10.0.0.1.4886: UDP, length 0
15:57:24.637783 IP 10.0.0.222.54154 > 10.0.0.1.4886: UDP, length 0
15:57:24.654181 IP 10.0.0.222.54154 > 10.0.0.1.4886: UDP, length 0
15:57:25.103551 IP 10.0.0.222.46121 > bom07s10-in-f163.1e100.net.http: Flags [F.], seq 1655, ack 185753, win 1699, options [nop,nop,TS val 4916561 ecr 4294950659], length 0
15:57:25.140853 IP bom07s10-in-f163.1e100.net.http > 10.0.0.222.46121: Flags [.], ack 1656, win 272, options [nop,nop,TS val 4294950747 ecr 4916561], length 0
15:57:25.178170 IP bom07s10-in-f163.1e100.net.http > 10.0.0.222.46121: Flags [F.], seq 185753, ack 1656, win 272, options [nop,nop,TS val 4294950750 ecr 4916561], length 0
15:57:25.179140 IP 10.0.0.222.46121 > bom07s10-in-f163.1e100.net.http: Flags [.], ack 185754, win 1699, options [nop,nop,TS val 4916570 ecr 4294950750], length 0
15:57:25.182967 IP sc-in-f94.1e100.net.http > 10.0.0.222.53066: Flags [P.], seq 1:155, ack 727, win 249, options [nop,nop,TS val 4294950751 ecr 4916482], length 154
15:57:25.184549 IP 10.0.0.222.53066 > sc-in-f94.1e100.net.http: Flags [.], ack 155, win 256, options [nop,nop,TS val 4916571 ecr 4294950751], length 0
15:57:25.272412 IP 10.0.0.222.43444 > 10.0.0.1.domain: 62997+ A? webplus.google.com. (36)
15:57:25.375976 IP 10.0.0.1.domain > 10.0.0.222.43444: 62997* 1/0/0 A 172.217.26.206 (52)
15:57:26.213093 IP 10.0.0.222.53060 > sc-in-f94.1e100.net.http: Flags [F.], seq 761, ack 546, win 256, options [nop,nop,TS val 4916672 ecr 4294950363], length 0
15:57:26.213300 IP 10.0.0.222 > all-routers.mcast.net: igmp leave 239.255.255.250
15:57:26.213382 IP 10.0.0.222 > all-routers.mcast.net: igmp leave 239.255.255.250
15:57:26.213531 IP 10.0.0.222.46120 > bom07s10-in-f163.1e100.net.http: Flags [F.], seq 1549, ack 17704, win 398, options [nop,nop,TS val 4916673 ecr 4294950521], length 0
15:57:26.213670 IP 10.0.0.222.34582 > bom07s10-in-f165.1e100.net.https: Flags [F.], seq 525, ack 3564, win 294, options [nop,nop,TS val 4916673 ecr 1464988947], length 0
15:57:26.213780 IP 10.0.0.222.33770 > bom05s05-in-f4.1e100.net.https: Flags [F.], seq 764, ack 299, win 256, options [nop,nop,TS val 4916673 ecr 768690934], length 0
15:57:26.213993 IP 10.0.0.222.49177 > bom05s05-in-f4.1e100.net.https: Flags [F.], seq 539, ack 4472, win 304, options [nop,nop,TS val 4916673 ecr 907347848], length 0
15:57:26.214059 IP 10.0.0.222.53066 > sc-in-f94.1e100.net.http: Flags [F.], seq 727, ack 155, win 256, options [nop,nop,TS val 4916673 ecr 4294950751], length 0
15:57:26.214261 IP 10.0.0.222.46123 > bom07s10-in-f163.1e100.net.http: Flags [F.], seq 306, ack 19658, win 421, options [nop,nop,TS val 4916673 ecr 4294950578], length 0
15:57:26.214504 IP 10.0.0.222.46122 > bom07s10-in-f163.1e100.net.http: Flags [F.], seq 732, ack 17600, win 398, options [nop,nop,TS val 4916673 ecr 4294950568], length 0
15:57:26.214751 IP 10.0.0.222.46124 > bom07s10-in-f163.1e100.net.http: Flags [F.], seq 1, ack 1, win 251, options [nop,nop,TS val 4916673 ecr 4294950461], length 0
15:57:26.216349 IP sc-in-f94.1e100.net.http > 10.0.0.222.53060: Flags [F.], seq 546, ack 762, win 249, options [nop,nop,TS val 4294950854 ecr 4916672], length 0
15:57:26.216886 IP bom07s10-in-f165.1e100.net.https > 10.0.0.222.34582: Flags [F.], seq 3564, ack 526, win 350, options [nop,nop,TS val 1464995098 ecr 4916673], length 0
15:57:26.217593 IP 10.0.0.222.53060 > sc-in-f94.1e100.net.http: Flags [.], ack 547, win 256, options [nop,nop,TS val 4916674 ecr 4294950854], length 0
15:57:26.217793 IP 10.0.0.222.34582 > bom07s10-in-f165.1e100.net.https: Flags [.], ack 3565, win 294, options [nop,nop,TS val 4916674 ecr 1464995098], length 0
15:57:26.220845 IP bom07s10-in-f163.1e100.net.http > 10.0.0.222.46124: Flags [.], ack 2, win 227, options [nop,nop,TS val 4294950855 ecr 4916673], length 0
15:57:26.224736 IP bom07s10-in-f163.1e100.net.http > 10.0.0.222.46120: Flags [F.], seq 17704, ack 1550, win 272, options [nop,nop,TS val 4294950855 ecr 4916673], length 0
15:57:26.226026 IP 10.0.0.222.46120 > bom07s10-in-f163.1e100.net.http: Flags [.], ack 17705, win 398, options [nop,nop,TS val 4916675 ecr 4294950855], length 0
15:57:26.240346 IP sc-in-f94.1e100.net.http > 10.0.0.222.53066: Flags [F.], seq 155, ack 728, win 249, options [nop,nop,TS val 4294950856 ecr 4916673], length 0
15:57:26.241576 IP 10.0.0.222.53066 > sc-in-f94.1e100.net.http: Flags [.], ack 156, win 256, options [nop,nop,TS val 4916676 ecr 4294950856], length 0
15