06:38:30.265250 c0:ee:fb:3b:35:93 (oui Unknown) > Broadcast Null Unnumbered, xid, Flags [Response], length 6: 01 00
06:38:30.472965 IP6 :: > ff02::1:ff3b:3593: ICMP6, neighbor solicitation, who has fe80::c2ee:fbff:fe3b:3593, length 24
06:38:30.473031 IP6 :: > ff02::1:ff3b:3593: ICMP6, neighbor solicitation, who has fe80::c2ee:fbff:fe3b:3593, length 24
06:38:30.493297 IP 0.0.0.0.bootpc > 255.255.255.255.bootps: BOOTP/DHCP, Request from c0:ee:fb:3b:35:93 (oui Unknown), length 298
06:38:30.493584 IP 0.0.0.0.bootpc > 255.255.255.255.bootps: BOOTP/DHCP, Request from c0:ee:fb:3b:35:93 (oui Unknown), length 298
06:38:30.494704 IP 10.0.0.1.bootps > 10.0.0.222.bootpc: BOOTP/DHCP, Reply, length 300
06:38:30.504113 IP 0.0.0.0.bootpc > 255.255.255.255.bootps: BOOTP/DHCP, Request from c0:ee:fb:3b:35:93 (oui Unknown), length 310
06:38:30.504284 IP 0.0.0.0.bootpc > 255.255.255.255.bootps: BOOTP/DHCP, Request from c0:ee:fb:3b:35:93 (oui Unknown), length 310
06:38:30.518306 IP 10.0.0.1.bootps > 10.0.0.222.bootpc: BOOTP/DHCP, Reply, length 300
06:38:30.652808 ARP, Request who-has 10.0.0.1 tell 10.0.0.222, length 28
06:38:30.652938 ARP, Reply 10.0.0.1 is-at 98:de:d0:09:37:b4 (oui Unknown), length 28
06:38:30.653036 ARP, Request who-has 10.0.0.1 tell 10.0.0.222, length 28
06:38:30.654683 IP 10.0.0.222.56924 > 10.0.0.1.domain: 59720+ AAAA? connectivitycheck.gstatic.com. (47)
06:38:30.654997 IP 10.0.0.1 > 10.0.0.222: ICMP 10.0.0.1 udp port domain unreachable, length 83
06:38:30.660262 IP 10.0.0.222.55041 > 10.0.0.1.domain: 59720+ AAAA? connectivitycheck.gstatic.com. (47)
06:38:30.660612 IP 10.0.0.1 > 10.0.0.222: ICMP 10.0.0.1 udp port domain unreachable, length 83
06:38:30.662929 IP 10.0.0.222.54197 > 10.0.0.1.domain: 44406+ A? connectivitycheck.gstatic.com. (47)
06:38:30.663170 IP 10.0.0.1 > 10.0.0.222: ICMP 10.0.0.1 udp port domain unreachable, length 83
06:38:30.665373 IP 10.0.0.222.48806 > 10.0.0.1.domain: 44406+ A? connectivitycheck.gstatic.com. (47)
06:38:30.665600 IP 10.0.0.1 > 10.0.0.222: ICMP 10.0.0.1 udp port domain unreachable, length 83
06:38:30.667874 IP 10.0.0.222.50844 > 10.0.0.1.domain: 40044+ AAAA? connectivitycheck.gstatic.com. (47)
06:38:30.668034 IP 10.0.0.1 > 10.0.0.222: ICMP 10.0.0.1 udp port domain unreachable, length 83
06:38:30.670503 IP 10.0.0.222.51886 > 10.0.0.1.domain: 40044+ AAAA? connectivitycheck.gstatic.com. (47)
06:38:30.670666 IP 10.0.0.1 > 10.0.0.222: ICMP 10.0.0.1 udp port domain unreachable, length 83
06:38:30.673006 IP 10.0.0.222.40260 > 10.0.0.1.domain: 47286+ A? connectivitycheck.gstatic.com. (47)
06:38:30.808427 IP 10.0.0.222.49831 > 10.0.0.1.domain: 56474+ A? clients3.google.com. (37)
06:38:31.472990 IP6 fe80::c2ee:fbff:fe3b:3593 > ip6-allrouters: ICMP6, router solicitation, length 16
06:38:31.473103 IP6 fe80::c2ee:fbff:fe3b:3593 > ip6-allrouters: ICMP6, router solicitation, length 16
06:38:32.498648 ARP, Reply 192.168.0.100 is-at 98:de:d0:09:37:b4 (oui Unknown), length 28
06:38:33.125477 IP 10.0.0.222.64953 > 10.0.0.1.domain: 55874+ AAAA? 127.0.0.1. (27)
06:38:33.125744 IP 10.0.0.1 > 10.0.0.222: ICMP 10.0.0.1 udp port domain unreachable, length 63
06:38:33.128083 IP 10.0.0.222.50860 > 10.0.0.1.domain: 55874+ AAAA? 127.0.0.1. (27)
06:38:33.128242 IP 10.0.0.1 > 10.0.0.222: ICMP 10.0.0.1 udp port domain unreachable, length 63
06:38:33.130889 IP 10.0.0.222.42592 > 10.0.0.1.domain: 42954+ AAAA? 127.0.0.1. (27)
06:38:35.495825 IP6 fe80::c2ee:fbff:fe3b:3593 > ip6-allrouters: ICMP6, router solicitation, length 16
06:38:35.495909 IP6 fe80::c2ee:fbff:fe3b:3593 > ip6-allrouters: ICMP6, router solicitation, length 16
06:38:35.542379 ARP, Reply 192.168.0.100 is-at 98:de:d0:09:37:b4 (oui Unknown), length 28
06:38:35.660392 ARP, Request who-has 10.0.0.222 tell 10.0.0.1, length 28
06:38:35.662314 ARP, Reply 10.0.0.222 is-at c0:ee:fb:3b:35:93 (oui Unknown), length 28
06:38:36.946460 IP 10.0.0.222.40734 > 90.d0.24ae.ip4.static.sl-reverse.com.https: Flags [S], seq 93986341, win 65535, options [mss 1460,sackOK,TS val 1128890 ecr 0,nop,wscale 8], length 0
06:38:37.186886 IP 90.d0.24ae.ip4.static.sl-reverse.com.https > 10.0.0.222.40734: Flags [S.], seq 409541958, ack 93986342, win 65535, options [mss 1290,nop,wscale 9,sackOK,TS val 1729030562 ecr 1128890], length 0
06:38:37.189785 IP 10.0.0.222.40734 > 90.d0.24ae.ip4.static.sl-reverse.com.https: Flags [.], ack 1, win 343, options [nop,nop,TS val 1128915 ecr 1729030562], length 0
06:38:37.215373 IP 10.0.0.222.40734 > 90.d0.24ae.ip4.static.sl-reverse.com.https: Flags [P.], seq 1:5, ack 1, win 343, options [nop,nop,TS val 1128918 ecr 1729030562], length 4
06:38:37.431909 IP 90.d0.24ae.ip4.static.sl-reverse.com.https > 10.0.0.222.40734: Flags [.], ack 1, win 514, options [nop,nop,TS val 1729030805 ecr 1128915], length 0
06:38:37.484731 IP 90.d0.24ae.ip4.static.sl-reverse.com.https > 10.0.0.222.40734: Flags [.], ack 5, win 514, options [nop,nop,TS val 1729030861 ecr 1128918], length 0
06:38:37.488711 IP 10.0.0.222.40734 > 90.d0.24ae.ip4.static.sl-reverse.com.https: Flags [P.], seq 5:241, ack 1, win 343, options [nop,nop,TS val 1128945 ecr 1729030861], length 236
06:38:37.678596 IP 10.0.0.222 > all-routers.mcast.net: igmp leave 224.0.0.251
06:38:37.678698 IP 10.0.0.222 > all-routers.mcast.net: igmp leave 224.0.0.251
06:38:37.730964 IP 90.d0.24ae.ip4.static.sl-reverse.com.https > 10.0.0.222.40734: Flags [P.], seq 1:58, ack 241, win 514, options [nop,nop,TS val 1729031106 ecr 1128945], length 57
06:38:37.731131 IP 90.d0.24ae.ip4.static.sl-reverse.com.https > 10.0.0.222.40734: Flags [P.], seq 58:101, ack 241, win 514, options [nop,nop,TS val 1729031106 ecr 1128945], length 43
06:38:37.740682 IP 10.0.0.222.40734 > 90.d0.24ae.ip4.static.sl-reverse.com.https: Flags [.], ack 58, win 343, options [nop,nop,TS val 1128970 ecr 1729031106], length 0
06:38:37.750502 IP 10.0.0.222.40734 > 90.d0.24ae.ip4.static.sl-reverse.com.https: Flags [.], ack 101, win 343, options [nop,nop,TS val 1128970 ecr 1729031106], length 0
06:38:37.762592 IP 90.d0.24ae.ip4.static.sl-reverse.com.https > 10.0.0.222.40734: Flags [P.], seq 101:342, ack 241, win 514, options [nop,nop,TS val 1729031137 ecr 1128945], length 241
06:38:37.762839 IP 90.d0.24ae.ip4.static.sl-reverse.com.https > 10.0.0.222.40734: Flags [P.], seq 342:376, ack 241, win 514, options [nop,nop,TS val 1729031138 ecr 1128945], length 34
06:38:37.770643 IP 10.0.0.222.40734 > 90.d0.24ae.ip4.static.sl-reverse.com.https: Flags [P.], seq 241:244, ack 101, win 343, options [nop,nop,TS val 1128973 ecr 1729031106], length 3
06:38:37.812962 IP 10.0.0.222.40734 > 90.d0.24ae.ip4.static.sl-reverse.com.https: Flags [.], ack 376, win 347, options [nop,nop,TS val 1128978 ecr 1729031137], length 0
06:38:38.039675 IP 90.d0.24ae.ip4.static.sl-reverse.com.https > 10.0.0.222.40734: Flags [.], ack 244, win 514, options [nop,nop,TS val 1729031416 ecr 1128973], length 0
06:38:38.042840 IP 10.0.0.222.40734 > 90.d0.24ae.ip4.static.sl-reverse.com.https: Flags [P.], seq 244:423, ack 376, win 347, options [nop,nop,TS val 1129000 ecr 1729031416], length 179
06:38:38.136017 IP 10.0.0.222.42592 > 10.0.0.1.domain: 42954+ AAAA? 127.0.0.1. (27)
06:38:38.197423 IP 10.0.0.1.domain > 10.0.0.222.42592: 42954 NXDomain 0/1/0 (102)
06:38:38.283083 IP 90.d0.24ae.ip4.static.sl-reverse.com.https > 10.0.0.222.40734: Flags [P.], seq 376:417, ack 423, win 514, options [nop,nop,TS val 1729031659 ecr 1129000], length 41
06:38:38.285837 IP 10.0.0.222.40734 > 90.d0.24ae.ip4.static.sl-reverse.com.https: Flags [.], ack 417, win 347, options [nop,nop,TS val 1129025 ecr 1729031659], length 0
06:38:38.558666 ARP, Reply 192.168.0.100 is-at 98:de:d0:09:37:b4 (oui Unknown), length 28
06:38:38.679436 IP 10.0.0.222.57496 > 10.0.0.1.domain: 39276+ A? connectivitycheck.gstatic.com. (47)
06:38:38.746260 IP 10.0.0.1.domain > 10.0.0.222.57496: 39276 1/0/0 A 172.217.26.206 (63)
06:38:38.752706 IP 10.0.0.222.47130 > maa03s23-in-f14.1e100.net.http: Flags [S], seq 2119375173, win 65535, options [mss 1460,sackOK,TS val 1129071 ecr 0,nop,wscale 8], length 0
06:38:38.752973 IP maa03s23-in-f14.1e100.net.http > 10.0.0.222.47130: Flags [S.], seq 2851124231, ack 2119375174, win 28960, options [mss 1460,sackOK,TS val 297414 ecr 1129071,nop,wscale 7], length 0
06:38:38.754627 IP 10.0.0.222.47130 > maa03s23-in-f14.1e100.net.http: Flags [.], ack 1, win 343, options [nop,nop,TS val 1129072 ecr 297414], length 0
06:38:38.756366 IP 10.0.0.222.47130 > maa03s23-in-f14.1e100.net.http: Flags [P.], seq 1:187, ack 1, win 343, options [nop,nop,TS val 1129072 ecr 297414], length 186
06:38:38.756515 IP maa03s23-in-f14.1e100.net.http > 10.0.0.222.47130: Flags [.], ack 187, win 235, options [nop,nop,TS val 297414 ecr 1129072], length 0
06:38:38.769863 IP 10.0.0.222.56804 > 10.0.0.1.domain: 49162+ AAAA? 127.0.0.0. (27)
06:38:38.836338 IP6 fe80::c2ee:fbff:fe3b:3593 > ff02::16: HBH ICMP6, multicast listener report v2, 1 group record(s), length 28
06:38:38.836452 IP6 fe80::c2ee:fbff:fe3b:3593 > ff02::16: HBH ICMP6, multicast listener report v2, 1 group record(s), length 28
06:38:38.851479 IP 10.0.0.1.domain > 10.0.0.222.56804: 49162 NXDomain 0/1/0 (102)
06:38:39.124303 IP maa03s23-in-f14.1e100.net.http > 10.0.0.222.47130: Flags [P.], seq 1:163, ack 187, win 235, options [nop,nop,TS val 297451 ecr 1129072], length 162
06:38:39.194448 IP 10.0.0.222.47130 > maa03s23-in-f14.1e100.net.http: Flags [.], ack 163, win 347, options [nop,nop,TS val 1129116 ecr 297451], length 0
06:38:40.469071 IP 10.0.0.222.54948 > 10.0.0.1.domain: 33585+ AAAA? 224.0.0.0. (27)
06:38:40.537446 IP 10.0.0.1.domain > 10.0.0.222.54948: 33585 NXDomain 0/1/0 (102)
06:38:40.637180 IP 10.0.0.222.49855 > 10.0.0.1.domain: 61213+ AAAA? 169.254.0.0. (29)
06:38:40.703333 IP 10.0.0.1.domain > 10.0.0.222.49855: 61213 NXDomain 0/1/0 (104)
06:38:41.575330 ARP, Reply 192.168.0.100 is-at 98:de:d0:09:37:b4 (oui Unknown), length 28
06:38:42.222134 IP 10.0.0.222.42234 > 10.0.0.1.domain: 60379+ AAAA? 172.16.0.0. (28)
06:38:42.285684 IP 10.0.0.1.domain > 10.0.0.222.42234: 60379 NXDomain 0/1/0 (103)
06:38:42.381418 IP 10.0.0.222.60635 > 10.0.0.1.domain: 59587+ AAAA? 10.0.0.0. (26)
06:38:42.442449 IP 10.0.0.1.domain > 10.0.0.222.60635: 59587 NXDomain 0/1/0 (101)
06:38:43.411605 IP 10.0.0.222.55244 > 10.0.0.1.domain: 52060+ AAAA? 192.168.0.0. (29)
06:38:43.477143 IP 10.0.0.1.domain > 10.0.0.222.55244: 52060 NXDomain 0/1/0 (104)
06:38:44.591861 ARP, Reply 192.168.0.100 is-at 98:de:d0:09:37:b4 (oui Unknown), length 28
06:38:44.731418 IP 10.0.0.222 > 239.255.255.250: igmp v2 report 239.255.255.250
06:38:44.731546 IP 10.0.0.222 > 239.255.255.250: igmp v2 report 239.255.255.250
06:38:44.784753 IP 10.0.0.222.mdns > 224.0.0.251.mdns: 0 PTR (QU)? _mozilla_papi._tcp.local. (42)
06:38:44.784878 IP 10.0.0.222.mdns > 224.0.0.251.mdns: 0 PTR (QU)? _mozilla_papi._tcp.local. (42)
06:38:44.792942 IP 10.0.0.222 > 224.0.0.251: igmp v2 report 224.0.0.251
06:38:44.793042 IP 10.0.0.222 > 224.0.0.251: igmp v2 report 224.0.0.251
06:38:47.476773 IP 10.0.0.222.65261 > 10.0.0.1.domain: 36432+ A? clients1.google.co.in. (39)
06:38:47.478855 IP 10.0.0.222.57881 > 192.168.0.1.4886: UDP, length 0
06:38:47.479062 IP 10.0.0.1 > 10.0.0.222: ICMP time exceeded in-transit, length 36
06:38:47.494906 IP 10.0.0.222.57881 > 192.168.0.1.4886: UDP, length 0
06:38:47.495109 IP 10.0.0.1 > 10.0.0.222: ICMP time exceeded in-transit, length 36
06:38:47.511341 IP 10.0.0.222.57881 > 192.168.0.1.4886: UDP, length 0
06:38:47.511526 IP 10.0.0.1 > 10.0.0.222: ICMP time exceeded in-transit, length 36
06:38:47.528245 IP 10.0.0.222.57881 > 192.168.0.1.4886: UDP, length 0
06:38:47.528406 IP 10.0.0.1 > 10.0.0.222: ICMP time exceeded in-transit, length 36
06:38:47.543830 IP 10.0.0.1.domain > 10.0.0.222.65261: 36432 2/0/0 CNAME clients-cctld.l.google.com., A 216.58.199.131 (95)
06:38:47.544296 IP 10.0.0.222.57881 > 192.168.0.1.4886: UDP, length 0
06:38:47.544488 IP 10.0.0.1 > 10.0.0.222: ICMP time exceeded in-transit, length 36
06:38:47.547688 IP 10.0.0.222.36997 > bom07s01-in-f131.1e100.net.http: Flags [S], seq 763649838, win 65535, options [mss 1460,sackOK,TS val 1129951 ecr 0,nop,wscale 8], length 0
06:38:47.547936 IP bom07s01-in-f131.1e100.net.http > 10.0.0.222.36997: Flags [S.], seq 28364396, ack 763649839, win 28960, options [mss 1460,sackOK,TS val 298293 ecr 1129951,nop,wscale 7], length 0
06:38:47.549152 IP 10.0.0.222.36997 > bom07s01-in-f131.1e100.net.http: Flags [.], ack 1, win 343, options [nop,nop,TS val 1129951 ecr 298293], length 0
06:38:47.553320 IP 10.0.0.222.36997 > bom07s01-in-f131.1e100.net.http: Flags [P.], seq 1:737, ack 1, win 343, options [nop,nop,TS val 1129951 ecr 298293], length 736
06:38:47.553528 IP bom07s01-in-f131.1e100.net.http > 10.0.0.222.36997: Flags [.], ack 737, win 249, options [nop,nop,TS val 298294 ecr 1129951], length 0
06:38:47.561023 IP 10.0.0.222.57881 > 192.168.0.1.4886: UDP, length 0
06:38:47.561248 IP 10.0.0.1 > 10.0.0.222: ICMP time exceeded in-transit, length 36
06:38:47.578690 IP 10.0.0.222.57881 > 192.168.0.1.4886: UDP, length 0
06:38:47.593864 IP 10.0.0.222.57881 > 192.168.0.1.4886: UDP, length 0
06:38:47.611202 IP 10.0.0.222.57881 > 192.168.0.1.4886: UDP, length 0
06:38:47.611695 ARP, Reply 192.168.0.100 is-at 98:de:d0:09:37:b4 (oui Unknown), length 28
06:38:47.628877 IP 10.0.0.222.57881 > 192.168.0.1.4886: UDP, length 0
06:38:47.645081 IP 10.0.0.222.57881 > 192.168.0.1.4886: UDP, length 0
06:38:47.659614 IP 10.0.0.222.36998 > bom07s01-in-f131.1e100.net.http: Flags [S], seq 2133877169, win 65535, options [mss 1460,sackOK,TS val 1129962 ecr 0,nop,wscale 8], length 0
06:38:47.659906 IP bom07s01-in-f131.1e100.net.http > 10.0.0.222.36998: Flags [S.], seq 2873604485, ack 2133877170, win 28960, options [mss 1460,sackOK,TS val 298304 ecr 1129962,nop,wscale 7], length 0
06:38:47.661050 IP 10.0.0.222.57881 > 192.168.0.1.4886: UDP, length 0
06:38:47.661406 IP 10.0.0.222.36998 > bom07s01-in-f131.1e100.net.http: Flags [.], ack 1, win 343, options [nop,nop,TS val 1129962 ecr 298304], length 0
06:38:47.662765 IP 10.0.0.222.36998 > bom07s01-in-f131.1e100.net.http: Flags [P.], seq 1:738, ack 1, win 343, options [nop,nop,TS val 1129962 ecr 298304], length 737
06:38:47.662920 IP bom07s01-in-f131.1e100.net.http > 10.0.0.222.36998: Flags [.], ack 738, win 249, options [nop,nop,TS val 298305 ecr 1129962], length 0
06:38:47.676955 IP 10.0.0.222.57881 > 192.168.0.1.4886: UDP, length 0
06:38:47.693427 IP 10.0.0.222.57881 > 192.168.0.1.4886: UDP, length 0
06:38:47.713274 IP 10.0.0.222.57881 > 192.168.0.1.4886: UDP, length 0
06:38:47.726842 IP 10.0.0.222.57881 > 192.168.0.1.4886: UDP, length 0
06:38:47.742627 IP 10.0.0.222.57881 > 192.168.0.1.4886: UDP, length 0
06:38:47.763459 IP 10.0.0.222.57881 > 192.168.0.1.4886: UDP, length 0
06:38:47.780557 IP 10.0.0.222.57881 > 192.168.0.1.4886: UDP, length 0
06:38:47.793039 IP 10.0.0.222.57881 > 192.168.0.1.4886: UDP, length 0
06:38:47.810211 IP 10.0.0.222.57881 > 192.168.0.1.4886: UDP, length 0
06:38:47.829215 IP 10.0.0.222.57881 > 192.168.0.1.4886: UDP, length 0
06:38:47.833982 IP 10.0.0.222 > 224.0.0.251: igmp v2 report 224.0.0.251
06:38:47.834078 IP 10.0.0.222 > 224.0.0.251: igmp v2 report 224.0.0.251
06:38:47.843165 IP 10.0.0.222.57881 > 192.168.0.1.4886: UDP, length 0
06:38:47.855304 IP 10.0.0.222.36999 > bom07s01-in-f131.1e100.net.http: Flags [S], seq 3604180358, win 65535, options [mss 1460,sackOK,TS val 1129982 ecr 0,nop,wscale 8], length 0
06:38:47.855663 IP bom07s01-in-f131.1e100.net.http > 10.0.0.222.36999: Flags [S.], seq 3343038037, ack 3604180359, win 28960, options [mss 1460,sackOK,TS val 298324 ecr 1129982,nop,wscale 7], length 0
06:38:47.856962 IP 10.0.0.222.36999 > bom07s01-in-f131.1e100.net.http: Flags [.], ack 1, win 343, options [nop,nop,TS val 1129982 ecr 298324], length 0
06:38:47.860694 IP 10.0.0.222.36999 > bom07s01-in-f131.1e100.net.http: Flags [P.], seq 1:739, ack 1, win 343, options [nop,nop,TS val 1129982 ecr 298324], length 738
06:38:47.860906 IP bom07s01-in-f131.1e100.net.http > 10.0.0.222.36999: Flags [.], ack 739, win 249, options [nop,nop,TS val 298325 ecr 1129982], length 0
06:38:47.861086 IP 10.0.0.222.57881 > 192.168.0.1.4886: UDP, length 0
06:38:47.875148 IP 10.0.0.222.57881 > 192.168.0.1.4886: UDP, length 0
06:38:47.891850 IP 10.0.0.222.57881 > 192.168.0.1.4886: UDP, length 0
06:38:47.908106 IP 10.0.0.222.57881 > 192.168.0.1.4886: UDP, length 0
06:38:47.924727 IP 10.0.0.222.57881 > 192.168.0.1.4886: UDP, length 0
06:38:47.940925 IP 10.0.0.222.57881 > 192.168.0.1.4886: UDP, length 0
06:38:47.957586 IP 10.0.0.222.57881 > 192.168.0.1.4886: UDP, length 0
06:38:47.973820 IP 10.0.0.222.57881 > 192.168.0.1.4886: UDP, length 0
06:38:47.990041 IP 10.0.0.222.57881 > 192.168.0.1.4886: UDP, length 0
06:38:48.006576 IP 10.0.0.222.57881 > 192.168.0.1.4886: UDP, length 0
06:38:48.023111 IP 10.0.0.222.57881 > 192.168.0.1.4886: UDP, length 0
06:38:48.039126 IP 10.0.0.222.57881 > 192.168.0.1.4886: UDP, length 0
06:38:48.055719 IP 10.0.0.222.57881 > 192.168.0.1.4886: UDP, length 0
06:38:48.064351 IP 10.0.0.222.37000 > bom07s01-in-f131.1e100.net.http: Flags [S], seq 364411872, win 65535, options [mss 1460,sackOK,TS val 1130003 ecr 0,nop,wscale 8], length 0
06:38:48.064612 IP bom07s01-in-f131.1e100.net.http > 10.0.0.222.37000: Flags [S.], seq 3049616153, ack 364411873, win 28960, options [mss 1460,sackOK,TS val 298345 ecr 1130003,nop,wscale 7], length 0
06:38:48.066165 IP 10.0.0.222.36997 > bom07s01-in-f131.1e100.net.http: Flags [P.], seq 737:1476, ack 1, win 343, options [nop,nop,TS val 1130003 ecr 298294], length 739
06:38:48.066270 IP bom07s01-in-f131.1e100.net.http > 10.0.0.222.36997: Flags [.], ack 1476, win 272, options [nop,nop,TS val 298345 ecr 1130003], length 0
06:38:48.067211 IP 10.0.0.222.37000 > bom07s01-in-f131.1e100.net.http: Flags [.], ack 1, win 343, options [nop,nop,TS val 1130003 ecr 298345], length 0
06:38:48.071823 IP 10.0.0.222.57881 > 192.168.0.1.4886: UDP, length 0
06:38:48.088138 IP 10.0.0.222.57881 > 192.168.0.1.4886: UDP, length 0
06:38:48.104251 IP 10.0.0.222.57881 > 192.168.0.1.4886: UDP, length 0
06:38:48.120721 IP 10.0.0.222.57881 > 192.168.0.1.4886: UDP, length 0
06:38:48.137505 IP 10.0.0.222.57881 > 192.168.0.1.4886: UDP, length 0
06:38:48.153712 IP 10.0.0.222.57881 > 192.168.0.1.4886: UDP, length 0
06:38:48.170270 IP 10.0.0.222.57881 > 192.168.0.1.4886: UDP, length 0
06:38:48.186566 IP 10.0.0.222.57881 > 192.168.0.1.4886: UDP, length 0
06:38:48.203648 IP 10.0.0.222.57881 > 192.168.0.1.4886: UDP, length 0
06:38:48.220138 IP 10.0.0.222.57881 > 192.168.0.1.4886: UDP, length 0
06:38:48.237783 IP 10.0.0.222.57881 > 192.168.0.1.4886: UDP, length 0
06:38:48.254653 IP 10.0.0.222.57881 > 192.168.0.1.4886: UDP, length 0
06:38:48.271464 IP 10.0.0.222.57881 > 192.168.0.1.4886: UDP, length 0
06:38:48.287706 IP 10.0.0.222.57881 > 192.168.0.1.4886: UDP, length 0
06:38:48.291525 IP 10.0.0.222.37000 > bom07s01-in-f131.1e100.net.http: Flags [P.], seq 1:743, ack 1, win 343, options [nop,nop,TS val 1130025 ecr 298345], length 742
06:38:48.291756 IP bom07s01-in-f131.1e100.net.http > 10.0.0.222.37000: Flags [.], ack 743, win 249, options [nop,nop,TS val 298368 ecr 1130025], length 0
06:38:48.304502 IP 10.0.0.222.57881 > 192.168.0.1.4886: UDP, length 0
06:38:48.320635 IP 10.0.0.222.57881 > 192.168.0.1.4886: UDP, length 0
06:38:48.336794 IP 10.0.0.222.57881 > 192.168.0.1.4886: UDP, length 0
06:38:48.352921 IP 10.0.0.222.57881 > 192.168.0.1.4886: UDP, length 0
06:38:48.371525 IP 10.0.0.222.57881 > 192.168.0.1.4886: UDP, length 0
06:38:48.385604 IP 10.0.0.222.57881 > 192.168.0.1.4886: UDP, length 0
06:38:48.401617 IP 10.0.0.222.57881 > 192.168.0.1.4886: UDP, length 0
06:38:48.418225 IP 10.0.0.222.57881 > 192.168.0.1.4886: UDP, length 0
06:38:48.434303 IP 10.0.0.222.57881 > 192.168.0.1.4886: UDP, length 0
06:38:48.451369 IP 10.0.0.222.57881 > 192.168.0.1.4886: UDP, length 0
06:38:48.467892 IP 10.0.0.222.57881 > 192.168.0.1.4886: UDP, length 0
06:38:48.485484 IP 10.0.0.222.57881 > 192.168.0.1.4886: UDP, length 0
06:38:48.485692 IP 10.0.0.1 > 10.0.0.222: ICMP time exceeded in-transit, length 36
06:38:48.501941 IP 10.0.0.222.57881 > 192.168.0.1.4886: UDP, length 0
06:38:48.505802 IP 10.0.0.222.37001 > bom07s01-in-f131.1e100.net.http: Flags [S], seq 3251683823, win 65535, options [mss 1460,sackOK,TS val 1130047 ecr 0,nop,wscale 8], length 0
06:38:48.506068 IP bom07s01-in-f131.1e100.net.http > 10.0.0.222.37001: Flags [S.], seq 2181699526, ack 3251683824, win 28960, options [mss 1460,sackOK,TS val 298389 ecr 1130047,nop,wscale 7], length 0
06:38:48.507404 IP 10.0.0.222.37001 > bom07s01-in-f131.1e100.net.http: Flags [.], ack 1, win 343, options [nop,nop,TS val 1130047 ecr 298389], length 0
06:38:48.508183 IP 10.0.0.222.37001 > bom07s01-in-f131.1e100.net.http: Flags [P.], seq 1:744, ack 1, win 343, options [nop,nop,TS val 1130047 ecr 298389], length 743
06:38:48.508311 IP bom07s01-in-f131.1e100.net.http > 10.0.0.222.37001: Flags [.], ack 744, win 249, options [nop,nop,TS val 298389 ecr 1130047], length 0
06:38:48.518441 IP 10.0.0.222.57881 > 192.168.0.1.4886: UDP, length 0
06:38:48.534995 IP 10.0.0.222.57881 > 192.168.0.1.4886: UDP, length 0
06:38:48.551137 IP 10.0.0.222.57881 > 192.168.0.1.4886: UDP, length 0
06:38:48.570700 IP 10.0.0.222.57881 > 192.168.0.1.4886: UDP, length 0
06:38:48.586614 IP 10.0.0.222.57881 > 192.168.0.1.4886: UDP, length 0
06:38:48.603750 IP 10.0.0.222.57881 > 192.168.0.1.4886: UDP, length 0
06:38:48.619832 IP 10.0.0.222.57881 > 192.168.0.1.4886: UDP, length 0
06:38:48.636587 IP 10.0.0.222.57881 > 192.168.0.1.4886: UDP, length 0
06:38:48.653262 IP 10.0.0.222.57881 > 192.168.0.1.4886: UDP, length 0
06:38:48.669806 IP 10.0.0.222.57881 > 192.168.0.1.4886: UDP, length 0
06:38:48.686521 IP 10.0.0.222.57881 > 192.168.0.1.4886: UDP, length 0
06:38:48.704653 IP 10.0.0.222.57881 > 192.168.0.1.4886: UDP, length 0
06:38:48.719224 IP 10.0.0.222.57881 > 192.168.0.1.4886: UDP, length 0
06:38:48.735552 IP 10.0.0.222.57881 > 192.168.0.1.4886: UDP, length 0
06:38:48.752564 IP 10.0.0.222.57881 > 192.168.0.1.4886: UDP, length 0
06:38:48.769271 IP 10.0.0.222.57881 > 192.168.0.1.4886: UDP, length 0
06:38:48.785794 IP 10.0.0.222.57881 > 192.168.0.1.4886: UDP, length 0
06:38:48.803414 IP 10.0.0.222.57881 > 192.168.0.1.4886: UDP, length 0
06:38:48.820610 IP 10.0.0.222.57881 > 192.168.0.1.4886: UDP, length 0
06:38:48.836574 IP 10.0.0.222.57881 > 192.168.0.1.4886: UDP, length 0
06:38:48.852472 IP 10.0.0.222.57881 > 192.168.0.1.4886: UDP, length 0
06:38:48.868603 IP 10.0.0.222.57881 > 192.168.0.1.4886: UDP, length 0
06:38:48.885289 IP 10.0.0.222.57881 > 192.168.0.1.4886: UDP, length 0
06:38:48.901797 IP 10.0.0.222.57881 > 192.168.0.1.4886: UDP, length 0
06:38:48.915098 IP 10.0.0.222.37002 > bom07s01-in-f131.1e100.net.http: Flags [S], seq 3637434345, win 65535, options [mss 1460,sackOK,TS val 1130088 ecr 0,nop,wscale 8], length 0
06:38:48.915413 IP bom07s01-in-f131.1e100.net.http > 10.0.0.222.37002: Flags [S.], seq 3835078930, ack 3637434346, win 28960, options [mss 1460,sackOK,TS val 298430 ecr 1130088,nop,wscale 7], length 0
06:38:48.916411 IP 10.0.0.222.37002 > bom07s01-in-f131.1e100.net.http: Flags [.], ack 1, win 343, options [nop,nop,TS val 1130088 ecr 298430], length 0
06:38:48.918238 IP 10.0.0.222.57881 > 192.168.0.1.4886: UDP, length 0
06:38:48.921614 IP 10.0.0.222.37002 > bom07s01-in-f131.1e100.net.http: Flags [P.], seq 1:746, ack 1, win 343, options [nop,nop,TS val 1130088 ecr 298430], length 745
06:38:48.921788 IP bom07s01-in-f131.1e100.net.http > 10.0.0.222.37002: Flags [.], ack 746, win 249, options [nop,nop,TS val 298431 ecr 1130088], length 0
06:38:48.935225 IP 10.0.0.222.57881 > 192.168.0.1.4886: UDP, length 0
06:38:48.952584 IP 10.0.0.222.57881 > 192.168.0.1.4886: UDP, length 0
06:38:48.970176 IP 10.0.0.222.57881 > 192.168.0.1.4886: UDP, length 0
06:38:48.985923 IP 10.0.0.222.57881 > 192.168.0.1.4886: UDP, length 0
06:38:49.001988 IP 10.0.0.222.57881 > 192.168.0.1.4886: UDP, length 0
06:38:49.018074 IP 10.0.0.222.57881 > 192.168.0.1.4886: UDP, length 0
06:38:49.034236 IP 10.0.0.222.57881 > 192.168.0.1.4886: UDP, length 0
06:38:49.050869 IP 10.0.0.222.57881 > 192.168.0.1.4886: UDP, length 0
06:38:49.067210 IP 10.0.0.222.57881 > 192.168.0.1.4886: UDP, length 0
06:38:49.083589 IP 10.0.0.222.57881 > 192.168.0.1.4886: UDP, length 0
06:38:49.099881 IP 10.0.0.222.57881 > 192.168.0.1.4886: UDP, length 0
06:38:49.115831 IP 10.0.0.222.57881 > 192.168.0.1.4886: UDP, length 0
06:38:49.125197 IP bom07s01-in-f131.1e100.net.http > 10.0.0.222.36997: Flags [P.], seq 1:697, ack 1476, win 272, options [nop,nop,TS val 298451 ecr 1130003], length 696
06:38:49.127382 IP 10.0.0.222.36997 > bom07s01-in-f131.1e100.net.http: Flags [.], ack 697, win 348, options [nop,nop,TS val 1130109 ecr 298451], length 0
06:38:49.132472 IP 10.0.0.222.57881 > 192.168.0.1.4886: UDP, length 0
06:38:49.148595 IP 10.0.0.222.57881 > 192.168.0.1.4886: UDP, length 0
06:38:49.164784 IP 10.0.0.222.57881 > 192.168.0.1.4886: UDP, length 0
06:38:49.181206 IP 10.0.0.222.57881 > 192.168.0.1.4886: UDP, length 0
06:38:49.197253 IP 10.0.0.222.57881 > 192.168.0.1.4886: UDP, length 0
06:38:49.213854 IP 10.0.0.222.57881 > 192.168.0.1.4886: UDP, length 0
06:38:49.230546 IP 10.0.0.222.57881 > 192.168.0.1.4886: UDP, length 0
06:38:49.246519 IP 10.0.0.222.57881 > 192.168.0.1.4886: UDP, length 0
06:38:49.262746 IP 10.0.0.222.57881 > 192.168.0.1.4886: UDP, length 0
06:38:49.279518 IP 10.0.0.222.57881 > 192.168.0.1.4886: UDP, length 0
06:38:49.295594 IP 10.0.0.222.57881 > 192.168.0.1.4886: UDP, length 0
06:38:49.312041 IP 10.0.0.222.57881 > 192.168.0.1.4886: UDP, length 0
06:38:49.328748 IP 10.0.0.222.57881 > 192.168.0.1.4886: UDP, length 0
06:38:49.346026 IP 10.0.0.222.57881 > 192.168.0.1.4886: UDP, length 0
06:38:49.362543 IP 10.0.0.222.57881 > 192.168.0.1.4886: UDP, length 0
06:38:49.378658 IP 10.0.0.222.57881 > 192.168.0.1.4886: UDP, length 0
06:38:49.395532 IP 10.0.0.222.57881 > 192.168.0.1.4886: UDP, length 0
06:38:49.411737 IP 10.0.0.222.57881 > 192.168.0.1.4886: UDP, length 0
06:38:49.428525 IP 10.0.0.222.57881 > 192.168.0.1.4886: UDP, length 0
06:38:49.444816 IP 10.0.0.222.57881 > 192.168.0.1.4886: UDP, length 0
06:38:49.449457 IP maa03s23-in-f14.1e100.net.http > 10.0.0.222.47130: Flags [F.], seq 163, ack 187, win 235, options [nop,nop,TS val 298483 ecr 1129116], length 0
06:38:49.460933 IP 10.0.0.222.57881 > 192.168.0.1.4886: UDP, length 0
06:38:49.482193 IP 10.0.0.222.47130 > maa03s23-in-f14.1e100.net.http: Flags [.], ack 164, win 347, options [nop,nop,TS val 1130145 ecr 298483], length 0
06:38:49.482454 IP 10.0.0.222.57881 > 192.168.0.1.4886: UDP, length 0
06:38:49.482649 IP 10.0.0.1 > 10.0.0.222: ICMP time exceeded in-transit, length 36
06:38:49.485825 IP bom07s01-in-f131.1e100.net.http > 10.0.0.222.36999: Flags [P.], seq 1:720, ack 739, win 249, options [nop,nop,TS val 298487 ecr 1129982], length 719
06:38:49.486605 IP bom07s01-in-f131.1e100.net.http > 10.0.0.222.36998: Flags [P.], seq 1:661, ack 738, win 249, options [nop,nop,TS val 298487 ecr 1129962], length 660
06:38:49.488584 IP 10.0.0.222.36999 > bom07s01-in-f131.1e100.net.http: Flags [.], ack 720, win 348, options [nop,nop,TS val 1130145 ecr 298487], length 0
06:38:49.489768 IP 10.0.0.222.36998 > bom07s01-in-f131.1e100.net.http: Flags [.], ack 661, win 348, options [nop,nop,TS val 1130145 ecr 298487], length 0
06:38:49.490680 IP 10.0.0.222.36999 > bom07s01-in-f131.1e100.net.http: Flags [P.], seq 739:1488, ack 720, win 348, options [nop,nop,TS val 1130145 ecr 298487], length 749
06:38:49.490830 IP bom07s01-in-f131.1e100.net.http > 10.0.0.222.36999: Flags [.], ack 1488, win 272, options [nop,nop,TS val 298488 ecr 1130145], length 0
06:38:49.499311 IP 10.0.0.222.57881 > 192.168.0.1.4886: UDP, length 0
06:38:49.516179 IP 10.0.0.222.57881 > 192.168.0.1.4886: UDP, length 0
06:38:49.532550 IP 10.0.0.222.57881 > 192.168.0.1.4886: UDP, length 0
06:38:49.548889 IP 10.0.0.222.57881 > 192.168.0.1.4886: UDP, length 0
06:38:49.565937 IP 10.0.0.222.57881 > 192.168.0.1.4886: UDP, length 0
06:38:49.582174 IP 10.0.0.222.57881 > 192.168.0.1.4886: UDP, length 0
06:38:49.600325 IP 10.0.0.222.57881 > 192.168.0.1.4886: UDP, length 0
06:38:49.615637 IP 10.0.0.222.57881 > 192.168.0.1.4886: UDP, length 0
06:38:49.632652 IP 10.0.0.222.57881 > 192.168.0.1.4886: UDP, length 0
06:38:49.649628 IP 10.0.0.222.57881 > 192.168.0.1.4886: UDP, length 0
06:38:49.667320 IP 10.0.0.222.57881 > 192.168.0.1.4886: UDP, length 0
06:38:49.683392 IP 10.0.0.222.57881 > 192.168.0.1.4886: UDP, length 0
06:38:49.699725 IP 10.0.0.222.57881 > 192.168.0.1.4886: UDP, length 0
06:38:49.715718 IP 10.0.0.222.57881 > 192.168.0.1.4886: UDP, length 0
06:38:49.736042 IP 10.0.0.222.36998 > bom07s01-in-f131.1e100.net.http: Flags [P.], seq 738:1489, ack 661, win 348, options [nop,nop,TS val 1130170 ecr 298487], length 751
06:38:49.736290 IP bom07s01-in-f131.1e100.net.http > 10.0.0.222.36998: Flags [.], ack 1489, win 272, options [nop,nop,TS val 298512 ecr 1130170], length 0
06:38:49.737174 IP bom07s01-in-f131.1e100.net.http > 10.0.0.222.37000: Flags [P.], seq 1:722, ack 743, win 249, options [nop,nop,TS val 298512 ecr 1130025], length 721
06:38:49.738367 IP 10.0.0.222.37000 > bom07s01-in-f131.1e100.net.http: Flags [.], ack 722, win 348, options [nop,nop,TS val 1130170 ecr 298512], length 0
06:38:49.751827 IP 10.0.0.222.57881 > 192.168.0.1.4886: UDP, length 0
06:38:49.769740 IP 10.0.0.222.57881 > 192.168.0.1.4886: UDP, length 0
06:38:49.785539 IP 10.0.0.222.57881 > 192.168.0.1.4886: UDP, length 0
06:38:49.801696 IP 10.0.0.222.57881 > 192.168.0.1.4886: UDP, length 0
06:38:49.818075 IP 10.0.0.222.57881 > 192.168.0.1.4886: UDP, length 0
06:38:49.840547 IP 10.0.0.222.57881 > 192.168.0.1.4886: UDP, length 0
06:38:49.852066 IP 10.0.0.222.57881 > 192.168.0.1.4886: UDP, length 0
06:38:49.869582 IP 10.0.0.222.57881 > 192.168.0.1.4886: UDP, length 0
06:38:49.886435 IP 10.0.0.222.57881 > 192.168.0.1.4886: UDP, length 0
06:38:49.902575 IP 10.0.0.222.57881 > 192.168.0.1.4886: UDP, length 0
06:38:49.919244 IP 10.0.0.222.57881 > 192.168.0.1.4886: UDP, length 0
06:38:49.935927 IP 10.0.0.222.57881 > 192.168.0.1.4886: UDP, length 0
06:38:49.951864 IP 10.0.0.222.57881 > 192.168.0.1.4886: UDP, length 0
06:38:49.968689 IP 10.0.0.222.57881 > 192.168.0.1.4886: UDP, length 0
06:38:49.984633 IP 10.0.0.222.57881 > 192.168.0.1.4886: UDP, length 0
06:38:50.001504 IP 10.0.0.222.57881 > 192.168.0.1.4886: UDP, length 0
06:38:50.018002 IP 10.0.0.222.57881 > 192.168.0.1.4886: UDP, length 0
06:38:50.037634 IP 10.0.0.222.57881 > 192.168.0.1.4886: UDP, length 0
06:38:50.050594 IP 10.0.0.222.57881 > 192.168.0.1.4886: UDP, length 0
06:38:50.067024 IP 10.0.0.222.57881 > 192.168.0.1.4886: UDP, length 0
06:38:50.078828 IP bom07s01-in-f131.1e100.net.http > 10.0.0.222.37001: Flags [P.], seq 1:737, ack 744, win 249, options [nop,nop,TS val 298546 ecr 1130047], length 736
06:38:50.080106 IP 10.0.0.222.37001 > bom07s01-in-f131.1e100.net.http: Flags [.], ack 737, win 348, options [nop,nop,TS val 1130204 ecr 298546], length 0
06:38:50.083004 IP 10.0.0.222.57881 > 192.168.0.1.4886: UDP, length 0
06:38:50.084663 IP bom07s01-in-f131.1e100.net.http > 10.0.0.222.36997: Flags [P.], seq 697:1417, ack 1476, win 272, options [nop,nop,TS val 298547 ecr 1130109], length 720
06:38:50.086097 IP 10.0.0.222.36997 > bom07s01-in-f131.1e100.net.http: Flags [.], ack 1417, win 354, options [nop,nop,TS val 1130205 ecr 298547], length 0
06:38:50.089737 IP bom07s01-in-f131.1e100.net.http > 10.0.0.222.37002: Flags [P.], seq 1:756, ack 746, win 249, options [nop,nop,TS val 298547 ecr 1130088], length 755
06:38:50.090892 IP 10.0.0.222.37002 > bom07s01-in-f131.1e100.net.http: Flags [.], ack 756, win 349, options [nop,nop,TS val 1130205 ecr 298547], length 0
06:38:50.099822 IP 10.0.0.222.57881 > 192.168.0.1.4886: UDP, length 0
06:38:50.116389 IP 10.0.0.222.57881 > 192.168.0.1.4886: UDP, length 0
06:38:50.132709 IP 10.0.0.222.57881 > 192.168.0.1.4886: UDP, length 0
06:38:50.166979 IP 10.0.0.222.36997 > bom07s01-in-f131.1e100.net.http: Flags [P.], seq 1476:2229, ack 1417, win 354, options [nop,nop,TS val 1130213 ecr 298547], length 753
06:38:50.167234 IP bom07s01-in-f131.1e100.net.http > 10.0.0.222.36997: Flags [.], ack 2229, win 295, options [nop,nop,TS val 298555 ecr 1130213], length 0
06:38:50.181770 IP 10.0.0.222.57881 > 192.168.0.1.4886: UDP, length 0
06:38:50.197880 IP 10.0.0.222.57881 > 192.168.0.1.4886: UDP, length 0
06:38:50.214755 IP 10.0.0.222.57881 > 192.168.0.1.4886: UDP, length 0
06:38:50.231498 IP 10.0.0.222.57881 > 192.168.0.1.4886: UDP, length 0
06:38:50.231716 IP 10.0.0.222.36999 > bom07s01-in-f131.1e100.net.http: Flags [F.], seq 1488, ack 720, win 348, options [nop,nop,TS val 1130219 ecr 298488], length 0
06:38:50.233391 IP 10.0.0.222.36997 > bom07s01-in-f131.1e100.net.http: Flags [F.], seq 2229, ack 1417, win 354, options [nop,nop,TS val 1130219 ecr 298555], length 0
06:38:50.233755 IP 10.0.0.222.36998 > bom07s01-in-f131.1e100.net.http: Flags [F.], seq 1489, ack 661, win 348, options [nop,nop,TS val 1130219 ecr 298512], length 0
06:38:50.244523 IP 10.0.0.222.57767 > 10.0.0.1.domain: 53553+ A? www.google.co.in. (34)
06:38:50.248240 IP 10.0.0.222.57881 > 192.168.0.1.4886: UDP, length 0
06:38:50.264281 IP 10.0.0.222.57881 > 192.168.0.1.4886: UDP, length 0
06:38:50.270485 IP bom07s01-in-f131.1e100.net.http > 10.0.0.222.36998: Flags [.], ack 1490, win 272, options [nop,nop,TS val 298566 ecr 1130219], length 0
06:38:50.270611 IP bom07s01-in-f131.1e100.net.http > 10.0.0.222.36997: Flags [.], ack 2230, win 295, options [nop,nop,TS val 298566 ecr 1130219], length 0
06:38:50.270677 IP bom07s01-in-f131.1e100.net.http > 10.0.0.222.36999: Flags [.], ack 1489, win 272, options [nop,nop,TS val 298566 ecr 1130219], length 0
06:38:50.280622 IP 10.0.0.222.57881 > 192.168.0.1.4886: UDP, length 0
06:38:50.296868 IP 10.0.0.222.57881 > 192.168.0.1.4886: UDP, length 0
06:38:50.313264 IP 10.0.0.222.57881 > 192.168.0.1.4886: UDP, length 0
06:38:50.330240 IP 10.0.0.222.57881 > 192.168.0.1.4886: UDP, length 0
06:38:50.336001 IP 10.0.0.1.domain > 10.0.0.222.57767: 53553 1/0/0 A 216.58.199.131 (50)
06:38:50.339173 IP 10.0.0.222.37003 > bom07s01-in-f131.1e100.net.http: Flags [S], seq 3668954198, win 65535, options [mss 1460,sackOK,TS val 1130230 ecr 0,nop,wscale 8], length 0
06:38:50.339435 IP bom07s01-in-f131.1e100.net.http > 10.0.0.222.37003: Flags [S.], seq 554139760, ack 3668954199, win 28960, options [mss 1460,sackOK,TS val 298572 ecr 1130230,nop,wscale 7], length 0
06:38:50.343280 IP 10.0.0.222.37003 > bom07s01-in-f131.1e100.net.http: Flags [.], ack 1, win 343, options [nop,nop,TS val 1130230 ecr 298572], length 0
06:38:50.343631 IP 10.0.0.222.37003 > bom07s01-in-f131.1e100.net.http: Flags [P.], seq 1:923, ack 1, win 343, options [nop,nop,TS val 1130230 ecr 298572], length 922
06:38:50.343774 IP bom07s01-in-f131.1e100.net.http > 10.0.0.222.37003: Flags [.], ack 923, win 249, options [nop,nop,TS val 298573 ecr 1130230], length 0
06:38:50.346601 IP 10.0.0.222.57881 > 192.168.0.1.4886: UDP, length 0
06:38:50.362758 IP 10.0.0.222.57881 > 192.168.0.1.4886: UDP, length 0
06:38:50.379195 IP 10.0.0.222.57881 > 192.168.0.1.4886: UDP, length 0
06:38:50.395683 IP 10.0.0.222.57881 > 192.168.0.1.4886: UDP, length 0
06:38:50.412286 IP 10.0.0.222.57881 > 192.168.0.1.4886: UDP, length 0
06:38:50.428912 IP 10.0.0.222.57881 > 192.168.0.1.4886: UDP, length 0
06:38:50.445891 IP 10.0.0.222.57881 > 192.168.0.1.4886: UDP, length 0
06:38:50.461899 IP 10.0.0.222.57881 > 192.168.0.1.4886: UDP, length 0
06:38:50.478195 IP 10.0.0.222.57881 > 192.168.0.1.4886: UDP, length 0
06:38:50.478424 IP 10.0.0.1 > 10.0.0.222: ICMP time exceeded in-transit, length 36
06:38:50.494593 IP 10.0.0.222.57881 > 192.168.0.1.4886: UDP, length 0
06:38:50.512291 IP 10.0.0.222.57881 > 192.168.0.1.4886: UDP, length 0
06:38:50.527551 IP 10.0.0.222.57881 > 192.168.0.1.4886: UDP, length 0
06:38:50.544085 IP 10.0.0.222.57881 > 192.168.0.1.4886: UDP, length 0
06:38:50.559961 IP 10.0.0.222.57881 > 192.168.0.1.4886: UDP, length 0
06:38:50.573849 IP bom07s01-in-f131.1e100.net.http > 10.0.0.222.36999: Flags [F.], seq 720, ack 1489, win 272, options [nop,nop,TS val 298596 ecr 1130219], length 0
06:38:50.575282 IP 10.0.0.222.36999 > bom07s01-in-f131.1e100.net.http: Flags [.], ack 721, win 348, options [nop,nop,TS val 1130254 ecr 298596], length 0
06:38:50.575965 IP 10.0.0.222.57881 > 192.168.0.1.4886: UDP, length 0
06:38:50.592645 IP 10.0.0.222.57881 > 192.168.0.1.4886: UDP, length 0
06:38:50.608640 IP 10.0.0.222.57881 > 192.168.0.1.4886: UDP, length 0
06:38:50.610652 IP bom07s01-in-f131.1e100.net.http > 10.0.0.222.36998: Flags [F.], seq 661, ack 1490, win 272, options [nop,nop,TS val 298600 ecr 1130219], length 0
06:38:50.611641 IP 10.0.0.222.36998 > bom07s01-in-f131.1e100.net.http: Flags [.], ack 662, win 348, options [nop,nop,TS val 1130257 ecr 298600], length 0
06:38:50.625053 IP 10.0.0.222.57881 > 192.168.0.1.4886: UDP, length 0
06:38:50.725214 ARP, Reply 192.168.0.100 is-at 98:de:d0:09:37:b4 (oui Unknown), length 28
06:38:51.053385 IP bom07s01-in-f131.1e100.net.http > 10.0.0.222.36997: Flags [F.], seq 1417, ack 2230, win 295, options [nop,nop,TS val 298644 ecr 1130219], length 0
06:38:51.174342 IP 10.0.0.222.36997 > bom07s01-in-f131.1e100.net.http: Flags [.], ack 1418, win 354, options [nop,nop,TS val 1130314 ecr 298644], length 0
06:38:51.853159 IP bom07s01-in-f131.1e100.net.http > 10.0.0.222.37003: Flags [.], seq 1:1449, ack 923, win 249, options [nop,nop,TS val 298724 ecr 1130230], length 1448
06:38:51.853270 IP bom07s01-in-f131.1e100.net.http > 10.0.0.222.37003: Flags [.], seq 1449:2897, ack 923, win 249, options [nop,nop,TS val 298724 ecr 1130230], length 1448
06:38:51.853334 IP bom07s01-in-f131.1e100.net.http > 10.0.0.222.37003: Flags [.], seq 2897:4345, ack 923, win 249, options [nop,nop,TS val 298724 ecr 1130230], length 1448
06:38:51.853389 IP bom07s01-in-f131.1e100.net.http > 10.0.0.222.37003: Flags [.], seq 4345:5793, ack 923, win 249, options [nop,nop,TS val 298724 ecr 1130230], length 1448
06:38:51.991450 IP bom07s01-in-f131.1e100.net.http > 10.0.0.222.37003: Flags [.], seq 5793:7241, ack 923, win 249, options [nop,nop,TS val 298738 ecr 1130230], length 1448
06:38:51.992023 IP bom07s01-in-f131.1e100.net.http > 10.0.0.222.37003: Flags [.], seq 7241:8689, ack 923, win 249, options [nop,nop,TS val 298738 ecr 1130230], length 1448
06:38:51.992507 IP bom07s01-in-f131.1e100.net.http > 10.0.0.222.37003: Flags [.], seq 8689:10137, ack 923, win 249, options [nop,nop,TS val 298738 ecr 1130230], length 1448
06:38:51.992666 IP 10.0.0.222.37003 > bom07s01-in-f131.1e100.net.http: Flags [.], ack 1449, win 354, options [nop,nop,TS val 1130396 ecr 298724], length 0
06:38:51.992873 IP 10.0.0.222.37003 > bom07s01-in-f131.1e100.net.http: Flags [.], ack 2897, win 365, options [nop,nop,TS val 1130396 ecr 298724], length 0
06:38:51.993109 IP 10.0.0.222.37003 > bom07s01-in-f131.1e100.net.http: Flags [.], ack 4345, win 377, options [nop,nop,TS val 1130396 ecr 298724], length 0
06:38:51.994639 IP bom07s01-in-f131.1e100.net.http > 10.0.0.222.37003: Flags [.], seq 10137:11585, ack 923, win 249, options [nop,nop,TS val 298738 ecr 1130396], length 1448
06:38:51.994828 IP 10.0.0.222.37003 > bom07s01-in-f131.1e100.net.http: Flags [.], ack 5793, win 388, options [nop,nop,TS val 1130396 ecr 298724], length 0
06:38:51.995016 IP 10.0.0.222.37003 > bom07s01-in-f131.1e100.net.http: Flags [.], ack 7241, win 399, options [nop,nop,TS val 1130396 ecr 298738], length 0
06:38:51.995250 IP 10.0.0.222.37003 > bom07s01-in-f131.1e100.net.http: Flags [.], ack 8689, win 411, options [nop,nop,TS val 1130396 ecr 298738], length 0
06:38:51.995769 IP bom07s01-in-f131.1e100.net.http > 10.0.0.222.37003: Flags [.], seq 11585:13033, ack 923, win 249, options [nop,nop,TS val 298738 ecr 1130396], length 1448
06:38:51.996383 IP bom07s01-in-f131.1e100.net.http > 10.0.0.222.37003: Flags [.], seq 13033:14481, ack 923, win 249, options [nop,nop,TS val 298738 ecr 1130396], length 1448
