14:19:59.812540 ARP, Request who-has 10.0.0.222 tell 10.0.0.1, length 28
14:20:00.812453 ARP, Request who-has 10.0.0.222 tell 10.0.0.1, length 28
14:20:00.995852 c0:ee:fb:3b:35:93 (oui Unknown) > Broadcast Null Unnumbered, xid, Flags [Response], length 6: 01 00
14:20:01.169010 IP6 :: > ff02::1:ff3b:3593: ICMP6, neighbor solicitation, who has fe80::c2ee:fbff:fe3b:3593, length 24
14:20:01.169080 IP6 :: > ff02::1:ff3b:3593: ICMP6, neighbor solicitation, who has fe80::c2ee:fbff:fe3b:3593, length 24
14:20:01.179247 IP6 :: > ff02::16: HBH ICMP6, multicast listener report v2, 1 group record(s), length 28
14:20:01.179271 IP6 :: > ff02::16: HBH ICMP6, multicast listener report v2, 1 group record(s), length 28
14:20:01.213951 IP 0.0.0.0.bootpc > 255.255.255.255.bootps: BOOTP/DHCP, Request from c0:ee:fb:3b:35:93 (oui Unknown), length 298
14:20:01.214050 IP 0.0.0.0.bootpc > 255.255.255.255.bootps: BOOTP/DHCP, Request from c0:ee:fb:3b:35:93 (oui Unknown), length 298
14:20:01.214702 IP bom07s01-in-f14.1e100.net.http > 10.0.0.222.45269: Flags [F.], seq 3138247276, ack 3872788460, win 341, options [nop,nop,TS val 2435509212 ecr 287193], length 0
14:20:01.214750 IP bom07s01-in-f14.1e100.net.http > 10.0.0.222.45269: Flags [F.], seq 0, ack 1, win 341, options [nop,nop,TS val 2435509652 ecr 287193], length 0
14:20:01.214765 IP bom07s01-in-f14.1e100.net.http > 10.0.0.222.45269: Flags [F.], seq 0, ack 1, win 341, options [nop,nop,TS val 2435510151 ecr 287193], length 0
14:20:01.214886 IP 10.0.0.1.bootps > 10.0.0.222.bootpc: BOOTP/DHCP, Reply, length 300
14:20:01.225968 IP 0.0.0.0.bootpc > 255.255.255.255.bootps: BOOTP/DHCP, Request from c0:ee:fb:3b:35:93 (oui Unknown), length 310
14:20:01.226018 IP 0.0.0.0.bootpc > 255.255.255.255.bootps: BOOTP/DHCP, Request from c0:ee:fb:3b:35:93 (oui Unknown), length 310
14:20:01.233345 IP 10.0.0.1.bootps > 10.0.0.222.bootpc: BOOTP/DHCP, Reply, length 300
14:20:01.346372 ARP, Request who-has 10.0.0.1 tell 10.0.0.222, length 28
14:20:01.346425 ARP, Reply 10.0.0.1 is-at c4:e9:84:16:11:5e (oui Unknown), length 28
14:20:01.346486 ARP, Request who-has 10.0.0.1 tell 10.0.0.222, length 28
14:20:01.348217 IP 10.0.0.222.34599 > 10.0.0.1.domain: 36132+ AAAA? connectivitycheck.gstatic.com. (47)
14:20:01.540993 IP bom07s01-in-f14.1e100.net.http > 10.0.0.222.45269: Flags [F.], seq 0, ack 1, win 341, options [nop,nop,TS val 2435511149 ecr 287193], length 0
14:20:01.601597 IP 10.0.0.1.domain > 10.0.0.222.34599: 36132 1/0/0 AAAA 2404:6800:4009:806::200e (75)
14:20:02.646451 IP6 fe80::c2ee:fbff:fe3b:3593 > ip6-allrouters: ICMP6, router solicitation, length 16
14:20:02.646590 IP6 fe80::c2ee:fbff:fe3b:3593 > ip6-allrouters: ICMP6, router solicitation, length 16
14:20:02.648726 IP 10.0.0.222.45269 > bom07s01-in-f14.1e100.net.http: Flags [R], seq 3872788460, win 0, length 0
14:20:03.332830 IP 10.0.0.222.37020 > 10.0.0.1.domain: 39530+ AAAA? 127.0.0.1. (27)
14:20:03.783468 IP 10.0.0.1.domain > 10.0.0.222.37020: 39530 NXDomain 0/1/0 (102)
14:20:04.375479 IP 10.0.0.222.47970 > 10.0.0.1.domain: 35846+ AAAA? 127.0.0.0. (27)
14:20:04.905950 IP 10.0.0.1.domain > 10.0.0.222.47970: 35846 NXDomain 0/1/0 (102)
14:20:06.542524 ARP, Request who-has 10.0.0.222 tell 10.0.0.1, length 28
14:20:06.596318 IP 10.0.0.222.57452 > 10.0.0.1.domain: 53277+ AAAA? 224.0.0.0. (27)
14:20:06.598050 ARP, Reply 10.0.0.222 is-at c0:ee:fb:3b:35:93 (oui Unknown), length 28
14:20:07.202051 IP 10.0.0.1.domain > 10.0.0.222.57452: 53277 NXDomain 0/1/0 (102)
14:20:07.435143 IP 10.0.0.222.51453 > 10.0.0.1.domain: 52665+ AAAA? 169.254.0.0. (29)
14:20:07.820802 IP 10.0.0.1.domain > 10.0.0.222.51453: 52665 NXDomain 0/1/0 (104)
14:20:09.004939 IP 10.0.0.222.50956 > 10.0.0.1.domain: 60226+ AAAA? 172.16.0.0. (28)
14:20:09.205670 IP 10.0.0.1.domain > 10.0.0.222.50956: 60226 NXDomain 0/1/0 (103)
14:20:09.264763 IP 10.0.0.222.36978 > 10.0.0.1.domain: 60053+ AAAA? 10.0.0.0. (26)
14:20:09.551084 IP 10.0.0.1.domain > 10.0.0.222.36978: 60053 NXDomain 0/1/0 (101)
14:20:09.680132 IP 10.0.0.222.46884 > 10.0.0.1.domain: 39331+ A? connectivitycheck.gstatic.com. (47)
14:20:09.680439 IP 10.0.0.1 > 10.0.0.222: ICMP 10.0.0.1 udp port domain unreachable, length 83
14:20:09.682768 IP 10.0.0.222.57684 > 10.0.0.1.domain: 39331+ A? connectivitycheck.gstatic.com. (47)
14:20:09.683063 IP 10.0.0.1 > 10.0.0.222: ICMP 10.0.0.1 udp port domain unreachable, length 83
14:20:09.685303 IP 10.0.0.222.59846 > 10.0.0.1.domain: 42244+ A? connectivitycheck.gstatic.com. (47)
14:20:09.685538 IP 10.0.0.1 > 10.0.0.222: ICMP 10.0.0.1 udp port domain unreachable, length 83
14:20:09.688747 IP 10.0.0.222.36218 > 10.0.0.1.domain: 42244+ A? connectivitycheck.gstatic.com. (47)
14:20:09.689020 IP 10.0.0.1 > 10.0.0.222: ICMP 10.0.0.1 udp port domain unreachable, length 83
14:20:10.310513 IP 10.0.0.222.46265 > 10.0.0.1.domain: 37916+ AAAA? 192.168.0.0. (29)
14:20:10.310805 IP 10.0.0.1 > 10.0.0.222: ICMP 10.0.0.1 udp port domain unreachable, length 65
14:20:10.312400 IP 10.0.0.222.42055 > 10.0.0.1.domain: 37916+ AAAA? 192.168.0.0. (29)
14:20:10.312639 IP 10.0.0.1 > 10.0.0.222: ICMP 10.0.0.1 udp port domain unreachable, length 65
14:20:10.314317 IP 10.0.0.222.65024 > 10.0.0.1.domain: 53672+ AAAA? 192.168.0.0. (29)
14:20:11.836458 ARP, Reply 192.168.0.100 is-at c4:e9:84:16:11:5e (oui Unknown), length 28
14:20:14.846993 ARP, Reply 192.168.0.100 is-at c4:e9:84:16:11:5e (oui Unknown), length 28
14:20:15.334055 IP 10.0.0.222.65024 > 10.0.0.1.domain: 53672+ AAAA? 192.168.0.0. (29)
14:20:15.434619 IP 10.0.0.1.domain > 10.0.0.222.65024: 53672 NXDomain 0/1/0 (104)
14:20:17.861433 ARP, Reply 192.168.0.100 is-at c4:e9:84:16:11:5e (oui Unknown), length 28
14:20:20.876402 ARP, Reply 192.168.0.100 is-at c4:e9:84:16:11:5e (oui Unknown), length 28
14:20:22.504839 IP 10.0.0.222.47654 > 10.0.0.1.domain: 53723+ A? switchboard.services.mozilla.com. (50)
14:20:22.666670 IP 10.0.0.1.domain > 10.0.0.222.47654: 53723 2/0/0 CNAME switchboard.r53-2.services.mozilla.com., A 52.27.67.158 (98)
14:20:22.675833 IP 10.0.0.222.58924 > ec2-52-27-67-158.us-west-2.compute.amazonaws.com.https: Flags [S], seq 3000451580, win 65535, options [mss 1460,sackOK,TS val 313534 ecr 0,nop,wscale 8], length 0
14:20:23.038913 IP ec2-52-27-67-158.us-west-2.compute.amazonaws.com.https > 10.0.0.222.58924: Flags [S.], seq 2042958242, ack 3000451581, win 17898, options [mss 1440,sackOK,TS val 474676366 ecr 313534,nop,wscale 8], length 0
14:20:23.137548 IP 10.0.0.222.40016 > 10.0.0.1.domain: 55588+ AAAA? 10.0.0.222. (28)
14:20:23.138656 IP 10.0.0.222.58924 > ec2-52-27-67-158.us-west-2.compute.amazonaws.com.https: Flags [.], ack 1, win 343, options [nop,nop,TS val 313581 ecr 474676366], length 0
14:20:23.143272 IP 10.0.0.222.58924 > ec2-52-27-67-158.us-west-2.compute.amazonaws.com.https: Flags [P.], seq 1:199, ack 1, win 343, options [nop,nop,TS val 313581 ecr 474676366], length 198
14:20:23.255136 IP 10.0.0.1.domain > 10.0.0.222.40016: 55588 NXDomain 0/1/0 (103)
14:20:23.370876 IP 10.0.0.222.mdns > 224.0.0.251.mdns: 0 PTR (QU)? _mozilla_papi._tcp.local. (42)
14:20:23.370965 IP 10.0.0.222.mdns > 224.0.0.251.mdns: 0 PTR (QU)? _mozilla_papi._tcp.local. (42)
14:20:23.377964 IP 10.0.0.222 > 224.0.0.251: igmp v2 report 224.0.0.251
14:20:23.378077 IP 10.0.0.222 > 224.0.0.251: igmp v2 report 224.0.0.251
14:20:23.451694 IP ec2-52-27-67-158.us-west-2.compute.amazonaws.com.https > 10.0.0.222.58924: Flags [.], ack 199, win 75, options [nop,nop,TS val 474676483 ecr 313581], length 0
14:20:23.452412 IP ec2-52-27-67-158.us-west-2.compute.amazonaws.com.https > 10.0.0.222.58924: Flags [.], seq 1:1349, ack 199, win 75, options [nop,nop,TS val 474676484 ecr 313581], length 1348
14:20:23.452697 IP ec2-52-27-67-158.us-west-2.compute.amazonaws.com.https > 10.0.0.222.58924: Flags [.], seq 1349:2697, ack 199, win 75, options [nop,nop,TS val 474676484 ecr 313581], length 1348
14:20:23.452810 IP ec2-52-27-67-158.us-west-2.compute.amazonaws.com.https > 10.0.0.222.58924: Flags [P.], seq 2697:2942, ack 199, win 75, options [nop,nop,TS val 474676484 ecr 313581], length 245
14:20:23.453859 IP 10.0.0.222.58924 > ec2-52-27-67-158.us-west-2.compute.amazonaws.com.https: Flags [.], ack 1349, win 353, options [nop,nop,TS val 313612 ecr 474676484], length 0
14:20:23.454413 IP 10.0.0.222.58924 > ec2-52-27-67-158.us-west-2.compute.amazonaws.com.https: Flags [.], ack 2697, win 364, options [nop,nop,TS val 313612 ecr 474676484], length 0
14:20:23.454680 IP 10.0.0.222.58924 > ec2-52-27-67-158.us-west-2.compute.amazonaws.com.https: Flags [.], ack 2942, win 374, options [nop,nop,TS val 313612 ecr 474676484], length 0
14:20:23.484658 IP 10.0.0.222.58924 > ec2-52-27-67-158.us-west-2.compute.amazonaws.com.https: Flags [P.], seq 199:325, ack 2942, win 374, options [nop,nop,TS val 313615 ecr 474676484], length 126
14:20:23.826928 IP ec2-52-27-67-158.us-west-2.compute.amazonaws.com.https > 10.0.0.222.58924: Flags [P.], seq 2942:3200, ack 325, win 75, options [nop,nop,TS val 474676569 ecr 313615], length 258
14:20:23.888455 ARP, Reply 192.168.0.100 is-at c4:e9:84:16:11:5e (oui Unknown), length 28
14:20:23.910645 IP 10.0.0.222.58924 > ec2-52-27-67-158.us-west-2.compute.amazonaws.com.https: Flags [P.], seq 325:669, ack 3200, win 385, options [nop,nop,TS val 313658 ecr 474676569], length 344
14:20:24.284396 IP ec2-52-27-67-158.us-west-2.compute.amazonaws.com.https > 10.0.0.222.58924: Flags [P.], seq 3200:4174, ack 669, win 79, options [nop,nop,TS val 474676676 ecr 313658], length 974
14:20:24.318048 IP 10.0.0.222.58924 > ec2-52-27-67-158.us-west-2.compute.amazonaws.com.https: Flags [.], ack 4174, win 395, options [nop,nop,TS val 313699 ecr 474676676], length 0
14:20:26.901422 ARP, Reply 192.168.0.100 is-at c4:e9:84:16:11:5e (oui Unknown), length 28
14:20:26.909777 IP 10.0.0.222 > 224.0.0.251: igmp v2 report 224.0.0.251
14:20:26.909896 IP 10.0.0.222 > 224.0.0.251: igmp v2 report 224.0.0.251
14:20:27.660178 IP 10.0.0.222 > 224.0.0.251: igmp v2 report 224.0.0.251
14:20:27.660295 IP 10.0.0.222 > 224.0.0.251: igmp v2 report 224.0.0.251
14:20:28.233360 IP 10.0.0.222.62840 > 10.0.0.1.domain: 52222+ A? mail.google.com. (33)
14:20:28.233600 IP 10.0.0.222.63526 > 10.0.0.1.domain: 33295+ A? google.co.in. (30)
14:20:28.276776 IP 10.0.0.222.43095 > 10.0.0.1.4886: UDP, length 0
14:20:28.276966 IP 10.0.0.1 > 10.0.0.222: ICMP 10.0.0.1 udp port 4886 unreachable, length 36
14:20:28.292979 IP 10.0.0.222.43095 > 10.0.0.1.4886: UDP, length 0
14:20:28.293095 IP 10.0.0.1 > 10.0.0.222: ICMP 10.0.0.1 udp port 4886 unreachable, length 36
14:20:28.309505 IP 10.0.0.222.43095 > 10.0.0.1.4886: UDP, length 0
14:20:28.309591 IP 10.0.0.1 > 10.0.0.222: ICMP 10.0.0.1 udp port 4886 unreachable, length 36
14:20:28.326137 IP 10.0.0.222.43095 > 10.0.0.1.4886: UDP, length 0
14:20:28.326231 IP 10.0.0.1 > 10.0.0.222: ICMP 10.0.0.1 udp port 4886 unreachable, length 36
14:20:28.342633 IP 10.0.0.222.43095 > 10.0.0.1.4886: UDP, length 0
14:20:28.342700 IP 10.0.0.1 > 10.0.0.222: ICMP 10.0.0.1 udp port 4886 unreachable, length 36
14:20:28.359008 IP 10.0.0.222.43095 > 10.0.0.1.4886: UDP, length 0
14:20:28.359070 IP 10.0.0.1 > 10.0.0.222: ICMP 10.0.0.1 udp port 4886 unreachable, length 36
14:20:28.374973 IP 10.0.0.222.43095 > 10.0.0.1.4886: UDP, length 0
14:20:28.391497 IP 10.0.0.222.43095 > 10.0.0.1.4886: UDP, length 0
14:20:28.408390 IP 10.0.0.222.43095 > 10.0.0.1.4886: UDP, length 0
14:20:28.424777 IP 10.0.0.222.43095 > 10.0.0.1.4886: UDP, length 0
14:20:28.427411 IP 10.0.0.1.domain > 10.0.0.222.62840: 52222 2/0/0 CNAME googlemail.l.google.com., A 216.58.199.133 (76)
14:20:28.431676 IP 10.0.0.222.41346 > bom07s01-in-f5.1e100.net.https: Flags [S], seq 1269694736, win 65535, options [mss 1460,sackOK,TS val 314110 ecr 0,nop,wscale 8], length 0
14:20:28.441140 IP 10.0.0.222.43095 > 10.0.0.1.4886: UDP, length 0
14:20:28.441325 IP 10.0.0.1.domain > 10.0.0.222.63526: 33295 1/0/0 A 216.58.199.131 (46)
14:20:28.443334 IP 10.0.0.222.38895 > bom07s01-in-f3.1e100.net.http: Flags [S], seq 549309086, win 65535, options [mss 1460,sackOK,TS val 314111 ecr 0,nop,wscale 8], length 0
14:20:28.443570 IP bom07s01-in-f3.1e100.net.http > 10.0.0.222.38895: Flags [S.], seq 726327574, ack 549309087, win 28960, options [mss 1460,sackOK,TS val 11369 ecr 314111,nop,wscale 7], length 0
14:20:28.444539 IP 10.0.0.222.38895 > bom07s01-in-f3.1e100.net.http: Flags [.], ack 1, win 343, options [nop,nop,TS val 314111 ecr 11369], length 0
14:20:28.445738 IP 10.0.0.222.38896 > bom07s01-in-f3.1e100.net.http: Flags [S], seq 3022153902, win 65535, options [mss 1460,sackOK,TS val 314111 ecr 0,nop,wscale 8], length 0
14:20:28.445927 IP bom07s01-in-f3.1e100.net.http > 10.0.0.222.38896: Flags [S.], seq 4112707591, ack 3022153903, win 28960, options [mss 1460,sackOK,TS val 11369 ecr 314111,nop,wscale 7], length 0
14:20:28.446411 IP 10.0.0.222.38895 > bom07s01-in-f3.1e100.net.http: Flags [P.], seq 1:749, ack 1, win 343, options [nop,nop,TS val 314111 ecr 11369], length 748
14:20:28.446538 IP bom07s01-in-f3.1e100.net.http > 10.0.0.222.38895: Flags [.], ack 749, win 249, options [nop,nop,TS val 11369 ecr 314111], length 0
14:20:28.447041 IP 10.0.0.222.38896 > bom07s01-in-f3.1e100.net.http: Flags [.], ack 1, win 343, options [nop,nop,TS val 314111 ecr 11369], length 0
14:20:28.457676 IP 10.0.0.222.43095 > 10.0.0.1.4886: UDP, length 0
14:20:28.473943 IP 10.0.0.222.43095 > 10.0.0.1.4886: UDP, length 0
14:20:28.490216 IP 10.0.0.222.43095 > 10.0.0.1.4886: UDP, length 0
14:20:28.506524 IP 10.0.0.222.43095 > 10.0.0.1.4886: UDP, length 0
14:20:28.522799 IP 10.0.0.222.43095 > 10.0.0.1.4886: UDP, length 0
14:20:28.539071 IP 10.0.0.222.43095 > 10.0.0.1.4886: UDP, length 0
14:20:28.555348 IP 10.0.0.222.43095 > 10.0.0.1.4886: UDP, length 0
14:20:28.568906 IP bom07s01-in-f5.1e100.net.https > 10.0.0.222.41346: Flags [S.], seq 658862294, ack 1269694737, win 42540, options [mss 1430,sackOK,TS val 1355460199 ecr 314110,nop,wscale 7], length 0
14:20:28.570808 IP 10.0.0.222.41346 > bom07s01-in-f5.1e100.net.https: Flags [.], ack 1, win 343, options [nop,nop,TS val 314124 ecr 1355460199], length 0
14:20:28.571118 IP 10.0.0.222.41346 > bom07s01-in-f5.1e100.net.https: Flags [P.], seq 1:198, ack 1, win 343, options [nop,nop,TS val 314124 ecr 1355460199], length 197
14:20:28.572220 IP 10.0.0.222.43095 > 10.0.0.1.4886: UDP, length 0
14:20:28.588556 IP 10.0.0.222.43095 > 10.0.0.1.4886: UDP, length 0
14:20:28.605095 IP 10.0.0.222.43095 > 10.0.0.1.4886: UDP, length 0
14:20:28.621776 IP 10.0.0.222.43095 > 10.0.0.1.4886: UDP, length 0
14:20:28.638057 IP 10.0.0.222.43095 > 10.0.0.1.4886: UDP, length 0
14:20:28.654383 IP 10.0.0.222.43095 > 10.0.0.1.4886: UDP, length 0
14:20:28.715921 IP bom07s01-in-f5.1e100.net.https > 10.0.0.222.41346: Flags [.], ack 198, win 341, options [nop,nop,TS val 1355460338 ecr 314124], length 0
14:20:28.716617 IP bom07s01-in-f5.1e100.net.https > 10.0.0.222.41346: Flags [.], seq 1:1349, ack 198, win 341, options [nop,nop,TS val 1355460338 ecr 314124], length 1348
14:20:28.717965 IP 10.0.0.222.41346 > bom07s01-in-f5.1e100.net.https: Flags [.], ack 1349, win 353, options [nop,nop,TS val 314139 ecr 1355460338], length 0
14:20:28.723102 IP bom07s01-in-f5.1e100.net.https > 10.0.0.222.41346: Flags [.], seq 1349:2697, ack 198, win 341, options [nop,nop,TS val 1355460338 ecr 314124], length 1348
14:20:28.724450 IP 10.0.0.222.41346 > bom07s01-in-f5.1e100.net.https: Flags [.], ack 2697, win 364, options [nop,nop,TS val 314139 ecr 1355460338], length 0
14:20:28.729187 IP bom07s01-in-f5.1e100.net.https > 10.0.0.222.41346: Flags [P.], seq 2697:3160, ack 198, win 341, options [nop,nop,TS val 1355460338 ecr 314124], length 463
14:20:28.730297 IP 10.0.0.222.41346 > bom07s01-in-f5.1e100.net.https: Flags [.], ack 3160, win 374, options [nop,nop,TS val 314140 ecr 1355460338], length 0
14:20:28.758544 IP 10.0.0.222.41346 > bom07s01-in-f5.1e100.net.https: Flags [P.], seq 198:324, ack 3160, win 374, options [nop,nop,TS val 314143 ecr 1355460338], length 126
14:20:28.759181 IP 10.0.0.222.41346 > bom07s01-in-f5.1e100.net.https: Flags [P.], seq 324:481, ack 3160, win 374, options [nop,nop,TS val 314143 ecr 1355460338], length 157
14:20:28.905513 IP bom07s01-in-f5.1e100.net.https > 10.0.0.222.41346: Flags [P.], seq 3160:3422, ack 481, win 350, options [nop,nop,TS val 1355460526 ecr 314143], length 262
14:20:28.906807 IP bom07s01-in-f5.1e100.net.https > 10.0.0.222.41346: Flags [P.], seq 3422:3484, ack 481, win 350, options [nop,nop,TS val 1355460526 ecr 314143], length 62
14:20:28.907290 IP bom07s01-in-f5.1e100.net.https > 10.0.0.222.41346: Flags [P.], seq 3484:3526, ack 481, win 350, options [nop,nop,TS val 1355460526 ecr 314143], length 42
14:20:28.907669 IP bom07s01-in-f5.1e100.net.https > 10.0.0.222.41346: Flags [P.], seq 3526:3564, ack 481, win 350, options [nop,nop,TS val 1355460527 ecr 314143], length 38
14:20:28.910686 IP 10.0.0.222.41346 > bom07s01-in-f5.1e100.net.https: Flags [P.], seq 481:519, ack 3564, win 385, options [nop,nop,TS val 314158 ecr 1355460526], length 38
14:20:29.127461 IP bom07s01-in-f5.1e100.net.https > 10.0.0.222.41346: Flags [.], ack 519, win 350, options [nop,nop,TS val 1355460718 ecr 314158], length 0
14:20:29.358553 IP bom07s01-in-f3.1e100.net.http > 10.0.0.222.38895: Flags [P.], seq 1:546, ack 749, win 249, options [nop,nop,TS val 11460 ecr 314111], length 545
14:20:29.360164 IP 10.0.0.222.38895 > bom07s01-in-f3.1e100.net.http: Flags [.], ack 546, win 347, options [nop,nop,TS val 314203 ecr 11460], length 0
14:20:29.468158 IP 10.0.0.222.1555 > 10.0.0.1.domain: 37512+ A? www.google.com. (32)
14:20:29.489517 IP 10.0.0.222.43095 > 10.0.0.1.4886: UDP, length 0
14:20:29.489662 IP 10.0.0.1 > 10.0.0.222: ICMP 10.0.0.1 udp port 4886 unreachable, length 36
14:20:29.490269 IP 10.0.0.222.58387 > 10.0.0.1.domain: 43961+ A? www.google.co.in. (34)
14:20:29.505898 IP 10.0.0.222.43095 > 10.0.0.1.4886: UDP, length 0
14:20:29.522164 IP 10.0.0.222.43095 > 10.0.0.1.4886: UDP, length 0
14:20:29.538405 IP 10.0.0.222.43095 > 10.0.0.1.4886: UDP, length 0
14:20:29.554803 IP 10.0.0.222.43095 > 10.0.0.1.4886: UDP, length 0
14:20:29.571208 IP 10.0.0.222.43095 > 10.0.0.1.4886: UDP, length 0
14:20:29.587376 IP 10.0.0.222.43095 > 10.0.0.1.4886: UDP, length 0
14:20:29.603780 IP 10.0.0.222.43095 > 10.0.0.1.4886: UDP, length 0
14:20:29.620303 IP 10.0.0.222.43095 > 10.0.0.1.4886: UDP, length 0
14:20:29.627329 IP 10.0.0.1.domain > 10.0.0.222.58387: 43961 1/0/0 A 216.58.199.131 (50)
14:20:29.630332 IP 10.0.0.222.38897 > bom07s01-in-f3.1e100.net.http: Flags [S], seq 2882179950, win 65535, options [mss 1460,sackOK,TS val 314230 ecr 0,nop,wscale 8], length 0
14:20:29.630709 IP bom07s01-in-f3.1e100.net.http > 10.0.0.222.38897: Flags [S.], seq 2524878674, ack 2882179951, win 28960, options [mss 1460,sackOK,TS val 11487 ecr 314230,nop,wscale 7], length 0
14:20:29.635405 IP 10.0.0.222.38897 > bom07s01-in-f3.1e100.net.http: Flags [.], ack 1, win 343, options [nop,nop,TS val 314230 ecr 11487], length 0
14:20:29.636176 IP 10.0.0.222.38897 > bom07s01-in-f3.1e100.net.http: Flags [P.], seq 1:753, ack 1, win 343, options [nop,nop,TS val 314230 ecr 11487], length 752
14:20:29.636396 IP bom07s01-in-f3.1e100.net.http > 10.0.0.222.38897: Flags [.], ack 753, win 249, options [nop,nop,TS val 11488 ecr 314230], length 0
14:20:29.637053 IP 10.0.0.222.43095 > 10.0.0.1.4886: UDP, length 0
14:20:29.653552 IP 10.0.0.222.43095 > 10.0.0.1.4886: UDP, length 0
14:20:29.669737 IP 10.0.0.222.43095 > 10.0.0.1.4886: UDP, length 0
14:20:29.686732 IP 10.0.0.222.43095 > 10.0.0.1.4886: UDP, length 0
14:20:29.701573 IP 10.0.0.1.domain > 10.0.0.222.1555: 37512 1/0/0 A 216.58.199.132 (48)
14:20:29.706796 IP 10.0.0.222.43095 > 10.0.0.1.4886: UDP, length 0
14:20:29.708298 IP 10.0.0.222.46983 > bom07s01-in-f4.1e100.net.https: Flags [S], seq 2788266303, win 65535, options [mss 1460,sackOK,TS val 314238 ecr 0,nop,wscale 8], length 0
14:20:29.712562 IP 10.0.0.222.57790 > bom07s01-in-f4.1e100.net.https: Flags [S], seq 2965359337, win 65535, options [mss 1460,sackOK,TS val 314238 ecr 0,nop,wscale 8], length 0
14:20:29.723197 IP 10.0.0.222.43095 > 10.0.0.1.4886: UDP, length 0
14:20:29.739668 IP 10.0.0.222.43095 > 10.0.0.1.4886: UDP, length 0
14:20:29.756211 IP 10.0.0.222.43095 > 10.0.0.1.4886: UDP, length 0
14:20:29.773328 IP 10.0.0.222.43095 > 10.0.0.1.4886: UDP, length 0
14:20:29.789803 IP 10.0.0.222.43095 > 10.0.0.1.4886: UDP, length 0
14:20:29.806193 IP 10.0.0.222.43095 > 10.0.0.1.4886: UDP, length 0
14:20:29.822657 IP 10.0.0.222.43095 > 10.0.0.1.4886: UDP, length 0
14:20:29.832611 IP bom07s01-in-f4.1e100.net.https > 10.0.0.222.46983: Flags [S.], seq 3318849396, ack 2788266304, win 42540, options [mss 1430,sackOK,TS val 2435719049 ecr 314238,nop,wscale 7], length 0
14:20:29.832837 IP bom07s01-in-f4.1e100.net.https > 10.0.0.222.57790: Flags [S.], seq 3378165506, ack 2965359338, win 42540, options [mss 1430,sackOK,TS val 288362358 ecr 314238,nop,wscale 7], length 0
14:20:29.834066 IP 10.0.0.222.46983 > bom07s01-in-f4.1e100.net.https: Flags [.], ack 1, win 343, options [nop,nop,TS val 314250 ecr 2435719049], length 0
14:20:29.834300 IP 10.0.0.222.57790 > bom07s01-in-f4.1e100.net.https: Flags [.], ack 1, win 343, options [nop,nop,TS val 314250 ecr 288362358], length 0
14:20:29.835179 IP 10.0.0.222.46983 > bom07s01-in-f4.1e100.net.https: Flags [P.], seq 1:197, ack 1, win 343, options [nop,nop,TS val 314250 ecr 2435719049], length 196
14:20:29.837323 IP 10.0.0.222.57790 > bom07s01-in-f4.1e100.net.https: Flags [P.], seq 1:181, ack 1, win 343, options [nop,nop,TS val 314250 ecr 288362358], length 180
14:20:29.839091 IP 10.0.0.222.43095 > 10.0.0.1.4886: UDP, length 0
14:20:29.855103 IP 10.0.0.222.43095 > 10.0.0.1.4886: UDP, length 0
14:20:29.871621 IP 10.0.0.222.43095 > 10.0.0.1.4886: UDP, length 0
14:20:29.888296 IP 10.0.0.222.43095 > 10.0.0.1.4886: UDP, length 0
14:20:29.913239 ARP, Reply 192.168.0.100 is-at c4:e9:84:16:11:5e (oui Unknown), length 28
14:20:29.962180 IP bom07s01-in-f4.1e100.net.https > 10.0.0.222.46983: Flags [.], ack 197, win 341, options [nop,nop,TS val 2435719176 ecr 314250], length 0
14:20:29.962517 IP bom07s01-in-f4.1e100.net.https > 10.0.0.222.46983: Flags [.], seq 1:1349, ack 197, win 341, options [nop,nop,TS val 2435719178 ecr 314250], length 1348
14:20:29.964115 IP 10.0.0.222.46983 > bom07s01-in-f4.1e100.net.https: Flags [.], ack 1349, win 353, options [nop,nop,TS val 314263 ecr 2435719178], length 0
14:20:29.969266 IP bom07s01-in-f4.1e100.net.https > 10.0.0.222.46983: Flags [.], seq 1349:2697, ack 197, win 341, options [nop,nop,TS val 2435719178 ecr 314250], length 1348
14:20:29.971446 IP 10.0.0.222.46983 > bom07s01-in-f4.1e100.net.https: Flags [.], ack 2697, win 364, options [nop,nop,TS val 314264 ecr 2435719178], length 0
14:20:29.975460 IP bom07s01-in-f4.1e100.net.https > 10.0.0.222.46983: Flags [P.], seq 2697:3515, ack 197, win 341, options [nop,nop,TS val 2435719178 ecr 314250], length 818
14:20:29.977315 IP 10.0.0.222.46983 > bom07s01-in-f4.1e100.net.https: Flags [.], ack 3515, win 374, options [nop,nop,TS val 314264 ecr 2435719178], length 0
14:20:29.979174 IP bom07s01-in-f4.1e100.net.https > 10.0.0.222.57790: Flags [.], ack 181, win 341, options [nop,nop,TS val 288362483 ecr 314250], length 0
14:20:29.979525 IP bom07s01-in-f4.1e100.net.https > 10.0.0.222.57790: Flags [.], seq 1:1349, ack 181, win 341, options [nop,nop,TS val 288362484 ecr 314250], length 1348
14:20:29.982826 IP 10.0.0.222.57790 > bom07s01-in-f4.1e100.net.https: Flags [.], ack 1349, win 353, options [nop,nop,TS val 314265 ecr 288362484], length 0
14:20:29.986122 IP bom07s01-in-f4.1e100.net.https > 10.0.0.222.57790: Flags [.], seq 1349:2697, ack 181, win 341, options [nop,nop,TS val 288362484 ecr 314250], length 1348
14:20:29.988321 IP 10.0.0.222.57790 > bom07s01-in-f4.1e100.net.https: Flags [.], ack 2697, win 364, options [nop,nop,TS val 314266 ecr 288362484], length 0
14:20:29.992365 IP bom07s01-in-f4.1e100.net.https > 10.0.0.222.57790: Flags [P.], seq 2697:3521, ack 181, win 341, options [nop,nop,TS val 288362484 ecr 314250], length 824
14:20:29.994109 IP 10.0.0.222.57790 > bom07s01-in-f4.1e100.net.https: Flags [.], ack 3521, win 374, options [nop,nop,TS val 314266 ecr 288362484], length 0
14:20:30.032646 IP 10.0.0.222.46983 > bom07s01-in-f4.1e100.net.https: Flags [P.], seq 197:323, ack 3515, win 374, options [nop,nop,TS val 314270 ecr 2435719178], length 126
14:20:30.036460 IP 10.0.0.222.46983 > bom07s01-in-f4.1e100.net.https: Flags [P.], seq 323:480, ack 3515, win 374, options [nop,nop,TS val 314270 ecr 2435719178], length 157
14:20:30.064127 IP 10.0.0.222.57790 > bom07s01-in-f4.1e100.net.https: Flags [P.], seq 181:307, ack 3521, win 374, options [nop,nop,TS val 314273 ecr 288362484], length 126
14:20:30.200628 IP bom07s01-in-f4.1e100.net.https > 10.0.0.222.46983: Flags [P.], seq 3515:3777, ack 323, win 341, options [nop,nop,TS val 2435719374 ecr 314270], length 262
14:20:30.202337 IP bom07s01-in-f4.1e100.net.https > 10.0.0.222.46983: Flags [P.], seq 3777:3839, ack 323, win 341, options [nop,nop,TS val 2435719374 ecr 314270], length 62
14:20:30.202511 IP bom07s01-in-f4.1e100.net.https > 10.0.0.222.46983: Flags [P.], seq 3839:3881, ack 323, win 341, options [nop,nop,TS val 2435719374 ecr 314270], length 42
14:20:30.202725 IP 10.0.0.222.46983 > bom07s01-in-f4.1e100.net.https: Flags [.], ack 3777, win 385, options [nop,nop,TS val 314287 ecr 2435719374], length 0
14:20:30.202972 IP bom07s01-in-f4.1e100.net.https > 10.0.0.222.46983: Flags [P.], seq 3881:3919, ack 480, win 350, options [nop,nop,TS val 2435719378 ecr 314270], length 38
14:20:30.204079 IP 10.0.0.222.46983 > bom07s01-in-f4.1e100.net.https: Flags [.], ack 3839, win 385, options [nop,nop,TS val 314287 ecr 2435719374], length 0
14:20:30.205077 IP 10.0.0.222.46983 > bom07s01-in-f4.1e100.net.https: Flags [.], ack 3881, win 385, options [nop,nop,TS val 314287 ecr 2435719374], length 0
14:20:30.205170 IP 10.0.0.222.46983 > bom07s01-in-f4.1e100.net.https: Flags [.], ack 3919, win 385, options [nop,nop,TS val 314287 ecr 2435719378], length 0
14:20:30.205377 IP 10.0.0.222.46983 > bom07s01-in-f4.1e100.net.https: Flags [P.], seq 480:518, ack 3919, win 385, options [nop,nop,TS val 314287 ecr 2435719378], length 38
14:20:30.229012 IP bom07s01-in-f4.1e100.net.https > 10.0.0.222.57790: Flags [P.], seq 3521:3783, ack 307, win 341, options [nop,nop,TS val 288362710 ecr 314273], length 262
14:20:30.231159 IP 10.0.0.222.57790 > bom07s01-in-f4.1e100.net.https: Flags [.], ack 3783, win 385, options [nop,nop,TS val 314290 ecr 288362710], length 0
14:20:30.234360 IP 10.0.0.222.57790 > bom07s01-in-f4.1e100.net.https: Flags [P.], seq 307:541, ack 3783, win 385, options [nop,nop,TS val 314290 ecr 288362710], length 234
14:20:30.373408 IP bom07s01-in-f4.1e100.net.https > 10.0.0.222.46983: Flags [.], ack 518, win 350, options [nop,nop,TS val 2435719586 ecr 314287], length 0
14:20:30.406118 IP bom07s01-in-f4.1e100.net.https > 10.0.0.222.57790: Flags [.], ack 541, win 350, options [nop,nop,TS val 288362919 ecr 314290], length 0
14:20:30.445438 IP bom07s01-in-f4.1e100.net.https > 10.0.0.222.57790: Flags [P.], seq 3783:4542, ack 541, win 350, options [nop,nop,TS val 288362953 ecr 314290], length 759
14:20:30.478413 IP 10.0.0.222.57790 > bom07s01-in-f4.1e100.net.https: Flags [.], ack 4542, win 395, options [nop,nop,TS val 314315 ecr 288362953], length 0
14:20:30.685662 IP bom07s01-in-f3.1e100.net.http > 10.0.0.222.38897: Flags [.], seq 1:1449, ack 753, win 249, options [nop,nop,TS val 11593 ecr 314230], length 1448
14:20:30.688759 IP 10.0.0.222.38897 > bom07s01-in-f3.1e100.net.http: Flags [.], ack 1449, win 354, options [nop,nop,TS val 314335 ecr 11593], length 0
14:20:30.702601 IP bom07s01-in-f3.1e100.net.http > 10.0.0.222.38897: Flags [.], seq 1449:2897, ack 753, win 249, options [nop,nop,TS val 11595 ecr 314230], length 1448
14:20:30.702728 IP bom07s01-in-f3.1e100.net.http > 10.0.0.222.38897: Flags [.], seq 2897:4345, ack 753, win 249, options [nop,nop,TS val 11595 ecr 314230], length 1448
14:20:30.702801 IP bom07s01-in-f3.1e100.net.http > 10.0.0.222.38897: Flags [.], seq 4345:5793, ack 753, win 249, options [nop,nop,TS val 11595 ecr 314230], length 1448
14:20:30.703848 IP bom07s01-in-f3.1e100.net.http > 10.0.0.222.38897: Flags [.], seq 5793:7241, ack 753, win 249, options [nop,nop,TS val 11595 ecr 314335], length 1448
14:20:30.704322 IP bom07s01-in-f3.1e100.net.http > 10.0.0.222.38897: Flags [.], seq 7241:8689, ack 753, win 249, options [nop,nop,TS val 11595 ecr 314335], length 1448
14:20:30.704831 IP bom07s01-in-f3.1e100.net.http > 10.0.0.222.38897: Flags [.], seq 8689:10137, ack 753, win 249, options [nop,nop,TS val 11595 ecr 314335], length 1448
14:20:30.705450 IP bom07s01-in-f3.1e100.net.http > 10.0.0.222.38897: Flags [.], seq 10137:11585, ack 753, win 249, options [nop,nop,TS val 11595 ecr 314335], length 1448
14:20:30.705643 IP 10.0.0.222.38897 > bom07s01-in-f3.1e100.net.http: Flags [.], ack 2897, win 365, options [nop,nop,TS val 314337 ecr 11595], length 0
14:20:30.705767 IP bom07s01-in-f3.1e100.net.http > 10.0.0.222.38897: Flags [.], seq 11585:13033, ack 753, win 249, options [nop,nop,TS val 11595 ecr 314337], length 1448
14:20:30.706339 IP bom07s01-in-f3.1e100.net.http > 10.0.0.222.38897: Flags [P.], seq 13033:13186, ack 753, win 249, options [nop,nop,TS val 11595 ecr 314337], length 153
14:20:30.707076 IP 10.0.0.222.38897 > bom07s01-in-f3.1e100.net.http: Flags [.], ack 4345, win 377, options [nop,nop,TS val 314337 ecr 11595], length 0
14:20:30.708486 IP 10.0.0.222.38897 > bom07s01-in-f3.1e100.net.http: Flags [.], ack 5793, win 388, options [nop,nop,TS val 314338 ecr 11595], length 0
14:20:30.709680 IP 10.0.0.222.38897 > bom07s01-in-f3.1e100.net.http: Flags [.], ack 7241, win 399, options [nop,nop,TS val 314338 ecr 11595], length 0
14:20:30.710030 IP 10.0.0.222.38897 > bom07s01-in-f3.1e100.net.http: Flags [.], ack 8689, win 411, options [nop,nop,TS val 314338 ecr 11595], length 0
14:20:30.711312 IP 10.0.0.222.38897 > bom07s01-in-f3.1e100.net.http: Flags [.], ack 10137, win 422, options [nop,nop,TS val 314338 ecr 11595], length 0
14:20:30.711884 IP 10.0.0.222.38897 > bom07s01-in-f3.1e100.net.http: Flags [.], ack 11585, win 433, options [nop,nop,TS val 314338 ecr 11595], length 0
14:20:30.712106 IP 10.0.0.222.38897 > bom07s01-in-f3.1e100.net.http: Flags [.], ack 13033, win 444, options [nop,nop,TS val 314338 ecr 11595], length 0
14:20:30.712545 IP 10.0.0.222.38897 > bom07s01-in-f3.1e100.net.http: Flags [.], ack 13186, win 444, options [nop,nop,TS val 314338 ecr 11595], length 0
14:20:30.808425 IP 10.0.0.222.43095 > 10.0.0.1.4886: UDP, length 0
14:20:30.808648 IP 10.0.0.1 > 10.0.0.222: ICMP 10.0.0.1 udp port 4886 unreachable, length 36
14:20:30.825064 IP 10.0.0.222.43095 > 10.0.0.1.4886: UDP, length 0
14:20:30.841699 IP 10.0.0.222.43095 > 10.0.0.1.4886: UDP, length 0
14:20:30.843476 IP 10.0.0.222.38897 > bom07s01-in-f3.1e100.net.http: Flags [P.], seq 753:1575, ack 13186, win 444, options [nop,nop,TS val 314351 ecr 11595], length 822
14:20:30.843651 IP bom07s01-in-f3.1e100.net.http > 10.0.0.222.38897: Flags [.], ack 1575, win 272, options [nop,nop,TS val 11609 ecr 314351], length 0
14:20:30.857578 IP 10.0.0.222.43095 > 10.0.0.1.4886: UDP, length 0
14:20:30.873908 IP 10.0.0.222.43095 > 10.0.0.1.4886: UDP, length 0
14:20:30.877844 IP 10.0.0.222.45222 > 10.0.0.1.domain: 55312+ A? ssl.gstatic.com. (33)
14:20:30.888341 IP 10.0.0.222.38899 > bom07s01-in-f3.1e100.net.http: Flags [S], seq 2212412519, win 65535, options [mss 1460,sackOK,TS val 314356 ecr 0,nop,wscale 8], length 0
14:20:30.888576 IP bom07s01-in-f3.1e100.net.http > 10.0.0.222.38899: Flags [S.], seq 616248819, ack 2212412520, win 28960, options [mss 1460,sackOK,TS val 11613 ecr 314356,nop,wscale 7], length 0
14:20:30.889549 IP 10.0.0.222.38899 > bom07s01-in-f3.1e100.net.http: Flags [.], ack 1, win 343, options [nop,nop,TS val 314356 ecr 11613], length 0
14:20:30.889813 IP 10.0.0.222.43095 > 10.0.0.1.4886: UDP, length 0
14:20:30.906261 IP 10.0.0.222.43095 > 10.0.0.1.4886: UDP, length 0
14:20:30.922918 IP 10.0.0.222.43095 > 10.0.0.1.4886: UDP, length 0
14:20:30.939251 IP 10.0.0.222.43095 > 10.0.0.1.4886: UDP, length 0
14:20:30.955809 IP 10.0.0.222.43095 > 10.0.0.1.4886: UDP, length 0
14:20:30.972330 IP 10.0.0.222.43095 > 10.0.0.1.4886: UDP, length 0
14:20:30.988759 IP 10.0.0.222.43095 > 10.0.0.1.4886: UDP, length 0
14:20:31.005245 IP 10.0.0.222.43095 > 10.0.0.1.4886: UDP, length 0
14:20:31.021894 IP 10.0.0.222.43095 > 10.0.0.1.4886: UDP, length 0
14:20:31.038349 IP 10.0.0.222.43095 > 10.0.0.1.4886: UDP, length 0
14:20:31.054899 IP 10.0.0.222.43095 > 10.0.0.1.4886: UDP, length 0
14:20:31.071394 IP 10.0.0.222.43095 > 10.0.0.1.4886: UDP, length 0
14:20:31.087870 IP 10.0.0.222.43095 > 10.0.0.1.4886: UDP, length 0
14:20:31.104655 IP 10.0.0.222.43095 > 10.0.0.1.4886: UDP, length 0
14:20:31.121190 IP 10.0.0.222.43095 > 10.0.0.1.4886: UDP, length 0
14:20:31.132505 IP 10.0.0.222.38899 > bom07s01-in-f3.1e100.net.http: Flags [P.], seq 1:770, ack 1, win 343, options [nop,nop,TS val 314380 ecr 11613], length 769
14:20:31.132712 IP bom07s01-in-f3.1e100.net.http > 10.0.0.222.38899: Flags [.], ack 770, win 249, options [nop,nop,TS val 11638 ecr 314380], length 0
14:20:31.135315 IP 10.0.0.222.38897 > bom07s01-in-f3.1e100.net.http: Flags [P.], seq 1575:2434, ack 13186, win 444, options [nop,nop,TS val 314380 ecr 11609], length 859
14:20:31.135476 IP bom07s01-in-f3.1e100.net.http > 10.0.0.222.38897: Flags [.], ack 2434, win 295, options [nop,nop,TS val 11638 ecr 314380], length 0
14:20:31.137239 IP 10.0.0.222.43095 > 10.0.0.1.4886: UDP, length 0
14:20:31.143434 IP 10.0.0.1.domain > 10.0.0.222.45222: 55312 1/0/0 A 216.58.199.131 (49)
14:20:31.145823 IP 10.0.0.222.38900 > bom07s01-in-f3.1e100.net.http: Flags [S], seq 2732153911, win 65535, options [mss 1460,sackOK,TS val 314381 ecr 0,nop,wscale 8], length 0
14:20:31.146069 IP bom07s01-in-f3.1e100.net.http > 10.0.0.222.38900: Flags [S.], seq 288136331, ack 2732153912, win 28960, options [mss 1460,sackOK,TS val 11639 ecr 314381,nop,wscale 7], length 0
14:20:31.147017 IP 10.0.0.222.38900 > bom07s01-in-f3.1e100.net.http: Flags [.], ack 1, win 343, options [nop,nop,TS val 314381 ecr 11639], length 0
14:20:31.147971 IP 10.0.0.222.38900 > bom07s01-in-f3.1e100.net.http: Flags [P.], seq 1:344, ack 1, win 343, options [nop,nop,TS val 314381 ecr 11639], length 343
14:20:31.148101 IP bom07s01-in-f3.1e100.net.http > 10.0.0.222.38900: Flags [.], ack 344, win 235, options [nop,nop,TS val 11639 ecr 314381], length 0
14:20:31.154040 IP 10.0.0.222.43095 > 10.0.0.1.4886: UDP, length 0
14:20:31.171878 IP 10.0.0.222.43095 > 10.0.0.1.4886: UDP, length 0
14:20:31.188130 IP 10.0.0.222.43095 > 10.0.0.1.4886: UDP, length 0
14:20:31.204535 IP 10.0.0.222.43095 > 10.0.0.1.4886: UDP, length 0
14:20:31.220523 IP 10.0.0.222.43095 > 10.0.0.1.4886: UDP, length 0
14:20:31.236794 IP 10.0.0.222.43095 > 10.0.0.1.4886: UDP, length 0
14:20:31.253392 IP 10.0.0.222.43095 > 10.0.0.1.4886: UDP, length 0
14:20:31.277995 IP 10.0.0.222.43095 > 10.0.0.1.4886: UDP, length 0
14:20:31.278180 IP 10.0.0.1 > 10.0.0.222: ICMP 10.0.0.1 udp port 4886 unreachable, length 36
14:20:31.294514 IP 10.0.0.222.43095 > 10.0.0.1.4886: UDP, length 0
14:20:31.310671 IP 10.0.0.222.43095 > 10.0.0.1.4886: UDP, length 0
14:20:31.327172 IP 10.0.0.222.43095 > 10.0.0.1.4886: UDP, length 0
14:20:31.343528 IP 10.0.0.222.43095 > 10.0.0.1.4886: UDP, length 0
14:20:31.347768 IP 10.0.0.222 > 239.255.255.250: igmp v2 report 239.255.255.250
14:20:31.347859 IP 10.0.0.222 > 239.255.255.250: igmp v2 report 239.255.255.250
14:20:31.359610 IP 10.0.0.222.43095 > 10.0.0.1.4886: UDP, length 0
14:20:31.375527 IP 10.0.0.222.43095 > 10.0.0.1.4886: UDP, length 0
14:20:31.391857 IP 10.0.0.222.43095 > 10.0.0.1.4886: UDP, length 0
14:20:31.408007 IP 10.0.0.222.43095 > 10.0.0.1.4886: UDP, length 0
14:20:31.424126 IP 10.0.0.222.43095 > 10.0.0.1.4886: UDP, length 0
14:20:31.440419 IP 10.0.0.222.43095 > 10.0.0.1.4886: UDP, length 0
14:20:31.457230 IP 10.0.0.222.43095 > 10.0.0.1.4886: UDP, length 0
14:20:31.475664 IP 10.0.0.222.43095 > 10.0.0.1.4886: UDP, length 0
14:20:31.490449 IP 10.0.0.222.43095 > 10.0.0.1.4886: UDP, length 0
14:20:31.506804 IP 10.0.0.222.43095 > 10.0.0.1.4886: UDP, length 0
14:20:31.839277 IP 10.0.0.222.1900 > 239.255.255.250.1900: UDP, length 94
14:20:31.839370 IP 10.0.0.222.1900 > 239.255.255.250.1900: UDP, length 94
14:20:31.874475 IP bom07s01-in-f3.1e100.net.http > 10.0.0.222.38899: Flags [.], seq 1:1449, ack 770, win 249, options [nop,nop,TS val 11712 ecr 314380], length 1448
14:20:31.875282 IP bom07s01-in-f3.1e100.net.http > 10.0.0.222.38899: Flags [P.], seq 1449:2676, ack 770, win 249, options [nop,nop,TS val 11712 ecr 314380], length 1227
14:20:31.876436 IP 10.0.0.222.38899 > bom07s01-in-f3.1e100.net.http: Flags [.], ack 1449, win 354, options [nop,nop,TS val 314454 ecr 11712], length 0
14:20:31.877046 IP 10.0.0.222.38899 > bom07s01-in-f3.1e100.net.http: Flags [.], ack 2676, win 365, options [nop,nop,TS val 314454 ecr 11712], length 0
14:20:31.916960 IP bom07s01-in-f3.1e100.net.http > 10.0.0.222.38899: Flags [.], seq 2676:4124, ack 770, win 249, options [nop,nop,TS val 11716 ecr 314454], length 1448
14:20:31.917124 IP bom07s01-in-f3.1e100.net.http > 10.0.0.222.38899: Flags [.], seq 4124:5572, ack 770, win 249, options [nop,nop,TS val 11716 ecr 314454], length 1448
14:20:31.917202 IP bom07s01-in-f3.1e100.net.http > 10.0.0.222.38899: Flags [.], seq 5572:7020, ack 770, win 249, options [nop,nop,TS val 11716 ecr 314454], length 1448
14:20:31.917616 IP bom07s01-in-f3.1e100.net.http > 10.0.0.222.38899: Flags [P.], seq 7020:8068, ack 770, win 249, options [nop,nop,TS val 11716 ecr 314454], length 1048
14:20:31.918839 IP 10.0.0.222.38899 > bom07s01-in-f3.1e100.net.http: Flags [.], ack 4124, win 377, options [nop,nop,TS val 314459 ecr 11716], length 0
14:20:31.919070 IP 10.0.0.222.38899 > bom07s01-in-f3.1e100.net.http: Flags [.], ack 5572, win 388, options [nop,nop,TS val 314459 ecr 11716], length 0
14:20:31.919286 IP 10.0.0.222.38899 > bom07s01-in-f3.1e100.net.http: Flags [.], ack 7020, win 399, options [nop,nop,TS val 314459 ecr 11716], length 0
14:20:31.920363 IP 10.0.0.222.38899 > bom07s01-in-f3.1e100.net.http: Flags [.], ack 8068, win 411, options [nop,nop,TS val 314459 ecr 11716], length 0
14:20:31.923963 IP bom07s01-in-f3.1e100.net.http > 10.0.0.222.38899: Flags [.], seq 8068:9516, ack 770, win 249, options [nop,nop,TS val 11717 ecr 314459], length 1448
14:20:31.924103 IP bom07s01-in-f3.1e100.net.http > 10.0.0.222.38899: Flags [.], seq 9516:10964, ack 770, win 249, options [nop,nop,TS val 11717 ecr 314459], length 1448
14:20:31.924197 IP bom07s01-in-f3.1e100.net.http > 10.0.0.222.38899: Flags [.], seq 10964:12412, ack 770, win 249, options [nop,nop,TS val 11717 ecr 314459], length 1448
14:20:31.924618 IP bom07s01-in-f3.1e100.net.http > 10.0.0.222.38899: Flags [P.], seq 12412:13460, ack 770, win 249, options [nop,nop,TS val 11717 ecr 314459], length 1048
14:20:31.925468 IP 10.0.0.222.38899 > bom07s01-in-f3.1e100.net.http: Flags [.], ack 9516, win 422, options [nop,nop,TS val 314459 ecr 11717], length 0
14:20:31.926507 IP 10.0.0.222.38899 > bom07s01-in-f3.1e100.net.http: Flags [.], ack 10964, win 433, options [nop,nop,TS val 314459 ecr 11717], length 0
14:20:31.926711 IP 10.0.0.222.38899 > bom07s01-in-f3.1e100.net.http: Flags [.], ack 12412, win 444, options [nop,nop,TS val 314459 ecr 11717], length 0
14:20:31.927363 IP 10.0.0.222.38899 > bom07s01-in-f3.1e100.net.http: Flags [.], ack 13460, win 456, options [nop,nop,TS val 314459 ecr 11717], length 0
14:20:31.991910 IP bom07s01-in-f3.1e100.net.http > 10.0.0.222.38900: Flags [.], seq 1:1449, ack 344, win 235, options [nop,nop,TS val 11723 ecr 314381], length 1448
14:20:31.992061 IP bom07s01-in-f3.1e100.net.http > 10.0.0.222.38900: Flags [.], seq 1449:2897, ack 344, win 235, options [nop,nop,TS val 11723 ecr 314381], length 1448
