16:33:49.853360 ARP, Reply 192.168.0.100 is-at 00:1e:a6:6a:69:64 (oui Unknown), length 28
16:33:52.871146 ARP, Reply 192.168.0.100 is-at 00:1e:a6:6a:69:64 (oui Unknown), length 28
16:33:55.886195 ARP, Reply 192.168.0.100 is-at 00:1e:a6:6a:69:64 (oui Unknown), length 28
16:33:58.898317 ARP, Reply 192.168.0.100 is-at 00:1e:a6:6a:69:64 (oui Unknown), length 28
16:34:01.924890 ARP, Reply 192.168.0.100 is-at 00:1e:a6:6a:69:64 (oui Unknown), length 28
16:34:04.939171 ARP, Reply 192.168.0.100 is-at 00:1e:a6:6a:69:64 (oui Unknown), length 28
16:34:07.950528 ARP, Reply 192.168.0.100 is-at 00:1e:a6:6a:69:64 (oui Unknown), length 28
16:34:08.038783 c0:ee:fb:3b:35:93 (oui Unknown) > Broadcast Null Unnumbered, xid, Flags [Response], length 6: 01 00
16:34:08.180680 IP6 :: > ff02::1:ff3b:3593: ICMP6, neighbor solicitation, who has fe80::c2ee:fbff:fe3b:3593, length 24
16:34:08.180781 IP6 :: > ff02::1:ff3b:3593: ICMP6, neighbor solicitation, who has fe80::c2ee:fbff:fe3b:3593, length 24
16:34:08.208663 IP 0.0.0.0.bootpc > 255.255.255.255.bootps: BOOTP/DHCP, Request from c0:ee:fb:3b:35:93 (oui Unknown), length 298
16:34:08.208820 IP 0.0.0.0.bootpc > 255.255.255.255.bootps: BOOTP/DHCP, Request from c0:ee:fb:3b:35:93 (oui Unknown), length 298
16:34:08.209753 IP 10.0.0.1.bootps > 10.0.0.222.bootpc: BOOTP/DHCP, Reply, length 300
16:34:08.219171 IP 0.0.0.0.bootpc > 255.255.255.255.bootps: BOOTP/DHCP, Request from c0:ee:fb:3b:35:93 (oui Unknown), length 310
16:34:08.219301 IP 0.0.0.0.bootpc > 255.255.255.255.bootps: BOOTP/DHCP, Request from c0:ee:fb:3b:35:93 (oui Unknown), length 310
16:34:08.229231 IP 10.0.0.1.bootps > 10.0.0.222.bootpc: BOOTP/DHCP, Reply, length 300
16:34:08.325207 ARP, Request who-has 10.0.0.1 tell 10.0.0.222, length 28
16:34:08.325323 ARP, Reply 10.0.0.1 is-at 00:1e:a6:6a:69:64 (oui Unknown), length 28
16:34:08.325439 ARP, Request who-has 10.0.0.1 tell 10.0.0.222, length 28
16:34:08.327146 IP 10.0.0.222.17895 > 10.0.0.1.domain: 13256+ AAAA? connectivitycheck.gstatic.com. (47)
16:34:08.404016 IP 10.0.0.1.domain > 10.0.0.222.17895: 13256 1/0/0 AAAA 2404:6800:4009:801::200e (75)
16:34:08.406154 IP 10.0.0.222.19619 > 10.0.0.1.domain: 23623+ A? connectivitycheck.gstatic.com. (47)
16:34:08.471770 IP 10.0.0.1.domain > 10.0.0.222.19619: 23623 1/0/0 A 216.58.199.142 (63)
16:34:08.477465 IP 10.0.0.222.47965 > bom07s01-in-f14.1e100.net.http: Flags [S], seq 862807041, win 65535, options [mss 1460,sackOK,TS val 482238 ecr 0,nop,wscale 8], length 0
16:34:08.477746 IP bom07s01-in-f14.1e100.net.http > 10.0.0.222.47965: Flags [S.], seq 2614715732, ack 862807042, win 28960, options [mss 1460,sackOK,TS val 42559 ecr 482238,nop,wscale 7], length 0
16:34:08.479598 IP 10.0.0.222.47965 > bom07s01-in-f14.1e100.net.http: Flags [.], ack 1, win 343, options [nop,nop,TS val 482238 ecr 42559], length 0
16:34:08.482420 IP 10.0.0.222.47965 > bom07s01-in-f14.1e100.net.http: Flags [P.], seq 1:187, ack 1, win 343, options [nop,nop,TS val 482238 ecr 42559], length 186
16:34:08.482581 IP bom07s01-in-f14.1e100.net.http > 10.0.0.222.47965: Flags [.], ack 187, win 235, options [nop,nop,TS val 42559 ecr 482238], length 0
16:34:08.859814 IP bom07s01-in-f14.1e100.net.http > 10.0.0.222.47965: Flags [P.], seq 1:163, ack 187, win 235, options [nop,nop,TS val 42597 ecr 482238], length 162
16:34:08.937474 IP 10.0.0.222.47965 > bom07s01-in-f14.1e100.net.http: Flags [.], ack 163, win 347, options [nop,nop,TS val 482284 ecr 42597], length 0
16:34:09.180314 IP6 fe80::c2ee:fbff:fe3b:3593 > ip6-allrouters: ICMP6, router solicitation, length 16
16:34:09.180405 IP6 fe80::c2ee:fbff:fe3b:3593 > ip6-allrouters: ICMP6, router solicitation, length 16
16:34:10.915267 IP 10.0.0.222.1606 > 10.0.0.1.domain: 18615+ AAAA? 127.0.0.1. (27)
16:34:10.923788 IP 10.0.0.222.25078 > 10.0.0.1.domain: 26871+ A? switchboard.services.mozilla.com. (50)
16:34:10.964990 ARP, Reply 192.168.0.100 is-at 00:1e:a6:6a:69:64 (oui Unknown), length 28
16:34:10.986934 IP 10.0.0.1.domain > 10.0.0.222.1606: 18615 NXDomain 0/1/0 (102)
16:34:10.994752 IP 10.0.0.1.domain > 10.0.0.222.25078: 26871 2/0/0 CNAME switchboard.r53-2.services.mozilla.com., A 52.42.79.187 (98)
16:34:11.023509 IP 10.0.0.222.51287 > ec2-52-42-79-187.us-west-2.compute.amazonaws.com.https: Flags [S], seq 3453725964, win 65535, options [mss 1460,sackOK,TS val 482493 ecr 0,nop,wscale 8], length 0
16:34:11.284582 IP ec2-52-42-79-187.us-west-2.compute.amazonaws.com.https > 10.0.0.222.51287: Flags [S.], seq 2243510662, ack 3453725965, win 17898, options [mss 1440,sackOK,TS val 734086665 ecr 482493,nop,wscale 8], length 0
16:34:11.290092 IP 10.0.0.222.51287 > ec2-52-42-79-187.us-west-2.compute.amazonaws.com.https: Flags [.], ack 1, win 343, options [nop,nop,TS val 482519 ecr 734086665], length 0
16:34:11.293215 IP 10.0.0.222.51287 > ec2-52-42-79-187.us-west-2.compute.amazonaws.com.https: Flags [P.], seq 1:199, ack 1, win 343, options [nop,nop,TS val 482520 ecr 734086665], length 198
16:34:11.350078 IP 10.0.0.222.11522 > 10.0.0.1.domain: 17001+ AAAA? 127.0.0.0. (27)
16:34:11.412565 IP 10.0.0.1.domain > 10.0.0.222.11522: 17001 NXDomain 0/1/0 (102)
16:34:11.553161 IP ec2-52-42-79-187.us-west-2.compute.amazonaws.com.https > 10.0.0.222.51287: Flags [.], ack 199, win 75, options [nop,nop,TS val 734086733 ecr 482520], length 0
16:34:11.556228 IP ec2-52-42-79-187.us-west-2.compute.amazonaws.com.https > 10.0.0.222.51287: Flags [.], seq 1:1279, ack 199, win 75, options [nop,nop,TS val 734086733 ecr 482520], length 1278
16:34:11.556439 IP ec2-52-42-79-187.us-west-2.compute.amazonaws.com.https > 10.0.0.222.51287: Flags [.], seq 1279:2557, ack 199, win 75, options [nop,nop,TS val 734086733 ecr 482520], length 1278
16:34:11.556507 IP ec2-52-42-79-187.us-west-2.compute.amazonaws.com.https > 10.0.0.222.51287: Flags [P.], seq 2557:2961, ack 199, win 75, options [nop,nop,TS val 734086733 ecr 482520], length 404
16:34:11.558029 IP 10.0.0.222.51287 > ec2-52-42-79-187.us-west-2.compute.amazonaws.com.https: Flags [.], ack 1279, win 353, options [nop,nop,TS val 482546 ecr 734086733], length 0
16:34:11.558985 IP 10.0.0.222.51287 > ec2-52-42-79-187.us-west-2.compute.amazonaws.com.https: Flags [.], ack 2557, win 363, options [nop,nop,TS val 482546 ecr 734086733], length 0
16:34:11.560440 IP 10.0.0.222.51287 > ec2-52-42-79-187.us-west-2.compute.amazonaws.com.https: Flags [.], ack 2961, win 373, options [nop,nop,TS val 482547 ecr 734086733], length 0
16:34:11.587845 IP 10.0.0.222.51287 > ec2-52-42-79-187.us-west-2.compute.amazonaws.com.https: Flags [P.], seq 199:325, ack 2961, win 373, options [nop,nop,TS val 482549 ecr 734086733], length 126
16:34:11.849517 IP ec2-52-42-79-187.us-west-2.compute.amazonaws.com.https > 10.0.0.222.51287: Flags [P.], seq 2961:3219, ack 325, win 75, options [nop,nop,TS val 734086807 ecr 482549], length 258
16:34:11.853644 IP 10.0.0.222.51287 > ec2-52-42-79-187.us-west-2.compute.amazonaws.com.https: Flags [P.], seq 325:669, ack 3219, win 383, options [nop,nop,TS val 482576 ecr 734086807], length 344
16:34:12.116655 IP ec2-52-42-79-187.us-west-2.compute.amazonaws.com.https > 10.0.0.222.51287: Flags [P.], seq 3219:4194, ack 669, win 79, options [nop,nop,TS val 734086873 ecr 482576], length 975
16:34:12.152646 IP 10.0.0.222.51287 > ec2-52-42-79-187.us-west-2.compute.amazonaws.com.https: Flags [.], ack 4194, win 393, options [nop,nop,TS val 482606 ecr 734086873], length 0
16:34:13.149090 IP 10.0.0.222.6918 > 10.0.0.1.domain: 14267+ AAAA? 169.254.0.0. (29)
16:34:13.214132 IP 10.0.0.1.domain > 10.0.0.222.6918: 14267 NXDomain 0/1/0 (104)
16:34:13.570752 IP 10.0.0.222.3794 > 10.0.0.1.domain: 28343+ A? ssl.google-analytics.com. (42)
16:34:13.641329 IP 10.0.0.1.domain > 10.0.0.222.3794: 28343 2/0/0 CNAME ssl-google-analytics.l.google.com., A 216.58.199.136 (102)
16:34:13.832160 IP 10.0.0.222.17122 > 10.0.0.1.domain: 10822+ AAAA? 172.16.0.0. (28)
16:34:13.893352 IP 10.0.0.1.domain > 10.0.0.222.17122: 10822 NXDomain 0/1/0 (103)
16:34:13.951331 IP 10.0.0.222.5740 > 10.0.0.1.domain: 8251+ AAAA? 10.0.0.0. (26)
16:34:13.978433 ARP, Reply 192.168.0.100 is-at 00:1e:a6:6a:69:64 (oui Unknown), length 28
16:34:14.000666 IP 10.0.0.222.27202 > 10.0.0.1.domain: 3332+ A? 2.android.pool.ntp.org. (40)
16:34:14.024995 IP 10.0.0.1.domain > 10.0.0.222.5740: 8251 NXDomain 0/1/0 (101)
16:34:14.061840 IP 10.0.0.1.domain > 10.0.0.222.27202: 3332 4/0/0 A 123.108.200.124, A 139.59.19.184, A 125.62.193.121, A 52.66.103.58 (104)
16:34:14.067590 IP 10.0.0.222.57168 > 123.108.200.124.ntp: NTPv3, Client, length 48
16:34:14.095066 IP 123.108.200.124.ntp > 10.0.0.222.57168: NTPv3, Server, length 48
16:34:14.743125 IP 10.0.0.222.29456 > 10.0.0.1.domain: 14441+ AAAA? 192.168.0.0. (29)
16:34:14.808982 IP 10.0.0.1.domain > 10.0.0.222.29456: 14441 NXDomain 0/1/0 (104)
16:34:15.556148 IP 10.0.0.222.21633 > 10.0.0.1.domain: 2744+ AAAA? 10.0.0.222. (28)
16:34:15.629347 IP 10.0.0.1.domain > 10.0.0.222.21633: 2744 NXDomain 0/1/0 (103)
16:34:16.952305 IP 10.0.0.222 > igmp.mcast.net: igmp v3 report, 1 group record(s)
16:34:16.952433 IP 10.0.0.222 > igmp.mcast.net: igmp v3 report, 1 group record(s)
16:34:16.990209 ARP, Reply 192.168.0.100 is-at 00:1e:a6:6a:69:64 (oui Unknown), length 28
16:34:17.204603 IP6 fe80::c2ee:fbff:fe3b:3593 > ip6-allrouters: ICMP6, router solicitation, length 16
16:34:17.204695 IP6 fe80::c2ee:fbff:fe3b:3593 > ip6-allrouters: ICMP6, router solicitation, length 16
16:34:17.683421 IP 10.0.0.222.5737 > 10.0.0.1.domain: 5784+ A? mail.google.com. (33)
16:34:17.689682 IP 10.0.0.222.30895 > 10.0.0.1.domain: 31519+ A? www.google.co.in. (34)
16:34:17.690690 IP 10.0.0.222.10905 > 10.0.0.1.domain: 19230+ A? m.youtube.com. (31)
16:34:17.691627 IP 10.0.0.222.17821 > 10.0.0.1.domain: 28728+ A? https. (23)
16:34:17.745334 IP 10.0.0.1.domain > 10.0.0.222.5737: 5784 2/0/0 CNAME googlemail.l.google.com., A 216.58.199.133 (76)
16:34:17.748572 IP 10.0.0.222.39613 > bom07s01-in-f5.1e100.net.https: Flags [S], seq 3407957757, win 65535, options [mss 1460,sackOK,TS val 483165 ecr 0,nop,wscale 8], length 0
16:34:17.754690 IP bom07s01-in-f5.1e100.net.https > 10.0.0.222.39613: Flags [S.], seq 4100354765, ack 3407957758, win 42540, options [mss 1430,sackOK,TS val 116837801 ecr 483165,nop,wscale 7], length 0
16:34:17.756138 IP 10.0.0.222.39613 > bom07s01-in-f5.1e100.net.https: Flags [.], ack 1, win 343, options [nop,nop,TS val 483166 ecr 116837801], length 0
16:34:17.758575 IP 10.0.0.222.39613 > bom07s01-in-f5.1e100.net.https: Flags [P.], seq 1:198, ack 1, win 343, options [nop,nop,TS val 483166 ecr 116837801], length 197
16:34:17.760628 IP 10.0.0.1.domain > 10.0.0.222.17821: 28728 NXDomain 0/1/0 (98)
16:34:17.760837 IP 10.0.0.1.domain > 10.0.0.222.30895: 31519 1/0/0 A 216.58.199.131 (50)
16:34:17.761693 IP bom07s01-in-f5.1e100.net.https > 10.0.0.222.39613: Flags [.], ack 198, win 341, options [nop,nop,TS val 116837811 ecr 483166], length 0
16:34:17.762542 IP bom07s01-in-f5.1e100.net.https > 10.0.0.222.39613: Flags [.], seq 1:1279, ack 198, win 341, options [nop,nop,TS val 116837811 ecr 483166], length 1278
16:34:17.762757 IP bom07s01-in-f5.1e100.net.https > 10.0.0.222.39613: Flags [.], seq 1279:2557, ack 198, win 341, options [nop,nop,TS val 116837811 ecr 483166], length 1278
16:34:17.762808 IP bom07s01-in-f5.1e100.net.https > 10.0.0.222.39613: Flags [P.], seq 2557:3159, ack 198, win 341, options [nop,nop,TS val 116837811 ecr 483166], length 602
16:34:17.763527 IP 10.0.0.222.36702 > bom07s01-in-f131.1e100.net.http: Flags [S], seq 662496431, win 65535, options [mss 1460,sackOK,TS val 483167 ecr 0,nop,wscale 8], length 0
16:34:17.763777 IP bom07s01-in-f131.1e100.net.http > 10.0.0.222.36702: Flags [S.], seq 952243648, ack 662496432, win 28960, options [mss 1460,sackOK,TS val 43487 ecr 483167,nop,wscale 7], length 0
16:34:17.763934 IP 10.0.0.222.39613 > bom07s01-in-f5.1e100.net.https: Flags [.], ack 1279, win 353, options [nop,nop,TS val 483167 ecr 116837811], length 0
16:34:17.764838 IP 10.0.0.222.39613 > bom07s01-in-f5.1e100.net.https: Flags [.], ack 2557, win 363, options [nop,nop,TS val 483167 ecr 116837811], length 0
16:34:17.765196 IP 10.0.0.222.39613 > bom07s01-in-f5.1e100.net.https: Flags [.], ack 3159, win 373, options [nop,nop,TS val 483167 ecr 116837811], length 0
16:34:17.766172 IP 10.0.0.222.36702 > bom07s01-in-f131.1e100.net.http: Flags [.], ack 1, win 343, options [nop,nop,TS val 483167 ecr 43487], length 0
16:34:17.766917 IP 10.0.0.1.domain > 10.0.0.222.10905: 19230 1/0/0 A 216.58.199.142 (47)
16:34:17.809789 IP 10.0.0.222.39613 > bom07s01-in-f5.1e100.net.https: Flags [P.], seq 198:324, ack 3159, win 373, options [nop,nop,TS val 483171 ecr 116837811], length 126
16:34:17.812770 IP bom07s01-in-f5.1e100.net.https > 10.0.0.222.39613: Flags [P.], seq 3159:3421, ack 324, win 341, options [nop,nop,TS val 116837863 ecr 483171], length 262
16:34:17.812919 IP bom07s01-in-f5.1e100.net.https > 10.0.0.222.39613: Flags [P.], seq 3421:3483, ack 324, win 341, options [nop,nop,TS val 116837863 ecr 483171], length 62
16:34:17.812965 IP bom07s01-in-f5.1e100.net.https > 10.0.0.222.39613: Flags [P.], seq 3483:3525, ack 324, win 341, options [nop,nop,TS val 116837863 ecr 483171], length 42
16:34:17.819689 IP 10.0.0.222.39613 > bom07s01-in-f5.1e100.net.https: Flags [.], ack 3421, win 383, options [nop,nop,TS val 483173 ecr 116837863], length 0
16:34:17.820310 IP 10.0.0.222.39613 > bom07s01-in-f5.1e100.net.https: Flags [.], ack 3483, win 383, options [nop,nop,TS val 483173 ecr 116837863], length 0
16:34:17.820552 IP 10.0.0.222.39613 > bom07s01-in-f5.1e100.net.https: Flags [.], ack 3525, win 383, options [nop,nop,TS val 483173 ecr 116837863], length 0
16:34:17.821171 IP 10.0.0.222.46671 > bom07s01-in-f14.1e100.net.https: Flags [S], seq 1915674457, win 65535, options [mss 1460,sackOK,TS val 483173 ecr 0,nop,wscale 8], length 0
16:34:17.821884 IP 10.0.0.222.39613 > bom07s01-in-f5.1e100.net.https: Flags [P.], seq 324:481, ack 3525, win 383, options [nop,nop,TS val 483173 ecr 116837863], length 157
16:34:17.822202 IP 10.0.0.222.39613 > bom07s01-in-f5.1e100.net.https: Flags [P.], seq 481:519, ack 3525, win 383, options [nop,nop,TS val 483173 ecr 116837863], length 38
16:34:17.826146 IP bom07s01-in-f14.1e100.net.https > 10.0.0.222.46671: Flags [S.], seq 3837096433, ack 1915674458, win 42540, options [mss 1430,sackOK,TS val 128555564 ecr 483173,nop,wscale 7], length 0
16:34:17.827075 IP 10.0.0.222.46671 > bom07s01-in-f14.1e100.net.https: Flags [.], ack 1, win 343, options [nop,nop,TS val 483173 ecr 128555564], length 0
16:34:17.827448 IP bom07s01-in-f5.1e100.net.https > 10.0.0.222.39613: Flags [P.], seq 3525:3563, ack 481, win 350, options [nop,nop,TS val 116837874 ecr 483173], length 38
16:34:17.829630 IP 10.0.0.222.46671 > bom07s01-in-f14.1e100.net.https: Flags [P.], seq 1:196, ack 1, win 343, options [nop,nop,TS val 483173 ecr 128555564], length 195
16:34:17.832181 IP bom07s01-in-f14.1e100.net.https > 10.0.0.222.46671: Flags [.], ack 196, win 341, options [nop,nop,TS val 128555572 ecr 483173], length 0
16:34:17.833092 IP bom07s01-in-f14.1e100.net.https > 10.0.0.222.46671: Flags [.], seq 1:1279, ack 196, win 341, options [nop,nop,TS val 128555572 ecr 483173], length 1278
16:34:17.833323 IP bom07s01-in-f14.1e100.net.https > 10.0.0.222.46671: Flags [.], seq 1279:2557, ack 196, win 341, options [nop,nop,TS val 128555572 ecr 483173], length 1278
16:34:17.833442 IP bom07s01-in-f14.1e100.net.https > 10.0.0.222.46671: Flags [.], seq 2557:3835, ack 196, win 341, options [nop,nop,TS val 128555572 ecr 483173], length 1278
16:34:17.833516 IP bom07s01-in-f14.1e100.net.https > 10.0.0.222.46671: Flags [P.], seq 3835:3987, ack 196, win 341, options [nop,nop,TS val 128555572 ecr 483173], length 152
16:34:17.834408 IP 10.0.0.222.46671 > bom07s01-in-f14.1e100.net.https: Flags [.], ack 1279, win 353, options [nop,nop,TS val 483174 ecr 128555572], length 0
16:34:17.837260 IP 10.0.0.222.46671 > bom07s01-in-f14.1e100.net.https: Flags [.], ack 2557, win 363, options [nop,nop,TS val 483174 ecr 128555572], length 0
16:34:17.838386 IP 10.0.0.222.46671 > bom07s01-in-f14.1e100.net.https: Flags [.], ack 3835, win 373, options [nop,nop,TS val 483174 ecr 128555572], length 0
16:34:17.838671 IP 10.0.0.222.46671 > bom07s01-in-f14.1e100.net.https: Flags [.], ack 3987, win 383, options [nop,nop,TS val 483174 ecr 128555572], length 0
16:34:17.849445 IP 10.0.0.222.46671 > bom07s01-in-f14.1e100.net.https: Flags [P.], seq 196:322, ack 3987, win 383, options [nop,nop,TS val 483175 ecr 128555572], length 126
16:34:17.852537 IP bom07s01-in-f14.1e100.net.https > 10.0.0.222.46671: Flags [P.], seq 3987:4233, ack 322, win 341, options [nop,nop,TS val 128555592 ecr 483175], length 246
16:34:17.852666 IP bom07s01-in-f14.1e100.net.https > 10.0.0.222.46671: Flags [P.], seq 4233:4295, ack 322, win 341, options [nop,nop,TS val 128555593 ecr 483175], length 62
16:34:17.852775 IP bom07s01-in-f14.1e100.net.https > 10.0.0.222.46671: Flags [P.], seq 4295:4337, ack 322, win 341, options [nop,nop,TS val 128555593 ecr 483175], length 42
16:34:17.858436 IP 10.0.0.222.46671 > bom07s01-in-f14.1e100.net.https: Flags [P.], seq 322:479, ack 4337, win 393, options [nop,nop,TS val 483176 ecr 128555592], length 157
16:34:17.858800 IP 10.0.0.222.46671 > bom07s01-in-f14.1e100.net.https: Flags [P.], seq 479:517, ack 4337, win 393, options [nop,nop,TS val 483176 ecr 128555592], length 38
16:34:17.861176 IP bom07s01-in-f14.1e100.net.https > 10.0.0.222.46671: Flags [.], ack 517, win 350, options [nop,nop,TS val 128555601 ecr 483176], length 0
16:34:17.861308 IP bom07s01-in-f14.1e100.net.https > 10.0.0.222.46671: Flags [P.], seq 4337:4375, ack 517, win 350, options [nop,nop,TS val 128555601 ecr 483176], length 38
16:34:17.863607 IP bom07s01-in-f5.1e100.net.https > 10.0.0.222.39613: Flags [.], ack 519, win 350, options [nop,nop,TS val 116837914 ecr 483173], length 0
16:34:17.869815 IP 10.0.0.222.39613 > bom07s01-in-f5.1e100.net.https: Flags [.], ack 3563, win 383, options [nop,nop,TS val 483178 ecr 116837874], length 0
16:34:17.899942 IP 10.0.0.222.46671 > bom07s01-in-f14.1e100.net.https: Flags [.], ack 4375, win 393, options [nop,nop,TS val 483181 ecr 128555601], length 0
16:34:18.860607 IP bom07s01-in-f14.1e100.net.http > 10.0.0.222.47965: Flags [F.], seq 163, ack 187, win 235, options [nop,nop,TS val 43597 ecr 482284], length 0
16:34:18.910945 IP 10.0.0.222 > igmp.mcast.net: igmp v3 report, 1 group record(s)
16:34:18.911178 IP 10.0.0.222 > igmp.mcast.net: igmp v3 report, 1 group record(s)
16:34:18.949865 IP 10.0.0.222.47965 > bom07s01-in-f14.1e100.net.http: Flags [.], ack 164, win 347, options [nop,nop,TS val 483286 ecr 43597], length 0
16:34:19.404852 IP 10.0.0.222.7129 > 10.0.0.1.domain: 16133+ A? search.disconnect.me. (38)
16:34:19.405095 IP 10.0.0.222.37556 > 10.0.0.1.4886: UDP, length 0
16:34:19.405261 IP 10.0.0.1 > 10.0.0.222: ICMP 10.0.0.1 udp port 4886 unreachable, length 36
16:34:19.405462 IP 10.0.0.222.37556 > 10.0.0.1.4886: UDP, length 0
16:34:19.405548 IP 10.0.0.1 > 10.0.0.222: ICMP 10.0.0.1 udp port 4886 unreachable, length 36
16:34:19.405723 IP 10.0.0.222.37556 > 10.0.0.1.4886: UDP, length 0
16:34:19.405809 IP 10.0.0.1 > 10.0.0.222: ICMP 10.0.0.1 udp port 4886 unreachable, length 36
16:34:19.405989 IP 10.0.0.222.37556 > 10.0.0.1.4886: UDP, length 0
16:34:19.406103 IP 10.0.0.1 > 10.0.0.222: ICMP 10.0.0.1 udp port 4886 unreachable, length 36
16:34:19.406398 IP 10.0.0.222.37556 > 10.0.0.1.4886: UDP, length 0
16:34:19.406499 IP 10.0.0.1 > 10.0.0.222: ICMP 10.0.0.1 udp port 4886 unreachable, length 36
16:34:19.406752 IP 10.0.0.222.37556 > 10.0.0.1.4886: UDP, length 0
16:34:19.406852 IP 10.0.0.1 > 10.0.0.222: ICMP 10.0.0.1 udp port 4886 unreachable, length 36
16:34:19.407645 IP 10.0.0.222.1900 > 239.255.255.250.1900: UDP, length 94
16:34:19.407756 IP 10.0.0.222.1900 > 239.255.255.250.1900: UDP, length 94
16:34:19.417161 IP 10.0.0.222.37556 > 10.0.0.1.4886: UDP, length 0
16:34:19.434015 IP 10.0.0.222.37556 > 10.0.0.1.4886: UDP, length 0
16:34:19.450339 IP 10.0.0.222.37556 > 10.0.0.1.4886: UDP, length 0
16:34:19.467545 IP 10.0.0.222.37556 > 10.0.0.1.4886: UDP, length 0
16:34:19.483482 IP 10.0.0.222.37556 > 10.0.0.1.4886: UDP, length 0
16:34:19.488232 IP 10.0.0.1.domain > 10.0.0.222.7129: 16133 4/0/0 CNAME disconnect-search-629157811.us-east-1.elb.amazonaws.com., A 52.71.141.146, A 52.22.118.233, A 52.203.205.67 (155)
16:34:19.615914 IP 10.0.0.222.60335 > ec2-52-71-141-146.compute-1.amazonaws.com.https: Flags [S], seq 3966277835, win 65535, options [mss 1460,sackOK,TS val 483340 ecr 0,nop,wscale 8], length 0
16:34:19.616271 IP 10.0.0.222.49043 > ec2-52-71-141-146.compute-1.amazonaws.com.https: Flags [S], seq 1397432889, win 65535, options [mss 1460,sackOK,TS val 483340 ecr 0,nop,wscale 8], length 0
16:34:19.616558 IP 10.0.0.222.37556 > 10.0.0.1.4886: UDP, length 0
16:34:19.616891 IP 10.0.0.222.37556 > 10.0.0.1.4886: UDP, length 0
16:34:19.617202 IP 10.0.0.222.37556 > 10.0.0.1.4886: UDP, length 0
16:34:19.617497 IP 10.0.0.222.26704 > 10.0.0.1.domain: 14981+ A? safebrowsing.google.com. (41)
16:34:19.617703 IP 10.0.0.222.37556 > 10.0.0.1.4886: UDP, length 0
16:34:19.618042 IP 10.0.0.222.37556 > 10.0.0.1.4886: UDP, length 0
16:34:19.618313 IP 10.0.0.222.37556 > 10.0.0.1.4886: UDP, length 0
16:34:19.618564 IP 10.0.0.222.37556 > 10.0.0.1.4886: UDP, length 0
16:34:19.618870 IP 10.0.0.222.37556 > 10.0.0.1.4886: UDP, length 0
16:34:19.631142 IP 10.0.0.222.37556 > 10.0.0.1.4886: UDP, length 0
16:34:19.649365 IP 10.0.0.222.37556 > 10.0.0.1.4886: UDP, length 0
16:34:19.665786 IP 10.0.0.222.37556 > 10.0.0.1.4886: UDP, length 0
16:34:19.682285 IP 10.0.0.222.37556 > 10.0.0.1.4886: UDP, length 0
16:34:19.697664 IP 10.0.0.1.domain > 10.0.0.222.26704: 14981 2/0/0 CNAME sb.l.google.com., A 216.58.199.142 (76)
16:34:19.698501 IP 10.0.0.222.37556 > 10.0.0.1.4886: UDP, length 0
16:34:19.813097 IP ec2-52-71-141-146.compute-1.amazonaws.com.https > 10.0.0.222.49043: Flags [S.], seq 3326768246, ack 1397432890, win 14480, options [mss 1440,sackOK,TS val 128484856 ecr 483340,nop,wscale 8], length 0
16:34:19.813220 IP ec2-52-71-141-146.compute-1.amazonaws.com.https > 10.0.0.222.60335: Flags [S.], seq 540733364, ack 3966277836, win 14480, options [mss 1440,sackOK,TS val 128484855 ecr 483340,nop,wscale 8], length 0
16:34:19.875171 IP 10.0.0.222.46671 > bom07s01-in-f14.1e100.net.https: Flags [P.], seq 517:938, ack 4375, win 393, options [nop,nop,TS val 483362 ecr 128555601], length 421
16:34:19.879083 IP 10.0.0.222.46671 > bom07s01-in-f14.1e100.net.https: Flags [.], seq 938:2356, ack 4375, win 393, options [nop,nop,TS val 483362 ecr 128555601], length 1418
16:34:19.879372 IP 10.0.0.222.46671 > bom07s01-in-f14.1e100.net.https: Flags [P.], seq 2356:2402, ack 4375, win 393, options [nop,nop,TS val 483362 ecr 128555601], length 46
16:34:19.879655 IP 10.0.0.222.46673 > bom07s01-in-f14.1e100.net.https: Flags [S], seq 1794552483, win 65535, options [mss 1460,sackOK,TS val 483362 ecr 0,nop,wscale 8], length 0
16:34:19.881207 IP 10.0.0.222.46671 > bom07s01-in-f14.1e100.net.https: Flags [.], seq 2402:3820, ack 4375, win 393, options [nop,nop,TS val 483362 ecr 128555601], length 1418
16:34:19.882207 IP bom07s01-in-f14.1e100.net.https > 10.0.0.222.46673: Flags [S.], seq 2563907211, ack 1794552484, win 42540, options [mss 1430,sackOK,TS val 116420301 ecr 483362,nop,wscale 7], length 0
16:34:19.882466 IP bom07s01-in-f14.1e100.net.https > 10.0.0.222.46671: Flags [.], ack 2402, win 381, options [nop,nop,TS val 128557623 ecr 483362], length 0
16:34:19.882707 IP 10.0.0.222.46671 > bom07s01-in-f14.1e100.net.https: Flags [.], seq 3820:5238, ack 4375, win 393, options [nop,nop,TS val 483362 ecr 128555601], length 1418
16:34:19.883777 IP 10.0.0.222.46671 > bom07s01-in-f14.1e100.net.https: Flags [P.], seq 5238:6111, ack 4375, win 393, options [nop,nop,TS val 483362 ecr 128555601], length 873
16:34:19.885611 IP 10.0.0.222.23621 > 10.0.0.1.domain: 16569+ A? netbanking.hdfcbank.com. (41)
16:34:19.885911 IP 10.0.0.222.60337 > ec2-52-71-141-146.compute-1.amazonaws.com.https: Flags [S], seq 1919844698, win 65535, options [mss 1460,sackOK,TS val 483365 ecr 0,nop,wscale 8], length 0
16:34:19.886183 IP 10.0.0.222.37556 > 10.0.0.1.4886: UDP, length 0
16:34:19.886398 IP 10.0.0.222.37556 > 10.0.0.1.4886: UDP, length 0
16:34:19.886685 IP bom07s01-in-f14.1e100.net.https > 10.0.0.222.46671: Flags [.], ack 5238, win 425, options [nop,nop,TS val 128557626 ecr 483362], length 0
16:34:19.886836 IP 10.0.0.222.37556 > 10.0.0.1.4886: UDP, length 0
16:34:19.887039 IP 10.0.0.222.37556 > 10.0.0.1.4886: UDP, length 0
16:34:19.887285 IP 10.0.0.222.37556 > 10.0.0.1.4886: UDP, length 0
16:34:19.887480 IP 10.0.0.222.37556 > 10.0.0.1.4886: UDP, length 0
16:34:19.887696 IP 10.0.0.222.37556 > 10.0.0.1.4886: UDP, length 0
16:34:19.887873 IP 10.0.0.222.37556 > 10.0.0.1.4886: UDP, length 0
16:34:19.888190 IP 10.0.0.222.37556 > 10.0.0.1.4886: UDP, length 0
16:34:19.889098 IP 10.0.0.222.49043 > ec2-52-71-141-146.compute-1.amazonaws.com.https: Flags [.], ack 1, win 343, options [nop,nop,TS val 483379 ecr 128484856], length 0
16:34:19.890074 IP 10.0.0.222.60335 > ec2-52-71-141-146.compute-1.amazonaws.com.https: Flags [.], ack 1, win 343, options [nop,nop,TS val 483379 ecr 128484855], length 0
16:34:19.890489 IP 10.0.0.222.60335 > ec2-52-71-141-146.compute-1.amazonaws.com.https: Flags [P.], seq 1:203, ack 1, win 343, options [nop,nop,TS val 483380 ecr 128484855], length 202
16:34:19.890813 IP 10.0.0.222.46673 > bom07s01-in-f14.1e100.net.https: Flags [.], ack 1, win 343, options [nop,nop,TS val 483380 ecr 116420301], length 0
16:34:19.891284 IP 10.0.0.222.49043 > ec2-52-71-141-146.compute-1.amazonaws.com.https: Flags [P.], seq 1:187, ack 1, win 343, options [nop,nop,TS val 483380 ecr 128484856], length 186
16:34:19.891748 IP 10.0.0.222.46673 > bom07s01-in-f14.1e100.net.https: Flags [P.], seq 1:206, ack 1, win 343, options [nop,nop,TS val 483380 ecr 116420301], length 205
16:34:19.894081 IP bom07s01-in-f14.1e100.net.https > 10.0.0.222.46673: Flags [.], ack 206, win 341, options [nop,nop,TS val 116420313 ecr 483380], length 0
16:34:19.895079 IP bom07s01-in-f14.1e100.net.https > 10.0.0.222.46673: Flags [.], seq 1:1279, ack 206, win 341, options [nop,nop,TS val 116420313 ecr 483380], length 1278
16:34:19.895318 IP bom07s01-in-f14.1e100.net.https > 10.0.0.222.46673: Flags [.], seq 1279:2557, ack 206, win 341, options [nop,nop,TS val 116420313 ecr 483380], length 1278
16:34:19.895411 IP bom07s01-in-f14.1e100.net.https > 10.0.0.222.46673: Flags [.], seq 2557:3835, ack 206, win 341, options [nop,nop,TS val 116420313 ecr 483380], length 1278
16:34:19.895477 IP bom07s01-in-f14.1e100.net.https > 10.0.0.222.46673: Flags [P.], seq 3835:3988, ack 206, win 341, options [nop,nop,TS val 116420313 ecr 483380], length 153
16:34:19.896362 IP 10.0.0.222.46673 > bom07s01-in-f14.1e100.net.https: Flags [.], ack 1279, win 353, options [nop,nop,TS val 483380 ecr 116420313], length 0
16:34:19.896690 IP 10.0.0.222.46673 > bom07s01-in-f14.1e100.net.https: Flags [.], ack 2557, win 363, options [nop,nop,TS val 483380 ecr 116420313], length 0
16:34:19.897433 IP 10.0.0.222.37556 > 10.0.0.1.4886: UDP, length 0
16:34:19.897731 IP 10.0.0.222.46673 > bom07s01-in-f14.1e100.net.https: Flags [.], ack 3835, win 373, options [nop,nop,TS val 483380 ecr 116420313], length 0
16:34:19.898578 IP 10.0.0.222.46673 > bom07s01-in-f14.1e100.net.https: Flags [.], ack 3988, win 383, options [nop,nop,TS val 483380 ecr 116420313], length 0
16:34:19.913672 IP 10.0.0.222.37556 > 10.0.0.1.4886: UDP, length 0
16:34:19.917608 IP 10.0.0.222.46673 > bom07s01-in-f14.1e100.net.https: Flags [P.], seq 206:332, ack 3988, win 383, options [nop,nop,TS val 483382 ecr 116420313], length 126
16:34:19.921189 IP bom07s01-in-f14.1e100.net.https > 10.0.0.222.46673: Flags [P.], seq 3988:4250, ack 332, win 341, options [nop,nop,TS val 116420339 ecr 483382], length 262
16:34:19.921329 IP bom07s01-in-f14.1e100.net.https > 10.0.0.222.46673: Flags [P.], seq 4250:4312, ack 332, win 341, options [nop,nop,TS val 116420339 ecr 483382], length 62
16:34:19.921443 IP bom07s01-in-f14.1e100.net.https > 10.0.0.222.46673: Flags [P.], seq 4312:4354, ack 332, win 341, options [nop,nop,TS val 116420339 ecr 483382], length 42
16:34:19.926781 IP bom07s01-in-f14.1e100.net.https > 10.0.0.222.46671: Flags [.], ack 6111, win 447, options [nop,nop,TS val 128557667 ecr 483362], length 0
16:34:19.927598 IP 10.0.0.222.46673 > bom07s01-in-f14.1e100.net.https: Flags [P.], seq 332:489, ack 4354, win 393, options [nop,nop,TS val 483383 ecr 116420339], length 157
16:34:19.927920 IP 10.0.0.222.46673 > bom07s01-in-f14.1e100.net.https: Flags [P.], seq 489:535, ack 4354, win 393, options [nop,nop,TS val 483383 ecr 116420339], length 46
16:34:19.929697 IP 10.0.0.222.37556 > 10.0.0.1.4886: UDP, length 0
16:34:19.930484 IP bom07s01-in-f14.1e100.net.https > 10.0.0.222.46673: Flags [.], ack 535, win 350, options [nop,nop,TS val 116420349 ecr 483383], length 0
16:34:19.930625 IP bom07s01-in-f14.1e100.net.https > 10.0.0.222.46673: Flags [P.], seq 4354:4392, ack 535, win 350, options [nop,nop,TS val 116420349 ecr 483383], length 38
16:34:19.941923 IP bom07s01-in-f14.1e100.net.https > 10.0.0.222.46671: Flags [P.], seq 4375:4609, ack 6111, win 447, options [nop,nop,TS val 128557682 ecr 483362], length 234
16:34:19.942191 IP bom07s01-in-f14.1e100.net.https > 10.0.0.222.46671: Flags [P.], seq 4609:5258, ack 6111, win 447, options [nop,nop,TS val 128557682 ecr 483362], length 649
16:34:19.942299 IP bom07s01-in-f14.1e100.net.https > 10.0.0.222.46671: Flags [P.], seq 5258:5304, ack 6111, win 447, options [nop,nop,TS val 128557682 ecr 483362], length 46
16:34:19.943106 IP 10.0.0.222.46671 > bom07s01-in-f14.1e100.net.https: Flags [.], ack 4609, win 403, options [nop,nop,TS val 483385 ecr 128557682], length 0
16:34:19.943695 IP 10.0.0.222.46671 > bom07s01-in-f14.1e100.net.https: Flags [.], ack 5258, win 413, options [nop,nop,TS val 483385 ecr 128557682], length 0
16:34:19.944461 IP 10.0.0.222.46671 > bom07s01-in-f14.1e100.net.https: Flags [.], ack 5304, win 413, options [nop,nop,TS val 483385 ecr 128557682], length 0
16:34:19.945989 IP 10.0.0.222.37556 > 10.0.0.1.4886: UDP, length 0
16:34:19.974937 IP 10.0.0.1.domain > 10.0.0.222.23621: 16569 1/0/0 A 175.100.160.21 (57)
16:34:20.001887 ARP, Reply 192.168.0.100 is-at 00:1e:a6:6a:69:64 (oui Unknown), length 28
16:34:20.066896 IP 10.0.0.222.37556 > 10.0.0.1.4886: UDP, length 0
16:34:20.067215 IP 10.0.0.222.46673 > bom07s01-in-f14.1e100.net.https: Flags [.], ack 4392, win 393, options [nop,nop,TS val 483388 ecr 116420349], length 0
16:34:20.067477 IP 10.0.0.222.46673 > bom07s01-in-f14.1e100.net.https: Flags [P.], seq 535:566, ack 4392, win 393, options [nop,nop,TS val 483388 ecr 116420349], length 31
16:34:20.067706 IP 10.0.0.222.46673 > bom07s01-in-f14.1e100.net.https: Flags [F.], seq 566, ack 4392, win 393, options [nop,nop,TS val 483388 ecr 116420349], length 0
16:34:20.068014 IP 10.0.0.222.46671 > bom07s01-in-f14.1e100.net.https: Flags [P.], seq 6111:6157, ack 5304, win 413, options [nop,nop,TS val 483388 ecr 128557682], length 46
16:34:20.068325 IP 10.0.0.222.20931 > 10.0.0.1.domain: 5098+ A? safebrowsing-cache.google.com. (47)
16:34:20.068613 IP 10.0.0.222.37556 > 10.0.0.1.4886: UDP, length 0
16:34:20.068894 IP 10.0.0.222.37556 > 10.0.0.1.4886: UDP, length 0
16:34:20.069213 IP 10.0.0.222.37556 > 10.0.0.1.4886: UDP, length 0
16:34:20.069435 IP 10.0.0.222.37556 > 10.0.0.1.4886: UDP, length 0
16:34:20.069625 IP 10.0.0.222.37556 > 10.0.0.1.4886: UDP, length 0
16:34:20.070067 IP 10.0.0.222.37556 > 10.0.0.1.4886: UDP, length 0
16:34:20.070956 IP bom07s01-in-f14.1e100.net.https > 10.0.0.222.46671: Flags [.], ack 6157, win 447, options [nop,nop,TS val 128557811 ecr 483388], length 0
16:34:20.071101 IP bom07s01-in-f14.1e100.net.https > 10.0.0.222.46673: Flags [F.], seq 4392, ack 567, win 350, options [nop,nop,TS val 116420489 ecr 483388], length 0
16:34:20.072467 IP 10.0.0.222.46673 > bom07s01-in-f14.1e100.net.https: Flags [.], ack 4393, win 393, options [nop,nop,TS val 483398 ecr 116420489], length 0
16:34:20.072733 IP 10.0.0.222.56014 > netbanking.hdfcbank.com.https: Flags [S], seq 3907166047, win 65535, options [mss 1460,sackOK,TS val 483398 ecr 0,nop,wscale 8], length 0
16:34:20.076995 IP netbanking.hdfcbank.com.https > 10.0.0.222.56014: Flags [S.], seq 3641793605, ack 3907166048, win 1212, options [mss 1212], length 0
16:34:20.079098 IP 10.0.0.222.56014 > netbanking.hdfcbank.com.https: Flags [.], ack 1, win 65535, length 0
16:34:20.079578 IP 10.0.0.222.56014 > netbanking.hdfcbank.com.https: Flags [P.], seq 1:206, ack 1, win 65535, length 205
16:34:20.079709 IP 10.0.0.222.37556 > 10.0.0.1.4886: UDP, length 0
16:34:20.083557 IP ec2-52-71-141-146.compute-1.amazonaws.com.https > 10.0.0.222.60337: Flags [S.], seq 2277424133, ack 1919844699, win 14480, options [mss 1440,sackOK,TS val 128484923 ecr 483365,nop,wscale 8], length 0
16:34:20.083978 IP netbanking.hdfcbank.com.https > 10.0.0.222.56014: Flags [P.], seq 1:1213, ack 206, win 35278, length 1212
16:34:20.084260 IP netbanking.hdfcbank.com.https > 10.0.0.222.56014: Flags [P.], seq 1213:2425, ack 206, win 35278, length 1212
16:34:20.084610 IP netbanking.hdfcbank.com.https > 10.0.0.222.56014: Flags [P.], seq 2425:3637, ack 206, win 35278, length 1212
16:34:20.084737 IP netbanking.hdfcbank.com.https > 10.0.0.222.56014: Flags [P.], seq 3637:4550, ack 206, win 35278, length 913
16:34:20.084949 IP 10.0.0.222.60337 > ec2-52-71-141-146.compute-1.amazonaws.com.https: Flags [.], ack 1, win 343, options [nop,nop,TS val 483399 ecr 128484923], length 0
16:34:20.085146 IP 10.0.0.222.56014 > netbanking.hdfcbank.com.https: Flags [.], ack 1213, win 65535, length 0
16:34:20.086585 IP 10.0.0.222.56014 > netbanking.hdfcbank.com.https: Flags [.], ack 2425, win 65535, length 0
16:34:20.086843 IP ec2-52-71-141-146.compute-1.amazonaws.com.https > 10.0.0.222.60335: Flags [.], ack 203, win 61, options [nop,nop,TS val 128484924 ecr 483380], length 0
16:34:20.086960 IP 10.0.0.222.56014 > netbanking.hdfcbank.com.https: Flags [.], ack 3637, win 65535, length 0
16:34:20.087108 IP 10.0.0.222.56014 > netbanking.hdfcbank.com.https: Flags [.], ack 4550, win 65535, length 0
16:34:20.087396 IP ec2-52-71-141-146.compute-1.amazonaws.com.https > 10.0.0.222.60335: Flags [.], seq 1:1279, ack 203, win 61, options [nop,nop,TS val 128484924 ecr 483380], length 1278
16:34:20.090022 IP ec2-52-71-141-146.compute-1.amazonaws.com.https > 10.0.0.222.60335: Flags [.], seq 1279:2557, ack 203, win 61, options [nop,nop,TS val 128484924 ecr 483380], length 1278
16:34:20.090259 IP 10.0.0.222.60335 > ec2-52-71-141-146.compute-1.amazonaws.com.https: Flags [.], ack 1279, win 353, options [nop,nop,TS val 483400 ecr 128484924], length 0
16:34:20.090438 IP ec2-52-71-141-146.compute-1.amazonaws.com.https > 10.0.0.222.60335: Flags [.], seq 2557:3835, ack 203, win 61, options [nop,nop,TS val 128484924 ecr 483380], length 1278
16:34:20.090513 IP ec2-52-71-141-146.compute-1.amazonaws.com.https > 10.0.0.222.60335: Flags [P.], seq 3835:4097, ack 203, win 61, options [nop,nop,TS val 128484924 ecr 483380], length 262
16:34:20.091151 IP 10.0.0.222.60335 > ec2-52-71-141-146.compute-1.amazonaws.com.https: Flags [.], ack 2557, win 363, options [nop,nop,TS val 483400 ecr 128484924], length 0
16:34:20.091948 IP 10.0.0.222.60335 > ec2-52-71-141-146.compute-1.amazonaws.com.https: Flags [.], ack 3835, win 373, options [nop,nop,TS val 483400 ecr 128484924], length 0
16:34:20.092711 IP 10.0.0.222.60335 > ec2-52-71-141-146.compute-1.amazonaws.com.https: Flags [.], ack 4097, win 383, options [nop,nop,TS val 483400 ecr 128484924], length 0
16:34:20.095337 IP 10.0.0.222.37556 > 10.0.0.1.4886: UDP, length 0
16:34:20.099741 IP ec2-52-71-141-146.compute-1.amazonaws.com.https > 10.0.0.222.49043: Flags [.], ack 187, win 61, options [nop,nop,TS val 128484925 ecr 483380], length 0
16:34:20.100476 IP ec2-52-71-141-146.compute-1.amazonaws.com.https > 10.0.0.222.49043: Flags [.], seq 1:1279, ack 187, win 61, options [nop,nop,TS val 128484925 ecr 483380], length 1278
16:34:20.101602 IP 10.0.0.222.49043 > ec2-52-71-141-146.compute-1.amazonaws.com.https: Flags [.], ack 1279, win 353, options [nop,nop,TS val 483401 ecr 128484925], length 0
16:34:20.105190 IP ec2-52-71-141-146.compute-1.amazonaws.com.https > 10.0.0.222.49043: Flags [.], seq 1279:2557, ack 187, win 61, options [nop,nop,TS val 128484925 ecr 483380], length 1278
16:34:20.105392 IP ec2-52-71-141-146.compute-1.amazonaws.com.https > 10.0.0.222.49043: Flags [.], seq 2557:3835, ack 187, win 61, options [nop,nop,TS val 128484925 ecr 483380], length 1278
16:34:20.105507 IP ec2-52-71-141-146.compute-1.amazonaws.com.https > 10.0.0.222.49043: Flags [P.], seq 3835:4097, ack 187, win 61, options [nop,nop,TS val 128484925 ecr 483380], length 262
16:34:20.106630 IP 10.0.0.222.49043 > ec2-52-71-141-146.compute-1.amazonaws.com.https: Flags [.], ack 2557, win 363, options [nop,nop,TS val 483401 ecr 128484925], length 0
16:34:20.106893 IP 10.0.0.222.49043 > ec2-52-71-141-146.compute-1.amazonaws.com.https: Flags [.], ack 3835, win 373, options [nop,nop,TS val 483401 ecr 128484925], length 0
16:34:20.107754 IP 10.0.0.222.49043 > ec2-52-71-141-146.compute-1.amazonaws.com.https: Flags [.], ack 4097, win 383, options [nop,nop,TS val 483401 ecr 128484925], length 0
16:34:20.111467 IP 10.0.0.222.37556 > 10.0.0.1.4886: UDP, length 0
16:34:20.111988 IP 10.0.0.222.56014 > netbanking.hdfcbank.com.https: Flags [P.], seq 206:532, ack 4550, win 65535, length 326
16:34:20.113026 IP 10.0.0.222.60337 > ec2-52-71-141-146.compute-1.amazonaws.com.https: Flags [P.], seq 1:203, ack 1, win 343, options [nop,nop,TS val 483402 ecr 128484923], length 202
16:34:20.115963 IP ec2-52-71-141-146.compute-1.amazonaws.com.https > 10.0.0.222.60335: Flags [.], seq 4097:5375, ack 203, win 61, options [nop,nop,TS val 128484924 ecr 483380], length 1278
16:34:20.116114 IP ec2-52-71-141-146.compute-1.amazonaws.com.https > 10.0.0.222.60335: Flags [P.], seq 5375:5837, ack 203, win 61, options [nop,nop,TS val 128484924 ecr 483380], length 462
16:34:20.118091 IP 10.0.0.222.60335 > ec2-52-71-141-146.compute-1.amazonaws.com.https: Flags [.], ack 5375, win 393, options [nop,nop,TS val 483402 ecr 128484924], length 0
16:34:20.118359 IP 10.0.0.222.60335 > ec2-52-71-141-146.compute-1.amazonaws.com.https: Flags [.], ack 5837, win 403, options [nop,nop,TS val 483402 ecr 128484924], length 0
16:34:20.120894 IP 10.0.0.222.21807 > 10.0.0.1.domain: 16118+ A? sr.symcd.com. (30)
16:34:20.121634 IP ec2-52-71-141-146.compute-1.amazonaws.com.https > 10.0.0.222.49043: Flags [.], seq 4097:5375, ack 187, win 61, options [nop,nop,TS val 128484925 ecr 483380], length 1278
16:34:20.121813 IP ec2-52-71-141-146.compute-1.amazonaws.com.https > 10.0.0.222.49043: Flags [P.], seq 5375:5837, ack 187, win 61, options [nop,nop,TS val 128484925 ecr 483380], length 462
16:34:20.122950 IP 10.0.0.222.49043 > ec2-52-71-141-146.compute-1.amazonaws.com.https: Flags [.], ack 5375, win 393, options [nop,nop,TS val 483403 ecr 128484925], length 0
16:34:20.123209 IP 10.0.0.222.49043 > ec2-52-71-141-146.compute-1.amazonaws.com.https: Flags [.], ack 5837, win 403, options [nop,nop,TS val 483403 ecr 128484925], length 0
16:34:20.127569 IP netbanking.hdfcbank.com.https > 10.0.0.222.56014: Flags [.], ack 532, win 34952, length 0
16:34:20.127870 IP 10.0.0.222.37556 > 10.0.0.1.4886: UDP, length 0
16:34:20.128123 IP netbanking.hdfcbank.com.https > 10.0.0.222.56014: Flags [P.], seq 4550:4609, ack 532, win 34952, length 59
16:34:20.159655 IP 10.0.0.222.56014 > netbanking.hdfcbank.com.https: Flags [.], ack 4609, win 65535, length 0
16:34:20.193904 IP 10.0.0.1.domain > 10.0.0.222.20931: 5098 2/0/0 CNAME safebrowsing.cache.l.google.com., A 216.58.199.174 (98)
16:34:20.300375 IP 10.0.0.1.domain > 10.0.0.222.21807: 16118 3/0/0 CNAME ocsp-ds.ws.symantec.com.edgekey.net., CNAME e8218.dscb1.akamaiedge.net., A 23.57.219.27 (132)
