15:53:46.227512 ARP, Reply pi is-at 00:1e:a6:1d:3f:6a (oui Unknown), length 28
15:53:49.244022 ARP, Reply pi is-at 00:1e:a6:1d:3f:6a (oui Unknown), length 28
15:53:52.260557 ARP, Reply pi is-at 00:1e:a6:1d:3f:6a (oui Unknown), length 28
15:53:55.274827 ARP, Reply pi is-at 00:1e:a6:1d:3f:6a (oui Unknown), length 28
15:53:56.793290 IP 10.0.0.222.8691 > 10.0.0.1.domain: 3966+ A? switchboard.services.mozilla.com. (50)
15:53:56.800460 IP 10.0.0.1.domain > 10.0.0.222.8691: 3966 2/0/0 CNAME switchboard.r53-2.services.mozilla.com., A 52.36.101.109 (98)
15:53:56.849148 IP 10.0.0.222.47408 > ec2-52-36-101-109.us-west-2.compute.amazonaws.com.https: Flags [S], seq 1600049219, win 64240, options [mss 1460,sackOK,TS val 4895735 ecr 0,nop,wscale 8], length 0
15:53:56.911721 IP 10.0.0.222.2718 > 10.0.0.1.domain: 21776+ A? kali. (22)
15:53:56.975821 IP 10.0.0.1.domain > 10.0.0.222.2718: 21776 NXDomain 0/1/0 (97)
15:53:57.104921 IP ec2-52-36-101-109.us-west-2.compute.amazonaws.com.https > 10.0.0.222.47408: Flags [S.], seq 360275408, ack 1600049220, win 17898, options [mss 1440,sackOK,TS val 41362871 ecr 4895735,nop,wscale 8], length 0
15:53:57.106057 IP 10.0.0.222.47408 > ec2-52-36-101-109.us-west-2.compute.amazonaws.com.https: Flags [.], ack 1, win 251, options [nop,nop,TS val 4895761 ecr 41362871], length 0
15:53:57.109255 IP 10.0.0.222.47408 > ec2-52-36-101-109.us-west-2.compute.amazonaws.com.https: Flags [P.], seq 1:199, ack 1, win 251, options [nop,nop,TS val 4895761 ecr 41362871], length 198
15:53:57.374887 IP ec2-52-36-101-109.us-west-2.compute.amazonaws.com.https > 10.0.0.222.47408: Flags [.], ack 199, win 75, options [nop,nop,TS val 41362938 ecr 4895761], length 0
15:53:57.376556 IP ec2-52-36-101-109.us-west-2.compute.amazonaws.com.https > 10.0.0.222.47408: Flags [.], seq 1:1349, ack 199, win 75, options [nop,nop,TS val 41362939 ecr 4895761], length 1348
15:53:57.376746 IP ec2-52-36-101-109.us-west-2.compute.amazonaws.com.https > 10.0.0.222.47408: Flags [.], seq 1349:2697, ack 199, win 75, options [nop,nop,TS val 41362939 ecr 4895761], length 1348
15:53:57.376833 IP ec2-52-36-101-109.us-west-2.compute.amazonaws.com.https > 10.0.0.222.47408: Flags [P.], seq 2697:2961, ack 199, win 75, options [nop,nop,TS val 41362939 ecr 4895761], length 264
15:53:57.379708 IP 10.0.0.222.47408 > ec2-52-36-101-109.us-west-2.compute.amazonaws.com.https: Flags [.], ack 1349, win 262, options [nop,nop,TS val 4895788 ecr 41362939], length 0
15:53:57.379961 IP 10.0.0.222.47408 > ec2-52-36-101-109.us-west-2.compute.amazonaws.com.https: Flags [.], ack 2697, win 272, options [nop,nop,TS val 4895788 ecr 41362939], length 0
15:53:57.380146 IP 10.0.0.222.47408 > ec2-52-36-101-109.us-west-2.compute.amazonaws.com.https: Flags [.], ack 2961, win 283, options [nop,nop,TS val 4895788 ecr 41362939], length 0
15:53:57.453556 IP 10.0.0.222.47408 > ec2-52-36-101-109.us-west-2.compute.amazonaws.com.https: Flags [P.], seq 199:325, ack 2961, win 283, options [nop,nop,TS val 4895795 ecr 41362939], length 126
15:53:57.709669 IP ec2-52-36-101-109.us-west-2.compute.amazonaws.com.https > 10.0.0.222.47408: Flags [P.], seq 2961:3219, ack 325, win 75, options [nop,nop,TS val 41363022 ecr 4895795], length 258
15:53:57.711285 IP 10.0.0.222.47408 > ec2-52-36-101-109.us-west-2.compute.amazonaws.com.https: Flags [.], ack 3219, win 294, options [nop,nop,TS val 4895821 ecr 41363022], length 0
15:53:57.714876 IP 10.0.0.222.47408 > ec2-52-36-101-109.us-west-2.compute.amazonaws.com.https: Flags [P.], seq 325:669, ack 3219, win 294, options [nop,nop,TS val 4895822 ecr 41363022], length 344
15:53:57.972803 IP ec2-52-36-101-109.us-west-2.compute.amazonaws.com.https > 10.0.0.222.47408: Flags [P.], seq 3219:4194, ack 669, win 79, options [nop,nop,TS val 41363088 ecr 4895822], length 975
15:53:58.015482 IP 10.0.0.222.47408 > ec2-52-36-101-109.us-west-2.compute.amazonaws.com.https: Flags [.], ack 4194, win 304, options [nop,nop,TS val 4895852 ecr 41363088], length 0
15:53:58.290973 ARP, Reply pi is-at 00:1e:a6:1d:3f:6a (oui Unknown), length 28
15:53:59.347298 IP 10.0.0.222.mdns > 224.0.0.251.mdns: 0 PTR (QU)? _mozilla_papi._tcp.local. (42)
15:53:59.347430 IP 10.0.0.222.mdns > 224.0.0.251.mdns: 0 PTR (QU)? _mozilla_papi._tcp.local. (42)
15:53:59.347560 IP 10.0.0.222 > igmp.mcast.net: igmp v3 report, 1 group record(s)
15:53:59.347631 IP 10.0.0.222 > igmp.mcast.net: igmp v3 report, 1 group record(s)
15:54:00.389915 IP 10.0.0.222.4145 > 10.0.0.1.domain: 3663+ A? 2.android.pool.ntp.org. (40)
15:54:00.398138 IP 10.0.0.1.domain > 10.0.0.222.4145: 3663 4/0/0 A 123.108.200.124, A 139.59.19.184, A 125.62.193.121, A 52.66.76.135 (104)
15:54:00.402914 IP 10.0.0.222.35984 > 123.108.200.124.ntp: NTPv3, Client, length 48
15:54:00.429290 IP 123.108.200.124.ntp > 10.0.0.222.35984: NTPv3, Server, length 48
15:54:01.206832 IP 10.0.0.222 > igmp.mcast.net: igmp v3 report, 1 group record(s)
15:54:01.206975 IP 10.0.0.222 > igmp.mcast.net: igmp v3 report, 1 group record(s)
15:54:01.307175 ARP, Reply pi is-at 00:1e:a6:1d:3f:6a (oui Unknown), length 28
15:54:01.467393 IP 10.0.0.222.13912 > 10.0.0.1.domain: 12335+ A? www.elastic.co. (32)
15:54:01.488802 IP 10.0.0.222.54154 > 10.0.0.1.4886: UDP, length 0
15:54:01.489036 IP 10.0.0.1 > 10.0.0.222: ICMP 10.0.0.1 udp port 4886 unreachable, length 36
15:54:01.505806 IP 10.0.0.222.54154 > 10.0.0.1.4886: UDP, length 0
15:54:01.505929 IP 10.0.0.1 > 10.0.0.222: ICMP 10.0.0.1 udp port 4886 unreachable, length 36
15:54:01.522665 IP 10.0.0.222.54154 > 10.0.0.1.4886: UDP, length 0
15:54:01.522755 IP 10.0.0.1 > 10.0.0.222: ICMP 10.0.0.1 udp port 4886 unreachable, length 36
15:54:01.539040 IP 10.0.0.222.54154 > 10.0.0.1.4886: UDP, length 0
15:54:01.539142 IP 10.0.0.1 > 10.0.0.222: ICMP 10.0.0.1 udp port 4886 unreachable, length 36
15:54:01.542829 IP 10.0.0.1.domain > 10.0.0.222.13912: 12335 2/0/0 A 52.24.47.246, A 52.43.58.45 (64)
15:54:01.549259 IP 10.0.0.222.48383 > ec2-52-24-47-246.us-west-2.compute.amazonaws.com.https: Flags [S], seq 2420269899, win 64240, options [mss 1460,sackOK,TS val 4896205 ecr 0,nop,wscale 8], length 0
15:54:01.555424 IP 10.0.0.222.54154 > 10.0.0.1.4886: UDP, length 0
15:54:01.555597 IP 10.0.0.1 > 10.0.0.222: ICMP 10.0.0.1 udp port 4886 unreachable, length 36
15:54:01.560551 IP 10.0.0.222.48384 > ec2-52-24-47-246.us-west-2.compute.amazonaws.com.https: Flags [S], seq 3146807370, win 64240, options [mss 1460,sackOK,TS val 4896206 ecr 0,nop,wscale 8], length 0
15:54:01.571904 IP 10.0.0.222.54154 > 10.0.0.1.4886: UDP, length 0
15:54:01.572061 IP 10.0.0.1 > 10.0.0.222: ICMP 10.0.0.1 udp port 4886 unreachable, length 36
15:54:01.588207 IP 10.0.0.222.54154 > 10.0.0.1.4886: UDP, length 0
15:54:01.604304 IP 10.0.0.222.54154 > 10.0.0.1.4886: UDP, length 0
15:54:01.620573 IP 10.0.0.222.54154 > 10.0.0.1.4886: UDP, length 0
15:54:01.636717 IP 10.0.0.222.54154 > 10.0.0.1.4886: UDP, length 0
15:54:01.652896 IP 10.0.0.222.54154 > 10.0.0.1.4886: UDP, length 0
15:54:01.668956 IP 10.0.0.222.54154 > 10.0.0.1.4886: UDP, length 0
15:54:01.685463 IP 10.0.0.222.54154 > 10.0.0.1.4886: UDP, length 0
15:54:01.701766 IP 10.0.0.222.54154 > 10.0.0.1.4886: UDP, length 0
15:54:01.718217 IP 10.0.0.222.54154 > 10.0.0.1.4886: UDP, length 0
15:54:01.734745 IP 10.0.0.222.54154 > 10.0.0.1.4886: UDP, length 0
15:54:01.751310 IP 10.0.0.222.54154 > 10.0.0.1.4886: UDP, length 0
15:54:01.767811 IP 10.0.0.222.54154 > 10.0.0.1.4886: UDP, length 0
15:54:01.784421 IP 10.0.0.222.54154 > 10.0.0.1.4886: UDP, length 0
15:54:01.801056 IP 10.0.0.222.54154 > 10.0.0.1.4886: UDP, length 0
15:54:01.802603 ARP, Request who-has 10.0.0.222 tell 10.0.0.1, length 28
15:54:01.804240 ARP, Reply 10.0.0.222 is-at c0:ee:fb:3b:35:93 (oui Unknown), length 28
15:54:01.804492 IP ec2-52-24-47-246.us-west-2.compute.amazonaws.com.https > 10.0.0.222.48383: Flags [S.], seq 2596773240, ack 2420269900, win 17898, options [mss 1440,sackOK,TS val 452902187 ecr 4896205,nop,wscale 8], length 0
15:54:01.806866 IP 10.0.0.222.48383 > ec2-52-24-47-246.us-west-2.compute.amazonaws.com.https: Flags [.], ack 1, win 251, options [nop,nop,TS val 4896231 ecr 452902187], length 0
15:54:01.807104 IP 10.0.0.222.48383 > ec2-52-24-47-246.us-west-2.compute.amazonaws.com.https: Flags [P.], seq 1:203, ack 1, win 251, options [nop,nop,TS val 4896231 ecr 452902187], length 202
15:54:01.817924 IP 10.0.0.222.54154 > 10.0.0.1.4886: UDP, length 0
15:54:01.831309 IP ec2-52-24-47-246.us-west-2.compute.amazonaws.com.https > 10.0.0.222.48384: Flags [S.], seq 969379661, ack 3146807371, win 17898, options [mss 1440,sackOK,TS val 452902193 ecr 4896206,nop,wscale 8], length 0
15:54:01.832491 IP 10.0.0.222.48384 > ec2-52-24-47-246.us-west-2.compute.amazonaws.com.https: Flags [.], ack 1, win 251, options [nop,nop,TS val 4896233 ecr 452902193], length 0
15:54:01.833252 IP 10.0.0.222.48384 > ec2-52-24-47-246.us-west-2.compute.amazonaws.com.https: Flags [P.], seq 1:203, ack 1, win 251, options [nop,nop,TS val 4896233 ecr 452902193], length 202
15:54:01.834838 IP 10.0.0.222.54154 > 10.0.0.1.4886: UDP, length 0
15:54:01.850964 IP 10.0.0.222.54154 > 10.0.0.1.4886: UDP, length 0
15:54:01.867850 IP 10.0.0.222.54154 > 10.0.0.1.4886: UDP, length 0
15:54:01.884561 IP 10.0.0.222.54154 > 10.0.0.1.4886: UDP, length 0
15:54:01.901332 IP 10.0.0.222.54154 > 10.0.0.1.4886: UDP, length 0
15:54:01.918170 IP 10.0.0.222.54154 > 10.0.0.1.4886: UDP, length 0
15:54:01.934587 IP 10.0.0.222.54154 > 10.0.0.1.4886: UDP, length 0
15:54:01.950696 IP 10.0.0.222.54154 > 10.0.0.1.4886: UDP, length 0
15:54:02.066349 IP ec2-52-24-47-246.us-west-2.compute.amazonaws.com.https > 10.0.0.222.48383: Flags [.], ack 203, win 75, options [nop,nop,TS val 452902253 ecr 4896231], length 0
15:54:02.069110 IP ec2-52-24-47-246.us-west-2.compute.amazonaws.com.https > 10.0.0.222.48383: Flags [.], seq 1:1349, ack 203, win 75, options [nop,nop,TS val 452902253 ecr 4896231], length 1348
15:54:02.069288 IP ec2-52-24-47-246.us-west-2.compute.amazonaws.com.https > 10.0.0.222.48383: Flags [.], seq 1349:2697, ack 203, win 75, options [nop,nop,TS val 452902253 ecr 4896231], length 1348
15:54:02.069384 IP ec2-52-24-47-246.us-west-2.compute.amazonaws.com.https > 10.0.0.222.48383: Flags [P.], seq 2697:2931, ack 203, win 75, options [nop,nop,TS val 452902253 ecr 4896231], length 234
15:54:02.070628 IP 10.0.0.222.48383 > ec2-52-24-47-246.us-west-2.compute.amazonaws.com.https: Flags [.], ack 1349, win 262, options [nop,nop,TS val 4896257 ecr 452902253], length 0
15:54:02.071139 IP 10.0.0.222.48383 > ec2-52-24-47-246.us-west-2.compute.amazonaws.com.https: Flags [.], ack 2697, win 272, options [nop,nop,TS val 4896257 ecr 452902253], length 0
15:54:02.071568 IP 10.0.0.222.48383 > ec2-52-24-47-246.us-west-2.compute.amazonaws.com.https: Flags [.], ack 2931, win 283, options [nop,nop,TS val 4896257 ecr 452902253], length 0
15:54:02.093780 IP 10.0.0.222.48383 > ec2-52-24-47-246.us-west-2.compute.amazonaws.com.https: Flags [P.], seq 203:329, ack 2931, win 283, options [nop,nop,TS val 4896259 ecr 452902253], length 126
15:54:02.104123 IP ec2-52-24-47-246.us-west-2.compute.amazonaws.com.https > 10.0.0.222.48384: Flags [.], ack 203, win 75, options [nop,nop,TS val 452902261 ecr 4896233], length 0
15:54:02.106906 IP ec2-52-24-47-246.us-west-2.compute.amazonaws.com.https > 10.0.0.222.48384: Flags [.], seq 1:1349, ack 203, win 75, options [nop,nop,TS val 452902261 ecr 4896233], length 1348
15:54:02.107321 IP ec2-52-24-47-246.us-west-2.compute.amazonaws.com.https > 10.0.0.222.48384: Flags [.], seq 1349:2697, ack 203, win 75, options [nop,nop,TS val 452902261 ecr 4896233], length 1348
15:54:02.107455 IP ec2-52-24-47-246.us-west-2.compute.amazonaws.com.https > 10.0.0.222.48384: Flags [P.], seq 2697:2931, ack 203, win 75, options [nop,nop,TS val 452902261 ecr 4896233], length 234
15:54:02.108254 IP 10.0.0.222.48384 > ec2-52-24-47-246.us-west-2.compute.amazonaws.com.https: Flags [.], ack 1349, win 262, options [nop,nop,TS val 4896261 ecr 452902261], length 0
15:54:02.108489 IP 10.0.0.222.48384 > ec2-52-24-47-246.us-west-2.compute.amazonaws.com.https: Flags [.], ack 2697, win 272, options [nop,nop,TS val 4896261 ecr 452902261], length 0
15:54:02.109489 IP 10.0.0.222.48384 > ec2-52-24-47-246.us-west-2.compute.amazonaws.com.https: Flags [.], ack 2931, win 283, options [nop,nop,TS val 4896261 ecr 452902261], length 0
15:54:02.119004 IP 10.0.0.222.48384 > ec2-52-24-47-246.us-west-2.compute.amazonaws.com.https: Flags [P.], seq 203:329, ack 2931, win 283, options [nop,nop,TS val 4896262 ecr 452902261], length 126
15:54:02.353381 IP ec2-52-24-47-246.us-west-2.compute.amazonaws.com.https > 10.0.0.222.48383: Flags [P.], seq 2931:3173, ack 329, win 75, options [nop,nop,TS val 452902325 ecr 4896259], length 242
15:54:02.394149 IP 10.0.0.222.48383 > ec2-52-24-47-246.us-west-2.compute.amazonaws.com.https: Flags [.], ack 3173, win 294, options [nop,nop,TS val 4896290 ecr 452902325], length 0
15:54:02.394661 IP ec2-52-24-47-246.us-west-2.compute.amazonaws.com.https > 10.0.0.222.48384: Flags [P.], seq 2931:3173, ack 329, win 75, options [nop,nop,TS val 452902333 ecr 4896262], length 242
15:54:02.434319 IP 10.0.0.222.48384 > ec2-52-24-47-246.us-west-2.compute.amazonaws.com.https: Flags [.], ack 3173, win 294, options [nop,nop,TS val 4896294 ecr 452902333], length 0
15:54:04.318331 ARP, Reply pi is-at 00:1e:a6:1d:3f:6a (oui Unknown), length 28
15:54:06.232439 IP 10.0.0.222.48383 > ec2-52-24-47-246.us-west-2.compute.amazonaws.com.https: Flags [P.], seq 329:1416, ack 3173, win 294, options [nop,nop,TS val 4896672 ecr 452902325], length 1087
15:54:06.524924 IP ec2-52-24-47-246.us-west-2.compute.amazonaws.com.https > 10.0.0.222.48383: Flags [.], ack 1416, win 83, options [nop,nop,TS val 452903368 ecr 4896672], length 0
15:54:06.577562 IP ec2-52-24-47-246.us-west-2.compute.amazonaws.com.https > 10.0.0.222.48383: Flags [.], seq 3173:4521, ack 1416, win 83, options [nop,nop,TS val 452903380 ecr 4896672], length 1348
15:54:06.577799 IP ec2-52-24-47-246.us-west-2.compute.amazonaws.com.https > 10.0.0.222.48383: Flags [P.], seq 4521:4887, ack 1416, win 83, options [nop,nop,TS val 452903380 ecr 4896672], length 366
15:54:06.577941 IP ec2-52-24-47-246.us-west-2.compute.amazonaws.com.https > 10.0.0.222.48383: Flags [.], seq 4887:6235, ack 1416, win 83, options [nop,nop,TS val 452903381 ecr 4896672], length 1348
15:54:06.577994 IP ec2-52-24-47-246.us-west-2.compute.amazonaws.com.https > 10.0.0.222.48383: Flags [P.], seq 6235:6405, ack 1416, win 83, options [nop,nop,TS val 452903381 ecr 4896672], length 170
15:54:06.578113 IP ec2-52-24-47-246.us-west-2.compute.amazonaws.com.https > 10.0.0.222.48383: Flags [.], seq 6405:7753, ack 1416, win 83, options [nop,nop,TS val 452903381 ecr 4896672], length 1348
15:54:06.578377 IP ec2-52-24-47-246.us-west-2.compute.amazonaws.com.https > 10.0.0.222.48383: Flags [P.], seq 7753:8536, ack 1416, win 83, options [nop,nop,TS val 452903381 ecr 4896672], length 783
15:54:06.580164 IP 10.0.0.222.48383 > ec2-52-24-47-246.us-west-2.compute.amazonaws.com.https: Flags [.], ack 4521, win 304, options [nop,nop,TS val 4896708 ecr 452903380], length 0
15:54:06.580373 IP 10.0.0.222.48383 > ec2-52-24-47-246.us-west-2.compute.amazonaws.com.https: Flags [.], ack 4887, win 315, options [nop,nop,TS val 4896708 ecr 452903380], length 0
15:54:06.580821 IP 10.0.0.222.48383 > ec2-52-24-47-246.us-west-2.compute.amazonaws.com.https: Flags [.], ack 6235, win 325, options [nop,nop,TS val 4896708 ecr 452903381], length 0
15:54:06.580990 IP 10.0.0.222.48383 > ec2-52-24-47-246.us-west-2.compute.amazonaws.com.https: Flags [.], ack 6405, win 336, options [nop,nop,TS val 4896708 ecr 452903381], length 0
15:54:06.581307 IP 10.0.0.222.48383 > ec2-52-24-47-246.us-west-2.compute.amazonaws.com.https: Flags [.], ack 7753, win 346, options [nop,nop,TS val 4896708 ecr 452903381], length 0
15:54:06.581443 IP ec2-52-24-47-246.us-west-2.compute.amazonaws.com.https > 10.0.0.222.48383: Flags [P.], seq 8536:9773, ack 1416, win 83, options [nop,nop,TS val 452903381 ecr 4896672], length 1237
15:54:06.581621 IP 10.0.0.222.48383 > ec2-52-24-47-246.us-west-2.compute.amazonaws.com.https: Flags [.], ack 8536, win 357, options [nop,nop,TS val 4896708 ecr 452903381], length 0
15:54:06.583091 IP 10.0.0.222.48383 > ec2-52-24-47-246.us-west-2.compute.amazonaws.com.https: Flags [.], ack 9773, win 367, options [nop,nop,TS val 4896708 ecr 452903381], length 0
15:54:06.586806 IP ec2-52-24-47-246.us-west-2.compute.amazonaws.com.https > 10.0.0.222.48383: Flags [.], seq 9773:11121, ack 1416, win 83, options [nop,nop,TS val 452903381 ecr 4896672], length 1348
15:54:06.586927 IP ec2-52-24-47-246.us-west-2.compute.amazonaws.com.https > 10.0.0.222.48383: Flags [P.], seq 11121:11321, ack 1416, win 83, options [nop,nop,TS val 452903381 ecr 4896672], length 200
15:54:06.588066 IP 10.0.0.222.48383 > ec2-52-24-47-246.us-west-2.compute.amazonaws.com.https: Flags [.], ack 11121, win 378, options [nop,nop,TS val 4896709 ecr 452903381], length 0
15:54:06.588414 IP 10.0.0.222.48383 > ec2-52-24-47-246.us-west-2.compute.amazonaws.com.https: Flags [.], ack 11321, win 388, options [nop,nop,TS val 4896709 ecr 452903381], length 0
15:54:06.591697 IP ec2-52-24-47-246.us-west-2.compute.amazonaws.com.https > 10.0.0.222.48383: Flags [.], seq 11321:12669, ack 1416, win 83, options [nop,nop,TS val 452903381 ecr 4896672], length 1348
15:54:06.592978 IP 10.0.0.222.48383 > ec2-52-24-47-246.us-west-2.compute.amazonaws.com.https: Flags [.], ack 12669, win 399, options [nop,nop,TS val 4896709 ecr 452903381], length 0
15:54:06.663099 IP 10.0.0.222.18427 > 10.0.0.1.domain: 1602+ A? static-www.elastic.co. (39)
15:54:06.674999 IP 10.0.0.222.54154 > 10.0.0.1.4886: UDP, length 0
15:54:06.675229 IP 10.0.0.1 > 10.0.0.222: ICMP 10.0.0.1 udp port 4886 unreachable, length 36
15:54:06.690356 IP 10.0.0.222.54154 > 10.0.0.1.4886: UDP, length 0
15:54:06.690557 IP 10.0.0.1 > 10.0.0.222: ICMP 10.0.0.1 udp port 4886 unreachable, length 36
15:54:06.706848 IP 10.0.0.222.54154 > 10.0.0.1.4886: UDP, length 0
15:54:06.707063 IP 10.0.0.1 > 10.0.0.222: ICMP 10.0.0.1 udp port 4886 unreachable, length 36
15:54:06.715957 IP 10.0.0.222.27114 > 10.0.0.1.domain: 6585+ A? app-lon02.marketo.com. (39)
15:54:06.723119 IP 10.0.0.222.54154 > 10.0.0.1.4886: UDP, length 0
15:54:06.723326 IP 10.0.0.1 > 10.0.0.222: ICMP 10.0.0.1 udp port 4886 unreachable, length 36
15:54:06.740372 IP 10.0.0.222.54154 > 10.0.0.1.4886: UDP, length 0
15:54:06.740579 IP 10.0.0.1 > 10.0.0.222: ICMP 10.0.0.1 udp port 4886 unreachable, length 36
15:54:06.755568 IP 10.0.0.222.54154 > 10.0.0.1.4886: UDP, length 0
15:54:06.758312 IP 10.0.0.1.domain > 10.0.0.222.18427: 1602 9/0/0 CNAME dte7euzg7lhqu.cloudfront.net., A 54.230.172.168, A 54.230.172.46, A 54.230.172.125, A 54.230.172.119, A 54.230.172.86, A 54.230.172.87, A 54.230.172.211, A 54.230.172.32 (209)
15:54:06.762375 IP 10.0.0.222.52768 > server-54-230-172-168.bom2.r.cloudfront.net.https: Flags [S], seq 2471868035, win 64240, options [mss 1460,sackOK,TS val 4896726 ecr 0,nop,wscale 8], length 0
15:54:06.763510 IP 10.0.0.222.52769 > server-54-230-172-168.bom2.r.cloudfront.net.https: Flags [S], seq 2305279946, win 64240, options [mss 1460,sackOK,TS val 4896726 ecr 0,nop,wscale 8], length 0
15:54:06.763879 IP 10.0.0.222.52770 > server-54-230-172-168.bom2.r.cloudfront.net.https: Flags [S], seq 963598986, win 64240, options [mss 1460,sackOK,TS val 4896726 ecr 0,nop,wscale 8], length 0
15:54:06.763990 IP 10.0.0.222.52771 > server-54-230-172-168.bom2.r.cloudfront.net.https: Flags [S], seq 2726569932, win 64240, options [mss 1460,sackOK,TS val 4896727 ecr 0,nop,wscale 8], length 0
15:54:06.764189 IP 10.0.0.222.52772 > server-54-230-172-168.bom2.r.cloudfront.net.https: Flags [S], seq 1311927893, win 64240, options [mss 1460,sackOK,TS val 4896727 ecr 0,nop,wscale 8], length 0
15:54:06.764601 IP 10.0.0.222.52773 > server-54-230-172-168.bom2.r.cloudfront.net.https: Flags [S], seq 2426756067, win 64240, options [mss 1460,sackOK,TS val 4896727 ecr 0,nop,wscale 8], length 0
15:54:06.765584 IP server-54-230-172-168.bom2.r.cloudfront.net.https > 10.0.0.222.52768: Flags [S.], seq 3597161123, ack 2471868036, win 28960, options [mss 1440,sackOK,TS val 457117979 ecr 4896726,nop,wscale 8], length 0
15:54:06.766465 IP server-54-230-172-168.bom2.r.cloudfront.net.https > 10.0.0.222.52769: Flags [S.], seq 2619885290, ack 2305279947, win 28960, options [mss 1440,sackOK,TS val 456380972 ecr 4896726,nop,wscale 8], length 0
15:54:06.766602 IP server-54-230-172-168.bom2.r.cloudfront.net.https > 10.0.0.222.52770: Flags [S.], seq 851978442, ack 963598987, win 28960, options [mss 1440,sackOK,TS val 457118374 ecr 4896726,nop,wscale 8], length 0
15:54:06.766700 IP 10.0.0.222.52768 > server-54-230-172-168.bom2.r.cloudfront.net.https: Flags [.], ack 1, win 251, options [nop,nop,TS val 4896727 ecr 457117979], length 0
15:54:06.767104 IP server-54-230-172-168.bom2.r.cloudfront.net.https > 10.0.0.222.52771: Flags [S.], seq 3179250897, ack 2726569933, win 28960, options [mss 1440,sackOK,TS val 463334394 ecr 4896727,nop,wscale 8], length 0
15:54:06.767215 IP server-54-230-172-168.bom2.r.cloudfront.net.https > 10.0.0.222.52772: Flags [S.], seq 1074925631, ack 1311927894, win 28960, options [mss 1440,sackOK,TS val 456380972 ecr 4896727,nop,wscale 8], length 0
15:54:06.767358 IP server-54-230-172-168.bom2.r.cloudfront.net.https > 10.0.0.222.52773: Flags [S.], seq 1892977770, ack 2426756068, win 28960, options [mss 1440,sackOK,TS val 455990670 ecr 4896727,nop,wscale 8], length 0
15:54:06.767557 IP 10.0.0.222.52768 > server-54-230-172-168.bom2.r.cloudfront.net.https: Flags [P.], seq 1:210, ack 1, win 251, options [nop,nop,TS val 4896727 ecr 457117979], length 209
15:54:06.767723 IP 10.0.0.222.52769 > server-54-230-172-168.bom2.r.cloudfront.net.https: Flags [.], ack 1, win 251, options [nop,nop,TS val 4896727 ecr 456380972], length 0
15:54:06.768129 IP 10.0.0.222.52770 > server-54-230-172-168.bom2.r.cloudfront.net.https: Flags [.], ack 1, win 251, options [nop,nop,TS val 4896727 ecr 457118374], length 0
15:54:06.768226 IP 10.0.0.222.52769 > server-54-230-172-168.bom2.r.cloudfront.net.https: Flags [P.], seq 1:210, ack 1, win 251, options [nop,nop,TS val 4896727 ecr 456380972], length 209
15:54:06.768380 IP 10.0.0.222.52770 > server-54-230-172-168.bom2.r.cloudfront.net.https: Flags [P.], seq 1:210, ack 1, win 251, options [nop,nop,TS val 4896727 ecr 457118374], length 209
15:54:06.769277 IP 10.0.0.222.52771 > server-54-230-172-168.bom2.r.cloudfront.net.https: Flags [.], ack 1, win 251, options [nop,nop,TS val 4896727 ecr 463334394], length 0
15:54:06.769521 IP 10.0.0.222.52772 > server-54-230-172-168.bom2.r.cloudfront.net.https: Flags [.], ack 1, win 251, options [nop,nop,TS val 4896727 ecr 456380972], length 0
15:54:06.770146 IP 10.0.0.222.52771 > server-54-230-172-168.bom2.r.cloudfront.net.https: Flags [P.], seq 1:210, ack 1, win 251, options [nop,nop,TS val 4896727 ecr 463334394], length 209
15:54:06.770344 IP 10.0.0.222.52772 > server-54-230-172-168.bom2.r.cloudfront.net.https: Flags [P.], seq 1:210, ack 1, win 251, options [nop,nop,TS val 4896727 ecr 456380972], length 209
15:54:06.770561 IP server-54-230-172-168.bom2.r.cloudfront.net.https > 10.0.0.222.52768: Flags [.], ack 210, win 118, options [nop,nop,TS val 457117980 ecr 4896727], length 0
15:54:06.771255 IP server-54-230-172-168.bom2.r.cloudfront.net.https > 10.0.0.222.52769: Flags [.], ack 210, win 118, options [nop,nop,TS val 456380972 ecr 4896727], length 0
15:54:06.771473 IP 10.0.0.222.52773 > server-54-230-172-168.bom2.r.cloudfront.net.https: Flags [.], ack 1, win 251, options [nop,nop,TS val 4896727 ecr 455990670], length 0
15:54:06.771635 IP server-54-230-172-168.bom2.r.cloudfront.net.https > 10.0.0.222.52770: Flags [.], ack 210, win 118, options [nop,nop,TS val 457118374 ecr 4896727], length 0
15:54:06.772268 IP 10.0.0.222.52773 > server-54-230-172-168.bom2.r.cloudfront.net.https: Flags [P.], seq 1:210, ack 1, win 251, options [nop,nop,TS val 4896727 ecr 455990670], length 209
15:54:06.772473 IP 10.0.0.222.54154 > 10.0.0.1.4886: UDP, length 0
15:54:06.773082 IP server-54-230-172-168.bom2.r.cloudfront.net.https > 10.0.0.222.52771: Flags [.], ack 210, win 118, options [nop,nop,TS val 463334395 ecr 4896727], length 0
15:54:06.773262 IP server-54-230-172-168.bom2.r.cloudfront.net.https > 10.0.0.222.52772: Flags [.], ack 210, win 118, options [nop,nop,TS val 456380973 ecr 4896727], length 0
15:54:06.775691 IP server-54-230-172-168.bom2.r.cloudfront.net.https > 10.0.0.222.52773: Flags [.], ack 210, win 118, options [nop,nop,TS val 455990671 ecr 4896727], length 0
15:54:06.776508 IP server-54-230-172-168.bom2.r.cloudfront.net.https > 10.0.0.222.52768: Flags [.], seq 1:1349, ack 210, win 118, options [nop,nop,TS val 457117980 ecr 4896727], length 1348
15:54:06.776694 IP server-54-230-172-168.bom2.r.cloudfront.net.https > 10.0.0.222.52768: Flags [.], seq 1349:2697, ack 210, win 118, options [nop,nop,TS val 457117980 ecr 4896727], length 1348
15:54:06.776741 IP server-54-230-172-168.bom2.r.cloudfront.net.https > 10.0.0.222.52768: Flags [P.], seq 2697:2950, ack 210, win 118, options [nop,nop,TS val 457117980 ecr 4896727], length 253
15:54:06.777734 IP server-54-230-172-168.bom2.r.cloudfront.net.https > 10.0.0.222.52769: Flags [.], seq 1:1349, ack 210, win 118, options [nop,nop,TS val 456380973 ecr 4896727], length 1348
15:54:06.777955 IP server-54-230-172-168.bom2.r.cloudfront.net.https > 10.0.0.222.52769: Flags [.], seq 1349:2697, ack 210, win 118, options [nop,nop,TS val 456380973 ecr 4896727], length 1348
15:54:06.777999 IP server-54-230-172-168.bom2.r.cloudfront.net.https > 10.0.0.222.52769: Flags [P.], seq 2697:2950, ack 210, win 118, options [nop,nop,TS val 456380973 ecr 4896727], length 253
15:54:06.779113 IP 10.0.0.222.52768 > server-54-230-172-168.bom2.r.cloudfront.net.https: Flags [.], ack 1349, win 262, options [nop,nop,TS val 4896728 ecr 457117980], length 0
15:54:06.779834 IP 10.0.0.222.52768 > server-54-230-172-168.bom2.r.cloudfront.net.https: Flags [.], ack 2697, win 272, options [nop,nop,TS val 4896728 ecr 457117980], length 0
15:54:06.780081 IP 10.0.0.222.52768 > server-54-230-172-168.bom2.r.cloudfront.net.https: Flags [.], ack 2950, win 283, options [nop,nop,TS val 4896728 ecr 457117980], length 0
15:54:06.781138 IP 10.0.0.222.52769 > server-54-230-172-168.bom2.r.cloudfront.net.https: Flags [.], ack 1349, win 262, options [nop,nop,TS val 4896728 ecr 456380973], length 0
15:54:06.781343 IP 10.0.0.222.52769 > server-54-230-172-168.bom2.r.cloudfront.net.https: Flags [.], ack 2697, win 272, options [nop,nop,TS val 4896728 ecr 456380973], length 0
15:54:06.781959 IP 10.0.0.222.52769 > server-54-230-172-168.bom2.r.cloudfront.net.https: Flags [.], ack 2950, win 283, options [nop,nop,TS val 4896728 ecr 456380973], length 0
15:54:06.782209 IP server-54-230-172-168.bom2.r.cloudfront.net.https > 10.0.0.222.52772: Flags [.], seq 1:1349, ack 210, win 118, options [nop,nop,TS val 456380973 ecr 4896727], length 1348
15:54:06.783476 IP 10.0.0.222.52772 > server-54-230-172-168.bom2.r.cloudfront.net.https: Flags [.], ack 1349, win 262, options [nop,nop,TS val 4896728 ecr 456380973], length 0
15:54:06.787251 IP server-54-230-172-168.bom2.r.cloudfront.net.https > 10.0.0.222.52772: Flags [.], seq 1349:2697, ack 210, win 118, options [nop,nop,TS val 456380973 ecr 4896727], length 1348
15:54:06.787377 IP server-54-230-172-168.bom2.r.cloudfront.net.https > 10.0.0.222.52772: Flags [P.], seq 2697:3438, ack 210, win 118, options [nop,nop,TS val 456380973 ecr 4896727], length 741
15:54:06.788119 IP 10.0.0.222.54154 > 10.0.0.1.4886: UDP, length 0
15:54:06.788369 IP 10.0.0.222.52772 > server-54-230-172-168.bom2.r.cloudfront.net.https: Flags [.], ack 2697, win 272, options [nop,nop,TS val 4896729 ecr 456380973], length 0
15:54:06.789084 IP 10.0.0.222.52772 > server-54-230-172-168.bom2.r.cloudfront.net.https: Flags [.], ack 3438, win 283, options [nop,nop,TS val 4896729 ecr 456380973], length 0
15:54:06.792829 IP 10.0.0.222.52768 > server-54-230-172-168.bom2.r.cloudfront.net.https: Flags [P.], seq 210:336, ack 2950, win 283, options [nop,nop,TS val 4896729 ecr 457117980], length 126
15:54:06.795158 IP server-54-230-172-168.bom2.r.cloudfront.net.https > 10.0.0.222.52771: Flags [.], seq 1:1349, ack 210, win 118, options [nop,nop,TS val 463334396 ecr 4896727], length 1348
15:54:06.795335 IP server-54-230-172-168.bom2.r.cloudfront.net.https > 10.0.0.222.52771: Flags [.], seq 1349:2697, ack 210, win 118, options [nop,nop,TS val 463334396 ecr 4896727], length 1348
15:54:06.795382 IP server-54-230-172-168.bom2.r.cloudfront.net.https > 10.0.0.222.52771: Flags [P.], seq 2697:2950, ack 210, win 118, options [nop,nop,TS val 463334396 ecr 4896727], length 253
15:54:06.796491 IP 10.0.0.222.52771 > server-54-230-172-168.bom2.r.cloudfront.net.https: Flags [.], ack 1349, win 262, options [nop,nop,TS val 4896730 ecr 463334396], length 0
15:54:06.796693 IP 10.0.0.222.52771 > server-54-230-172-168.bom2.r.cloudfront.net.https: Flags [.], ack 2697, win 272, options [nop,nop,TS val 4896730 ecr 463334396], length 0
15:54:06.797567 IP 10.0.0.222.52771 > server-54-230-172-168.bom2.r.cloudfront.net.https: Flags [.], ack 2950, win 283, options [nop,nop,TS val 4896730 ecr 463334396], length 0
15:54:06.803130 IP 10.0.0.222.52772 > server-54-230-172-168.bom2.r.cloudfront.net.https: Flags [P.], seq 210:336, ack 3438, win 283, options [nop,nop,TS val 4896730 ecr 456380973], length 126
15:54:06.803992 IP 10.0.0.222.26697 > 10.0.0.1.domain: 15584+ A? sjrtp2-cdn.marketo.com. (40)
15:54:06.804281 IP 10.0.0.222.54154 > 10.0.0.1.4886: UDP, length 0
15:54:06.805467 IP server-54-230-172-168.bom2.r.cloudfront.net.https > 10.0.0.222.52770: Flags [.], seq 1:1349, ack 210, win 118, options [nop,nop,TS val 457118375 ecr 4896727], length 1348
15:54:06.805627 IP server-54-230-172-168.bom2.r.cloudfront.net.https > 10.0.0.222.52770: Flags [.], seq 1349:2697, ack 210, win 118, options [nop,nop,TS val 457118375 ecr 4896727], length 1348
15:54:06.805696 IP server-54-230-172-168.bom2.r.cloudfront.net.https > 10.0.0.222.52770: Flags [P.], seq 2697:2950, ack 210, win 118, options [nop,nop,TS val 457118375 ecr 4896727], length 253
15:54:06.806832 IP 10.0.0.222.52770 > server-54-230-172-168.bom2.r.cloudfront.net.https: Flags [.], ack 1349, win 262, options [nop,nop,TS val 4896731 ecr 457118375], length 0
15:54:06.807130 IP 10.0.0.222.52770 > server-54-230-172-168.bom2.r.cloudfront.net.https: Flags [.], ack 2697, win 272, options [nop,nop,TS val 4896731 ecr 457118375], length 0
15:54:06.807893 IP 10.0.0.222.52770 > server-54-230-172-168.bom2.r.cloudfront.net.https: Flags [.], ack 2950, win 283, options [nop,nop,TS val 4896731 ecr 457118375], length 0
15:54:06.813865 IP 10.0.0.222.52769 > server-54-230-172-168.bom2.r.cloudfront.net.https: Flags [P.], seq 210:336, ack 2950, win 283, options [nop,nop,TS val 4896732 ecr 456380973], length 126
15:54:06.815857 IP server-54-230-172-168.bom2.r.cloudfront.net.https > 10.0.0.222.52773: Flags [.], seq 1:1349, ack 210, win 118, options [nop,nop,TS val 455990671 ecr 4896727], length 1348
15:54:06.816997 IP 10.0.0.222.52773 > server-54-230-172-168.bom2.r.cloudfront.net.https: Flags [.], ack 1349, win 262, options [nop,nop,TS val 4896732 ecr 455990671], length 0
15:54:06.820697 IP 10.0.0.222.54154 > 10.0.0.1.4886: UDP, length 0
15:54:06.820979 IP server-54-230-172-168.bom2.r.cloudfront.net.https > 10.0.0.222.52773: Flags [.], seq 1349:2697, ack 210, win 118, options [nop,nop,TS val 455990671 ecr 4896727], length 1348
15:54:06.821103 IP server-54-230-172-168.bom2.r.cloudfront.net.https > 10.0.0.222.52773: Flags [P.], seq 2697:2950, ack 210, win 118, options [nop,nop,TS val 455990671 ecr 4896727], length 253
15:54:06.823136 IP 10.0.0.222.52773 > server-54-230-172-168.bom2.r.cloudfront.net.https: Flags [.], ack 2697, win 272, options [nop,nop,TS val 4896732 ecr 455990671], length 0
15:54:06.823362 IP 10.0.0.222.52773 > server-54-230-172-168.bom2.r.cloudfront.net.https: Flags [.], ack 2950, win 283, options [nop,nop,TS val 4896732 ecr 455990671], length 0
15:54:06.831251 IP 10.0.0.222.52771 > server-54-230-172-168.bom2.r.cloudfront.net.https: Flags [P.], seq 210:336, ack 2950, win 283, options [nop,nop,TS val 4896733 ecr 463334396], length 126
15:54:06.832257 IP server-54-230-172-168.bom2.r.cloudfront.net.https > 10.0.0.222.52770: Flags [P.], seq 2697:2950, ack 210, win 118, options [nop,nop,TS val 457118377 ecr 4896727], length 253
15:54:06.832459 IP server-54-230-172-168.bom2.r.cloudfront.net.https > 10.0.0.222.52773: Flags [P.], seq 2697:2950, ack 210, win 118, options [nop,nop,TS val 455990673 ecr 4896727], length 253
15:54:06.832589 IP server-54-230-172-168.bom2.r.cloudfront.net.https > 10.0.0.222.52768: Flags [P.], seq 2950:3192, ack 336, win 118, options [nop,nop,TS val 457117982 ecr 4896729], length 242
15:54:06.832637 IP server-54-230-172-168.bom2.r.cloudfront.net.https > 10.0.0.222.52771: Flags [P.], seq 2697:2950, ack 210, win 118, options [nop,nop,TS val 463334398 ecr 4896727], length 253
15:54:06.832709 IP server-54-230-172-168.bom2.r.cloudfront.net.https > 10.0.0.222.52772: Flags [P.], seq 3438:3680, ack 336, win 118, options [nop,nop,TS val 456380976 ecr 4896730], length 242
15:54:06.832760 IP server-54-230-172-168.bom2.r.cloudfront.net.https > 10.0.0.222.52769: Flags [P.], seq 2950:3192, ack 336, win 118, options [nop,nop,TS val 456380977 ecr 4896732], length 242
15:54:06.833493 IP 10.0.0.222.52770 > server-54-230-172-168.bom2.r.cloudfront.net.https: Flags [.], ack 2950, win 283, options [nop,nop,TS val 4896733 ecr 457118377,nop,nop,sack 1 {2697:2950}], length 0
15:54:06.833600 IP 10.0.0.222.52773 > server-54-230-172-168.bom2.r.cloudfront.net.https: Flags [.], ack 2950, win 283, options [nop,nop,TS val 4896734 ecr 455990673,nop,nop,sack 1 {2697:2950}], length 0
15:54:06.834651 IP 10.0.0.222.52771 > server-54-230-172-168.bom2.r.cloudfront.net.https: Flags [.], ack 2950, win 283, options [nop,nop,TS val 4896734 ecr 463334398,nop,nop,sack 1 {2697:2950}], length 0
15:54:06.834880 IP ec2-52-24-47-246.us-west-2.compute.amazonaws.com.https > 10.0.0.222.48383: Flags [P.], seq 12669:12857, ack 1416, win 83, options [nop,nop,TS val 452903445 ecr 4896708], length 188
15:54:06.835782 IP 10.0.0.222.52769 > server-54-230-172-168.bom2.r.cloudfront.net.https: Flags [.], ack 3192, win 294, options [nop,nop,TS val 4896734 ecr 456380977], length 0
15:54:06.835987 IP 10.0.0.222.48383 > ec2-52-24-47-246.us-west-2.compute.amazonaws.com.https: Flags [.], ack 12857, win 399, options [nop,nop,TS val 4896734 ecr 452903445], length 0
15:54:06.836997 IP 10.0.0.222.54154 > 10.0.0.1.4886: UDP, length 0
15:54:06.837211 IP server-54-230-172-168.bom2.r.cloudfront.net.https > 10.0.0.222.52771: Flags [P.], seq 2950:3192, ack 336, win 118, options [nop,nop,TS val 463334401 ecr 4896733], length 242
15:54:06.838036 IP 10.0.0.222.52771 > server-54-230-172-168.bom2.r.cloudfront.net.https: Flags [.], ack 3192, win 294, options [nop,nop,TS val 4896734 ecr 463334401], length 0
15:54:06.846014 IP 10.0.0.222.52770 > server-54-230-172-168.bom2.r.cloudfront.net.https: Flags [P.], seq 210:336, ack 2950, win 283, options [nop,nop,TS val 4896735 ecr 457118377], length 126
15:54:06.847381 IP 10.0.0.222.52768 > server-54-230-172-168.bom2.r.cloudfront.net.https: Flags [P.], seq 336:1130, ack 3192, win 294, options [nop,nop,TS val 4896735 ecr 457117982], length 794
15:54:06.847661 IP 10.0.0.222.52772 > server-54-230-172-168.bom2.r.cloudfront.net.https: Flags [P.], seq 336:1119, ack 3680, win 294, options [nop,nop,TS val 4896735 ecr 456380976], length 783
15:54:06.848001 IP 10.0.0.222.48384 > ec2-52-24-47-246.us-west-2.compute.amazonaws.com.https: Flags [P.], seq 329:360, ack 3173, win 294, options [nop,nop,TS val 4896735 ecr 452902333], length 31
15:54:06.848230 IP 10.0.0.222.48384 > ec2-52-24-47-246.us-west-2.compute.amazonaws.com.https: Flags [F.], seq 360, ack 3173, win 294, options [nop,nop,TS val 4896735 ecr 452902333], length 0
15:54:06.849193 IP server-54-230-172-168.bom2.r.cloudfront.net.https > 10.0.0.222.52770: Flags [P.], seq 2950:3192, ack 336, win 118, options [nop,nop,TS val 457118382 ecr 4896735], length 242
15:54:06.850240 IP 10.0.0.222.52770 > server-54-230-172-168.bom2.r.cloudfront.net.https: Flags [.], ack 3192, win 294, options [nop,nop,TS val 4896735 ecr 457118382], length 0
15:54:06.851978 IP server-54-230-172-168.bom2.r.cloudfront.net.https > 10.0.0.222.52772: Flags [P.], seq 3680:4333, ack 1119, win 124, options [nop,nop,TS val 456380980 ecr 4896735], length 653
15:54:06.852459 IP server-54-230-172-168.bom2.r.cloudfront.net.https > 10.0.0.222.52772: Flags [.], seq 4333:5681, ack 1119, win 124, options [nop,nop,TS val 456380980 ecr 4896735], length 1348
15:54:06.852857 IP server-54-230-172-168.bom2.r.cloudfront.net.https > 10.0.0.222.52772: Flags [.], seq 5681:7029, ack 1119, win 124, options [nop,nop,TS val 456380980 ecr 4896735], length 1348
15:54:06.852945 IP server-54-230-172-168.bom2.r.cloudfront.net.https > 10.0.0.222.52772: Flags [.], seq 7029:8377, ack 1119, win 124, options [nop,nop,TS val 456380980 ecr 4896735], length 1348
15:54:06.853017 IP server-54-230-172-168.bom2.r.cloudfront.net.https > 10.0.0.222.52772: Flags [.], seq 8377:9725, ack 1119, win 124, options [nop,nop,TS val 456380980 ecr 4896735], length 1348
15:54:06.853123 IP server-54-230-172-168.bom2.r.cloudfront.net.https > 10.0.0.222.52772: Flags [P.], seq 9725:10135, ack 1119, win 124, options [nop,nop,TS val 456380980 ecr 4896735], length 410
15:54:06.854092 IP 10.0.0.222.54154 > 10.0.0.1.4886: UDP, length 0
15:54:06.860096 IP server-54-230-172-168.bom2.r.cloudfront.net.https > 10.0.0.222.52772: Flags [.], seq 10135:11483, ack 1119, win 124, options [nop,nop,TS val 456380980 ecr 4896735], length 1348
15:54:06.860292 IP server-54-230-172-168.bom2.r.cloudfront.net.https > 10.0.0.222.52772: Flags [.], seq 11483:12831, ack 1119, win 124, options [nop,nop,TS val 456380980 ecr 4896735], length 1348
15:54:06.860359 IP server-54-230-172-168.bom2.r.cloudfront.net.https > 10.0.0.222.52772: Flags [.], seq 12831:14179, ack 1119, win 124, options [nop,nop,TS val 456380980 ecr 4896735], length 1348
15:54:06.865012 IP 10.0.0.222.52773 > server-54-230-172-168.bom2.r.cloudfront.net.https: Flags [P.], seq 210:336, ack 2950, win 283, options [nop,nop,TS val 4896737 ecr 455990673], length 126
15:54:06.865575 IP 10.0.0.222.52768 > server-54-230-172-168.bom2.r.cloudfront.net.https: Flags [P.], seq 1130:1925, ack 3192, win 294, options [nop,nop,TS val 4896737 ecr 457117982], length 795
15:54:06.866510 IP 10.0.0.222.52771 > server-54-230-172-168.bom2.r.cloudfront.net.https: Flags [P.], seq 336:1122, ack 3192, win 294, options [nop,nop,TS val 4896737 ecr 463334401], length 786
15:54:06.867249 IP 10.0.0.222.52770 > server-54-230-172-168.bom2.r.cloudfront.net.https: Flags [P.], seq 336:1122, ack 3192, win 294, options [nop,nop,TS val 4896737 ecr 457118382], length 786
15:54:06.868126 IP 10.0.0.222.52769 > server-54-230-172-168.bom2.r.cloudfront.net.https: Flags [P.], seq 336:1142, ack 3192, win 294, options [nop,nop,TS val 4896737 ecr 456380977], length 806
15:54:06.869448 IP 10.0.0.222.52772 > server-54-230-172-168.bom2.r.cloudfront.net.https: Flags [.], ack 14179, win 388, options [nop,nop,TS val 4896737 ecr 456380980], length 0
15:54:06.869821 IP 10.0.0.222.54154 > 10.0.0.1.4886: UDP, length 0
15:54:06.870339 IP 10.0.0.222.52773 > server-54-230-172-168.bom2.r.cloudfront.net.https: Flags [P.], seq 336:1144, ack 2950, win 283, options [nop,nop,TS val 4896737 ecr 455990673], length 808
15:54:06.874478 IP server-54-230-172-168.bom2.r.cloudfront.net.https > 10.0.0.222.52772: Flags [.], seq 14179:15527, ack 1119, win 124, options [nop,nop,TS val 456380980 ecr 4896735], length 1348
